id,title,url,domain,permalink,subreddit,score,num_comments,gilded,created,author_flair_text,author,is_self,over_18
4raiav,"With the Mavs' signing of Seth Curry, all they need to do is sign Jason Thompson and Gerald Green and they can run out a lineup of Curry-Thompson-Barnes-Green-Bogut",https://www.reddit.com/r/nba/comments/4raiav/with_the_mavs_signing_of_seth_curry_all_they_need/,self.nba,https://www.reddit.com/r/nba/comments/4raiav/with_the_mavs_signing_of_seth_curry_all_they_need/?ref=search_posts,nba,5017,419,0,1467714016.0,[TOR] Kyle Lowry,Jones3787,True,False
4r9l9m,"Bill Wixey on Twitter: ""Dear Oklahoma City: That feeling you're experiencing? Like your heart has been ripped out of your chest? Get used to it. Love, Seattle""",https://twitter.com/billwixey/status/749995678068121602,twitter.com,https://www.reddit.com/r/nba/comments/4r9l9m/bill_wixey_on_twitter_dear_oklahoma_city_that/?ref=search_posts,nba,2927,1165,0,1467699651.0,Lakers,vulgarswami_,False,False
4r9tp0,"[Charania] Vertical Sources: Free agent center Zaza Pachulia has agreed to a one-year, $2.9M deal to sign with the Golden State Warriors.",https://twitter.com/ShamsCharania/status/750106750850732032,twitter.com,https://www.reddit.com/r/nba/comments/4r9tp0/charania_vertical_sources_free_agent_center_zaza/?ref=search_posts,nba,2727,1352,0,1467703165.0,Warriors,Anon10W1z,False,False
4r90de,My Way Too Extensive Thoughts on KD and the NBA,https://www.reddit.com/r/nba/comments/4r90de/my_way_too_extensive_thoughts_on_kd_and_the_nba/,self.nba,https://www.reddit.com/r/nba/comments/4r90de/my_way_too_extensive_thoughts_on_kd_and_the_nba/?ref=search_posts,nba,3697,848,3,1467691614.0,Lakers,aeisenst,True,False
4radfg,Jaylen Brown block on Ben Simmons,https://streamable.com/ajow,streamable.com,https://www.reddit.com/r/nba/comments/4radfg/jaylen_brown_block_on_ben_simmons/?ref=search_posts,nba,287,105,0,1467711857.0,[BOS] Larry Bird,I_Enjoy_Taffy,False,False
4ratox,Steph Curry surprises a young fan at his door,https://instagram.com/p/BHdtdOrD_ya/,instagram.com,https://www.reddit.com/r/nba/comments/4ratox/steph_curry_surprises_a_young_fan_at_his_door/?ref=search_posts,nba,236,87,0,1467719145.0,,4for5,False,False
4r9vsu,"[Slater] Sam Presti: ""I'd like to thank Kevin for not only what he did for the team on the floor, but for what he did for Oklahoma.""",https://twitter.com/anthonyVslater/status/750110122173730816,twitter.com,https://www.reddit.com/r/nba/comments/4r9vsu/slater_sam_presti_id_like_to_thank_kevin_for_not/?ref=search_posts,nba,258,65,0,1467704025.0,[NJN] Vince Carter,VinceBarter,False,False
4r93ht,"Vincent Goodwill on Twitter: ""Jennings agrees to a one year $5 million deal with the Knicks according to sources""",https://twitter.com/vgoodwill/status/750062773233651717,twitter.com,https://www.reddit.com/r/nba/comments/4r93ht/vincent_goodwill_on_twitter_jennings_agrees_to_a/?ref=search_posts,nba,964,266,0,1467692760.0,[DAL] Tyson Chandler,rps215,False,False
4r9lin,[Aldridge] Told emphatically by league source there's no chance Russell Westbrook will do a renegotiation/extension of his contract (one yr remaining).,https://twitter.com/daldridgetnt/status/750092405626380288,twitter.com,https://www.reddit.com/r/nba/comments/4r9lin/aldridge_told_emphatically_by_league_source/?ref=search_posts,nba,675,357,0,1467699747.0,Warriors,Anon10W1z,False,False
4r9qy0,[BR] Westbrook unlikely to extend contract. Thunder open to trading him if he does not extend.,http://m.bleacherreport.com/articles/2650038-russell-westbrook-latest-news-rumors-speculation-on-thunder-pgs-future,m.bleacherreport.com,https://www.reddit.com/r/nba/comments/4r9qy0/br_westbrook_unlikely_to_extend_contract_thunder/?ref=search_posts,nba,778,528,0,1467702002.0,Warriors,ash8795,False,False
4rawfy,Front page of tomorrow's Daily Oklahoman,http://imgur.com/rfhFXLo,imgur.com,https://www.reddit.com/r/nba/comments/4rawfy/front_page_of_tomorrows_daily_oklahoman/?ref=search_posts,nba,792,217,0,1467720436.0,Thunder,jawhn1,False,False
4ragb6,The potential Warriors starting lineup all finished in the top ten of All-Star Western Conference voting,https://www.reddit.com/r/nba/comments/4ragb6/the_potential_warriors_starting_lineup_all/,self.nba,https://www.reddit.com/r/nba/comments/4ragb6/the_potential_warriors_starting_lineup_all/?ref=search_posts,nba,272,60,0,1467713154.0,,BearsNecessity,True,False
4rado8,Weren't we just talking about how players should look out for themselves rather than their organization after we saw what the bulls did to Rose?,https://www.reddit.com/r/nba/comments/4rado8/werent_we_just_talking_about_how_players_should/,self.nba,https://www.reddit.com/r/nba/comments/4rado8/werent_we_just_talking_about_how_players_should/?ref=search_posts,nba,570,373,0,1467711965.0,Lakers,Quicktip,True,False
4r9z7e,"[Wojnarowski] Free agent center Roy Hibbert is finalizing a deal with the Charlotte Hornets, league sources tell @TheVertical.",https://twitter.com/WojVerticalNBA/status/750116198252175360,twitter.com,https://www.reddit.com/r/nba/comments/4r9z7e/wojnarowski_free_agent_center_roy_hibbert_is/?ref=search_posts,nba,237,117,0,1467705429.0,Warriors,Anon10W1z,False,False
4r9p48,List of reactions from around the league to Durant's Decision today.,https://www.reddit.com/r/nba/comments/4r9p48/list_of_reactions_from_around_the_league_to/,self.nba,https://www.reddit.com/r/nba/comments/4r9p48/list_of_reactions_from_around_the_league_to/?ref=search_posts,nba,272,83,0,1467701229.0,[ATL] Pete Maravich,lipstickpizza,True,False
4r9gom,"Royce Young on Twitter: ""The Thunder aren't going to draw free agents to OKC. But maybe they can sell Griffin on coming home to play with Westbrook.""",https://twitter.com/royceyoung/status/750080744903499777,twitter.com,https://www.reddit.com/r/nba/comments/4r9gom/royce_young_on_twitter_the_thunder_arent_going_to/?ref=search_posts,nba,378,118,0,1467697761.0,Raptors,LinuxF4n,False,False
4r9xvf,Dirk And Mavs Agree To 'Rest-Of-Cap-Room' Salary Of $9M-to-$12M for 2016-17,http://www.scout.com/nba/mavericks/story/1683645-dirk-mavs-agree-to-rest-of-cap-deal,scout.com,https://www.reddit.com/r/nba/comments/4r9xvf/dirk_and_mavs_agree_to_restofcaproom_salary_of/?ref=search_posts,nba,283,88,0,1467704853.0,Mavericks,wharf_rat_01,False,False
4rau3k,"People who still respect KD and his decision, care to share why?",https://www.reddit.com/r/nba/comments/4rau3k/people_who_still_respect_kd_and_his_decision_care/,self.nba,https://www.reddit.com/r/nba/comments/4rau3k/people_who_still_respect_kd_and_his_decision_care/?ref=search_posts,nba,53,302,0,1467719357.0,Thunder,SillyRabbit2121,True,False
4r9x7b,Ben Simmons Threads the Needle in Transition - NBA TV,https://streamable.com/3331,streamable.com,https://www.reddit.com/r/nba/comments/4r9x7b/ben_simmons_threads_the_needle_in_transition_nba/?ref=search_posts,nba,876,177,0,1467704573.0,[TOR] Amir Johnson,H4pl0,False,False
4r9qhx,Boston Celtics vs Philadelphia 76ers Game Thread,https://www.reddit.com/r/nba/comments/4r9qhx/boston_celtics_vs_philadelphia_76ers_game_thread/,self.nba,https://www.reddit.com/r/nba/comments/4r9qhx/boston_celtics_vs_philadelphia_76ers_game_thread/?ref=search_posts,nba,74,391,0,1467701827.0,76ers,BCSinReverse,True,False
4rag2j,"Adrian Wojnarowski on Twitter: ""Free agent guard Seth Curry is finalizing a two-year, $6M deal with the Dallas Mavericks, league sources tell @TheVertical.""",https://twitter.com/WojVerticalNBA/status/750147956196663296,twitter.com,https://www.reddit.com/r/nba/comments/4rag2j/adrian_wojnarowski_on_twitter_free_agent_guard/?ref=search_posts,nba,1264,256,0,1467713039.0,[BOS] Paul Pierce,Chancelor_West,False,False
4rapty,"Joel Embiid on Twitter: ""I hate seeing y'all bashing KD.At least he cares about winning more than anything and that deserves some respek. Respect his decision or FOH""",https://twitter.com/JoelEmbiid/status/750057056938389505,twitter.com,https://www.reddit.com/r/nba/comments/4rapty/joel_embiid_on_twitter_i_hate_seeing_yall_bashing/?ref=search_posts,nba,676,572,0,1467717468.0,,PZinger6,False,False
4rbg5m,Cavs Rumors: Dwyane Wade to Have Sit-Down Meeting with Cavaliers,https://www.google.com/amp/cavaliersnation.com/2016/07/05/cavs-rumors-dwyane-wade-sit-meeting-cavaliers/,google.com,https://www.reddit.com/r/nba/comments/4rbg5m/cavs_rumors_dwyane_wade_to_have_sitdown_meeting/?ref=search_posts,nba,1719,842,0,1467730421.0,[CLE] Kevin Love,Segrandi,False,False
4r99ih,[Katz] People are going to Durant's home to harass him? What a complete and utter embarrassment.,https://twitter.com/FredKatz/status/750071049438527488,twitter.com,https://www.reddit.com/r/nba/comments/4r99ih/katz_people_are_going_to_durants_home_to_harass/?ref=search_posts,nba,287,141,0,1467694893.0,Warriors,lf2012,False,False
4rafoe,Andrew Bogut confirms he is off to Dallas,https://www.instagram.com/p/BHc0z4dj71z/?taken-by=andrewbogut12,instagram.com,https://www.reddit.com/r/nba/comments/4rafoe/andrew_bogut_confirms_he_is_off_to_dallas/?ref=search_posts,nba,665,109,0,1467712872.0,Raptors,bcisback,False,False
4ra1sc,"[Wojnarowski] Sources: Charlotte, Roy Hibbert agreement: One-year, $5M.",https://twitter.com/WojVerticalNBA/status/750120893460975617,twitter.com,https://www.reddit.com/r/nba/comments/4ra1sc/wojnarowski_sources_charlotte_roy_hibbert/?ref=search_posts,nba,970,297,0,1467706538.0,Warriors,Anon10W1z,False,False
4ra13b,Ben Simmons No Look Overhead Pass - NBA TV,https://streamable.com/k73j,streamable.com,https://www.reddit.com/r/nba/comments/4ra13b/ben_simmons_no_look_overhead_pass_nba_tv/?ref=search_posts,nba,187,33,0,1467706227.0,[TOR] Amir Johnson,H4pl0,False,False
4raq7a,What would it take for Wade to sign with the Cavs? Does this seem like a possibility given the recent KD signing?,https://www.reddit.com/r/nba/comments/4raq7a/what_would_it_take_for_wade_to_sign_with_the_cavs/,self.nba,https://www.reddit.com/r/nba/comments/4raq7a/what_would_it_take_for_wade_to_sign_with_the_cavs/?ref=search_posts,nba,7,35,0,1467717647.0,,joe4942,True,False
4rbimm,Who were the 'curry vs lebron's throughout the history of the nba?,https://www.reddit.com/r/nba/comments/4rbimm/who_were_the_curry_vs_lebrons_throughout_the/,self.nba,https://www.reddit.com/r/nba/comments/4rbimm/who_were_the_curry_vs_lebrons_throughout_the/?ref=search_posts,nba,0,75,0,1467731784.0,,Ohowun,True,False
4r9jyu,REMINDER: Ben Simmons debuts tonight in the Summer League against the Celtics at 7:00 EST.,https://www.reddit.com/r/nba/comments/4r9jyu/reminder_ben_simmons_debuts_tonight_in_the_summer/,self.nba,https://www.reddit.com/r/nba/comments/4r9jyu/reminder_ben_simmons_debuts_tonight_in_the_summer/?ref=search_posts,nba,75,27,0,1467699112.0,Raptors,DeKobe-DeBryant,True,False
4r9nvp,Stephen Jackson on KD #Facts,https://www.youtube.com/watch?v=_EeMPWlf_zY,youtube.com,https://www.reddit.com/r/nba/comments/4r9nvp/stephen_jackson_on_kd_facts/?ref=search_posts,nba,21,34,0,1467700724.0,[NYK] Stephon Marbury,Mjoh23,False,False
4r97ax,"After the Warriors sign KD, could'nt they match Harrison Barnes offer due to having his bird rights and eat the luxury tax?",https://www.reddit.com/r/nba/comments/4r97ax/after_the_warriors_sign_kd_couldnt_they_match/,self.nba,https://www.reddit.com/r/nba/comments/4r97ax/after_the_warriors_sign_kd_couldnt_they_match/?ref=search_posts,nba,3,30,0,1467694089.0,Kings,amblix,True,False
4r95l4,What are some players ages that surprise you?,https://www.reddit.com/r/nba/comments/4r95l4/what_are_some_players_ages_that_surprise_you/,self.nba,https://www.reddit.com/r/nba/comments/4r95l4/what_are_some_players_ages_that_surprise_you/?ref=search_posts,nba,60,116,0,1467693495.0,Heat,Number333,True,False
4r9nan,"Mike Mazzeo on Twitter: ""The Gerald Wallace and Paul Pierce-Kevin Garnett trades seem worse and worse everyday""",https://twitter.com/MazzESPN/status/750065323185999874,twitter.com,https://www.reddit.com/r/nba/comments/4r9nan/mike_mazzeo_on_twitter_the_gerald_wallace_and/?ref=search_posts,nba,25,29,0,1467700483.0,Raptors,LinuxF4n,False,False
4r9ume,How does the West playoff seeding look now?,https://www.reddit.com/r/nba/comments/4r9ume/how_does_the_west_playoff_seeding_look_now/,self.nba,https://www.reddit.com/r/nba/comments/4r9ume/how_does_the_west_playoff_seeding_look_now/?ref=search_posts,nba,16,46,0,1467703542.0,Heat,dwcmwa,True,False
4ra2op,"GAME THREAD: Philadelphia 76ers vs Boston Celtics - (Jul. 4, 2016) [Summer League]",https://www.reddit.com/r/nba/comments/4ra2op/game_thread_philadelphia_76ers_vs_boston_celtics/,self.nba,https://www.reddit.com/r/nba/comments/4ra2op/game_thread_philadelphia_76ers_vs_boston_celtics/?ref=search_posts,nba,13,42,0,1467706947.0,Bucks,Metsvault,True,False
4r9mjc,[David Aldridge] That does not mean there’s no chance W’Brook could re-sign in OKC in ‘17. It just makes no sense financially to do renegotiation/extension.,https://twitter.com/daldridgetnt/status/750093476142850048,twitter.com,https://www.reddit.com/r/nba/comments/4r9mjc/david_aldridge_that_does_not_mean_theres_no/?ref=search_posts,nba,73,47,0,1467700151.0,Raptors,LinuxF4n,False,False
4r9wxw,"Sam Amick on Twitter: ""Dewayne Dedmon, who spent past two seasons in Orlando, has serious interest from Houston and Toronto. He was hoping to fill the Zaza role.""",https://twitter.com/sam_amick/status/750111377721847809,twitter.com,https://www.reddit.com/r/nba/comments/4r9wxw/sam_amick_on_twitter_dewayne_dedmon_who_spent/?ref=search_posts,nba,25,25,0,1467704471.0,,joe4942,False,False
4r9wkw,"Tim Bontemps on Twitter: ""Presti says Durant has earned the right to make this decision.""",https://twitter.com/TimBontemps/status/750111438182768640,twitter.com,https://www.reddit.com/r/nba/comments/4r9wkw/tim_bontemps_on_twitter_presti_says_durant_has/?ref=search_posts,nba,68,76,0,1467704326.0,Clippers Bandwagon,willbsn13,False,False
4r9s74,SAS Full Rant on KD's Decision (19 mins),https://www.youtube.com/watch?annotation_id=576e4acf-0000-2dda-8a0d-001a113ddfa6&feature=iv&src_vid=QXnEoVchZ44&v=2Bp9kJucv44,youtube.com,https://www.reddit.com/r/nba/comments/4r9s74/sas_full_rant_on_kds_decision_19_mins/?ref=search_posts,nba,133,86,0,1467702538.0,,theswaglol,False,False
4rb9m1,"the details of the KD and GSW meeting. and the messages that he received from green,curry and others",http://theundefeated.com/features/strength-in-numbers-convinced-kevin-durant-to-join-warriors/,theundefeated.com,https://www.reddit.com/r/nba/comments/4rb9m1/the_details_of_the_kd_and_gsw_meeting_and_the/?ref=search_posts,nba,127,42,0,1467726964.0,Bulls,dahman96,False,False
4raabx,Good FA fit for OKC,https://www.reddit.com/r/nba/comments/4raabx/good_fa_fit_for_okc/,self.nba,https://www.reddit.com/r/nba/comments/4raabx/good_fa_fit_for_okc/?ref=search_posts,nba,1,39,0,1467710431.0,OKC Hornets,mccoolio,True,False
4rb13y,How would you have reacted if Kevin Durant joined the Spurs instead of the Warriors?,https://www.reddit.com/r/nba/comments/4rb13y/how_would_you_have_reacted_if_kevin_durant_joined/,self.nba,https://www.reddit.com/r/nba/comments/4rb13y/how_would_you_have_reacted_if_kevin_durant_joined/?ref=search_posts,nba,2,55,0,1467722669.0,Pistons,rjgalanto14,True,False
4r924p,How the league can combat super teams like the one that was formed today,https://www.reddit.com/r/nba/comments/4r924p/how_the_league_can_combat_super_teams_like_the/,self.nba,https://www.reddit.com/r/nba/comments/4r924p/how_the_league_can_combat_super_teams_like_the/?ref=search_posts,nba,0,59,0,1467692255.0,Celtics,401klaser,True,False
4ra5es,[Lee Jenkins] Hushing Loud City: Kevin Durant says goodbye to city that helped make him,http://www.si.com/nba/2016/07/04/kevin-durant-thunder-exit-warriors-free-agency,si.com,https://www.reddit.com/r/nba/comments/4ra5es/lee_jenkins_hushing_loud_city_kevin_durant_says/?ref=search_posts,nba,21,20,0,1467708181.0,[MIL] Giannis Antetokounmpo,birlik54,False,False
4r950z,[Charania] Dallas sending 2nd round pick to Warriors for Bogut,https://twitter.com/ShamsCharania/status/750065126238191616,twitter.com,https://www.reddit.com/r/nba/comments/4r950z/charania_dallas_sending_2nd_round_pick_to/?ref=search_posts,nba,128,70,0,1467693290.0,Warriors,wafino1,False,False
4razjs,Nba writers defending Durant,https://www.reddit.com/r/nba/comments/4razjs/nba_writers_defending_durant/,self.nba,https://www.reddit.com/r/nba/comments/4razjs/nba_writers_defending_durant/?ref=search_posts,nba,0,162,0,1467721944.0,Lakers,nowadaysyouth,True,False
4r9xcw,Presti says Westbrook and Nick Collison met privately with Durant before the team meetings even began with Durant.,https://twitter.com/royceyoung/status/750112669726748672?s=09,twitter.com,https://www.reddit.com/r/nba/comments/4r9xcw/presti_says_westbrook_and_nick_collison_met/?ref=search_posts,nba,127,50,0,1467704638.0,,TheKeyNextDoor,False,False
4rb4y6,[Brandon Jennings] Find a way to get Trevor Ariza to the Knicks. A vet that wanna win,https://mobile.twitter.com/thinkiminthe90s/status/750191751139201024,mobile.twitter.com,https://www.reddit.com/r/nba/comments/4rb4y6/brandon_jennings_find_a_way_to_get_trevor_ariza/?ref=search_posts,nba,64,41,0,1467724633.0,Rockets,Superawesomecoolman,False,False
4rba0m,Most underrated starting player in the NBA?,https://www.reddit.com/r/nba/comments/4rba0m/most_underrated_starting_player_in_the_nba/,self.nba,https://www.reddit.com/r/nba/comments/4rba0m/most_underrated_starting_player_in_the_nba/?ref=search_posts,nba,0,73,0,1467727177.0,Timberwolves,bpc19,True,False
4r9vpe,[Serious] What do you think could be done to stop these super teams from happening in the next CBA?,https://www.reddit.com/r/nba/comments/4r9vpe/serious_what_do_you_think_could_be_done_to_stop/,self.nba,https://www.reddit.com/r/nba/comments/4r9vpe/serious_what_do_you_think_could_be_done_to_stop/?ref=search_posts,nba,0,59,0,1467703987.0,,YOLO_EXPRESS,True,False
4racmg,Don't hand the Warriors their title just yet.,https://www.reddit.com/r/nba/comments/4racmg/dont_hand_the_warriors_their_title_just_yet/,self.nba,https://www.reddit.com/r/nba/comments/4racmg/dont_hand_the_warriors_their_title_just_yet/?ref=search_posts,nba,0,65,0,1467711477.0,[POR] Damian Lillard,easy_dc13,True,False
4rab3l,Brook Lopez vs Andre Drummond?,https://www.reddit.com/r/nba/comments/4rab3l/brook_lopez_vs_andre_drummond/,self.nba,https://www.reddit.com/r/nba/comments/4rab3l/brook_lopez_vs_andre_drummond/?ref=search_posts,nba,1,57,0,1467710794.0,New Jersey Nets,KashMoney941,True,False
4ra6lx,"This is Simmons 3rd injury this game, what is happening?",https://www.reddit.com/r/nba/comments/4ra6lx/this_is_simmons_3rd_injury_this_game_what_is/,self.nba,https://www.reddit.com/r/nba/comments/4ra6lx/this_is_simmons_3rd_injury_this_game_what_is/?ref=search_posts,nba,26,21,0,1467708723.0,Bucks,Metsvault,True,False
4raai3,"[Aldridge] Was told that, as of now, Dwyane Wade’s meeting with the Bucks on Wednesday is still on. FWIW.",https://twitter.com/daldridgetnt/status/750137580142813184,twitter.com,https://www.reddit.com/r/nba/comments/4raai3/aldridge_was_told_that_as_of_now_dwyane_wades/?ref=search_posts,nba,166,82,0,1467710515.0,Warriors,Anon10W1z,False,False
4rbjm4,What has been curry's reaction to this?,https://www.reddit.com/r/nba/comments/4rbjm4/what_has_been_currys_reaction_to_this/,self.nba,https://www.reddit.com/r/nba/comments/4rbjm4/what_has_been_currys_reaction_to_this/?ref=search_posts,nba,10,45,0,1467732352.0,,DeuceMango,True,False
4ra85h,Jaylen Brown has as many points as free throw attempts.,https://www.reddit.com/r/nba/comments/4ra85h/jaylen_brown_has_as_many_points_as_free_throw/,self.nba,https://www.reddit.com/r/nba/comments/4ra85h/jaylen_brown_has_as_many_points_as_free_throw/?ref=search_posts,nba,17,83,0,1467709420.0,Heat,Coletheism,True,False
4r9zzg,"If Westbrook leaves sometime in the next year, are the OKC Thunder the biggest ""What-If?"" team in NBA history?",https://www.reddit.com/r/nba/comments/4r9zzg/if_westbrook_leaves_sometime_in_the_next_year_are/,self.nba,https://www.reddit.com/r/nba/comments/4r9zzg/if_westbrook_leaves_sometime_in_the_next_year_are/?ref=search_posts,nba,19,54,0,1467705767.0,76ers,rhetrim,True,False
4r91nb,"[Stein] The Knicks are about to strike a deal with Brandon Jennings, according to league sources",https://twitter.com/ESPNSteinLine/status/750060232051527682,twitter.com,https://www.reddit.com/r/nba/comments/4r91nb/stein_the_knicks_are_about_to_strike_a_deal_with/?ref=search_posts,nba,212,69,0,1467692074.0,Warriors,Anon10W1z,False,False
4raan0,[Katz] Here is Presti essentially saying he had an inkling Durant was leaving before KD made the call to him this morning.,https://twitter.com/fredkatz/status/750133546535231488,twitter.com,https://www.reddit.com/r/nba/comments/4raan0/katz_here_is_presti_essentially_saying_he_had_an/?ref=search_posts,nba,52,25,0,1467710583.0,,4for5,False,False
4r9t6z,Realistic Westbrook trade offers?,https://www.reddit.com/r/nba/comments/4r9t6z/realistic_westbrook_trade_offers/,self.nba,https://www.reddit.com/r/nba/comments/4r9t6z/realistic_westbrook_trade_offers/?ref=search_posts,nba,20,102,0,1467702963.0,Celtics,LarryIegend,True,False
4r9zuq,Free agent center Zaza Pachulia turned down the Trail Blazers and joined with the reigning Western Conference champions,http://www.blazersedge.com/2016/7/4/12094944/nba-free-agency-rumors-news-zaza-pachulia-golden-state-warriors,blazersedge.com,https://www.reddit.com/r/nba/comments/4r9zuq/free_agent_center_zaza_pachulia_turned_down_the/?ref=search_posts,nba,121,48,0,1467705711.0,,rekol85,False,False
4ra8ab,T.J. McConnell's Girlfriend Made Him Change His Hair,http://thesixersense.com/2016/07/04/t-j-mcconnells-girlfriend-made-him-change-his-hair/,thesixersense.com,https://www.reddit.com/r/nba/comments/4ra8ab/tj_mcconnells_girlfriend_made_him_change_his_hair/?ref=search_posts,nba,44,20,0,1467709479.0,Pacers,AmadeusCrumb,False,False
4rasgd,[Axelrod] Gabrielle Union (Wade's wife) has some interesting recent Likes on twitter,https://mobile.twitter.com/BenAxelrod/status/750154454293475328,mobile.twitter.com,https://www.reddit.com/r/nba/comments/4rasgd/axelrod_gabrielle_union_wades_wife_has_some/?ref=search_posts,nba,172,70,0,1467718590.0,Cavaliers,Chuggawumba123,False,False
4r9rra,Why did the Spurs not get this backlash for Aldridge signing?,https://www.reddit.com/r/nba/comments/4r9rra/why_did_the_spurs_not_get_this_backlash_for/,self.nba,https://www.reddit.com/r/nba/comments/4r9rra/why_did_the_spurs_not_get_this_backlash_for/?ref=search_posts,nba,0,92,0,1467702346.0,Lakers,wepresidentnowe,True,False
4rafk3,"Kinda weird Durant told Oladipo ""You're gunna love it here.""",https://www.reddit.com/r/nba/comments/4rafk3/kinda_weird_durant_told_oladipo_youre_gunna_love/,self.nba,https://www.reddit.com/r/nba/comments/4rafk3/kinda_weird_durant_told_oladipo_youre_gunna_love/?ref=search_posts,nba,208,68,0,1467712815.0,Lakers,WERData,True,False
4ra9y4,Harrison Barnes first official statement since signing with the Mavericks,https://www.facebook.com/hbarnes40/posts/1257868564224263,facebook.com,https://www.reddit.com/r/nba/comments/4ra9y4/harrison_barnes_first_official_statement_since/?ref=search_posts,nba,78,38,0,1467710249.0,[CHI] Scottie Pippen,jeric13xd,False,False
4ra31h,This KD thing got me thinking--what NBA stories in the past 10 years will be 30 for 30'd?,https://www.reddit.com/r/nba/comments/4ra31h/this_kd_thing_got_me_thinkingwhat_nba_stories_in/,self.nba,https://www.reddit.com/r/nba/comments/4ra31h/this_kd_thing_got_me_thinkingwhat_nba_stories_in/?ref=search_posts,nba,18,101,0,1467707105.0,Knicks,kobesrightelbow,True,False
4ra81s,"Up-to-date Warriors payroll going into next season. Currently ~$300k under projected cap of $94,000,000.",http://imgur.com/2jHWdgZ,imgur.com,https://www.reddit.com/r/nba/comments/4ra81s/uptodate_warriors_payroll_going_into_next_season/?ref=search_posts,nba,94,74,0,1467709376.0,NBA,Mathisonsf,False,False
4r9a29,Would Derrick Williams be a nice sneaky pick up for a contender?,https://www.reddit.com/r/nba/comments/4r9a29/would_derrick_williams_be_a_nice_sneaky_pick_up/,self.nba,https://www.reddit.com/r/nba/comments/4r9a29/would_derrick_williams_be_a_nice_sneaky_pick_up/?ref=search_posts,nba,14,30,0,1467695121.0,Raptors,pacpacpac,True,False
4rb9h1,Who will be the worst team next season?,https://www.reddit.com/r/nba/comments/4rb9h1/who_will_be_the_worst_team_next_season/,self.nba,https://www.reddit.com/r/nba/comments/4rb9h1/who_will_be_the_worst_team_next_season/?ref=search_posts,nba,12,76,0,1467726899.0,San Diego Clippers,pashmeow,True,False
4r9jv5,"Travis Singleton on Twitter: ""Thunder players found out about the KD signing through the letter just like the rest of the world #Wow""",https://twitter.com/SneakerReporter/status/750063103786700800,twitter.com,https://www.reddit.com/r/nba/comments/4r9jv5/travis_singleton_on_twitter_thunder_players_found/?ref=search_posts,nba,122,52,0,1467699066.0,[OKC] Russell Westbrook,limark,False,False
4rab6c,Dan Gilbert's jet is on its way to Florida.,https://twitter.com/lullonsports/status/750138079059509248,twitter.com,https://www.reddit.com/r/nba/comments/4rab6c/dan_gilberts_jet_is_on_its_way_to_florida/?ref=search_posts,nba,146,136,0,1467710832.0,Cavaliers,Gumby_15,False,False
4raq7j,Which Conference is Stronger now?,https://www.reddit.com/r/nba/comments/4raq7j/which_conference_is_stronger_now/,self.nba,https://www.reddit.com/r/nba/comments/4raq7j/which_conference_is_stronger_now/?ref=search_posts,nba,0,40,0,1467717653.0,NBA,Modestout23,True,False
