id,title,url,domain,permalink,subreddit,score,num_comments,gilded,created,author_flair_text,author,is_self,over_18
4u0u50,Dirk Nowitzki: The Samson and Delilah complex. Did having a haircut during the season(s) affect his numbers?,https://www.reddit.com/r/nba/comments/4u0u50/dirk_nowitzki_the_samson_and_delilah_complex_did/,self.nba,https://www.reddit.com/r/nba/comments/4u0u50/dirk_nowitzki_the_samson_and_delilah_complex_did/?ref=search_posts,nba,334,62,0,1469186338.0,[ATL] Pete Maravich,lipstickpizza,True,False
4tzcm3,Team USA coach Mike Krzyzewski: Anti-gay North Carolina law ’embarrassing’,http://nba.nbcsports.com/2016/07/21/team-usa-coach-mike-krzyzewski-anti-gay-north-carolina-law-embarrassing/?utm_source=dlvr.it&utm_medium=twitter,nba.nbcsports.com,https://www.reddit.com/r/nba/comments/4tzcm3/team_usa_coach_mike_krzyzewski_antigay_north/?ref=search_posts,nba,673,272,0,1469165496.0,Spurs,PhillipJFry32,False,False
4u0lkm,"Kyrie Irving is wearing a wrist band that says ""Don't be a little bitch"" on it during Team USA Camp.",https://www.reddit.com/r/nba/comments/4u0lkm/kyrie_irving_is_wearing_a_wrist_band_that_says/,self.nba,https://www.reddit.com/r/nba/comments/4u0lkm/kyrie_irving_is_wearing_a_wrist_band_that_says/?ref=search_posts,nba,1075,285,0,1469182876.0,[LAL] Kobe Bryant,lakerswiz,True,False
4tzl24,"Dwight Howard: ""I've got little kids at basketball camps telling me, 'My dad says you suck at free throws.' Other players have flaws, but they aren't getting magnified the way the free throws are."" A great article on why some big men just can't get better at shooting free throws.",http://espn.go.com/nba/story/_/id/17115866/real-root-nba-intentional-foul-epidemic,espn.go.com,https://www.reddit.com/r/nba/comments/4tzl24/dwight_howard_ive_got_little_kids_at_basketball/?ref=search_posts,nba,525,254,0,1469168529.0,Clippers,Russel_TRILLson,False,False
4tzg6w,One of my hobbies is tracing photos of iconic NBA players on a sketch app on my phone. Here's an album of some of my drawings.,http://imgur.com/a/vvJ0P,imgur.com,https://www.reddit.com/r/nba/comments/4tzg6w/one_of_my_hobbies_is_tracing_photos_of_iconic_nba/?ref=search_posts,nba,436,106,0,1469166762.0,Lakers,HotSingleInYourArea,False,False
4tzmwd,"[King] Jae Crowder to @Tom_NBA on Horford considering Wiz: ""We beat them four times this year. You don't want to go there.""",https://twitter.com/ByJayKing/status/756235283335618560,twitter.com,https://www.reddit.com/r/nba/comments/4tzmwd/king_jae_crowder_to_tom_nba_on_horford/?ref=search_posts,nba,160,290,0,1469169218.0,Raptors,BismackMyBiyombo,False,False
4u07fg,Jae Crowder: 'Toronto is not a team we're worried about.',https://twitter.com/CBSSportsNBA/status/756261924808093696,twitter.com,https://www.reddit.com/r/nba/comments/4u07fg/jae_crowder_toronto_is_not_a_team_were_worried/?ref=search_posts,nba,799,762,0,1469177182.0,Raptors,RapidRaptors,False,False
4u067v,[Durant] I recognize this was a tough decision for the NBA but I respect the choice. Discrimination of any kind cannot be allowed,https://twitter.com/KDTrey5/status/756281543522418688,twitter.com,https://www.reddit.com/r/nba/comments/4u067v/durant_i_recognize_this_was_a_tough_decision_for/?ref=search_posts,nba,317,218,0,1469176704.0,Raptors,BismackMyBiyombo,False,False
4tzp5q,r/NBA Roast of the: Denver Nuggets (04/30),https://www.reddit.com/r/nba/comments/4tzp5q/rnba_roast_of_the_denver_nuggets_0430/,self.nba,https://www.reddit.com/r/nba/comments/4tzp5q/rnba_roast_of_the_denver_nuggets_0430/?ref=search_posts,nba,364,583,0,1469170088.0,The Truth,FeversMirrors,True,False
4u0gb9,Hypothetical: Lebron James and Serena Williams conceive a child. What is a likely timeline for him/her?,https://www.reddit.com/r/nba/comments/4u0gb9/hypothetical_lebron_james_and_serena_williams/,self.nba,https://www.reddit.com/r/nba/comments/4u0gb9/hypothetical_lebron_james_and_serena_williams/?ref=search_posts,nba,625,161,0,1469180800.0,Nets,laibok,True,False
4tz984,"[Shelburne] Paul George on the relocation of the All-Star Game: ""I'm huge on keeping your word. I'm not necessarily saying it's bad for the NBA to move it. Charlotte is a growing city and the Hornets have picked that program up. It's a shame it's possible that we'd take that away from them""",https://twitter.com/ramonashelburne/status/756234741368717313,twitter.com,https://www.reddit.com/r/nba/comments/4tz984/shelburne_paul_george_on_the_relocation_of_the/?ref=search_posts,nba,607,476,0,1469164288.0,West,urfaselol,False,False
4tzscb,"DeMarcus Cousins NASTY Career-HIGH vs Hornets - 56 Pts, 12 rebounds, 4 assists; makes Spencer Hawes contemplate life choices!",https://www.youtube.com/watch?v=yWwC5UXpb2g,youtube.com,https://www.reddit.com/r/nba/comments/4tzscb/demarcus_cousins_nasty_careerhigh_vs_hornets_56/?ref=search_posts,nba,308,82,0,1469171285.0,Kings,truwarier14,False,False
4u191d,"Derrick Rose talks upcoming season, says Knicks & Warriors viewed as NBA's ""super teams",https://twitter.com/nbacom/status/756351840787333120,twitter.com,https://www.reddit.com/r/nba/comments/4u191d/derrick_rose_talks_upcoming_season_says_knicks/?ref=search_posts,nba,810,573,0,1469193724.0,Lakers,Yepswab,False,False
4tzwmz,Sources: Undrafted NC State guard Cat Barber has agreed to a partially guaranteed deal with the Philadelphia 76ers.,https://twitter.com/shamscharania/status/756271369080504328,twitter.com,https://www.reddit.com/r/nba/comments/4tzwmz/sources_undrafted_nc_state_guard_cat_barber_has/?ref=search_posts,nba,34,14,0,1469172941.0,Thunder,goossens,False,False
4tziuu,NBA Statement Regarding 2017 NBA All-Star Game,http://www.nba.com/2016/news/07/21/nba-statement-all-star-game-relocation-from-charlotte/,nba.com,https://www.reddit.com/r/nba/comments/4tziuu/nba_statement_regarding_2017_nba_allstar_game/?ref=search_posts,nba,19,14,0,1469167738.0,Hawks,medieval7,False,False
4u0fwl,"Stephen Curry vs John Wall UNREAL Duel - Wall With 41 Pts, Steph With 51 Pts, 11 Threes!",https://www.youtube.com/watch?v=lHY3t5S8CyQ,youtube.com,https://www.reddit.com/r/nba/comments/4u0fwl/stephen_curry_vs_john_wall_unreal_duel_wall_with/?ref=search_posts,nba,113,28,0,1469180633.0,[WAS] Gilbert Arenas,Laure2015,False,False
4tzt8l,Your starting 5 non all star team that could make the playoffs,https://www.reddit.com/r/nba/comments/4tzt8l/your_starting_5_non_all_star_team_that_could_make/,self.nba,https://www.reddit.com/r/nba/comments/4tzt8l/your_starting_5_non_all_star_team_that_could_make/?ref=search_posts,nba,3,52,0,1469171623.0,,Clipper4Life,True,False
4tzln1,"[Flynn] Louisiana is 1 of 11 states suing DOJ over Bathroom ruling. Still, NBA sending game to New Orleans.",https://twitter.com/FlynnShawn/status/756209165157142528,twitter.com,https://www.reddit.com/r/nba/comments/4tzln1/flynn_louisiana_is_1_of_11_states_suing_doj_over/?ref=search_posts,nba,104,68,0,1469168734.0,Supersonics,cyclone_87,False,False
4u0k0j,Dwight Howard 16 Pts 21 Reb 9 Blocks NBA FINALS 2009 G4 vs Lakers,https://www.youtube.com/watch?v=5k106Gkb4tA,youtube.com,https://www.reddit.com/r/nba/comments/4u0k0j/dwight_howard_16_pts_21_reb_9_blocks_nba_finals/?ref=search_posts,nba,89,38,0,1469182250.0,Thunder,nomad700,False,False
4tz96t,[Sports Illustrated] Phoenix shaping Devin Booker for stardom,http://www.si.com/nba/2016/07/21/devin-booker-suns-summer-league-team-usa-earl-watson-eric-bledsoe,si.com,https://www.reddit.com/r/nba/comments/4tz96t/sports_illustrated_phoenix_shaping_devin_booker/?ref=search_posts,nba,14,24,0,1469164275.0,Suns,sems_can_gcig,False,False
4u067q,Who are some of the best most underrated shooters ever?,https://www.reddit.com/r/nba/comments/4u067q/who_are_some_of_the_best_most_underrated_shooters/,self.nba,https://www.reddit.com/r/nba/comments/4u067q/who_are_some_of_the_best_most_underrated_shooters/?ref=search_posts,nba,8,47,0,1469176700.0,,ThomasDeThaey13,True,False
4tzda2,Warriors' Klay Thompson sees Manu Ginobili's sacrifice as inspiration,http://news4sanantonio.com/sports/spurs-zone/warriors-klay-thompson-sees-manu-ginobilis-sacrifice-as-inspiration,news4sanantonio.com,https://www.reddit.com/r/nba/comments/4tzda2/warriors_klay_thompson_sees_manu_ginobilis/?ref=search_posts,nba,91,52,0,1469165712.0,Spurs,PhillipJFry32,False,False
4tzkd3,"After this busy off-season, which player will enjoy the greatest overall increase in statistical output?",https://www.reddit.com/r/nba/comments/4tzkd3/after_this_busy_offseason_which_player_will_enjoy/,self.nba,https://www.reddit.com/r/nba/comments/4tzkd3/after_this_busy_offseason_which_player_will_enjoy/?ref=search_posts,nba,9,23,0,1469168266.0,Lakers,kurkirk,True,False
4tze60,Three stripes. #TeamAdidas,https://i.reddituploads.com/32dbad2b9e7746c399d7853278a8fed6?fit=max&h=1536&w=1536&s=a8477d6c398cce2322ca9b5750aab0ac,i.reddituploads.com,https://www.reddit.com/r/nba/comments/4tze60/three_stripes_teamadidas/?ref=search_posts,nba,61,22,0,1469166022.0,Thunder,goossens,False,False
4u0chz,What is your favorite Dunk from a Dunk Contest.,https://www.reddit.com/r/nba/comments/4u0chz/what_is_your_favorite_dunk_from_a_dunk_contest/,self.nba,https://www.reddit.com/r/nba/comments/4u0chz/what_is_your_favorite_dunk_from_a_dunk_contest/?ref=search_posts,nba,0,35,0,1469179208.0,[GSW] Draymond Green,GlacierPineapple,True,False
4u19aa,"If LBJ hungers to defeat the upcoming Dubs, is the current squad up to task? If not, who do you think will arrive to the Cavs before ASW?",https://www.reddit.com/r/nba/comments/4u19aa/if_lbj_hungers_to_defeat_the_upcoming_dubs_is_the/,self.nba,https://www.reddit.com/r/nba/comments/4u19aa/if_lbj_hungers_to_defeat_the_upcoming_dubs_is_the/?ref=search_posts,nba,0,104,0,1469193865.0,Spurs,casio_is_my_watch,True,False
4tz44t,"Beyond New Orleans, NBA considering New York/Brooklyn and Chicago for 2017 All-Star game",http://nba.nbcsports.com/2016/07/21/beyond-new-orleans-nba-considering-new-yorkbrooklyn-and-chicago-for-2017-all-star-game/?utm_source=dlvr.it&utm_medium=twitter,nba.nbcsports.com,https://www.reddit.com/r/nba/comments/4tz44t/beyond_new_orleans_nba_considering_new/?ref=search_posts,nba,29,37,0,1469162522.0,Knicks,HaruSoul,False,False
4u0tq3,What should the Bucks new arena name be?,https://www.reddit.com/r/nba/comments/4u0tq3/what_should_the_bucks_new_arena_name_be/,self.nba,https://www.reddit.com/r/nba/comments/4u0tq3/what_should_the_bucks_new_arena_name_be/?ref=search_posts,nba,26,45,0,1469186150.0,[MIL] Ray Allen,ReverendGames,True,False
4u0gxd,"You have to build a franchise with either KD or Curry, who do you go with?",https://www.reddit.com/r/nba/comments/4u0gxd/you_have_to_build_a_franchise_with_either_kd_or/,self.nba,https://www.reddit.com/r/nba/comments/4u0gxd/you_have_to_build_a_franchise_with_either_kd_or/?ref=search_posts,nba,8,86,0,1469181037.0,[CHI] Michael Jordan,Lucyfer2016,True,False
4tzsta,[Sacramento Kings Twitter] Kings Applaud @NBA Decision to Move All-Star Game From Charlotte,https://twitter.com/SacramentoKings/status/756242105710809088?ref_src=twsrc%5Etfw,twitter.com,https://www.reddit.com/r/nba/comments/4tzsta/sacramento_kings_twitter_kings_applaud_nba/?ref=search_posts,nba,62,30,0,1469171464.0,Wizards,ireddit270,False,False
4u0o9s,Kobe plays with Zaire Wade and Chris Paul Jr. @ 2016 All-Star Game,https://www.youtube.com/watch?v=x2I1xRuXKQw,youtube.com,https://www.reddit.com/r/nba/comments/4u0o9s/kobe_plays_with_zaire_wade_and_chris_paul_jr_2016/?ref=search_posts,nba,175,76,0,1469183982.0,[HOU] Stromile Swift,texasproof,False,False
4u0k6f,The Real James Harden Defense 2015-2016,https://youtu.be/-S2T3p2CIdk,youtu.be,https://www.reddit.com/r/nba/comments/4u0k6f/the_real_james_harden_defense_20152016/?ref=search_posts,nba,140,178,0,1469182315.0,[HOU] James Harden,GettingLostInDaSauce,False,False
4u0hes,Most NBA team subreddits talking about bad/hiveminded /r/nba is towards them or something in particular.,https://www.reddit.com/r/nba/comments/4u0hes/most_nba_team_subreddits_talking_about/,self.nba,https://www.reddit.com/r/nba/comments/4u0hes/most_nba_team_subreddits_talking_about/?ref=search_posts,nba,67,106,0,1469181235.0,Raptors,RapidRaptors,True,False
4u1b7z,The Greatest Delly Tribute Video in the history of Delly Tribute Videos,https://www.youtube.com/watch?v=b4dBo87zZTA,youtube.com,https://www.reddit.com/r/nba/comments/4u1b7z/the_greatest_delly_tribute_video_in_the_history/?ref=search_posts,nba,21,14,0,1469194789.0,[CHA] Larry Johnson,TheFuzzNBA,False,False
4u1c02,If Bill Burr Was An NBA Commentator,https://www.youtube.com/watch?v=QXhrCm6zdr4,youtube.com,https://www.reddit.com/r/nba/comments/4u1c02/if_bill_burr_was_an_nba_commentator/?ref=search_posts,nba,63,47,0,1469195178.0,Cavaliers Bandwagon,offandthenonagain,False,False
4tzmqe,"Today, after a decade, I pulled out my Zaza Pachulia basketball card collection and sold it. Feels weird.",https://www.reddit.com/r/nba/comments/4tzmqe/today_after_a_decade_i_pulled_out_my_zaza/,self.nba,https://www.reddit.com/r/nba/comments/4tzmqe/today_after_a_decade_i_pulled_out_my_zaza/?ref=search_posts,nba,108,44,0,1469169147.0,[ATL] Zaza Pachulia,TheUnderpaid,True,False
4u0c36,"[Hughes, Bleacher Report] The Biggest Hole Every NBA Team Has to Fill After 2016's NBA Free-Agent Frenzy",http://deslide.clusterfake.net/?o=html_table&u=http%3A%2F%2Fbleacherreport.com%2Farticles%2F2653192-the-biggest-hole-every-nba-team-has-to-fill-after-2016s-nba-free-agent-frenzy,deslide.clusterfake.net,https://www.reddit.com/r/nba/comments/4u0c36/hughes_bleacher_report_the_biggest_hole_every_nba/?ref=search_posts,nba,25,30,0,1469179045.0,Bulls,wjbc,False,False
4tzbov,Knicks Express Interest in Trading for Greg Monroe,http://amicohoops.net/latest-cousins-cavs-celtics-mavs/,amicohoops.net,https://www.reddit.com/r/nba/comments/4tzbov/knicks_express_interest_in_trading_for_greg_monroe/?ref=search_posts,nba,3,35,0,1469165160.0,Thunder,Remolten11,False,False
4tznxh,How can being a fan of your team make everyone jealous?,https://www.reddit.com/r/nba/comments/4tznxh/how_can_being_a_fan_of_your_team_make_everyone/,self.nba,https://www.reddit.com/r/nba/comments/4tznxh/how_can_being_a_fan_of_your_team_make_everyone/?ref=search_posts,nba,27,127,0,1469169625.0,Jazz,RGiss,True,False
4u07rl,What should the Over/Unders be set at for the 2016-2017 season?,https://www.reddit.com/r/nba/comments/4u07rl/what_should_the_overunders_be_set_at_for_the/,self.nba,https://www.reddit.com/r/nba/comments/4u07rl/what_should_the_overunders_be_set_at_for_the/?ref=search_posts,nba,8,52,0,1469177333.0,Knicks,mrgeriatric,True,False
4tzzj4,What's Jamal Murray's potential?,https://www.reddit.com/r/nba/comments/4tzzj4/whats_jamal_murrays_potential/,self.nba,https://www.reddit.com/r/nba/comments/4tzzj4/whats_jamal_murrays_potential/?ref=search_posts,nba,11,27,0,1469174066.0,,Bottle1234,True,False
4u06c0,Do people care about PED use in the NBA? Would people care if alot of the players are using PED?,https://www.reddit.com/r/nba/comments/4u06c0/do_people_care_about_ped_use_in_the_nba_would/,self.nba,https://www.reddit.com/r/nba/comments/4u06c0/do_people_care_about_ped_use_in_the_nba_would/?ref=search_posts,nba,7,47,0,1469176756.0,[NYK] Kristaps Porzingis,NotYourAverageJose,True,False
4u0s0f,DeMarcus Cousins reveals his favorite NBA team growing up,https://twitter.com/boogiecousins/status/756269971727011840,twitter.com,https://www.reddit.com/r/nba/comments/4u0s0f/demarcus_cousins_reveals_his_favorite_nba_team/?ref=search_posts,nba,57,42,0,1469185453.0,Kings,BigGreekMike,False,False
4tz258,"[Nick DePaula] Upcoming sneaker free agent Harrison Barnes has agreed to a multi-year shoe deal extension with Adidas, sources tell @TheVertical.",https://twitter.com/NickDePaula/status/756224556696821760,twitter.com,https://www.reddit.com/r/nba/comments/4tz258/nick_depaula_upcoming_sneaker_free_agent_harrison/?ref=search_posts,nba,182,83,0,1469161856.0,West,urfaselol,False,False
4tzrd1,Would you call KD a bitch in real life to his face?,https://www.reddit.com/r/nba/comments/4tzrd1/would_you_call_kd_a_bitch_in_real_life_to_his_face/,self.nba,https://www.reddit.com/r/nba/comments/4tzrd1/would_you_call_kd_a_bitch_in_real_life_to_his_face/?ref=search_posts,nba,57,239,0,1469170934.0,Mavericks,badoosh123,True,False
4tzy91,Has any player besides DeAndre Jordan this season ever been First Team All-NBA but not made the All Star team?,https://www.reddit.com/r/nba/comments/4tzy91/has_any_player_besides_deandre_jordan_this_season/,self.nba,https://www.reddit.com/r/nba/comments/4tzy91/has_any_player_besides_deandre_jordan_this_season/?ref=search_posts,nba,16,40,0,1469173558.0,Warriors,DrizzlinDrizzy,True,False
4u0ado,Top 5 Centers of ALL Time?,https://www.reddit.com/r/nba/comments/4u0ado/top_5_centers_of_all_time/,self.nba,https://www.reddit.com/r/nba/comments/4u0ado/top_5_centers_of_all_time/?ref=search_posts,nba,0,67,0,1469178360.0,Cavaliers,theWalkON777,True,False
4tzx3u,Power Ranking Current NBA Owners,https://www.reddit.com/r/nba/comments/4tzx3u/power_ranking_current_nba_owners/,self.nba,https://www.reddit.com/r/nba/comments/4tzx3u/power_ranking_current_nba_owners/?ref=search_posts,nba,0,44,0,1469173129.0,,discovet11,True,False
4tzmm7,[ByJayKing] Marcin Gortat does not love Jae Crowder's comments about the Washington Wizards.,https://twitter.com/ByJayKing/status/756251844461158400,twitter.com,https://www.reddit.com/r/nba/comments/4tzmm7/byjayking_marcin_gortat_does_not_love_jae/?ref=search_posts,nba,28,43,0,1469169106.0,,Cross_em_up,False,False
4tz9z6,Stephen A. Smith putting up some shots,https://youtu.be/RI-07xDt5pM,youtu.be,https://www.reddit.com/r/nba/comments/4tz9z6/stephen_a_smith_putting_up_some_shots/?ref=search_posts,nba,80,50,0,1469164552.0,,TheKeyNextDoor,False,False
4tzre3,"My Wish: Steph Curry meets with Ashley, a 14 year old who is in remission from leukemia, and grants her selfless wish",http://espn.go.com/video/clip?id=17117191,espn.go.com,https://www.reddit.com/r/nba/comments/4tzre3/my_wish_steph_curry_meets_with_ashley_a_14_year/?ref=search_posts,nba,26,34,0,1469170945.0,Warriors,GurleyThings,False,False
4u0zmn,The Real James Harden Defense 2015-2016,https://www.youtube.com/watch?v=-S2T3p2CIdk&feature=youtu.be,youtube.com,https://www.reddit.com/r/nba/comments/4u0zmn/the_real_james_harden_defense_20152016/?ref=search_posts,nba,25,42,0,1469188928.0,[HOU] James Harden,Halomate,False,False
4tzd5u,Charlotte Hornets Statement on 2017 NBA All-Star Game,http://www.nba.com/hornets/charlotte-hornets-statement-2017-nba-all-star-game,nba.com,https://www.reddit.com/r/nba/comments/4tzd5u/charlotte_hornets_statement_on_2017_nba_allstar/?ref=search_posts,nba,34,21,0,1469165675.0,,Somali_Pir8,False,False
4tz72i,Create your perfect Starting 5 from the rosters of the non-playoff teams and answer honestly: Would they beat the Warriors in 7?,https://www.reddit.com/r/nba/comments/4tz72i/create_your_perfect_starting_5_from_the_rosters/,self.nba,https://www.reddit.com/r/nba/comments/4tz72i/create_your_perfect_starting_5_from_the_rosters/?ref=search_posts,nba,4,49,0,1469163511.0,,arashtp,True,False
4u0q0j,"Nets coach Kenny Atkinson once wondered about PG Jeremy Lin: 'Is this kid any good? He was kind of an afterthought. He was part of the group that didn’t play, and I was working with that group on a daily basis.”",http://espn.go.com/blog/brooklyn-nets/post/_/id/23744/brooklyn-nets-coach-kenny-atkinson-once-wondered-about-pg-jeremy-lin-is-this-kid-any-good,espn.go.com,https://www.reddit.com/r/nba/comments/4u0q0j/nets_coach_kenny_atkinson_once_wondered_about_pg/?ref=search_posts,nba,61,15,0,1469184655.0,,justforgotfrag,False,False
4tz38v,A Rundown of 2016 North Carolina Sports,https://www.reddit.com/r/nba/comments/4tz38v/a_rundown_of_2016_north_carolina_sports/,self.nba,https://www.reddit.com/r/nba/comments/4tz38v/a_rundown_of_2016_north_carolina_sports/?ref=search_posts,nba,61,41,0,1469162231.0,KnickerBockers,halfcutskelly,True,False
4tzkqq,"SportsCenter on Twitter: ""WNBA has fined teams & players for wearing black shirts in wake of recent shootings by & against police officers.""",https://twitter.com/SportsCenter/status/756251663028068352,twitter.com,https://www.reddit.com/r/nba/comments/4tzkqq/sportscenter_on_twitter_wnba_has_fined_teams/?ref=search_posts,nba,79,32,0,1469168410.0,[BOS] Paul Pierce,Chancelor_West,False,False
4u10bv,D'Angelo Russell soaking in all Coach Pop has to offer,https://twitter.com/iamdrewinla/status/756278396246556672,twitter.com,https://www.reddit.com/r/nba/comments/4u10bv/dangelo_russell_soaking_in_all_coach_pop_has_to/?ref=search_posts,nba,74,47,0,1469189265.0,Lakers,KingsCrossings,False,False
4u0ay9,Anyone watchimg this 2 million dollar basketball tournament on espn?,https://www.reddit.com/r/nba/comments/4u0ay9/anyone_watchimg_this_2_million_dollar_basketball/,self.nba,https://www.reddit.com/r/nba/comments/4u0ay9/anyone_watchimg_this_2_million_dollar_basketball/?ref=search_posts,nba,25,21,0,1469178601.0,[PHI] Allen Iverson,McKie4Three,True,False
4tzepg,"Kobe 1v1 LIL Bow Wow for $1,000 (Kobe camp 2011)",https://www.youtube.com/watch?v=IYoaSI2GC2k,youtube.com,https://www.reddit.com/r/nba/comments/4tzepg/kobe_1v1_lil_bow_wow_for_1000_kobe_camp_2011/?ref=search_posts,nba,10,22,0,1469166205.0,Lakers,tcubelol,False,False
4tzsdr,Governor McCrory Issues Statement on the NBA's Decision to Relocate 2017 All-Star Game,https://governor.nc.gov/press-release/governor-mccrory-issues-statement-nbas-decision-relocate-2017-all-star-game,governor.nc.gov,https://www.reddit.com/r/nba/comments/4tzsdr/governor_mccrory_issues_statement_on_the_nbas/?ref=search_posts,nba,77,106,0,1469171297.0,Warriors,timejustin49,False,False
4tyxan,"CMV: Steve Nash maybe deserved one MVP, but he definitely did not deserve two",https://www.reddit.com/r/nba/comments/4tyxan/cmv_steve_nash_maybe_deserved_one_mvp_but_he/,self.nba,https://www.reddit.com/r/nba/comments/4tyxan/cmv_steve_nash_maybe_deserved_one_mvp_but_he/?ref=search_posts,nba,0,28,0,1469160170.0,,baby_milo,True,False
4u0mql,Looking for Stats: Drives to the basket on Isolations and PnR Ball Handler,https://www.reddit.com/r/nba/comments/4u0mql/looking_for_stats_drives_to_the_basket_on/,self.nba,https://www.reddit.com/r/nba/comments/4u0mql/looking_for_stats_drives_to_the_basket_on/?ref=search_posts,nba,0,8,0,1469183377.0,,JamesHarenDPOTY,True,False
4u0gco,How well do you think the Select Team could do at the Olympics?,https://www.reddit.com/r/nba/comments/4u0gco/how_well_do_you_think_the_select_team_could_do_at/,self.nba,https://www.reddit.com/r/nba/comments/4u0gco/how_well_do_you_think_the_select_team_could_do_at/?ref=search_posts,nba,5,18,0,1469180817.0,Warriors,truthoftheyouth,True,False
4u0oy1,Ben Simmons Summer League Highlights - Magic Esque,https://www.youtube.com/watch?v=61Th2jE10gM,youtube.com,https://www.reddit.com/r/nba/comments/4u0oy1/ben_simmons_summer_league_highlights_magic_esque/?ref=search_posts,nba,0,15,0,1469184249.0,Raptors,Xenorak94,False,False
4tzs9e,Dream Team vs Redeem Team,https://www.reddit.com/r/nba/comments/4tzs9e/dream_team_vs_redeem_team/,self.nba,https://www.reddit.com/r/nba/comments/4tzs9e/dream_team_vs_redeem_team/?ref=search_posts,nba,0,17,0,1469171256.0,[OKC] Steven Adams,legendariusss,True,False
4tzy8o,Stupid Scenario,https://www.reddit.com/r/nba/comments/4tzy8o/stupid_scenario/,self.nba,https://www.reddit.com/r/nba/comments/4tzy8o/stupid_scenario/?ref=search_posts,nba,0,14,0,1469173555.0,[GSW] Draymond Green,GlacierPineapple,True,False
4tzdom,[OC] Players Average Salary Increase vs. Increase in Projected Salary Cap (2016-2018),http://imgur.com/a/XTo1T,imgur.com,https://www.reddit.com/r/nba/comments/4tzdom/oc_players_average_salary_increase_vs_increase_in/?ref=search_posts,nba,8,5,0,1469165856.0,[TOR] Kyle Lowry,ThatCoxKid,False,False
4u06yx,Inside the NBA - How to Post Up,https://www.youtube.com/attribution_link?a=T3CtWeKIbLU&u=%2Fwatch%3Fv%3DqbGGx6W7hy4%26feature%3Dshare,youtube.com,https://www.reddit.com/r/nba/comments/4u06yx/inside_the_nba_how_to_post_up/?ref=search_posts,nba,17,3,0,1469177016.0,[HOU] James Harden,gignac,False,False
4tyx97,"[Basketball Insiders] Larry Coon, CBA expert, chatted today. Here's the transcript.",http://www.basketballinsiders.com/chat/nba-chat-with-larry-coon-7212016/,basketballinsiders.com,https://www.reddit.com/r/nba/comments/4tyx97/basketball_insiders_larry_coon_cba_expert_chatted/?ref=search_posts,nba,3,2,0,1469160154.0,Bulls,wjbc,False,False
4tzhb0,Jae Crowder on Durant and how BOS beat CLE and GSW,https://twitter.com/ByTomWesterholm/status/756191434957553664,twitter.com,https://www.reddit.com/r/nba/comments/4tzhb0/jae_crowder_on_durant_and_how_bos_beat_cle_and_gsw/?ref=search_posts,nba,0,7,0,1469167169.0,Knicks,ejayshun,False,False
4u0o1p,Kevin Durant Receives an Awkward Question from DeAndre Jordan.,https://www.youtube.com/watch?v=ExwFYgA02RA,youtube.com,https://www.reddit.com/r/nba/comments/4u0o1p/kevin_durant_receives_an_awkward_question_from/?ref=search_posts,nba,14,11,0,1469183888.0,[LAC] Matt Barnes,Big_Ballmers,False,False
4tzk7l,[Bonnell] hornets COO Whitfield said league is sufficiently committed to Charlotte that NBA doesn't plan to put 2019 ASG out to general bid.,https://twitter.com/rick_bonnell/status/756251314519171073,twitter.com,https://www.reddit.com/r/nba/comments/4tzk7l/bonnell_hornets_coo_whitfield_said_league_is/?ref=search_posts,nba,6,5,0,1469168212.0,[DAL] Tyson Chandler,rps215,False,False
4u13qz,Do players carry their own passports when they head to Toronto?,https://www.reddit.com/r/nba/comments/4u13qz/do_players_carry_their_own_passports_when_they/,self.nba,https://www.reddit.com/r/nba/comments/4u13qz/do_players_carry_their_own_passports_when_they/?ref=search_posts,nba,7,23,0,1469191020.0,[TOR] DeMar DeRozan,maximumdose,True,False
