id,title,url,domain,permalink,subreddit,score,num_comments,gilded,created,author_flair_text,author,is_self,over_18
4rmajv,"Chris Haynes on Twitter: ""Free agent forward Richard Jefferson has agreed to two-year deal with #Cavs, he announced on his Snapchat account.""",https://twitter.com/ChrisBHaynes/status/750882928213630977,twitter.com,https://www.reddit.com/r/nba/comments/4rmajv/chris_haynes_on_twitter_free_agent_forward/?ref=search_posts,nba,242,25,0,1467888224.0,[DAL] Michael Finley,monetclaude,False,False
4rmt0h,What's next for the heat?,https://www.reddit.com/r/nba/comments/4rmt0h/whats_next_for_the_heat/,self.nba,https://www.reddit.com/r/nba/comments/4rmt0h/whats_next_for_the_heat/?ref=search_posts,nba,2,37,0,1467895677.0,[MIA] Chris Bosh,FGCIsFreeAsFuck,True,False
4rkrq0,[Glover]: Like @SainAsylum just reported I can confirm the Griz are interested in Ellis. A possible sign & trade of Stephenson for Ellis has a chance.,https://twitter.com/G_Love24/status/750790238059061251,twitter.com,https://www.reddit.com/r/nba/comments/4rkrq0/glover_like_sainasylum_just_reported_i_can/?ref=search_posts,nba,81,49,0,1467867987.0,Pacers,Bran_TheBroken,False,False
4rkyr1,"[Medina] Larry Nance Jr. initially considered Brandon Ingram ""real skinny"" & would ""take a while"" to develop. Nance now calls Ingram the ""real deal""",https://twitter.com/MarkG_Medina/status/750806252934950912,twitter.com,https://www.reddit.com/r/nba/comments/4rkyr1/medina_larry_nance_jr_initially_considered/?ref=search_posts,nba,37,65,0,1467870499.0,Lakers,ChrisKamanMyEye,False,False
4rlpdj,[OC] Who is Dante Exum? (With videos),https://www.reddit.com/r/nba/comments/4rlpdj/oc_who_is_dante_exum_with_videos/,self.nba,https://www.reddit.com/r/nba/comments/4rlpdj/oc_who_is_dante_exum_with_videos/?ref=search_posts,nba,92,14,0,1467880329.0,Jazz,RGiss,True,False
4rm4a9,Wade and Butler both went to Marquette,https://www.reddit.com/r/nba/comments/4rm4a9/wade_and_butler_both_went_to_marquette/,self.nba,https://www.reddit.com/r/nba/comments/4rm4a9/wade_and_butler_both_went_to_marquette/?ref=search_posts,nba,13,26,0,1467885890.0,Rockets,RebeccaBlack2016,True,False
4rm1p3,"[Skolnick] This was not a game or a bluff, no matter how many hoped it was. Feelings were hurt. Frustration was real.",https://twitter.com/EthanJSkolnick/status/750863877437419520,twitter.com,https://www.reddit.com/r/nba/comments/4rm1p3/skolnick_this_was_not_a_game_or_a_bluff_no_matter/?ref=search_posts,nba,52,53,0,1467884935.0,Heat,AtlasNoseItch,False,False
4rmea1,"K.C. Johnson on Twitter: ""Bulls had strong internal debate on rebuild during draft week. When they passed on Celtics' offer for Butler, goal to remain competitive set""",https://twitter.com/KCJHoop/status/750888917600178176,twitter.com,https://www.reddit.com/r/nba/comments/4rmea1/kc_johnson_on_twitter_bulls_had_strong_internal/?ref=search_posts,nba,69,42,0,1467889660.0,[DAL] Michael Finley,monetclaude,False,False
4rm5fk,"Ethan J. Skolnick on Twitter: ""The Heat did not increase their offer to Dwyane Wade, to compete with other teams.""",https://twitter.com/EthanJSkolnick/status/750874895379116032,twitter.com,https://www.reddit.com/r/nba/comments/4rm5fk/ethan_j_skolnick_on_twitter_the_heat_did_not/?ref=search_posts,nba,55,88,0,1467886317.0,[DAL] Michael Finley,monetclaude,False,False
4rmcpk,"Tim MacMahon on Twitter: ""A second Mavs source reiterates ""zero"" chance Dallas would consider Hassan Whiteside if the Heat big man got cold feet.""",https://twitter.com/espn_macmahon/status/750886283162030081,twitter.com,https://www.reddit.com/r/nba/comments/4rmcpk/tim_macmahon_on_twitter_a_second_mavs_source/?ref=search_posts,nba,52,23,0,1467889039.0,[DAL] Michael Finley,monetclaude,False,False
4rla0l,[David Pick] Davis Bertans has reached a two-year agreement with the San Antonio Spurs.,https://twitter.com/IAmDPick/status/750825093832507392,twitter.com,https://www.reddit.com/r/nba/comments/4rla0l/david_pick_davis_bertans_has_reached_a_twoyear/?ref=search_posts,nba,30,26,0,1467874551.0,Lakers,defender530,False,False
4rm8ys,"[ESPN Stats & Info] ""With Wade and Rajon Rondo in their back court, the Bulls might have one of the worst-shooting back courts in the NBA https://t.co/qZtpXctrXe""",https://twitter.com/ESPNStatsInfo/status/750878802209800193,twitter.com,https://www.reddit.com/r/nba/comments/4rm8ys/espn_stats_info_with_wade_and_rajon_rondo_in/?ref=search_posts,nba,47,24,0,1467887630.0,[CLE] LeBron James,vibhyk,False,False
4rkv18,"Adrian Wojnarowski on Twitter: ""Chicago remains significantly involved in Dwyane Wade pursuit, league sources tell @TheVertical. No meeting today has no bearing on status.""",https://twitter.com/WojVerticalNBA/status/750802975442993152,twitter.com,https://www.reddit.com/r/nba/comments/4rkv18/adrian_wojnarowski_on_twitter_chicago_remains/?ref=search_posts,nba,55,42,0,1467869162.0,[DAL] Michael Finley,monetclaude,False,False
4rmlhm,[Kennedy] Dwyane Wade felt like an afterthought. The low-ball offer stung and he felt disrespected in other ways too after giving so much to the Heat.,https://twitter.com/AlexKennedyNBA/status/750901010743304193,twitter.com,https://www.reddit.com/r/nba/comments/4rmlhm/kennedy_dwyane_wade_felt_like_an_afterthought_the/?ref=search_posts,nba,68,29,0,1467892532.0,Warriors,Anon10W1z,False,False
4rlm64,/r/nba in 2010. Interesting to see,https://web.archive.org/web/20100331113304/http://www.reddit.com/r/nba/,web.archive.org,https://www.reddit.com/r/nba/comments/4rlm64/rnba_in_2010_interesting_to_see/?ref=search_posts,nba,18,16,0,1467879050.0,[DAL] Ricky Ledo,RafiakaMacakaDirk,False,False
4rm75c,"Dwain Price on Twitter: ""Wade is the guest co-host in the morning on Live with Kelly (Ripa). It will be the highest ratings for her show in the history of her show.""",https://twitter.com/DwainPrice/status/750877625355120641,twitter.com,https://www.reddit.com/r/nba/comments/4rm75c/dwain_price_on_twitter_wade_is_the_guest_cohost/?ref=search_posts,nba,151,40,0,1467886961.0,[DAL] Michael Finley,monetclaude,False,False
4rl8o0,Aldridge's Move to Spurs vs Durant's Move to Warriors,https://www.reddit.com/r/nba/comments/4rl8o0/aldridges_move_to_spurs_vs_durants_move_to/,self.nba,https://www.reddit.com/r/nba/comments/4rl8o0/aldridges_move_to_spurs_vs_durants_move_to/?ref=search_posts,nba,0,84,0,1467874046.0,,rastafarian_eggplant,True,False
4rmjw1,Wade's letter to Miami,https://www.reddit.com/r/nba/comments/4rmjw1/wades_letter_to_miami/,self.nba,https://www.reddit.com/r/nba/comments/4rmjw1/wades_letter_to_miami/?ref=search_posts,nba,20,12,0,1467891895.0,Rockets,zshawn10,True,False
4rlzo8,"[Stein] Brooklyn has emerged as a potential trade partner for Chicago to send Jose Calderon, according to league sources",https://twitter.com/ESPNSteinLine/status/750865995628032002,twitter.com,https://www.reddit.com/r/nba/comments/4rlzo8/stein_brooklyn_has_emerged_as_a_potential_trade/?ref=search_posts,nba,51,106,0,1467884183.0,Warriors,Anon10W1z,False,False
4rm97v,Would Whiteside still have chosen to stay with Miami if he didn't know Wade would leave?,https://www.reddit.com/r/nba/comments/4rm97v/would_whiteside_still_have_chosen_to_stay_with/,self.nba,https://www.reddit.com/r/nba/comments/4rm97v/would_whiteside_still_have_chosen_to_stay_with/?ref=search_posts,nba,12,55,0,1467887726.0,[MIN] Wally Szczerbiak,Fortehlulz33,True,False
4rm2vy,"[Windhorst] The Bulls are in talks to send Mike Dunleavy to the Cavs, sources told ESPN",https://twitter.com/WindhorstESPN/status/750870955535192064,twitter.com,https://www.reddit.com/r/nba/comments/4rm2vy/windhorst_the_bulls_are_in_talks_to_send_mike/?ref=search_posts,nba,56,86,0,1467885375.0,Warriors,Anon10W1z,False,False
4rmc7t,Could Bosh coming back to Toronto become reality?,https://www.reddit.com/r/nba/comments/4rmc7t/could_bosh_coming_back_to_toronto_become_reality/,self.nba,https://www.reddit.com/r/nba/comments/4rmc7t/could_bosh_coming_back_to_toronto_become_reality/?ref=search_posts,nba,14,72,0,1467888859.0,Raptors,RapidRaptors,True,False
4rljzx,Kings + Thunder trade idea.,https://www.reddit.com/r/nba/comments/4rljzx/kings_thunder_trade_idea/,self.nba,https://www.reddit.com/r/nba/comments/4rljzx/kings_thunder_trade_idea/?ref=search_posts,nba,10,28,0,1467878248.0,76ers,Martavis,True,False
4rn68e,Updated (very early) Win Projection Numbers,https://twitter.com/kmedved/status/750894441985081344,twitter.com,https://www.reddit.com/r/nba/comments/4rn68e/updated_very_early_win_projection_numbers/?ref=search_posts,nba,5,36,0,1467902075.0,76ers,tenyor,False,False
4rlv7m,"[K.C. Johnson] ""Wade doesn't need face-to-face meeting w/ Bulls because he met w/ them twice in '10 FA. He just has to pick them--and Bulls have to unload $""",https://twitter.com/KCJHoop/status/750858827633922048,twitter.com,https://www.reddit.com/r/nba/comments/4rlv7m/kc_johnson_wade_doesnt_need_facetoface_meeting_w/?ref=search_posts,nba,13,41,0,1467882535.0,[CLE] LeBron James,vibhyk,False,False
4rmdbk,"[Jason Richardson] Dear, Miami Heat fans you are @ Jason Richardson and not Josh Richardson. Sincerely Jason Richardson @jrich23",https://twitter.com/jrich23/status/750882647400812544,twitter.com,https://www.reddit.com/r/nba/comments/4rmdbk/jason_richardson_dear_miami_heat_fans_you_are/?ref=search_posts,nba,225,62,0,1467889287.0,West,urfaselol,False,False
4rmx43,How do you honestly feel about Dwyane Wade?,https://www.reddit.com/r/nba/comments/4rmx43/how_do_you_honestly_feel_about_dwyane_wade/,self.nba,https://www.reddit.com/r/nba/comments/4rmx43/how_do_you_honestly_feel_about_dwyane_wade/?ref=search_posts,nba,0,76,0,1467897523.0,Pacers,AmadeusCrumb,True,False
4rlxvu,"K.C. Johnson on Twitter: ""Bulls have found a trading partner for Calderon, per source.""",https://twitter.com/KCJHoop/status/750863288582430720,twitter.com,https://www.reddit.com/r/nba/comments/4rlxvu/kc_johnson_on_twitter_bulls_have_found_a_trading/?ref=search_posts,nba,47,58,0,1467883543.0,NBA,JaySpike,False,False
4rm8a3,[Post-Game Thread] Any Given Wednesday w/ Bill Simmons,https://www.reddit.com/r/nba/comments/4rm8a3/postgame_thread_any_given_wednesday_w_bill_simmons/,self.nba,https://www.reddit.com/r/nba/comments/4rm8a3/postgame_thread_any_given_wednesday_w_bill_simmons/?ref=search_posts,nba,5,38,0,1467887377.0,Warriors,CantHousewifeaHo,True,False
