id,title,url,domain,permalink,subreddit,score,num_comments,gilded,created,author_flair_text,author,is_self,over_18
4ra95y,"[Post Game Thread] Celtics defeat 76ers in Utah Summer League 102-94. Ben Simmons 10 points, 8 rebounds, 5 assists. Jaylen Brown 16 points, 6 rebounds",https://www.reddit.com/r/nba/comments/4ra95y/post_game_thread_celtics_defeat_76ers_in_utah/,self.nba,https://www.reddit.com/r/nba/comments/4ra95y/post_game_thread_celtics_defeat_76ers_in_utah/?ref=search_posts,nba,163,102,0,1467709886.0,[BOS] Larry Bird,I_Enjoy_Taffy,True,False
4r9dnt,"Anthony Slater on Twitter: ""Serge Ibaka came by summer league to say hi to OKC's staff, talk to Mark Bryant and even chatted up Victor Oladipo https://t.co/gKir84kV6A""",https://twitter.com/anthonyVslater/status/750078475646668800,twitter.com,https://www.reddit.com/r/nba/comments/4r9dnt/anthony_slater_on_twitter_serge_ibaka_came_by/?ref=search_posts,nba,165,35,0,1467696557.0,Thunder,DaBear405,False,False
4rabm2,"SportsCenter on Twitter: ""The new-look New York Knicks. https://t.co/Na5yWe0zbi""",https://twitter.com/SportsCenter/status/750114270139088896,twitter.com,https://www.reddit.com/r/nba/comments/4rabm2/sportscenter_on_twitter_the_newlook_new_york/?ref=search_posts,nba,38,29,0,1467711030.0,Knicks,shad-E,False,False
4ra0ly,"We are all expecting the Cavs to make some type of move, right?",https://www.reddit.com/r/nba/comments/4ra0ly/we_are_all_expecting_the_cavs_to_make_some_type/,self.nba,https://www.reddit.com/r/nba/comments/4ra0ly/we_are_all_expecting_the_cavs_to_make_some_type/?ref=search_posts,nba,0,71,0,1467706024.0,,Mr_germ,True,False
4r9s70,"[MacMahon] Dallas is getting a conditional 2019 second-round pick from the Warriors along with Andrew Bogut, according to a league source.",https://twitter.com/espn_macmahon/status/750103152125317120,twitter.com,https://www.reddit.com/r/nba/comments/4r9s70/macmahon_dallas_is_getting_a_conditional_2019/?ref=search_posts,nba,46,16,0,1467702537.0,Mavericks,gigantism,False,False
4rbmdl,"Disregarding the onslaught GSW is about to bring, what other match-ups are you excited to see?",https://www.reddit.com/r/nba/comments/4rbmdl/disregarding_the_onslaught_gsw_is_about_to_bring/,self.nba,https://www.reddit.com/r/nba/comments/4rbmdl/disregarding_the_onslaught_gsw_is_about_to_bring/?ref=search_posts,nba,5,39,0,1467733935.0,Lakers,Dankmemegod,True,False
4r9853,[Wojnarowski] Sources: Other possible center candidates in Charlotte: Festus Ezeli and Jordan Hill.,https://twitter.com/WojVerticalNBA/status/750069993254035461,twitter.com,https://www.reddit.com/r/nba/comments/4r9853/wojnarowski_sources_other_possible_center/?ref=search_posts,nba,63,31,0,1467694401.0,Warriors,Anon10W1z,False,False
4rbmtp,"Now that we know what KD has done, is this trade feasible? Who says no?",https://www.reddit.com/r/nba/comments/4rbmtp/now_that_we_know_what_kd_has_done_is_this_trade/,self.nba,https://www.reddit.com/r/nba/comments/4rbmtp/now_that_we_know_what_kd_has_done_is_this_trade/?ref=search_posts,nba,0,44,0,1467734208.0,Kings,penguin_cheezus,True,False
4rao1u,Zaza Pachulia is going to start for potentially the best team ever.,https://www.reddit.com/r/nba/comments/4rao1u/zaza_pachulia_is_going_to_start_for_potentially/,self.nba,https://www.reddit.com/r/nba/comments/4rao1u/zaza_pachulia_is_going_to_start_for_potentially/?ref=search_posts,nba,0,41,0,1467716629.0,Bulls,WhiteRose886,True,False
4raby4,Why is your team better then everyone thinks?,https://www.reddit.com/r/nba/comments/4raby4/why_is_your_team_better_then_everyone_thinks/,self.nba,https://www.reddit.com/r/nba/comments/4raby4/why_is_your_team_better_then_everyone_thinks/?ref=search_posts,nba,5,67,0,1467711183.0,[HOU] James Harden,EnterAdman,True,False
4rayjr,What do Oladipo's numbers look like next season?,https://www.reddit.com/r/nba/comments/4rayjr/what_do_oladipos_numbers_look_like_next_season/,self.nba,https://www.reddit.com/r/nba/comments/4rayjr/what_do_oladipos_numbers_look_like_next_season/?ref=search_posts,nba,9,21,0,1467721473.0,,jakaloaf,True,False
4rbmxf,List of 2016-2017 Assumed Starting Fives For Every Team,https://docs.google.com/document/d/1HYUC42tPBptY0A-Do2kOKrXprsLzrQn5jc29Du7ow8M,docs.google.com,https://www.reddit.com/r/nba/comments/4rbmxf/list_of_20162017_assumed_starting_fives_for_every/?ref=search_posts,nba,13,80,0,1467734273.0,Warriors,alienbluedit,False,False
4ra6f3,"(Amick) The salt in the wound for Oklahoma City? Had Durant given a verbal commitment to return to the Thunder, they were very confident that fellow free agent Al Horford would have come too",http://www.usatoday.com/story/sports/nba/2016/07/04/kevin-durant-warriors-free-agent-thunder/86684632/,usatoday.com,https://www.reddit.com/r/nba/comments/4ra6f3/amick_the_salt_in_the_wound_for_oklahoma_city_had/?ref=search_posts,nba,53,38,0,1467708644.0,Lakers,claydavisismyhero,False,False
4r9vzz,I don't wanna hear anyone say West is stacked anymore,https://www.reddit.com/r/nba/comments/4r9vzz/i_dont_wanna_hear_anyone_say_west_is_stacked/,self.nba,https://www.reddit.com/r/nba/comments/4r9vzz/i_dont_wanna_hear_anyone_say_west_is_stacked/?ref=search_posts,nba,0,63,0,1467704101.0,Knicks,akgamestar,True,False
4ra7gj,"[Seltzer] From the Sixers, Ben Simmons has cramping in both calf muscles; will not return.",https://twitter.com/brianseltzer/status/750131502365569024,twitter.com,https://www.reddit.com/r/nba/comments/4ra7gj/seltzer_from_the_sixers_ben_simmons_has_cramping/?ref=search_posts,nba,101,41,0,1467709103.0,[NJN] Vince Carter,VinceBarter,False,False
4r9ag7,Who is the MVP frontrunner next year?,https://www.reddit.com/r/nba/comments/4r9ag7/who_is_the_mvp_frontrunner_next_year/,self.nba,https://www.reddit.com/r/nba/comments/4r9ag7/who_is_the_mvp_frontrunner_next_year/?ref=search_posts,nba,0,72,0,1467695288.0,,Size--,True,False
4raris,Did the players in the 90s or 80s ever did what KD did?,https://www.reddit.com/r/nba/comments/4raris/did_the_players_in_the_90s_or_80s_ever_did_what/,self.nba,https://www.reddit.com/r/nba/comments/4raris/did_the_players_in_the_90s_or_80s_ever_did_what/?ref=search_posts,nba,0,44,0,1467718200.0,New Jersey Nets,Rybel511,True,False
4r99t2,"[Charania] Sacramento has waived forwards Caron Butler and Duje Dukan, league sources tell The Vertical.",https://twitter.com/ShamsCharania/status/750072581139693568,twitter.com,https://www.reddit.com/r/nba/comments/4r99t2/charania_sacramento_has_waived_forwards_caron/?ref=search_posts,nba,50,41,0,1467695027.0,Warriors,Anon10W1z,False,False
4r9ded,So how many games do you have the Warriors winning next season?,https://www.reddit.com/r/nba/comments/4r9ded/so_how_many_games_do_you_have_the_warriors/,self.nba,https://www.reddit.com/r/nba/comments/4r9ded/so_how_many_games_do_you_have_the_warriors/?ref=search_posts,nba,0,58,0,1467696443.0,[ORL] Pat Garrity,captain66dmg,True,False
4ragwg,Top Pick Ben Simmons Makes His Summer League Debut,https://www.youtube.com/watch?v=XO-dEpGWZqg,youtube.com,https://www.reddit.com/r/nba/comments/4ragwg/top_pick_ben_simmons_makes_his_summer_league_debut/?ref=search_posts,nba,15,35,0,1467713418.0,Trust The Process,tde12,False,False
4r94xz,"With a starting lineup of D-Will, Wes, Barnes, Dirk, and Bogut, how good is next year's Mavs team?",https://www.reddit.com/r/nba/comments/4r94xz/with_a_starting_lineup_of_dwill_wes_barnes_dirk/,self.nba,https://www.reddit.com/r/nba/comments/4r94xz/with_a_starting_lineup_of_dwill_wes_barnes_dirk/?ref=search_posts,nba,21,62,0,1467693264.0,Mavericks,N_TX,True,False
4rag9p,"People who've sat near the bench, what are some interesting things you've heard?",https://www.reddit.com/r/nba/comments/4rag9p/people_whove_sat_near_the_bench_what_are_some/,self.nba,https://www.reddit.com/r/nba/comments/4rag9p/people_whove_sat_near_the_bench_what_are_some/?ref=search_posts,nba,72,60,0,1467713129.0,Heat,acrossover23,True,False
4ra1vs,"[Begley] Lance Thomas has agreed to a multi-year deal with the Knicks worth $6 million annually, sources say. Exact years unclear at this point.",https://twitter.com/IanBegley/status/750117339702501376,twitter.com,https://www.reddit.com/r/nba/comments/4ra1vs/begley_lance_thomas_has_agreed_to_a_multiyear/?ref=search_posts,nba,105,44,0,1467706588.0,,nicejerk,False,False
4rahvt,"[MacMahon] A source said Seth Curry has been on the Mavs' radar all summer and the team moved quickly to get a deal done when the Kings renounced his rights this weekend, making him an unrestricted free agent. Curry would get the team's cap-room exception.",https://twitter.com/espn_macmahon/status/750150801746595840,twitter.com,https://www.reddit.com/r/nba/comments/4rahvt/macmahon_a_source_said_seth_curry_has_been_on_the/?ref=search_posts,nba,54,39,0,1467713831.0,Mavericks,gigantism,False,False
4ravvd,Who Wants Boris Diaw?,https://www.reddit.com/r/nba/comments/4ravvd/who_wants_boris_diaw/,self.nba,https://www.reddit.com/r/nba/comments/4ravvd/who_wants_boris_diaw/?ref=search_posts,nba,12,34,0,1467720174.0,[SAS] Manu Ginobili,BombAssPhoenix,True,False
4r9xae,"With Durant gone, and Westbrook most likely leaving, does the Harden trade officially go down as the worst trade of all time?",https://www.reddit.com/r/nba/comments/4r9xae/with_durant_gone_and_westbrook_most_likely/,self.nba,https://www.reddit.com/r/nba/comments/4r9xae/with_durant_gone_and_westbrook_most_likely/?ref=search_posts,nba,0,60,0,1467704608.0,[NJN] Drazen Petrovic,thejewznextdoor,True,False
