id,title,url,domain,permalink,subreddit,score,num_comments,gilded,created,author_flair_text,author,is_self,over_18
4tizuo,Denzel Valentine wins the Summer League Championship at the buzzer in overtime!,https://streamable.com/s2xx,streamable.com,https://www.reddit.com/r/nba/comments/4tizuo/denzel_valentine_wins_the_summer_league/?ref=search_posts,nba,3243,592,0,1468926018.0,The Truth,FeversMirrors,False,False
4th71n,"[Ira Winderman] Top remaining FAs: LeBron, Waiters, J.R. Smith, Motiejunas, L.Stephenson, Harkless, T. Zeller, Seraphin, Alan Anderson, David Lee, Kevin Martin, Norris Cole, Andre Miller, Gerald Green, Thomas Robinson, Amar'e, Neal, James Jones, Caron Butler, Kaman, Ty Lawson.",https://twitter.com/IraHeatBeat/status/755135425128308736,twitter.com,https://www.reddit.com/r/nba/comments/4th71n/ira_winderman_top_remaining_fas_lebron_waiters_jr/?ref=search_posts,nba,370,267,0,1468902212.0,West,urfaselol,False,False
4thrhv,"[Helin] Durant on Lakers: ""I really respect their team, but I think they're a couple years away from where I want to be.""",https://twitter.com/basketballtalk/status/755166568405803008,twitter.com,https://www.reddit.com/r/nba/comments/4thrhv/helin_durant_on_lakers_i_really_respect_their/?ref=search_posts,nba,691,202,0,1468909586.0,[NYK] Walt Frazier,DishingLikeClyde,False,False
4th5so,"[Announcement] Starting tonight: r/NBA ""Roast of the.."" series",https://www.reddit.com/r/nba/comments/4th5so/announcement_starting_tonight_rnba_roast_of_the/,self.nba,https://www.reddit.com/r/nba/comments/4th5so/announcement_starting_tonight_rnba_roast_of_the/?ref=search_posts,nba,381,155,0,1468901775.0,Spurs,BabyS1othWithA1,True,False
4tiy3u,"Sources on @TheVertical: Oklahoma City has rescinded qualifying offer on Dion Waiters, allowing him to become an unrestricted free agent.",https://twitter.com/wojverticalnba/status/755232949122043904,twitter.com,https://www.reddit.com/r/nba/comments/4tiy3u/sources_on_thevertical_oklahoma_city_has/?ref=search_posts,nba,485,244,0,1468925365.0,Thunder,goossens,False,False
4ti06w,"San Antonio Mayor Ivy Taylor declares July 21 as ""Tim Duncan Day""",https://twitter.com/IvyRTaylor/status/755162712686993408,twitter.com,https://www.reddit.com/r/nba/comments/4ti06w/san_antonio_mayor_ivy_taylor_declares_july_21_as/?ref=search_posts,nba,982,80,0,1468912789.0,Spurs,ToothlessBastard,False,False
4tjhj3,"[Thompson] Gregg Popovich on Spurs never being dubbed a super team: ""I just count championships.""",https://twitter.com/thompsonscribe/status/755238589324144644,twitter.com,https://www.reddit.com/r/nba/comments/4tjhj3/thompson_gregg_popovich_on_spurs_never_being/?ref=search_posts,nba,880,169,0,1468933366.0,[SAS] Speedy Claxton,s-c-,False,False
4thjyj,Could a team of all Lebron James's from every finals appearance beat the 1992 Dream Team in a best of 7?,https://www.reddit.com/r/nba/comments/4thjyj/could_a_team_of_all_lebron_jamess_from_every/,self.nba,https://www.reddit.com/r/nba/comments/4thjyj/could_a_team_of_all_lebron_jamess_from_every/?ref=search_posts,nba,671,524,0,1468906854.0,Trail Blazers,broccolibush42,True,False
4tizq3,"[Post Game Thread] The Chicago Bulls (7-0) defeat the Minnesota Timberwolves (4-4) 84-82, to win the Summer League championship",https://www.reddit.com/r/nba/comments/4tizq3/post_game_thread_the_chicago_bulls_70_defeat_the/,self.nba,https://www.reddit.com/r/nba/comments/4tizq3/post_game_thread_the_chicago_bulls_70_defeat_the/?ref=search_posts,nba,884,280,0,1468925969.0,Mavericks,btr154,True,False
4tinro,"[Shelburne] Kevin Durant on Tom Brady, ""I was ready to just say, 'OK. Lets go.' It's great to be in the presence of such greatness. But at the same time I knew I couldn't let that distract me.""",https://twitter.com/ramonashelburne/status/755169098003124224,twitter.com,https://www.reddit.com/r/nba/comments/4tinro/shelburne_kevin_durant_on_tom_brady_i_was_ready/?ref=search_posts,nba,316,170,0,1468921505.0,Celtics,Brad-Stevens,False,False
4thodc,"Slater: Russell Westbrook ""Ticked Off"" About Kevin Durant Leaving Thunder and Ready for a Challenging Season in OKC",http://newsok.com/examining-the-tricky-case-of-russell-westbrook/article/5509965,newsok.com,https://www.reddit.com/r/nba/comments/4thodc/slater_russell_westbrook_ticked_off_about_kevin/?ref=search_posts,nba,2158,730,0,1468908493.0,Thunder,Remolten11,False,False
4ti634,r/NBA Roast of the: Chicago Bulls (01/30),https://www.reddit.com/r/nba/comments/4ti634/rnba_roast_of_the_chicago_bulls_0130/,self.nba,https://www.reddit.com/r/nba/comments/4ti634/rnba_roast_of_the_chicago_bulls_0130/?ref=search_posts,nba,821,617,0,1468914987.0,The Truth,FeversMirrors,True,False
4tje30,"Kevin Durant on Free Agency Decision ""Who's going to give a fuck when I'm 49 years old?""",https://twitter.com/sam_amick/status/755257590670462977,twitter.com,https://www.reddit.com/r/nba/comments/4tje30/kevin_durant_on_free_agency_decision_whos_going/?ref=search_posts,nba,652,871,0,1468931843.0,[CHA] Larry Johnson,TheFuzzNBA,False,False
4tinf5,"For those who are uninitiated, Pau Gasol - How to Save a Life",https://www.youtube.com/watch?v=bLXSSP6Ujwg,youtube.com,https://www.reddit.com/r/nba/comments/4tinf5/for_those_who_are_uninitiated_pau_gasol_how_to/?ref=search_posts,nba,381,46,0,1468921381.0,[OKC] Steven Adams,kevinxdang,False,False
4thucm,"[Johnson] Butler on Wade and Rondo: ""What I want them guys to do whenever I’m on some bulls**t, I want them to tell me. I want you to say my name, man to man.""",https://twitter.com/KCJHoop/status/755169846300585984,twitter.com,https://www.reddit.com/r/nba/comments/4thucm/johnson_butler_on_wade_and_rondo_what_i_want_them/?ref=search_posts,nba,923,183,0,1468910643.0,[NYK] Walt Frazier,DishingLikeClyde,False,False
4tj5pk,"[Highkin] Denzel Valentine on the idea that Summer League doesn't matter: ""The people who are saying that have never won Summer League.""",https://twitter.com/highkin/status/755244048818974720,twitter.com,https://www.reddit.com/r/nba/comments/4tj5pk/highkin_denzel_valentine_on_the_idea_that_summer/?ref=search_posts,nba,959,159,0,1468928335.0,[NJN] Vince Carter,VinceBarter,False,False
4ti6ka,Stephen Curry Gets Crossed Compilation,https://www.youtube.com/watch?v=Da_R5QQEHhA&feature=youtu.be,youtube.com,https://www.reddit.com/r/nba/comments/4ti6ka/stephen_curry_gets_crossed_compilation/?ref=search_posts,nba,1113,642,0,1468915155.0,[HOU] James Harden,GettingLostInDaSauce,False,False
4ti0vt,"[Markazi] DeAndre Jordan laughed when he saw Harrison Barnes at Team USA camp. ""Hey man, congrats on Dallas. Nice picture.""",https://twitter.com/ArashMarkazi/status/755173237063946240,twitter.com,https://www.reddit.com/r/nba/comments/4ti0vt/markazi_deandre_jordan_laughed_when_he_saw/?ref=search_posts,nba,908,275,0,1468913035.0,Mavericks,gigantism,False,False
4th9yu,Make An All Time Injury Lineup,https://www.reddit.com/r/nba/comments/4th9yu/make_an_all_time_injury_lineup/,self.nba,https://www.reddit.com/r/nba/comments/4th9yu/make_an_all_time_injury_lineup/?ref=search_posts,nba,6,40,0,1468903233.0,Warriors,HassanBlackside,True,False
4tineg,"Jamal Murray Full 2016 Summer League Highlights - 19.6 PPG, 5 RPG, 2.4 APG",https://www.youtube.com/watch?v=aTLFm1LOXrw,youtube.com,https://www.reddit.com/r/nba/comments/4tineg/jamal_murray_full_2016_summer_league_highlights/?ref=search_posts,nba,27,16,0,1468921372.0,Nuggets,greendalealumnus,False,False
4tiz1w,Valentine CLUTCH shot! - ESPN,https://streamable.com/rthm,streamable.com,https://www.reddit.com/r/nba/comments/4tiz1w/valentine_clutch_shot_espn/?ref=search_posts,nba,97,11,0,1468925708.0,Bucks,Metsvault,False,False
4tjdrp,"Draymond Green to @TheVertical on GSW adding Kevin Durant: ""I'd sacrifice everything for championships.",https://twitter.com/MrMichaelLee/status/755257382523895809,twitter.com,https://www.reddit.com/r/nba/comments/4tjdrp/draymond_green_to_thevertical_on_gsw_adding_kevin/?ref=search_posts,nba,82,67,0,1468931692.0,[CHA] Larry Johnson,TheFuzzNBA,False,False
4tibxr,Who will be the most disappointing player on Team USA?,https://www.reddit.com/r/nba/comments/4tibxr/who_will_be_the_most_disappointing_player_on_team/,self.nba,https://www.reddit.com/r/nba/comments/4tibxr/who_will_be_the_most_disappointing_player_on_team/?ref=search_posts,nba,8,46,0,1468917085.0,,jakaloaf,True,False
4tjioi,What not-so-great players from your team (past or present) are considered cult heroes? (Stolen from r/soccer),https://www.reddit.com/r/nba/comments/4tjioi/what_notsogreat_players_from_your_team_past_or/,self.nba,https://www.reddit.com/r/nba/comments/4tjioi/what_notsogreat_players_from_your_team_past_or/?ref=search_posts,nba,13,75,0,1468933875.0,76ers,BIGxDADDYxKUSH,True,False
4thaf4,so how will SA replace all of the rebounding/big men they lost?,https://www.reddit.com/r/nba/comments/4thaf4/so_how_will_sa_replace_all_of_the_reboundingbig/,self.nba,https://www.reddit.com/r/nba/comments/4thaf4/so_how_will_sa_replace_all_of_the_reboundingbig/?ref=search_posts,nba,6,33,0,1468903408.0,Bucks,JudiciousJay,True,False
4thgnz,My favorite Manu Ginobili Moment. Hits the Three Point Game Winner in game one of the 2013 West Semifinals.,https://www.youtube.com/watch?v=Na8KhWxGitQ,youtube.com,https://www.reddit.com/r/nba/comments/4thgnz/my_favorite_manu_ginobili_moment_hits_the_three/?ref=search_posts,nba,19,15,0,1468905656.0,Spurs,PhillipJFry32,False,False
4tjqkj,Who would win in a fight?,https://www.reddit.com/r/nba/comments/4tjqkj/who_would_win_in_a_fight/,self.nba,https://www.reddit.com/r/nba/comments/4tjqkj/who_would_win_in_a_fight/?ref=search_posts,nba,7,53,0,1468938687.0,,Blackmanwdaplan,True,False
4ti2h8,"""He's a better player than when I was 19 or 20,"" Nowitzki said of the 21-year-old Bargnani. ""He's going to be a heck of a player. He's a little more athletic than I even was back then. He can drive a little better than me.""",http://espn.go.com/nba/recap?gameId=270114028,espn.go.com,https://www.reddit.com/r/nba/comments/4ti2h8/hes_a_better_player_than_when_i_was_19_or_20/?ref=search_posts,nba,207,71,0,1468913635.0,Toronto Huskies,coolassninjas,False,False
4tht9b,"Short video of Jimmy B practicing post-ups against Lowry, Barnes, etc.",http://www.chicagotribune.com/sports/basketball/bulls/ct-bulls-butler-video-spt-20160718-premiumvideo.html,chicagotribune.com,https://www.reddit.com/r/nba/comments/4tht9b/short_video_of_jimmy_b_practicing_postups_against/?ref=search_posts,nba,26,15,0,1468910237.0,Bulls,jroades26,False,False
4ti0k9,Who has the highest BBIQ of all time?,https://www.reddit.com/r/nba/comments/4ti0k9/who_has_the_highest_bbiq_of_all_time/,self.nba,https://www.reddit.com/r/nba/comments/4ti0k9/who_has_the_highest_bbiq_of_all_time/?ref=search_posts,nba,26,88,0,1468912928.0,[LAC] Matt Barnes,Big_Ballmers,True,False
4tjdgs,"In 2013, a group of 6 SB Nation writers came together and projected the top 100 players going into 2017, here they are",http://www.sbnation.com/2013/8/19/4615826/top-100-nba-players-2017-list,sbnation.com,https://www.reddit.com/r/nba/comments/4tjdgs/in_2013_a_group_of_6_sb_nation_writers_came/?ref=search_posts,nba,89,89,0,1468931561.0,[CLE] LeBron James,LouiseHopefully,False,False
4tj4p0,Start a team with 1 draft bust,https://www.reddit.com/r/nba/comments/4tj4p0/start_a_team_with_1_draft_bust/,self.nba,https://www.reddit.com/r/nba/comments/4tj4p0/start_a_team_with_1_draft_bust/?ref=search_posts,nba,9,34,0,1468927936.0,,supadupanova,True,False
4ti136,When Melo went OFF against Wolves 33 points in 3rd quarter!,https://www.youtube.com/watch?v=uO-rB_4r454,youtube.com,https://www.reddit.com/r/nba/comments/4ti136/when_melo_went_off_against_wolves_33_points_in/?ref=search_posts,nba,78,10,0,1468913107.0,[NYK] Stephon Marbury,Mjoh23,False,False
4thjo6,"Kevin Durant, Carmelo Anthony and Paul George work on post game after team USA practice",https://twitter.com/NBA/status/755151670103769088,twitter.com,https://www.reddit.com/r/nba/comments/4thjo6/kevin_durant_carmelo_anthony_and_paul_george_work/?ref=search_posts,nba,68,25,0,1468906749.0,[CHA] Larry Johnson,TheFuzzNBA,False,False
4ti2zj,Which Team does Chris Paul go to After this Year?,https://www.reddit.com/r/nba/comments/4ti2zj/which_team_does_chris_paul_go_to_after_this_year/,self.nba,https://www.reddit.com/r/nba/comments/4ti2zj/which_team_does_chris_paul_go_to_after_this_year/?ref=search_posts,nba,2,36,0,1468913836.0,Lakers,reigningnovice,True,False
4th6gm,How good were the Cleveland Cavaliers line ups pre 2008 without Lebron? Was their playoff potential only achieved because of Lebron or could they have had playoff hopes with the talent they had apart from him (if he were replaced or if he had left at a different time)?,https://www.reddit.com/r/nba/comments/4th6gm/how_good_were_the_cleveland_cavaliers_line_ups/,self.nba,https://www.reddit.com/r/nba/comments/4th6gm/how_good_were_the_cleveland_cavaliers_line_ups/?ref=search_posts,nba,0,40,0,1468902006.0,Bulls,snizarsnarfsnarf,True,False
4tjsnb,"USA Basketball Las Vegas scrimmage. PG, Derozan, Dray, DeAndre and Lowry vs Select Team",https://www.youtube.com/watch?v=zIImqGe4cVs,youtube.com,https://www.reddit.com/r/nba/comments/4tjsnb/usa_basketball_las_vegas_scrimmage_pg_derozan/?ref=search_posts,nba,49,37,0,1468939804.0,Kings,HermesTGS,False,False
4thhnf,2016 U.S. Olympic team's first practice. Couple of plays from the scrimmage.,https://streamable.com/q30t,streamable.com,https://www.reddit.com/r/nba/comments/4thhnf/2016_us_olympic_teams_first_practice_couple_of/?ref=search_posts,nba,38,24,0,1468905986.0,Supersonics,WhenMachinesCry,False,False
4tijun,"Since we're posting old videos, here's one of Kobe going one on one with a trash talker.",https://www.youtube.com/watch?v=y0U5GqWnXTc,youtube.com,https://www.reddit.com/r/nba/comments/4tijun/since_were_posting_old_videos_heres_one_of_kobe/?ref=search_posts,nba,21,14,0,1468920034.0,Warriors,TheSplashFamily,False,False
4tikpe,What is your all-time color commentary team?,https://www.reddit.com/r/nba/comments/4tikpe/what_is_your_alltime_color_commentary_team/,self.nba,https://www.reddit.com/r/nba/comments/4tikpe/what_is_your_alltime_color_commentary_team/?ref=search_posts,nba,13,24,0,1468920351.0,,nahnotthisone,True,False
4tia6t,Why was Kobe such a late draft?,https://www.reddit.com/r/nba/comments/4tia6t/why_was_kobe_such_a_late_draft/,self.nba,https://www.reddit.com/r/nba/comments/4tia6t/why_was_kobe_such_a_late_draft/?ref=search_posts,nba,10,122,0,1468916477.0,,theclownermb,True,False
4tjoj4,Why didn't LaMarcus Aldridge get more grief for going to SA?,https://www.reddit.com/r/nba/comments/4tjoj4/why_didnt_lamarcus_aldridge_get_more_grief_for/,self.nba,https://www.reddit.com/r/nba/comments/4tjoj4/why_didnt_lamarcus_aldridge_get_more_grief_for/?ref=search_posts,nba,6,64,0,1468937608.0,Rockets,angrycrayon9,True,False
4tj1nq,Leave your overreactions to players in this years draft since Summer League is over,https://www.reddit.com/r/nba/comments/4tj1nq/leave_your_overreactions_to_players_in_this_years/,self.nba,https://www.reddit.com/r/nba/comments/4tj1nq/leave_your_overreactions_to_players_in_this_years/?ref=search_posts,nba,29,36,0,1468926743.0,,kthimotee929,True,False
4thr8b,Create the best starting lineup using the following parameters:,https://www.reddit.com/r/nba/comments/4thr8b/create_the_best_starting_lineup_using_the/,self.nba,https://www.reddit.com/r/nba/comments/4thr8b/create_the_best_starting_lineup_using_the/?ref=search_posts,nba,5,47,0,1468909502.0,[LAL] Pau Gasol,ichifeet,True,False
4thlcu,Is there a better defensive five-man lineup in the league than the Bulls' : Rondo-Wade-Butler-Gibson-Lopez,https://www.reddit.com/r/nba/comments/4thlcu/is_there_a_better_defensive_fiveman_lineup_in_the/,self.nba,https://www.reddit.com/r/nba/comments/4thlcu/is_there_a_better_defensive_fiveman_lineup_in_the/?ref=search_posts,nba,0,48,0,1468907374.0,NBA,sinisterbathala,True,False
4tizby,MVP of the Summer League does it again!,https://streamable.com/8m11,streamable.com,https://www.reddit.com/r/nba/comments/4tizby/mvp_of_the_summer_league_does_it_again/?ref=search_posts,nba,63,4,0,1468925818.0,Bucks,Metsvault,False,False
4ti1hd,"[Cunningham] DeMarcus Cousins on Kings Draft: 'I can't control that. I control what I can control. I don't really understand it, but I do my job.'",https://twitter.com/SeanCunningham/status/755182123049287680,twitter.com,https://www.reddit.com/r/nba/comments/4ti1hd/cunningham_demarcus_cousins_on_kings_draft_i_cant/?ref=search_posts,nba,177,143,0,1468913265.0,[NJN] Vince Carter,VinceBarter,False,False
4tjd1s,SAC - PHX trade idea,https://www.reddit.com/r/nba/comments/4tjd1s/sac_phx_trade_idea/,self.nba,https://www.reddit.com/r/nba/comments/4tjd1s/sac_phx_trade_idea/?ref=search_posts,nba,15,50,0,1468931385.0,[NJN] Jason Kidd,wugs5,True,False
4tig5v,Dime on Uproxx: Ranking All Of The NBA’s Mascots Based On Sheer Creepiness,http://uproxx.com/dimemag/nba-mascots-ranked/,uproxx.com,https://www.reddit.com/r/nba/comments/4tig5v/dime_on_uproxx_ranking_all_of_the_nbas_mascots/?ref=search_posts,nba,41,21,0,1468918632.0,[PHO] Devin Booker,abeLJosh,False,False
4th74n,Open Court discusses super teams,https://www.youtube.com/watch?v=V7VEPNsMTC0&spfreload=5,youtube.com,https://www.reddit.com/r/nba/comments/4th74n/open_court_discusses_super_teams/?ref=search_posts,nba,33,7,0,1468902239.0,Bulls,ehs4290,False,False
4th3t5,Can someone eli5 to me positions and the numbers that represent those positions,https://www.reddit.com/r/nba/comments/4th3t5/can_someone_eli5_to_me_positions_and_the_numbers/,self.nba,https://www.reddit.com/r/nba/comments/4th3t5/can_someone_eli5_to_me_positions_and_the_numbers/?ref=search_posts,nba,14,41,0,1468901117.0,Lakers,Nickmi,True,False
4thup0,[Zillgitt] Mike Krzyzewski said Draymond Green apologized to his U.S. teammates for causing distraction prior to Rio Olympics.,https://twitter.com/JeffZillgitt/status/755171672349605888,twitter.com,https://www.reddit.com/r/nba/comments/4thup0/zillgitt_mike_krzyzewski_said_draymond_green/?ref=search_posts,nba,121,23,0,1468910775.0,[NJN] Vince Carter,VinceBarter,False,False
4ti0k5,"[Paul Henning] One unmentioned detail on Plumlee signing, Bucks developing reputation of taking care of their wanted FA's: Mids, Plums, Henson. None of them publicly took any meetings, all negotiations done behind closed doors until deal was done. No typical free agent dancing game.",https://twitter.com/brewcitypaul/status/755172372714446848,twitter.com,https://www.reddit.com/r/nba/comments/4ti0k5/paul_henning_one_unmentioned_detail_on_plumlee/?ref=search_posts,nba,59,18,0,1468912928.0,West,urfaselol,False,False
4tiuvp,Who is the most random player you know all-time and why?,https://www.reddit.com/r/nba/comments/4tiuvp/who_is_the_most_random_player_you_know_alltime/,self.nba,https://www.reddit.com/r/nba/comments/4tiuvp/who_is_the_most_random_player_you_know_alltime/?ref=search_posts,nba,29,122,0,1468924169.0,Warriors,madeuponsport,True,False
4tiz0v,Who said the Spurs (and Grizzlies) were boring? Highlights from the 3OT battle ft. a Marc Gasol three,https://www.youtube.com/watch?v=X265E0pRq2k,youtube.com,https://www.reddit.com/r/nba/comments/4tiz0v/who_said_the_spurs_and_grizzlies_were_boring/?ref=search_posts,nba,24,15,0,1468925700.0,Grizzlies,freudianchips,False,False
4tiyp4,"[Wojnarowski] OKC still holds Bird Rights and could re-sign Waiters, but needed to protect cap space, including for a possible Westbrook renegotiation.",https://twitter.com/WojVerticalNBA/status/755233685188796417,twitter.com,https://www.reddit.com/r/nba/comments/4tiyp4/wojnarowski_okc_still_holds_bird_rights_and_could/?ref=search_posts,nba,38,18,0,1468925588.0,,in_the_summertime,False,False
4thmqg,"[Iannazzone] Carmelo Anthony said the Knicks ""have a special team on paper.""",https://twitter.com/Al_Iannazzone/status/755159550446047232,twitter.com,https://www.reddit.com/r/nba/comments/4thmqg/iannazzone_carmelo_anthony_said_the_knicks_have_a/?ref=search_posts,nba,118,77,0,1468907887.0,[NJN] Vince Carter,VinceBarter,False,False
4tilym,Compare and Contrast: Shawn Marion and Kawhi Leonard,https://www.reddit.com/r/nba/comments/4tilym/compare_and_contrast_shawn_marion_and_kawhi/,self.nba,https://www.reddit.com/r/nba/comments/4tilym/compare_and_contrast_shawn_marion_and_kawhi/?ref=search_posts,nba,5,31,0,1468920830.0,[OKC] Steven Adams,legendariusss,True,False
4tj81u,"Free agent Mike Miller has agreed to a two-year, $5M-plus deal to return to Denver, league sources tell The Vertical.",https://twitter.com/shamscharania/status/755249422305337344,twitter.com,https://www.reddit.com/r/nba/comments/4tj81u/free_agent_mike_miller_has_agreed_to_a_twoyear/?ref=search_posts,nba,257,45,0,1468929289.0,Thunder,goossens,False,False
4tjreu,Shaq says Tim Duncan is not a 'big man',http://sports.yahoo.com/news/shaq-says-tim-duncan-not-204223591.html,sports.yahoo.com,https://www.reddit.com/r/nba/comments/4tjreu/shaq_says_tim_duncan_is_not_a_big_man/?ref=search_posts,nba,7,42,0,1468939116.0,,eedikiy,False,False
4tjkrr,Thunder rookie Domantas Sabonis shines in Lithuania's exhibition win over Spain,http://newsok.com/article/5510098,newsok.com,https://www.reddit.com/r/nba/comments/4tjkrr/thunder_rookie_domantas_sabonis_shines_in/?ref=search_posts,nba,52,20,0,1468935704.0,OKC Hornets,mccoolio,False,False
4tjmcp,Name a part of an NBA players game that was plagiarized from another player.,https://www.reddit.com/r/nba/comments/4tjmcp/name_a_part_of_an_nba_players_game_that_was/,self.nba,https://www.reddit.com/r/nba/comments/4tjmcp/name_a_part_of_an_nba_players_game_that_was/?ref=search_posts,nba,3,30,0,1468936490.0,[GSW] Harrison Barnes,Mack222,True,False
4tjkr9,Which NBA player's initial weakness eventually became one of his greatest strengths later in his career?,https://www.reddit.com/r/nba/comments/4tjkr9/which_nba_players_initial_weakness_eventually/,self.nba,https://www.reddit.com/r/nba/comments/4tjkr9/which_nba_players_initial_weakness_eventually/?ref=search_posts,nba,24,41,0,1468935700.0,76ers,davesays,True,False
4thedn,Jason Kidd - Top 10 Career Plays,https://youtu.be/hmp1qA4VRdA,youtu.be,https://www.reddit.com/r/nba/comments/4thedn/jason_kidd_top_10_career_plays/?ref=search_posts,nba,33,16,0,1468904823.0,Knicks,gitzky,False,False
4th3ev,/r/nba: What is your honest opinion of Carmelo Anthony?,https://www.reddit.com/r/nba/comments/4th3ev/rnba_what_is_your_honest_opinion_of_carmelo/,self.nba,https://www.reddit.com/r/nba/comments/4th3ev/rnba_what_is_your_honest_opinion_of_carmelo/?ref=search_posts,nba,8,113,0,1468900985.0,Bucks,TheUsername2015,True,False
4thbrq,Proposal for Oklahoma City's 2016-2017 Starting Lineup - Embracing the Underdog Mentality,https://www.reddit.com/r/nba/comments/4thbrq/proposal_for_oklahoma_citys_20162017_starting/,self.nba,https://www.reddit.com/r/nba/comments/4thbrq/proposal_for_oklahoma_citys_20162017_starting/?ref=search_posts,nba,0,47,0,1468903901.0,Thunder,iPhoneGalaxyS12,True,False
4tj4yh,Who Is The Most Overrated Of All Time?,https://www.reddit.com/r/nba/comments/4tj4yh/who_is_the_most_overrated_of_all_time/,self.nba,https://www.reddit.com/r/nba/comments/4tj4yh/who_is_the_most_overrated_of_all_time/?ref=search_posts,nba,14,231,0,1468928030.0,Warriors,HassanBlackside,True,False
4tj1wp,"WILD finish in Las Vegas, Bulls hit Jackpot! -ESPN",https://www.reddit.com/r/nba/comments/4tj1wp/wild_finish_in_las_vegas_bulls_hit_jackpot_espn/,self.nba,https://www.reddit.com/r/nba/comments/4tj1wp/wild_finish_in_las_vegas_bulls_hit_jackpot_espn/?ref=search_posts,nba,28,3,0,1468926848.0,Bucks,Metsvault,True,False
4tho03,Who will be the first rookie to score 30 points next season?,https://www.reddit.com/r/nba/comments/4tho03/who_will_be_the_first_rookie_to_score_30_points/,self.nba,https://www.reddit.com/r/nba/comments/4tho03/who_will_be_the_first_rookie_to_score_30_points/?ref=search_posts,nba,7,30,0,1468908346.0,[OKC] Russell Westbrook,MoEasy,True,False
4tidpv,"GAME THREAD: Minnesota Timberwolves vs. Chicago Bulls (Jul. 18, 2016)",https://www.reddit.com/r/nba/comments/4tidpv/game_thread_minnesota_timberwolves_vs_chicago/,self.nba,https://www.reddit.com/r/nba/comments/4tidpv/game_thread_minnesota_timberwolves_vs_chicago/?ref=search_posts,nba,50,200,0,1468917741.0,Bucks,Metsvault,True,False
4tivkb,Worst team in the league,https://www.reddit.com/r/nba/comments/4tivkb/worst_team_in_the_league/,self.nba,https://www.reddit.com/r/nba/comments/4tivkb/worst_team_in_the_league/?ref=search_posts,nba,0,53,0,1468924402.0,,shitroperanders,True,False
4tjv9o,"Jerian Grant Full Highlights in 2016 SL Championship Game - 24 Pts, 10 Rebs, 5 Ast, Finals Game MVP -- Bonus: Includes All 4 Clutch Shots from 4th/OT!",https://www.youtube.com/watch?v=mE5vgh97aO0,youtube.com,https://www.reddit.com/r/nba/comments/4tjv9o/jerian_grant_full_highlights_in_2016_sl/?ref=search_posts,nba,23,25,0,1468941152.0,NBA,SuhMachineGun,False,False
4thuyy,Best Jersey of all time? [BJOAT],https://www.reddit.com/r/nba/comments/4thuyy/best_jersey_of_all_time_bjoat/,self.nba,https://www.reddit.com/r/nba/comments/4thuyy/best_jersey_of_all_time_bjoat/?ref=search_posts,nba,2,41,0,1468910872.0,[GSW] Draymond Green,GlacierPineapple,True,False
4tiev7,Who Is The Most Underrated Player Of All Time?,https://www.reddit.com/r/nba/comments/4tiev7/who_is_the_most_underrated_player_of_all_time/,self.nba,https://www.reddit.com/r/nba/comments/4tiev7/who_is_the_most_underrated_player_of_all_time/?ref=search_posts,nba,36,150,0,1468918150.0,Warriors,HassanBlackside,True,False
4tj2vm,[META] how do you feel about the r/NBA community?,https://www.reddit.com/r/nba/comments/4tj2vm/meta_how_do_you_feel_about_the_rnba_community/,self.nba,https://www.reddit.com/r/nba/comments/4tj2vm/meta_how_do_you_feel_about_the_rnba_community/?ref=search_posts,nba,27,111,0,1468927221.0,[OKC] Steven Adams,legendariusss,True,False
