id,title,url,domain,permalink,subreddit,score,num_comments,gilded,created,author_flair_text,author,is_self,over_18
4q3bvy,Research into Thon Maker's Age - Probably far older than 19,https://www.reddit.com/r/nba/comments/4q3bvy/research_into_thon_makers_age_probably_far_older/,self.nba,https://www.reddit.com/r/nba/comments/4q3bvy/research_into_thon_makers_age_probably_far_older/?ref=search_posts,nba,3023,1412,0,1467063020.0,Bucks,plumlord,True,False
4q45ya,[Chris Emma] Fred Hoiberg said he's excited to coach Brook Lopez. The Bulls acquired Robin Lopez.,https://twitter.com/CEmma670/status/747462129654075392,twitter.com,https://www.reddit.com/r/nba/comments/4q45ya/chris_emma_fred_hoiberg_said_hes_excited_to_coach/?ref=search_posts,nba,3655,724,0,1467073080.0,West,urfaselol,False,False
4q4oul,"[Kennedy] NBA free agent who asks to be anonymous says his top 4 destinations, all things being equal, would be: 1. Spurs 2. Raptors 3. Cavs 4. Knicks",https://twitter.com/AlexKennedyNBA/status/747488403999064065,twitter.com,https://www.reddit.com/r/nba/comments/4q4oul/kennedy_nba_free_agent_who_asks_to_be_anonymous/?ref=search_posts,nba,411,428,0,1467078940.0,Kings,ccupgirl,False,False
4q55s3,"Jonathan Givony on Twitter: ""Before the draft, Thon Maker's guardian Ed Smith told me that reddit yearbook photo was from an English school in Perth, not a high school.""",https://twitter.com/DraftExpress/status/747505873543651328,twitter.com,https://www.reddit.com/r/nba/comments/4q55s3/jonathan_givony_on_twitter_before_the_draft_thon/?ref=search_posts,nba,278,132,0,1467084164.0,,normalsizedpenis23,False,False
4q3po9,"[Broussard] Kevin Durant now has free-agent meetings with six teams -- Warriors, Spurs, Thunder, Celtics, Heat, Clippers",http://espn.go.com/nba/story/_/id/16555870/kevin-durant-now-free-agent-meetings-six-teams-warriors-spurs-thunder-celtics-heat-clippers,espn.go.com,https://www.reddit.com/r/nba/comments/4q3po9/broussard_kevin_durant_now_has_freeagent_meetings/?ref=search_posts,nba,793,539,0,1467067949.0,West,urfaselol,False,False
4q3vgz,"David Pick on Twitter: ""Source: Devin Booker, MVP in France, agreed to Summer League deal with New York Knicks.""",https://twitter.com/IAmDPick/status/747444065793343488,twitter.com,https://www.reddit.com/r/nba/comments/4q3vgz/david_pick_on_twitter_source_devin_booker_mvp_in/?ref=search_posts,nba,294,91,0,1467069765.0,,normalsizedpenis23,False,False
4q4tzy,"[Stein] Carmelo Anthony tells ESPN that his recruitment of Kevin Durant has already begun, saying: ""We've been together. We've been talking.""",https://twitter.com/ESPNSteinLine/status/747495034832850946,twitter.com,https://www.reddit.com/r/nba/comments/4q4tzy/stein_carmelo_anthony_tells_espn_that_his/?ref=search_posts,nba,768,299,0,1467080564.0,Kings,ccupgirl,False,False
4q2l26,"The Hornets were supposed to be the Spirit, while the Bucks were almost named the Skunks. Why is a team in Los Angeles named the Lakers, and what's a team called the Jazz doing in Utah? Short stories behind the names of all 30 NBA teams.",https://www.reddit.com/r/nba/comments/4q2l26/the_hornets_were_supposed_to_be_the_spirit_while/,self.nba,https://www.reddit.com/r/nba/comments/4q2l26/the_hornets_were_supposed_to_be_the_spirit_while/?ref=search_posts,nba,469,224,0,1467050102.0,Supersonics,WhenMachinesCry,True,False
4q3ezi,2016 U.S. Olympic team,http://imgur.com/mThEKBM,imgur.com,https://www.reddit.com/r/nba/comments/4q3ezi/2016_us_olympic_team/?ref=search_posts,nba,1738,750,0,1467064215.0,[IND] Myles Turner,PMMeYourDairyPillows,False,False
4q3sul,[Kaufman] .@WojVerticalNBA says teams meeting with Kevin Durant feel they're laying groundwork for 17 FA since they all anticipate his return to OKC,https://twitter.com/AdamMKaufman/status/747442053878001664,twitter.com,https://www.reddit.com/r/nba/comments/4q3sul/kaufman_wojverticalnba_says_teams_meeting_with/?ref=search_posts,nba,613,184,0,1467068945.0,Thunder,Yesoh,False,False
4q53o4,"[Justin Termine] Klay told me he's going to give KD space on Team USA, but also do whatever it takes to get him to join Warriors.",https://twitter.com/TermineRadio/status/747507439633850369,twitter.com,https://www.reddit.com/r/nba/comments/4q53o4/justin_termine_klay_told_me_hes_going_to_give_kd/?ref=search_posts,nba,541,176,0,1467083528.0,West,urfaselol,False,False
4q3k5w,NBA kid Power Rankings,https://www.reddit.com/r/nba/comments/4q3k5w/nba_kid_power_rankings/,self.nba,https://www.reddit.com/r/nba/comments/4q3k5w/nba_kid_power_rankings/?ref=search_posts,nba,408,111,0,1467066082.0,Bulls,swaggyp_,True,False
4q3i1e,[Charlotte Observer] Marco Belinelli breaks his jaw during Italy-Canada exhibition game,http://www.charlotteobserver.com/sports/nba/charlotte-hornets/article86175847.html,charlotteobserver.com,https://www.reddit.com/r/nba/comments/4q3i1e/charlotte_observer_marco_belinelli_breaks_his_jaw/?ref=search_posts,nba,395,100,0,1467065324.0,Charlotte Hornets,CarolinaCoug,False,False
4q41sh,Spurs Special Forces 4,https://www.youtube.com/watch?v=EVE_AAW1fH4,youtube.com,https://www.reddit.com/r/nba/comments/4q41sh/spurs_special_forces_4/?ref=search_posts,nba,930,119,0,1467071774.0,[SAS] LaMarcus Aldridge,CheesyMightyMo,False,False
4q46de,[Amico] Former #Cavs coach Mike Brown has been offered top assistant job by #Warriors,https://twitter.com/AmicoHoops/status/747464275745181696,twitter.com,https://www.reddit.com/r/nba/comments/4q46de/amico_former_cavs_coach_mike_brown_has_been/?ref=search_posts,nba,380,182,0,1467073209.0,Kings,ccupgirl,False,False
4q3mlj,Should Bill Laimbeer be in the Hall of Fame?,https://www.reddit.com/r/nba/comments/4q3mlj/should_bill_laimbeer_be_in_the_hall_of_fame/,self.nba,https://www.reddit.com/r/nba/comments/4q3mlj/should_bill_laimbeer_be_in_the_hall_of_fame/?ref=search_posts,nba,7,28,0,1467066927.0,Celtics,rebirthandrecover,True,False
4q4qt3,Who do you have as the top 10 best NBA teams of all time?,https://www.reddit.com/r/nba/comments/4q4qt3/who_do_you_have_as_the_top_10_best_nba_teams_of/,self.nba,https://www.reddit.com/r/nba/comments/4q4qt3/who_do_you_have_as_the_top_10_best_nba_teams_of/?ref=search_posts,nba,29,65,0,1467079548.0,Thunder,CowboyState,True,False
4q4if6,"[Alex Kennedy] 2016 D-League MVP and Finals MVP Jarnell Stokes worked out for the Mavs. Last year, Stokes averaged 20.6 PPG (on 66.5 FG%), 9.3 RPG, 1.1 SPG",https://twitter.com/AlexKennedyNBA/status/747458772625424385,twitter.com,https://www.reddit.com/r/nba/comments/4q4if6/alex_kennedy_2016_dleague_mvp_and_finals_mvp/?ref=search_posts,nba,48,16,0,1467076938.0,Raptors,LinuxF4n,False,False
4q3fhx,Orlando Magic have apparently hired Chad Forcier as Vogel's head assistant,http://www.poundingtherock.com/2016/6/26/12035120/orlando-magic-have-apparently-hired-chad-forcier-as-vogels-head,poundingtherock.com,https://www.reddit.com/r/nba/comments/4q3fhx/orlando_magic_have_apparently_hired_chad_forcier/?ref=search_posts,nba,40,22,0,1467064380.0,Magic,dashik,False,False
4q3ol6,Best and worst NBA brothers?,https://www.reddit.com/r/nba/comments/4q3ol6/best_and_worst_nba_brothers/,self.nba,https://www.reddit.com/r/nba/comments/4q3ol6/best_and_worst_nba_brothers/?ref=search_posts,nba,21,35,0,1467067582.0,[GSW] Draymond Green,GlacierPineapple,True,False
4q4tmz,What's the most heated debate about basketball you've ever gotten into with a fellow fan?,https://www.reddit.com/r/nba/comments/4q4tmz/whats_the_most_heated_debate_about_basketball/,self.nba,https://www.reddit.com/r/nba/comments/4q4tmz/whats_the_most_heated_debate_about_basketball/?ref=search_posts,nba,4,54,0,1467080459.0,[NYK] Carmelo Anthony,Knicks4All,True,False
4q3rsp,Have any Thunder players said anything about Ibaka trade?,https://www.reddit.com/r/nba/comments/4q3rsp/have_any_thunder_players_said_anything_about/,self.nba,https://www.reddit.com/r/nba/comments/4q3rsp/have_any_thunder_players_said_anything_about/?ref=search_posts,nba,33,26,0,1467068618.0,Thunder,wickergoose,True,False
4q53j9,"Mitch Kupchak: ""We Need Help Everywhere""",http://espn.go.com/video/clip?id=16558387&ex_cid=espnapi_internal,espn.go.com,https://www.reddit.com/r/nba/comments/4q53j9/mitch_kupchak_we_need_help_everywhere/?ref=search_posts,nba,95,57,0,1467083486.0,Lakers,KingsCrossings,False,False
4q48oj,"[CSN Bay Area] The King's primary target in Free Agency is Ryan Anderson, second target - Courtney Lee",http://www.csnbayarea.com/page/kings-insider-podcast,csnbayarea.com,https://www.reddit.com/r/nba/comments/4q48oj/csn_bay_area_the_kings_primary_target_in_free/?ref=search_posts,nba,103,148,0,1467073929.0,West,urfaselol,False,False
4q5a16,"[Bontemps] Carmelo Anthony, on what he learned during his own free agency tour: ""I wouldn’t do it again, I’ll tell you that. I wouldn’t do it again.""",https://twitter.com/TimBontemps/status/747515984542638080,twitter.com,https://www.reddit.com/r/nba/comments/4q5a16/bontemps_carmelo_anthony_on_what_he_learned/?ref=search_posts,nba,224,86,0,1467085513.0,[NJN] Vince Carter,VinceBarter,False,False
4q4c18,2016/2017 NBA award predications,https://www.reddit.com/r/nba/comments/4q4c18/20162017_nba_award_predications/,self.nba,https://www.reddit.com/r/nba/comments/4q4c18/20162017_nba_award_predications/?ref=search_posts,nba,5,39,0,1467074961.0,[OKC] Russell Westbrook,westbitch0,True,False
4q48f5,Does the Cavs Championship run make the ousting of David Blatt some type of next-level genius move?,https://www.reddit.com/r/nba/comments/4q48f5/does_the_cavs_championship_run_make_the_ousting/,self.nba,https://www.reddit.com/r/nba/comments/4q48f5/does_the_cavs_championship_run_make_the_ousting/?ref=search_posts,nba,27,48,0,1467073844.0,Warriors,finaljustice09,True,False
4q29o0,Scenario: The NBA changes overnight-every player is the same height.,https://www.reddit.com/r/nba/comments/4q29o0/scenario_the_nba_changes_overnightevery_player_is/,self.nba,https://www.reddit.com/r/nba/comments/4q29o0/scenario_the_nba_changes_overnightevery_player_is/?ref=search_posts,nba,49,67,0,1467043434.0,Wizards,AnalSlutFrog,True,False
4q2ujy,"Which player proved the sentence ""Big guys take 4-6 years to develop."" true?",https://www.reddit.com/r/nba/comments/4q2ujy/which_player_proved_the_sentence_big_guys_take_46/,self.nba,https://www.reddit.com/r/nba/comments/4q2ujy/which_player_proved_the_sentence_big_guys_take_46/?ref=search_posts,nba,79,128,0,1467055389.0,[PHO] Vince Carter,SunsFan97,True,False
4q4n6s,"David Pick on Twitter: ""Source: Kyle Kuric, overcame brain surgery to remove tumor, has joined the Phoenix Suns for Summer League. This dude is a HERO.""",https://twitter.com/iamdpick/status/747484865382199296,twitter.com,https://www.reddit.com/r/nba/comments/4q4n6s/david_pick_on_twitter_source_kyle_kuric_overcame/?ref=search_posts,nba,65,39,0,1467078402.0,,BrontoPronto,False,False
4q2dxe,Kyrie celebrates championship with yacht party,https://streamable.com/gaic,streamable.com,https://www.reddit.com/r/nba/comments/4q2dxe/kyrie_celebrates_championship_with_yacht_party/?ref=search_posts,nba,28,35,0,1467045873.0,Spurs,CokeSniffa,False,False
4q50by,What is the 2017 NBA Draft Big Board In Your Opinion?,https://www.reddit.com/r/nba/comments/4q50by/what_is_the_2017_nba_draft_big_board_in_your/,self.nba,https://www.reddit.com/r/nba/comments/4q50by/what_is_the_2017_nba_draft_big_board_in_your/?ref=search_posts,nba,3,39,0,1467082513.0,[LAL] Dick Schnittker,310BrownGuy,True,False
4q52ji,"[Jonathan Givony] Everyone at that school (and on that yearbook photo page) were different ages, and nothing to glean from Thon being next to 23 year olds.",https://twitter.com/DraftExpress/status/747506029269815296,twitter.com,https://www.reddit.com/r/nba/comments/4q52ji/jonathan_givony_everyone_at_that_school_and_on/?ref=search_posts,nba,77,18,0,1467083180.0,[DAL] Jameer Nelson,KingKuma02D,False,False
4q42ay,Dunc'd On Mock Offseason Part 2 is out,https://www.reddit.com/r/nba/comments/4q42ay/duncd_on_mock_offseason_part_2_is_out/,self.nba,https://www.reddit.com/r/nba/comments/4q42ay/duncd_on_mock_offseason_part_2_is_out/?ref=search_posts,nba,159,58,0,1467071932.0,Danny Leroux (NBA ANALYST)- Verified ,DannyLeroux,True,False
4q44ag,"K.C. Johnson on Twitter: ""Denzel Valentine will wear No. 45 for the Bulls.""",https://twitter.com/KCJHoop/status/747457501197656064,twitter.com,https://www.reddit.com/r/nba/comments/4q44ag/kc_johnson_on_twitter_denzel_valentine_will_wear/?ref=search_posts,nba,90,29,0,1467072551.0,,BrontoPronto,False,False
4q5bfw,Hornets unlikely to have space to sign Jeremy Lin after other priorities | Lin will meet with three other clubs beginning on July 1st.,http://espn.go.com/nba/story/_/id/16556952/charlotte-hornets-fearful-jeremy-lin-sign-elsewhere,espn.go.com,https://www.reddit.com/r/nba/comments/4q5bfw/hornets_unlikely_to_have_space_to_sign_jeremy_lin/?ref=search_posts,nba,21,29,0,1467085964.0,Nets,IMShynZ,False,False
4q54zh,"Out of 14 players to shoot over 300+ long 2's (16+ ft), Karl-Anthony Towns was the only one to shoot over 50% on such shots",https://twitter.com/bball_ref/status/747496008305770496?ref_src=twsrc%5Etfw,twitter.com,https://www.reddit.com/r/nba/comments/4q54zh/out_of_14_players_to_shoot_over_300_long_2s_16_ft/?ref=search_posts,nba,139,45,0,1467083931.0,Timberwolves,KushedCudi,False,False
4q4fgt,Breaking Down Kevin Durant's Upcoming Contract Options,https://www.reddit.com/r/nba/comments/4q4fgt/breaking_down_kevin_durants_upcoming_contract/,self.nba,https://www.reddit.com/r/nba/comments/4q4fgt/breaking_down_kevin_durants_upcoming_contract/?ref=search_posts,nba,17,17,0,1467076020.0,Lakers,duneboggler,True,False
4q4d6o,Where does LeBron James rank among the greatest dunkers?,https://www.reddit.com/r/nba/comments/4q4d6o/where_does_lebron_james_rank_among_the_greatest/,self.nba,https://www.reddit.com/r/nba/comments/4q4d6o/where_does_lebron_james_rank_among_the_greatest/?ref=search_posts,nba,0,40,0,1467075323.0,,Some_Republikkkan,True,False
4q3pc9,[Mannix] It was the staunch belief that Ibaka’s desire for a larger role would lead him to leave the Thunder when his contract expired after next season.,http://sports.yahoo.com/news/why-the-thunder-traded-serge-ibaka-055837006.html,sports.yahoo.com,https://www.reddit.com/r/nba/comments/4q3pc9/mannix_it_was_the_staunch_belief_that_ibakas/?ref=search_posts,nba,101,16,0,1467067842.0,West,urfaselol,False,False
4q2zlz,Draft Prospects : Poeltl or Bender?,https://www.reddit.com/r/nba/comments/4q2zlz/draft_prospects_poeltl_or_bender/,self.nba,https://www.reddit.com/r/nba/comments/4q2zlz/draft_prospects_poeltl_or_bender/?ref=search_posts,nba,13,59,0,1467058007.0,[MIA] Justise Winslow,Tito_Our_Saviour,True,False
4q5b5i,"As Dallas, Portland, the Lakers and others line up to make their case to Hassan Whiteside, to woo him with a potential max deal, the conflicted Heat goes back and forth about how much to offer its shot-blocking prodigy. Some important people inside the Heat do not view Whiteside as a max player.",http://miamiherald.typepad.com/sports-buzz/2016/06/whiteside-others-to-test-rileys-success-getting-players-to-sign-for-less-um-fallout-dolphins.html,miamiherald.typepad.com,https://www.reddit.com/r/nba/comments/4q5b5i/as_dallas_portland_the_lakers_and_others_line_up/?ref=search_posts,nba,36,28,0,1467085877.0,[DAL] Dirk Nowitzki,xSmoothx,False,False
4q2pdp,/r/nba in the 80s,https://www.reddit.com/r/nba/comments/4q2pdp/rnba_in_the_80s/,self.nba,https://www.reddit.com/r/nba/comments/4q2pdp/rnba_in_the_80s/?ref=search_posts,nba,47,26,0,1467052522.0,Cavaliers,gnomeimean,True,False
4q4icl,"AlexKennedyNBA: As if this NBA free agency period won't be crazy enough with $94 million cap, notable players are discussing the possibility of teaming up.",https://twitter.com/AlexKennedyNBA/status/747477916271902720,twitter.com,https://www.reddit.com/r/nba/comments/4q4icl/alexkennedynba_as_if_this_nba_free_agency_period/?ref=search_posts,nba,60,77,0,1467076918.0,Knicks,HaruSoul,False,False
4q4bie,[Fisher] DallasBasketball.com is told by sources Mavs have secured a July 1 meeting with Mike Conley,https://twitter.com/fishsports/status/747470733341687809,twitter.com,https://www.reddit.com/r/nba/comments/4q4bie/fisher_dallasbasketballcom_is_told_by_sources/?ref=search_posts,nba,85,45,0,1467074798.0,Mavericks,gigantism,False,False
4q4oh1,2016-17 Starting Lineup Prediction Thread: Who is your team's starting five Opening Night?,https://www.reddit.com/r/nba/comments/4q4oh1/201617_starting_lineup_prediction_thread_who_is/,self.nba,https://www.reddit.com/r/nba/comments/4q4oh1/201617_starting_lineup_prediction_thread_who_is/?ref=search_posts,nba,10,165,0,1467078819.0,Knicks,tanoid,True,False
4q4blq,Who would give Harrison Barnes the max?,https://www.reddit.com/r/nba/comments/4q4blq/who_would_give_harrison_barnes_the_max/,self.nba,https://www.reddit.com/r/nba/comments/4q4blq/who_would_give_harrison_barnes_the_max/?ref=search_posts,nba,10,63,0,1467074828.0,,AKraiderfan,True,False
4q3s67,"If Kevin Durant ends up leaving OKC, I will not dislike him.",https://www.reddit.com/r/nba/comments/4q3s67/if_kevin_durant_ends_up_leaving_okc_i_will_not/,self.nba,https://www.reddit.com/r/nba/comments/4q3s67/if_kevin_durant_ends_up_leaving_okc_i_will_not/?ref=search_posts,nba,16,37,0,1467068727.0,[ORL] J.J. Redick,_KingGucci_,True,False
4q3wcm,[Charania] Former No. 6 pick Ekpe Udoh aiming to return to league after Euroleague championship,http://sports.yahoo.com/news/former-no--6-pick-aiming-to-return-to-league-151220952.html,sports.yahoo.com,https://www.reddit.com/r/nba/comments/4q3wcm/charania_former_no_6_pick_ekpe_udoh_aiming_to/?ref=search_posts,nba,27,16,0,1467070052.0,West,urfaselol,False,False
4q5cha,"[Watkins] Houston Rockets are looking at the following high-level free agents: Al Horford, Kevin Durant, Hassan Whiteside and Ryan Anderson.",http://espn.go.com/espn/now?nowId=21-0539172195050459530-4,espn.go.com,https://www.reddit.com/r/nba/comments/4q5cha/watkins_houston_rockets_are_looking_at_the/?ref=search_posts,nba,58,33,0,1467086318.0,West,urfaselol,False,False
4q47f8,"If any country were to beat the U.S. for the gold medal in Brazil, which country would it be, and why?",https://www.reddit.com/r/nba/comments/4q47f8/if_any_country_were_to_beat_the_us_for_the_gold/,self.nba,https://www.reddit.com/r/nba/comments/4q47f8/if_any_country_were_to_beat_the_us_for_the_gold/?ref=search_posts,nba,23,42,0,1467073548.0,,gringogrande33,True,False
4q2xwm,Ben Simmons excited about rejoining Embiid on court,http://www.philly.com/philly/sports/sixers/20160627_Ben_Simmons_excited_about_rejoining_Embiid_on_court.html,philly.com,https://www.reddit.com/r/nba/comments/4q2xwm/ben_simmons_excited_about_rejoining_embiid_on/?ref=search_posts,nba,191,44,0,1467057170.0,[NYK] Walt Frazier,DishingLikeClyde,False,False
4q489k,Mike Conley Grizzlies Recruitment Video - Our Conductor,http://www.nba.com/grizzlies/video/teams/grizzlies/2016/06/27/1467040729613-MIKE_CONLEY_OUR_CONDUCTOR_FINAL_CUT_WEB.mp4-617929,nba.com,https://www.reddit.com/r/nba/comments/4q489k/mike_conley_grizzlies_recruitment_video_our/?ref=search_posts,nba,53,22,0,1467073802.0,[MEM] Tony Allen,RaganSmash88,False,False
4q5bmc,"The Vertical will be producing a live Free Agency Show, coming on Thursday",https://twitter.com/ChrisMannixYS/status/747516749617242112,twitter.com,https://www.reddit.com/r/nba/comments/4q5bmc/the_vertical_will_be_producing_a_live_free_agency/?ref=search_posts,nba,27,10,0,1467086019.0,Raptors,foxsleftear,False,False
4q4hen,Why don't big men use the hook shot as much nowadays?,https://www.reddit.com/r/nba/comments/4q4hen/why_dont_big_men_use_the_hook_shot_as_much/,self.nba,https://www.reddit.com/r/nba/comments/4q4hen/why_dont_big_men_use_the_hook_shot_as_much/?ref=search_posts,nba,145,144,0,1467076627.0,Celtics,Mexter-Dorgan,True,False
4q4ue0,Who are your top 10 young players going into next season?,https://www.reddit.com/r/nba/comments/4q4ue0/who_are_your_top_10_young_players_going_into_next/,self.nba,https://www.reddit.com/r/nba/comments/4q4ue0/who_are_your_top_10_young_players_going_into_next/?ref=search_posts,nba,9,46,0,1467080684.0,Thunder,Yesoh,True,False
4q3uoe,"Domantas Sabonis expected to compete for Lithuania in the Olympics, miss summer league",http://newsok.com/article/5506585,newsok.com,https://www.reddit.com/r/nba/comments/4q3uoe/domantas_sabonis_expected_to_compete_for/?ref=search_posts,nba,196,38,0,1467069513.0,[OKC] Russell Westbrook,limark,False,False
4q489a,"[Bolch] Clippers' free agency pitch meeting with Kevin Durant is expected to take place in New York, per source.",https://twitter.com/latbbolch/status/747466782554763264,twitter.com,https://www.reddit.com/r/nba/comments/4q489a/bolch_clippers_free_agency_pitch_meeting_with/?ref=search_posts,nba,21,28,0,1467073801.0,Kings,ccupgirl,False,False
4q2pjf,"Which players' game, retired or active, aged like wine?",https://www.reddit.com/r/nba/comments/4q2pjf/which_players_game_retired_or_active_aged_like/,self.nba,https://www.reddit.com/r/nba/comments/4q2pjf/which_players_game_retired_or_active_aged_like/?ref=search_posts,nba,9,53,0,1467052611.0,Vancouver Grizzlies,chinli,True,False
4q3oxn,What team name would you create if you could?,https://www.reddit.com/r/nba/comments/4q3oxn/what_team_name_would_you_create_if_you_could/,self.nba,https://www.reddit.com/r/nba/comments/4q3oxn/what_team_name_would_you_create_if_you_could/?ref=search_posts,nba,3,29,0,1467067696.0,[GSW] Draymond Green,GlacierPineapple,True,False
4q57ur,How Much Longer Does Lebron Have?,https://www.reddit.com/r/nba/comments/4q57ur/how_much_longer_does_lebron_have/,self.nba,https://www.reddit.com/r/nba/comments/4q57ur/how_much_longer_does_lebron_have/?ref=search_posts,nba,5,31,0,1467084826.0,Bulls,chicity1,True,False
4q55ms,Has there ever been a player that's come back from a major injury and came back just as good or even better?,https://www.reddit.com/r/nba/comments/4q55ms/has_there_ever_been_a_player_thats_come_back_from/,self.nba,https://www.reddit.com/r/nba/comments/4q55ms/has_there_ever_been_a_player_thats_come_back_from/?ref=search_posts,nba,4,47,0,1467084131.0,Bulls,Thix,True,False
4q2rn7,Interesting Player Trivia,https://www.reddit.com/r/nba/comments/4q2rn7/interesting_player_trivia/,self.nba,https://www.reddit.com/r/nba/comments/4q2rn7/interesting_player_trivia/?ref=search_posts,nba,13,23,0,1467053791.0,[OKC] Russell Westbrook,limark,True,False
4q3mb6,[Broussard] Charlotte Hornets fearful Jeremy Lin will sign elsewhere,http://espn.go.com/nba/story?id=16556952&_slug_=charlotte-hornets-fearful-jeremy-lin-sign-elsewhere,espn.go.com,https://www.reddit.com/r/nba/comments/4q3mb6/broussard_charlotte_hornets_fearful_jeremy_lin/?ref=search_posts,nba,20,37,0,1467066827.0,West,JM15,False,False
4q3m6c,Report: Courtney Lee looking for $14 million per-season,https://twitter.com/hoopballtweets/status/747428759020572673,twitter.com,https://www.reddit.com/r/nba/comments/4q3m6c/report_courtney_lee_looking_for_14_million/?ref=search_posts,nba,82,72,0,1467066785.0,Hornets,ReidM15,False,False
4q52e2,"[Begley] Carmelo Anthony on the Derrick Rose trade: ""I like that a lot.""",https://twitter.com/IanBegley/status/747505136839200769,twitter.com,https://www.reddit.com/r/nba/comments/4q52e2/begley_carmelo_anthony_on_the_derrick_rose_trade/?ref=search_posts,nba,212,41,0,1467083136.0,Kings,ccupgirl,False,False
4q3c59,KD free agency related to both of LBJ's free agencies,https://www.reddit.com/r/nba/comments/4q3c59/kd_free_agency_related_to_both_of_lbjs_free/,self.nba,https://www.reddit.com/r/nba/comments/4q3c59/kd_free_agency_related_to_both_of_lbjs_free/?ref=search_posts,nba,0,18,0,1467063125.0,Thunder,Livin_Tha_Dream,True,False
4q2sgo,[MIXTAPE] Ben Simmons' SICK Home Team Hoops Mixtape put together right after draft. MASSIVE HYPE!,https://www.youtube.com/watch?v=GTFJ7RzBla4,youtube.com,https://www.reddit.com/r/nba/comments/4q2sgo/mixtape_ben_simmons_sick_home_team_hoops_mixtape/?ref=search_posts,nba,19,2,0,1467054252.0,[SAC] DeMarcus Cousins,KayJayA7X,False,False
4q3hbg,"Alex Kennedy: Most contested 2 pointers - Hassan Whiteside (13.5), Myles Turner (12.7), Al Horford (12.2) and Draymond Green (11.1), Paul Millsap (10.6)",https://twitter.com/AlexKennedyNBA/status/747397024149049344?ref_src=twsrc%5Etfw,twitter.com,https://www.reddit.com/r/nba/comments/4q3hbg/alex_kennedy_most_contested_2_pointers_hassan/?ref=search_posts,nba,6,6,0,1467065059.0,Heat,xcosmicwaffle69,False,False
4q2xn1,USA in the olympics.,https://www.reddit.com/r/nba/comments/4q2xn1/usa_in_the_olympics/,self.nba,https://www.reddit.com/r/nba/comments/4q2xn1/usa_in_the_olympics/?ref=search_posts,nba,2,21,0,1467057035.0,Timberwolves,Facov,True,False
4q4bi6,Do you think Seattle will ever have a NBA team again?,https://www.reddit.com/r/nba/comments/4q4bi6/do_you_think_seattle_will_ever_have_a_nba_team/,self.nba,https://www.reddit.com/r/nba/comments/4q4bi6/do_you_think_seattle_will_ever_have_a_nba_team/?ref=search_posts,nba,0,11,0,1467074796.0,[LAL] Didier Ilunga-Mbenga,CokeBoyRod,True,False
4q3pgl,Mavericks interested in Knicks free agent Lance Thomas.,http://sportsday.dallasnews.com/dallas-mavericks/mavericks/2016/06/24/report-mavericks-expected-show-interest-knicks-free-agent-lance-thomas,sportsday.dallasnews.com,https://www.reddit.com/r/nba/comments/4q3pgl/mavericks_interested_in_knicks_free_agent_lance/?ref=search_posts,nba,8,12,0,1467067882.0,Knicks,btopishere,False,False
4q48q7,Mike Conley-Our Conductor,http://www.nba.com/grizzlies/video/teams/grizzlies/2016/06/27/1467040729613-MIKE_CONLEY_OUR_CONDUCTOR_FINAL_CUT_WEB.mp4-617929,nba.com,https://www.reddit.com/r/nba/comments/4q48q7/mike_conleyour_conductor/?ref=search_posts,nba,21,4,0,1467073946.0,[MEM] Allen Iverson,ccman93,False,False
