id,title,url,domain,permalink,subreddit,score,num_comments,gilded,created,author_flair_text,author,is_self,over_18
4mavyp,Matthew Dellavedova hits Andre Iguodala in the groin.,https://streamable.com/8rtu,streamable.com,https://www.reddit.com/r/nba/comments/4mavyp/matthew_dellavedova_hits_andre_iguodala_in_the/?ref=search_posts,nba,2833,1271,0,1464951425.0,,-MarcusD-,False,False
4mau5p,Steve Kerr is not happy breaks clipboard.,https://streamable.com/8i7m,streamable.com,https://www.reddit.com/r/nba/comments/4mau5p/steve_kerr_is_not_happy_breaks_clipboard/?ref=search_posts,nba,5649,771,0,1464950590.0,,-MarcusD-,False,False
4mb12q,[Post Game Thread] The Golden State Warriors defeat the Cleveland Cavaliers 104-89 to take a 1-0 series lead,https://www.reddit.com/r/nba/comments/4mb12q/post_game_thread_the_golden_state_warriors_defeat/,self.nba,https://www.reddit.com/r/nba/comments/4mb12q/post_game_thread_the_golden_state_warriors_defeat/?ref=search_posts,nba,3023,3407,0,1464953730.0,[LAC] Chris Paul,LobItUp,True,False
4ma5wa,"GAME THREAD: Cleveland Cavaliers (0-0) @ Golden State Warriors (0-0) - (Jun. 02, 2016)",https://www.reddit.com/r/nba/comments/4ma5wa/game_thread_cleveland_cavaliers_00_golden_state/,self.nba,https://www.reddit.com/r/nba/comments/4ma5wa/game_thread_cleveland_cavaliers_00_golden_state/?ref=search_posts,nba,1502,22239,0,1464940787.0,[SAS] Danny Green,myellabella,True,False
4mb1uy,Are the Warriors the first real test for the Cavs?,https://www.reddit.com/r/nba/comments/4mb1uy/are_the_warriors_the_first_real_test_for_the_cavs/,self.nba,https://www.reddit.com/r/nba/comments/4mb1uy/are_the_warriors_the_first_real_test_for_the_cavs/?ref=search_posts,nba,274,498,0,1464954109.0,Warriors,supersmashbr000,True,False
4ma1ky,"Steve Kerr on the Cavs' experience on the big stage: ""LeBron has been here 15 years in a row or something.""""",https://twitter.com/jadande/status/738512342120468480,twitter.com,https://www.reddit.com/r/nba/comments/4ma1ky/steve_kerr_on_the_cavs_experience_on_the_big/?ref=search_posts,nba,549,102,0,1464939101.0,,ItsJotaPe,False,False
4mb58x,"[ESPN]: The Warriors' bench outscored the Cavs' bench by 35 Pts, the largest bench scoring differential in the last 50 yrs.",https://twitter.com/ESPNNBA/status/738581361498292225,twitter.com,https://www.reddit.com/r/nba/comments/4mb58x/espn_the_warriors_bench_outscored_the_cavs_bench/?ref=search_posts,nba,1008,188,0,1464955670.0,Heat,tft7178,False,False
4maqqr,"[Mannix]LeBron james to the referee after that offensive foul on Love, taken by Varejao: ""That's a flop. I know him, and that's a flop.""",https://twitter.com/ChrisMannixYS/status/738553337667149826,twitter.com,https://www.reddit.com/r/nba/comments/4maqqr/mannixlebron_james_to_the_referee_after_that/?ref=search_posts,nba,1826,431,0,1464949056.0,,w2chaudh,False,False
4mb5v3,"Kerr on Iguodala: ""He’s a brilliant basketball player. He doesnt get enough credit…he always settles us down & knows exactly what’s happening""""",https://mobile.twitter.com/warriors/status/738579904967544834,mobile.twitter.com,https://www.reddit.com/r/nba/comments/4mb5v3/kerr_on_iguodala_hes_a_brilliant_basketball/?ref=search_posts,nba,800,200,0,1464955954.0,,blazinflames666,False,False
4m9mjf,"Shams Charania on Twitter: ""Atlanta and Philadelphia are discussing a deal centered on a Jeff Teague and Nerlens Noel package, league sources tell The Vertical.""",https://twitter.com/ShamsCharania/status/738488558701318144,twitter.com,https://www.reddit.com/r/nba/comments/4m9mjf/shams_charania_on_twitter_atlanta_and/?ref=search_posts,nba,1154,964,0,1464933217.0,,onirapac,False,False
4maz5g,Curry with the no look pass to Iguodala who slams it down,https://streamable.com/l8v2,streamable.com,https://www.reddit.com/r/nba/comments/4maz5g/curry_with_the_no_look_pass_to_iguodala_who_slams/?ref=search_posts,nba,473,54,0,1464952876.0,Celtics,Agastopia,False,False
4mak8p,Draymond Green flops big time and draws the foul,https://streamable.com/7aa1,streamable.com,https://www.reddit.com/r/nba/comments/4mak8p/draymond_green_flops_big_time_and_draws_the_foul/?ref=search_posts,nba,1236,598,0,1464946411.0,Celtics,Agastopia,False,False
4mba8b,Shaun Livingston 20 Points Full Highlights (6/2/2016),https://www.youtube.com/watch?v=QtPOxnleTD4,youtube.com,https://www.reddit.com/r/nba/comments/4mba8b/shaun_livingston_20_points_full_highlights_622016/?ref=search_posts,nba,517,93,0,1464958064.0,[GSW] Raja Bell,unguilty,False,False
4ma86q,NBA Mean Tweets #4,https://youtu.be/21DNP22-EQI,youtu.be,https://www.reddit.com/r/nba/comments/4ma86q/nba_mean_tweets_4/?ref=search_posts,nba,1660,408,0,1464941668.0,Bulls,PrisonerofWawa69,False,False
4mbtv8,"[Nate Duncan] Cleveland isolated on 18 possessions tonight, scored one basket, fouled twice, rest misses or turnovers.",https://twitter.com/NateDuncanNBA/status/738604478400602112,twitter.com,https://www.reddit.com/r/nba/comments/4mbtv8/nate_duncan_cleveland_isolated_on_18_possessions/?ref=search_posts,nba,674,148,0,1464968709.0,,BearsNecessity,False,False
4mbd4n,"[Reynolds] Igoudala on 'the hit': ""There's a lot of emotions going out there. I respect a lot of guys' hustles in this league. You've got guys who've got to get a little dirty and a little physical to make a life and to feed their families. So I can only respect that""",https://twitter.com/ByTimReynolds/status/738598744132718594,twitter.com,https://www.reddit.com/r/nba/comments/4mbd4n/reynolds_igoudala_on_the_hit_theres_a_lot_of/?ref=search_posts,nba,575,355,0,1464959533.0,West,urfaselol,False,False
4mavo1,Steph Curry dekes Dellavadova and then hits the contested falling layup over Lebron,https://streamable.com/x2le,streamable.com,https://www.reddit.com/r/nba/comments/4mavo1/steph_curry_dekes_dellavadova_and_then_hits_the/?ref=search_posts,nba,569,103,0,1464951284.0,Celtics,Agastopia,False,False
4mb5q8,"Kerr on breaking clipboards: ""Destruction tends to ease some of the anger, so I try to take it out on the board rather than a player.""""",https://mobile.twitter.com/warriors/status/738580094571024384,mobile.twitter.com,https://www.reddit.com/r/nba/comments/4mb5q8/kerr_on_breaking_clipboards_destruction_tends_to/?ref=search_posts,nba,490,66,0,1464955893.0,,blazinflames666,False,False
4mb0ig,"Curry steals the ball from Lebron, runs down the court and drains a step back three pointer on Irving",https://streamable.com/r902,streamable.com,https://www.reddit.com/r/nba/comments/4mb0ig/curry_steals_the_ball_from_lebron_runs_down_the/?ref=search_posts,nba,394,58,0,1464953472.0,Celtics,Agastopia,False,False
4mamem,"LeBron James is now the only player in the top 10 in points, rebounds, assists, and wins in NBA Playoff history",http://i.imgur.com/c7cv8Si.jpg,i.imgur.com,https://www.reddit.com/r/nba/comments/4mamem/lebron_james_is_now_the_only_player_in_the_top_10/?ref=search_posts,nba,2080,618,0,1464947267.0,Knicks,noahsbun,False,False
4makxf,Kyrie Irving jumps over a falling Varejao and goes down the court to finish with a beautiful layup,https://streamable.com/ck9v,streamable.com,https://www.reddit.com/r/nba/comments/4makxf/kyrie_irving_jumps_over_a_falling_varejao_and/?ref=search_posts,nba,44,5,0,1464946702.0,Celtics,Agastopia,False,False
4mb6um,Steph and Klay shot a combined 2-12 on uncontested shots.,https://www.reddit.com/r/nba/comments/4mb6um/steph_and_klay_shot_a_combined_212_on_uncontested/,self.nba,https://www.reddit.com/r/nba/comments/4mb6um/steph_and_klay_shot_a_combined_212_on_uncontested/?ref=search_posts,nba,130,32,0,1464956411.0,[NYK] Langston Galloway,CoreFour1996,True,False
4m94wj,Is your NBA team the most popular sports team in your city?,https://www.reddit.com/r/nba/comments/4m94wj/is_your_nba_team_the_most_popular_sports_team_in/,self.nba,https://www.reddit.com/r/nba/comments/4m94wj/is_your_nba_team_the_most_popular_sports_team_in/?ref=search_posts,nba,18,153,0,1464927148.0,[SEA] Gary Payton,ImHungryAsFuck,True,False
4mb9cl,Isiah Thomas breaks down issues with the Cavs offense,https://streamable.com/mgio,streamable.com,https://www.reddit.com/r/nba/comments/4mb9cl/isiah_thomas_breaks_down_issues_with_the_cavs/?ref=search_posts,nba,75,28,0,1464957638.0,Spurs,MaltMilchek,False,False
4m9mtz,Which GSW and CLE role players will have to score if the superstars can't?,https://www.reddit.com/r/nba/comments/4m9mtz/which_gsw_and_cle_role_players_will_have_to_score/,self.nba,https://www.reddit.com/r/nba/comments/4m9mtz/which_gsw_and_cle_role_players_will_have_to_score/?ref=search_posts,nba,15,48,0,1464933324.0,Raptors,PistolPeteWouldLose,True,False
4mb2mr,Non of the Cavs players shot 50% in game 1. The warriors had 5 players shoot above 50%.,https://www.reddit.com/r/nba/comments/4mb2mr/non_of_the_cavs_players_shot_50_in_game_1_the/,self.nba,https://www.reddit.com/r/nba/comments/4mb2mr/non_of_the_cavs_players_shot_50_in_game_1_the/?ref=search_posts,nba,43,19,0,1464954457.0,,blazinflames666,True,False
4mbo99,"Andre Iguodala Full Defensive & Offensive HLTS in 2016 Finals G1 vs Cavs - 12 Pts, 7 Rebs, 6 Ast",https://www.youtube.com/watch?v=Ih1JV-rdRUM,youtube.com,https://www.reddit.com/r/nba/comments/4mbo99/andre_iguodala_full_defensive_offensive_hlts_in/?ref=search_posts,nba,94,20,0,1464965529.0,Clippers,gaspomacho567,False,False
4mb4cz,What's your opinion on Iso ball? It's frustrating to watch but very common in the NBA.,https://www.reddit.com/r/nba/comments/4mb4cz/whats_your_opinion_on_iso_ball_its_frustrating_to/,self.nba,https://www.reddit.com/r/nba/comments/4mb4cz/whats_your_opinion_on_iso_ball_its_frustrating_to/?ref=search_posts,nba,18,23,0,1464955280.0,[CLE] LeBron James,HnB_01,True,False
4mb1q1,"What's more concerning about the Warriors winning but Curry and Thompson shooting badly? That the Warriors can't sustain that success if they keep playing that badly, or that the cavs aren't going to be able to win games if they couldn't beat the Warriors when they did shoot badly.",https://www.reddit.com/r/nba/comments/4mb1q1/whats_more_concerning_about_the_warriors_winning/,self.nba,https://www.reddit.com/r/nba/comments/4mb1q1/whats_more_concerning_about_the_warriors_winning/?ref=search_posts,nba,25,84,0,1464954033.0,[NYK] Chris Copeland,bootum,True,False
4m9q00,"Dirk Nowitzki On His Options: ""Whatever's Best For Mavs""",http://www.scout.com/nba/mavericks/story/1653613-dirk-opt-reversal-whatever-s-best-for-mavs,scout.com,https://www.reddit.com/r/nba/comments/4m9q00/dirk_nowitzki_on_his_options_whatevers_best_for/?ref=search_posts,nba,24,29,0,1464934576.0,[DAL] Steve Nash,aceofspadez138,False,False
4ma3b3,Is there a worst narrative in sports today than bashing LeBron for his Finals record?,https://www.reddit.com/r/nba/comments/4ma3b3/is_there_a_worst_narrative_in_sports_today_than/,self.nba,https://www.reddit.com/r/nba/comments/4ma3b3/is_there_a_worst_narrative_in_sports_today_than/?ref=search_posts,nba,0,101,0,1464939775.0,Bucks,JudiciousJay,True,False
4m98si,Why is the West better than the East?,https://www.reddit.com/r/nba/comments/4m98si/why_is_the_west_better_than_the_east/,self.nba,https://www.reddit.com/r/nba/comments/4m98si/why_is_the_west_better_than_the_east/?ref=search_posts,nba,5,47,0,1464928444.0,[BOS] Larry Bird,johnjbernardo,True,False
4mba2b,What would the Playoffs looked like if it was seeded by record not conference? Would the Cav's be in the finals?,https://www.reddit.com/r/nba/comments/4mba2b/what_would_the_playoffs_looked_like_if_it_was/,self.nba,https://www.reddit.com/r/nba/comments/4mba2b/what_would_the_playoffs_looked_like_if_it_was/?ref=search_posts,nba,40,22,0,1464957977.0,,gonnaupvote1,True,False
4m9a3n,"Who's better, Draymond or Klay?",https://www.reddit.com/r/nba/comments/4m9a3n/whos_better_draymond_or_klay/,self.nba,https://www.reddit.com/r/nba/comments/4m9a3n/whos_better_draymond_or_klay/?ref=search_posts,nba,0,94,0,1464928871.0,[BOS] Isaiah Thomas,skftwins,True,False
4mb2c0,"[Rovell] ""Curry's 11 points is his 3rd lowest total for a game in which he played at least 25 minutes in the last two seasons.""",https://twitter.com/darrenrovell/status/738574732623122432,twitter.com,https://www.reddit.com/r/nba/comments/4mb2c0/rovell_currys_11_points_is_his_3rd_lowest_total/?ref=search_posts,nba,38,38,0,1464954315.0,Heat,tft7178,False,False
4mb3zh,Let's flip the script. Who thinks the Cavs WILL win? And what has to happen?,https://www.reddit.com/r/nba/comments/4mb3zh/lets_flip_the_script_who_thinks_the_cavs_will_win/,self.nba,https://www.reddit.com/r/nba/comments/4mb3zh/lets_flip_the_script_who_thinks_the_cavs_will_win/?ref=search_posts,nba,3,98,0,1464955098.0,Supersonics,edgar3981C,True,False
4mbcj3,What Western Conference team would Lebron James fit in perfectly?,https://www.reddit.com/r/nba/comments/4mbcj3/what_western_conference_team_would_lebron_james/,self.nba,https://www.reddit.com/r/nba/comments/4mbcj3/what_western_conference_team_would_lebron_james/?ref=search_posts,nba,19,79,0,1464959219.0,NBA,Virtuos_locust,True,False
4mab4w,"[Price] David Fizdale's contract with the Grizzlies will pay him $2 million in his first year, making him the lowest paid coach in the NBA. Total contract roughly $10.2 million.",https://twitter.com/DwainPrice/status/738528587427389442,twitter.com,https://www.reddit.com/r/nba/comments/4mab4w/price_david_fizdales_contract_with_the_grizzlies/?ref=search_posts,nba,26,15,0,1464942819.0,[NJN] Vince Carter,VinceBarter,False,False
4mb18x,Channing Frye was 26-45 from 3 in the playoffs before this game (57%). He played six minutes in Game 1-two of those in garbage time.,https://www.reddit.com/r/nba/comments/4mb18x/channing_frye_was_2645_from_3_in_the_playoffs/,self.nba,https://www.reddit.com/r/nba/comments/4mb18x/channing_frye_was_2645_from_3_in_the_playoffs/?ref=search_posts,nba,137,75,0,1464953810.0,Cavaliers,TheSportsGuy23,True,False
4mamwi,Barbosa out here getting fancy!,https://twitter.com/warriors/status/738548036016562176,twitter.com,https://www.reddit.com/r/nba/comments/4mamwi/barbosa_out_here_getting_fancy/?ref=search_posts,nba,50,4,0,1464947474.0,Knicks,Erichland,False,False
4ma5sk,"[Nichols] Just asked #Cavs Ty Lue how this Finals feels different last time: ""Before I was making suggestions, now I'm making decisions.""""",https://twitter.com/Rachel__Nichols/status/738520184533569536,twitter.com,https://www.reddit.com/r/nba/comments/4ma5sk/nichols_just_asked_cavs_ty_lue_how_this_finals/?ref=search_posts,nba,143,29,0,1464940751.0,[NJN] Vince Carter,VinceBarter,False,False
4mabgb,Robert Covington and Nik Stauskas reportedly among players possibly apart of Teague/Noel trade,http://www.philly.com/philly/blogs/sports/sixers/Could-Noel-and-possibly-Stauskas-Covington-be-Hawks-bound-.html,philly.com,https://www.reddit.com/r/nba/comments/4mabgb/robert_covington_and_nik_stauskas_reportedly/?ref=search_posts,nba,93,120,0,1464942941.0,[ATL] Lou Hudson,Martinsek,False,False
4m96go,Remember how Lebron was a monster in last years playoffs? He's somehow even BETTER now,https://www.reddit.com/r/nba/comments/4m96go/remember_how_lebron_was_a_monster_in_last_years/,self.nba,https://www.reddit.com/r/nba/comments/4m96go/remember_how_lebron_was_a_monster_in_last_years/?ref=search_posts,nba,25,28,0,1464927698.0,Hawks,ImABundleOfSticks,True,False
4mauy0,Lebron steals the ball from Curry and then makes a bullet pass to assist Kevin Love's and one,https://streamable.com/cqdy,streamable.com,https://www.reddit.com/r/nba/comments/4mauy0/lebron_steals_the_ball_from_curry_and_then_makes/?ref=search_posts,nba,139,9,0,1464950939.0,Celtics,Agastopia,False,False
4m9vu4,LeBron is The Best Postseason Basketball Player We Have Ever Seen - theringer.com,https://theringer.com/lebron-james-nba-playoffs-statistics-cff78e25fc66#.hed8i3rdv,theringer.com,https://www.reddit.com/r/nba/comments/4m9vu4/lebron_is_the_best_postseason_basketball_player/?ref=search_posts,nba,0,57,0,1464936842.0,Cavaliers,PatRockatansky,False,False
4m987c,What are some of the most controversial photos in NBA history?,https://www.reddit.com/r/nba/comments/4m987c/what_are_some_of_the_most_controversial_photos_in/,self.nba,https://www.reddit.com/r/nba/comments/4m987c/what_are_some_of_the_most_controversial_photos_in/?ref=search_posts,nba,97,157,0,1464928250.0,[SEA] Gary Payton,ImHungryAsFuck,True,False
4m96r5,Hoping Christmas comes early this year,http://imgur.com/a/acKpC,imgur.com,https://www.reddit.com/r/nba/comments/4m96r5/hoping_christmas_comes_early_this_year/?ref=search_posts,nba,59,12,0,1464927783.0,[CLE] LeBron James,whyrumgone21,False,False
4maylj,Livingston grabs the rebound and then executes a beautiful behind the back pass which leads to a Harrison Barnes slam,https://streamable.com/hu15,streamable.com,https://www.reddit.com/r/nba/comments/4maylj/livingston_grabs_the_rebound_and_then_executes_a/?ref=search_posts,nba,142,13,0,1464952612.0,Celtics,Agastopia,False,False
4m9c91,How many future hall of famers are going to be playing in these finals between the Warriors and Cavs?,https://www.reddit.com/r/nba/comments/4m9c91/how_many_future_hall_of_famers_are_going_to_be/,self.nba,https://www.reddit.com/r/nba/comments/4m9c91/how_many_future_hall_of_famers_are_going_to_be/?ref=search_posts,nba,12,42,0,1464929581.0,Warriors,iki100,True,False
4m9oat,Will the 2015 draft go down as the greatest of all time from top to bottom?,https://www.reddit.com/r/nba/comments/4m9oat/will_the_2015_draft_go_down_as_the_greatest_of/,self.nba,https://www.reddit.com/r/nba/comments/4m9oat/will_the_2015_draft_go_down_as_the_greatest_of/?ref=search_posts,nba,0,50,0,1464933892.0,,Fantasybballfish,True,False
4mb08p,Why isnt Shumpert playing?,https://www.reddit.com/r/nba/comments/4mb08p/why_isnt_shumpert_playing/,self.nba,https://www.reddit.com/r/nba/comments/4mb08p/why_isnt_shumpert_playing/?ref=search_posts,nba,7,36,0,1464953347.0,,JohnsWall,True,False
4ma19g,Are there any players you really liked that weren't very good and/or had ONE skill you enjoyed,https://www.reddit.com/r/nba/comments/4ma19g/are_there_any_players_you_really_liked_that/,self.nba,https://www.reddit.com/r/nba/comments/4ma19g/are_there_any_players_you_really_liked_that/?ref=search_posts,nba,19,71,0,1464938975.0,OKC Hornets,SavagePenguins,True,False
4m97jh,What team do you naturally root for and which team are you rooting for in the Finals,https://www.reddit.com/r/nba/comments/4m97jh/what_team_do_you_naturally_root_for_and_which/,self.nba,https://www.reddit.com/r/nba/comments/4m97jh/what_team_do_you_naturally_root_for_and_which/?ref=search_posts,nba,2,52,0,1464928031.0,Cavaliers,hernando13,True,False
4mb18p,"Out of the 9 Warriors players that played more than four minutes, 7 of them scored in the double digits",https://www.reddit.com/r/nba/comments/4mb18p/out_of_the_9_warriors_players_that_played_more/,self.nba,https://www.reddit.com/r/nba/comments/4mb18p/out_of_the_9_warriors_players_that_played_more/?ref=search_posts,nba,68,12,0,1464953807.0,[MIA] Alonzo Mourning,sqectre,True,False
4mackq,[Whiteside] KNOW your WORTH,https://twitter.com/youngwhiteside/status/738529906007670784,twitter.com,https://www.reddit.com/r/nba/comments/4mackq/whiteside_know_your_worth/?ref=search_posts,nba,37,59,0,1464943392.0,Raptors,BismackMyBiyombo,False,False
4m9pps,Memphis has reached agreement with JB Bickerstaff as associate head coach. Lakers were among teams pursuing him.,https://twitter.com/WojVerticalNBA/status/738493544734695424,twitter.com,https://www.reddit.com/r/nba/comments/4m9pps/memphis_has_reached_agreement_with_jb_bickerstaff/?ref=search_posts,nba,69,30,0,1464934472.0,Knicks,HaruSoul,False,False
4ma940,"[Berger] Adam Silver: ""We're never going to have NFL-style parity in this league.""",https://twitter.com/KBergCBS/status/738525030087155717,twitter.com,https://www.reddit.com/r/nba/comments/4ma940/berger_adam_silver_were_never_going_to_have/?ref=search_posts,nba,59,54,0,1464942038.0,[NJN] Vince Carter,VinceBarter,False,False
4m9t8h,The team with the longest streak of former players winning a championship is the Charlotte Hornets/Bobcats,https://www.reddit.com/r/nba/comments/4m9t8h/the_team_with_the_longest_streak_of_former/,self.nba,https://www.reddit.com/r/nba/comments/4m9t8h/the_team_with_the_longest_streak_of_former/?ref=search_posts,nba,47,14,0,1464935848.0,Hornets,I__Will,True,False
4mb0b4,Would you want the team that eliminated your team from the playoffs to win the championship?,https://www.reddit.com/r/nba/comments/4mb0b4/would_you_want_the_team_that_eliminated_your_team/,self.nba,https://www.reddit.com/r/nba/comments/4mb0b4/would_you_want_the_team_that_eliminated_your_team/?ref=search_posts,nba,24,57,0,1464953377.0,[MIN] Ricky Rubio,Dragonknight247,True,False
4mbfiy,[The Ringer] The Warriors Are the Perfect Bandwagon Team,https://theringer.com/nba-finals-golden-state-warriors-bandwagon-team-5fafef9a59a8#.9tuwl63nq,theringer.com,https://www.reddit.com/r/nba/comments/4mbfiy/the_ringer_the_warriors_are_the_perfect_bandwagon/?ref=search_posts,nba,7,50,0,1464960789.0,[GSW] Klay Thompson,lendawgg,False,False
4ma9i7,"Kobe Bryant reflects on closing out his career with a 60-point game, how he feels watching the Finals as a retired player, sharing knowledge with this generation of players and the differences between Steph Curry & LeBron James.",http://espn.go.com/video/clip?id=15911940&ex_cid=espnapi_internal,espn.go.com,https://www.reddit.com/r/nba/comments/4ma9i7/kobe_bryant_reflects_on_closing_out_his_career/?ref=search_posts,nba,107,9,0,1464942186.0,Lakers,KingsCrossings,False,False
4mb74x,LeBron doesn't shoot when given space and it is hurting his team,https://www.reddit.com/r/nba/comments/4mb74x/lebron_doesnt_shoot_when_given_space_and_it_is/,self.nba,https://www.reddit.com/r/nba/comments/4mb74x/lebron_doesnt_shoot_when_given_space_and_it_is/?ref=search_posts,nba,126,163,0,1464956554.0,Magic Johnson,xalpha23,True,False
4m9vn5,"If you could have one year of their prime, would you take Jordan or Shaq?",https://www.reddit.com/r/nba/comments/4m9vn5/if_you_could_have_one_year_of_their_prime_would/,self.nba,https://www.reddit.com/r/nba/comments/4m9vn5/if_you_could_have_one_year_of_their_prime_would/?ref=search_posts,nba,8,44,0,1464936773.0,,blackandgold26,True,False
4mb258,Shaun Livingston and Leonardo Barbosa outscored the Splash Brothers by 11 points.,https://www.reddit.com/r/nba/comments/4mb258/shaun_livingston_and_leonardo_barbosa_outscored/,self.nba,https://www.reddit.com/r/nba/comments/4mb258/shaun_livingston_and_leonardo_barbosa_outscored/?ref=search_posts,nba,236,66,0,1464954234.0,[SAS] Kawhi Leonard,FixPolo,True,False
4m93cq,R/NBA 2016 NBA FINALS PREDICTIONS RESULTS,https://www.reddit.com/r/nba/comments/4m93cq/rnba_2016_nba_finals_predictions_results/,self.nba,https://www.reddit.com/r/nba/comments/4m93cq/rnba_2016_nba_finals_predictions_results/?ref=search_posts,nba,124,46,0,1464926630.0,Lakers,inruinscrust,True,False
4mamrg,"(Snow)""Avery Bradley was the only player this season to cover more distance on defense (1.19 miles per game) than on offense (1.18 miles per game).""",https://twitter.com/taylorcsnow/status/737680559430901760,twitter.com,https://www.reddit.com/r/nba/comments/4mamrg/snowavery_bradley_was_the_only_player_this_season/?ref=search_posts,nba,259,40,0,1464947413.0,Celtics,iritian,False,False
4ma2ip,"What was the reasoning behind Dikembe Mutumbo being DPOY in 95, while only making the All-Defensive second team?",https://www.reddit.com/r/nba/comments/4ma2ip/what_was_the_reasoning_behind_dikembe_mutumbo/,self.nba,https://www.reddit.com/r/nba/comments/4ma2ip/what_was_the_reasoning_behind_dikembe_mutumbo/?ref=search_posts,nba,9,22,0,1464939459.0,[MIA] Hassan Whiteside,BigShotBosh,True,False
4m9qew,Gordon Hayward - 2015-2016 Season Highlights,https://www.youtube.com/watch?v=PYwt54RNIHg,youtube.com,https://www.reddit.com/r/nba/comments/4m9qew/gordon_hayward_20152016_season_highlights/?ref=search_posts,nba,38,6,0,1464934736.0,Jazz,MidLevelExceptional,False,False
4m9vew,"Almost 100 years old, former Lakers Coach John Kundla still marvels at the game",http://mobile.nytimes.com/2016/06/03/sports/basketball/john-kundla-almost-100-lakers-original-coach-still-marvels-at-the-game.html?smid=fb-nytimes&smtyp=cur&referer=http://m.facebook.com,mobile.nytimes.com,https://www.reddit.com/r/nba/comments/4m9vew/almost_100_years_old_former_lakers_coach_john/?ref=search_posts,nba,53,10,0,1464936693.0,Vancouver Grizzlies,gemmenegger,False,False
4macle,"[Cacciola] The Warriors are starting Harrison Barnes, according to team. Iguodala will come off bench.",https://twitter.com/ScottCacciola/status/738531229209747456,twitter.com,https://www.reddit.com/r/nba/comments/4macle/cacciola_the_warriors_are_starting_harrison/?ref=search_posts,nba,64,23,0,1464943397.0,[NJN] Vince Carter,VinceBarter,False,False
4map6g,"This may be a dumb question, but why doesn't LeBron just drive all the time?",https://www.reddit.com/r/nba/comments/4map6g/this_may_be_a_dumb_question_but_why_doesnt_lebron/,self.nba,https://www.reddit.com/r/nba/comments/4map6g/this_may_be_a_dumb_question_but_why_doesnt_lebron/?ref=search_posts,nba,116,104,0,1464948421.0,,9Virtues,True,False
4mb4lr,"[Windhorst] Adam Silver to seek end of Hack-a-Shaq, cites surge",http://espn.go.com/nba/playoffs/2016/story/_/id/15913971/2016-nba-playoffs-adam-silver-seek-end-hack-shaq-cites-surge,espn.go.com,https://www.reddit.com/r/nba/comments/4mb4lr/windhorst_adam_silver_to_seek_end_of_hackashaq/?ref=search_posts,nba,3,93,0,1464955397.0,Mavericks,Squirrel_Dude,False,False
4mankh,Barbosa knocks down referee Ken Mauer,https://twitter.com/CauldronICYMI/status/738549248225054721,twitter.com,https://www.reddit.com/r/nba/comments/4mankh/barbosa_knocks_down_referee_ken_mauer/?ref=search_posts,nba,106,18,0,1464947746.0,Knicks,Erichland,False,False
