id,title,url,domain,permalink,subreddit,score,num_comments,gilded,created,author_flair_text,author,is_self,over_18
4u48cx,"[Marc Stein] Dirk Nowitzki and the Mavs have finalized his new contract, with Dallas upping the deal to $50 million over two years, league sources say.",https://twitter.com/ESPNSteinLine/status/756556906244648960,twitter.com,https://www.reddit.com/r/nba/comments/4u48cx/marc_stein_dirk_nowitzki_and_the_mavs_have/?ref=search_posts,nba,2883,623,0,1469241047.0,West,urfaselol,False,False
4u39ec,"Hornets co-owner Felix Sabates denegrates transgender people after ASG move from Charlotte: “What is wrong with a person using a bathroom provided for the sex the were born with? Don’t force 8 year old children to share bathrooms with people that don’t share the organs they were born with.""",http://www.charlotteobserver.com/news/politics-government/article91222937.html,charlotteobserver.com,https://www.reddit.com/r/nba/comments/4u39ec/hornets_coowner_felix_sabates_denegrates/?ref=search_posts,nba,1170,1292,0,1469229544.0,[NOP] Anthony Davis,letmehollahollaholla,False,False
4u3cux,Free Talk Friday - Almost Rio Edition,https://www.reddit.com/r/nba/comments/4u3cux/free_talk_friday_almost_rio_edition/,self.nba,https://www.reddit.com/r/nba/comments/4u3cux/free_talk_friday_almost_rio_edition/?ref=search_posts,nba,81,462,0,1469230723.0,The Truth,FeversMirrors,True,False
4u3zgd,"From 1999 - 2014, the Spurs/Lakers won 13 out of 16 Western Conference Finals",https://www.reddit.com/r/nba/comments/4u3zgd/from_1999_2014_the_spurslakers_won_13_out_of_16/,self.nba,https://www.reddit.com/r/nba/comments/4u3zgd/from_1999_2014_the_spurslakers_won_13_out_of_16/?ref=search_posts,nba,245,97,0,1469238121.0,[DET] Andre Drummond,GraemeTaylor,True,False
4u2o8s,Cavaliers Sign Center Chris Andersen,http://www.nba.com/cavaliers/releases/andersen-signing-2016,nba.com,https://www.reddit.com/r/nba/comments/4u2o8s/cavaliers_sign_center_chris_andersen/?ref=search_posts,nba,318,150,0,1469221820.0,Pistons,zepg,False,False
4u2nfd,Carmelo Anthony blasts WNBA for fining players,http://espn.go.com/blog/nba/post/_/id/22780/fridays-knicks-links-carmelo-anthony-blasts-wnba-for-fining-players,espn.go.com,https://www.reddit.com/r/nba/comments/4u2nfd/carmelo_anthony_blasts_wnba_for_fining_players/?ref=search_posts,nba,1907,749,0,1469221494.0,,GilsWorld,False,False
4u3pkr,Evolution of Charles Barkley's pronounciation of 'Jonas Valanciunas',https://youtu.be/UXnj6cc4Mf0,youtu.be,https://www.reddit.com/r/nba/comments/4u3pkr/evolution_of_charles_barkleys_pronounciation_of/?ref=search_posts,nba,1601,106,0,1469234860.0,[TOR] Jamario Moon,BasedMasai,False,False
4u4j0k,"KD jersey for sale, $.48 in Oklahoma",http://www.espn.com/nba/story/_/id/17126265/oklahoma-city-store-sells-kevin-durant-thunder-jerseys-48-cents,espn.com,https://www.reddit.com/r/nba/comments/4u4j0k/kd_jersey_for_sale_48_in_oklahoma/?ref=search_posts,nba,870,161,0,1469244577.0,Rockets,rodo1116,False,False
4u3llq,"Manu Ginobili: “The fact that Philadelphia had a great coach and a person I appreciate so much as Brett Brown, made it more appealing in the case the Spurs didn’t happen, But the Spurs happened and they always had the priority. I never wanted to leave San Antonio”",http://sports.yahoo.com/news/manu-ginobili-i-never-wanted-to-leave-san-antonio-031556887.html,sports.yahoo.com,https://www.reddit.com/r/nba/comments/4u3llq/manu_ginobili_the_fact_that_philadelphia_had_a/?ref=search_posts,nba,785,109,0,1469233591.0,West,urfaselol,False,False
4u3jyw,[Sports Illustrated] Draymond Green reaches plea deal in assault case,http://www.si.com/nba/2016/07/22/draymond-green-golden-state-warriors-assault-case-plea-deal-agreement,si.com,https://www.reddit.com/r/nba/comments/4u3jyw/sports_illustrated_draymond_green_reaches_plea/?ref=search_posts,nba,366,295,0,1469233022.0,[GSW] Stephen Curry,RagingThoner,False,False
4u4d5g,"[MacMahon] Year 2 of Dirk's 2-year, $50M deal is only $5M guaranteed. Technically team option. Reality a Cuban/Dirk discussion",https://twitter.com/espn_macmahon/status/756563617508577280,twitter.com,https://www.reddit.com/r/nba/comments/4u4d5g/macmahon_year_2_of_dirks_2year_50m_deal_is_only/?ref=search_posts,nba,316,65,0,1469242649.0,Mavericks,gigantism,False,False
4u2rpb,The 76ers are being honest about their need to trade a big man,http://www.sbnation.com/2016/7/21/12248514/philadelphia-76ers-trade-rumors-jahlil-okafor-nerlens-noel-bryan-colangelo,sbnation.com,https://www.reddit.com/r/nba/comments/4u2rpb/the_76ers_are_being_honest_about_their_need_to/?ref=search_posts,nba,232,391,0,1469223216.0,Lakers,MartintheDragon,False,False
4u2drh,[OC] Rio 2016 Men's Basketball Retro Posters,http://imgur.com/a/bok7f,imgur.com,https://www.reddit.com/r/nba/comments/4u2drh/oc_rio_2016_mens_basketball_retro_posters/?ref=search_posts,nba,291,58,0,1469217104.0,[CHI] Luc Longley,tunami,False,False
4u3qda,WNBA players continue protesting despite fines,http://www.sbnation.com/2016/7/21/12247414/wnba-fines-t-shirts-tina-charles-liberty-mercury-fever,sbnation.com,https://www.reddit.com/r/nba/comments/4u3qda/wnba_players_continue_protesting_despite_fines/?ref=search_posts,nba,356,123,0,1469235129.0,Suns,Nicheslovespecies,False,False
4u2oat,Brent Barry has the most unexpectedly awesome career highlight reel ever,https://www.youtube.com/watch?v=LXg-k_1NGMY,youtube.com,https://www.reddit.com/r/nba/comments/4u2oat/brent_barry_has_the_most_unexpectedly_awesome/?ref=search_posts,nba,1237,370,0,1469221842.0,NBA,phoniksbeats,False,False
4u34gx,"Last year, I took a tour of the Celtics offices. Thought I would share some of the pics.",https://imgur.com/a/OnAw6,imgur.com,https://www.reddit.com/r/nba/comments/4u34gx/last_year_i_took_a_tour_of_the_celtics_offices/?ref=search_posts,nba,520,96,0,1469227864.0,Celtics,Joed112784,False,False
4u1uxm,Are referees allowed to use Performance Enchancing Drugs?,https://www.reddit.com/r/nba/comments/4u1uxm/are_referees_allowed_to_use_performance/,self.nba,https://www.reddit.com/r/nba/comments/4u1uxm/are_referees_allowed_to_use_performance/?ref=search_posts,nba,651,197,0,1469206283.0,[OKC] Russell Westbrook,SunkenLoki,True,False
4u4lxs,"The 2017 Milwaukee Bucks' wingspan is quite impressive, and they can still add one player.",http://imgur.com/a/3aTfb,imgur.com,https://www.reddit.com/r/nba/comments/4u4lxs/the_2017_milwaukee_bucks_wingspan_is_quite/?ref=search_posts,nba,1223,195,0,1469245582.0,Timberwolves,elbevee,False,False
4u38im,"[Charania] Yogi Ferrell of Indiana has reached agreement on a free-agent deal with the Brooklyn Nets, league source tells The Vertical.",https://twitter.com/ShamsCharania/status/756507460232441856,twitter.com,https://www.reddit.com/r/nba/comments/4u38im/charania_yogi_ferrell_of_indiana_has_reached/?ref=search_posts,nba,253,69,0,1469229262.0,Raptors,dealin92,False,False
4u420d,Your 2016 Playoffs 42 Club members: LeBron James and Russell Westbrook,https://www.reddit.com/r/nba/comments/4u420d/your_2016_playoffs_42_club_members_lebron_james/,self.nba,https://www.reddit.com/r/nba/comments/4u420d/your_2016_playoffs_42_club_members_lebron_james/?ref=search_posts,nba,208,155,0,1469238972.0,,BearsNecessity,True,False
4u2gc4,You get to make a squad consisting of players only from 2015-16 non-playoff teams. Who's your coach and starting 5?,https://www.reddit.com/r/nba/comments/4u2gc4/you_get_to_make_a_squad_consisting_of_players/,self.nba,https://www.reddit.com/r/nba/comments/4u2gc4/you_get_to_make_a_squad_consisting_of_players/?ref=search_posts,nba,16,40,0,1469218369.0,Warriors,TooCouchLocked,True,False
4u41mf,How did Magic Johnson Get Half an MVP Vote in 1983?,https://www.reddit.com/r/nba/comments/4u41mf/how_did_magic_johnson_get_half_an_mvp_vote_in_1983/,self.nba,https://www.reddit.com/r/nba/comments/4u41mf/how_did_magic_johnson_get_half_an_mvp_vote_in_1983/?ref=search_posts,nba,48,18,0,1469238848.0,Grizzlies,nuke-the-moon,True,False
4u3bys,"Believe in Barkley: He's a 6,000:1 Golf Underdog",http://espn.go.com/chalk/story/_/id/17120310/charles-barkley-6000-1-win-week-american-century-championship-celebrity-golf-tournament,espn.go.com,https://www.reddit.com/r/nba/comments/4u3bys/believe_in_barkley_hes_a_60001_golf_underdog/?ref=search_posts,nba,100,24,0,1469230421.0,[LAL] Dick Schnittker,310BrownGuy,False,False
4u3vjx,Who has had the worst career of any MVP in NBA history?,https://www.reddit.com/r/nba/comments/4u3vjx/who_has_had_the_worst_career_of_any_mvp_in_nba/,self.nba,https://www.reddit.com/r/nba/comments/4u3vjx/who_has_had_the_worst_career_of_any_mvp_in_nba/?ref=search_posts,nba,1,66,0,1469236830.0,Jazz,rabidmilkman,True,False
4u3btg,Gerald Green crazy windmill finish off the alley-oop. From 2012.,https://www.youtube.com/watch?v=nOzo4pHTZ-M,youtube.com,https://www.reddit.com/r/nba/comments/4u3btg/gerald_green_crazy_windmill_finish_off_the/?ref=search_posts,nba,57,22,0,1469230376.0,Lakers,cvjoey,False,False
4u3h98,Lebron James durability,https://www.reddit.com/r/nba/comments/4u3h98/lebron_james_durability/,self.nba,https://www.reddit.com/r/nba/comments/4u3h98/lebron_james_durability/?ref=search_posts,nba,30,40,0,1469232129.0,[MIA] Justise Winslow,Tito_Our_Saviour,True,False
4u3p32,What is your ultimate under 21 team?,https://www.reddit.com/r/nba/comments/4u3p32/what_is_your_ultimate_under_21_team/,self.nba,https://www.reddit.com/r/nba/comments/4u3p32/what_is_your_ultimate_under_21_team/?ref=search_posts,nba,28,43,0,1469234707.0,,Buttfin,True,False
4u41i7,Guerschon Yabusele Full Summer League 2016 Highlights,https://youtu.be/nWqIQgmdLWE,youtu.be,https://www.reddit.com/r/nba/comments/4u41i7/guerschon_yabusele_full_summer_league_2016/?ref=search_posts,nba,26,7,0,1469238805.0,Celtics,Timi093,False,False
4u3y7i,Is it possible we're overrating LeBron's Game 7 block on Iggy?,https://www.reddit.com/r/nba/comments/4u3y7i/is_it_possible_were_overrating_lebrons_game_7/,self.nba,https://www.reddit.com/r/nba/comments/4u3y7i/is_it_possible_were_overrating_lebrons_game_7/?ref=search_posts,nba,0,146,0,1469237719.0,Rockets,angrycrayon9,True,False
4u49qo,[USA Basketball] USA Basketball National Team Exhibition Games To Be Live Streamed On Facebook For First Time. First Game USA vs. Argentina is today 7/22 8 PM CST,https://twitter.com/usabasketball/status/756550033357598720,twitter.com,https://www.reddit.com/r/nba/comments/4u49qo/usa_basketball_usa_basketball_national_team/?ref=search_posts,nba,64,17,0,1469241527.0,West,urfaselol,False,False
4u4nyh,James Harden & Brandon Jennings highlights from Drew League,https://www.youtube.com/watch?v=pfEVMzp39zE,youtube.com,https://www.reddit.com/r/nba/comments/4u4nyh/james_harden_brandon_jennings_highlights_from/?ref=search_posts,nba,30,7,0,1469246277.0,Wizards,IWantSuperpowers,False,False
4u3jfi,Reminder: USBA Scrimmage vs Argentina is today at 9:00 EST,https://www.reddit.com/r/nba/comments/4u3jfi/reminder_usba_scrimmage_vs_argentina_is_today_at/,self.nba,https://www.reddit.com/r/nba/comments/4u3jfi/reminder_usba_scrimmage_vs_argentina_is_today_at/?ref=search_posts,nba,47,27,0,1469232840.0,Lakers,Dmanning2,True,False
4u2git,"For the 15th consecutive year, son of a former NBA player has been drafted.",https://www.reddit.com/r/nba/comments/4u2git/for_the_15th_consecutive_year_son_of_a_former_nba/,self.nba,https://www.reddit.com/r/nba/comments/4u2git/for_the_15th_consecutive_year_son_of_a_former_nba/?ref=search_posts,nba,84,48,0,1469218461.0,Supersonics,WhenMachinesCry,True,False
4u3el1,That time when a retired Michael Jordan destroys Corey Benjamin in a 1v1 after Benjamin was trash talking.,https://youtu.be/XxE6N6Etbo8,youtu.be,https://www.reddit.com/r/nba/comments/4u3el1/that_time_when_a_retired_michael_jordan_destroys/?ref=search_posts,nba,244,62,0,1469231282.0,[MIL] Ray Allen,ReverendGames,False,False
4u49ya,"How does this sub feel about ""The Jump""",https://www.reddit.com/r/nba/comments/4u49ya/how_does_this_sub_feel_about_the_jump/,self.nba,https://www.reddit.com/r/nba/comments/4u49ya/how_does_this_sub_feel_about_the_jump/?ref=search_posts,nba,29,33,0,1469241598.0,Hornets,wpphowler,True,False
4u3msq,"I created a 2017 free agency primer, and it includes updated cap situations for every team, a list of every free agent, every player with a player/team option as well as a list of the players with non-guaranteed contracts! Took a lot of work but hope you guys enjoy!",http://www.hoopsinquirer.com/2017-free-agency-primer/,hoopsinquirer.com,https://www.reddit.com/r/nba/comments/4u3msq/i_created_a_2017_free_agency_primer_and_it/?ref=search_posts,nba,74,28,0,1469233971.0,Bulls,Chargers23,False,False
4u3tcc,What's good/not good about watching a game in your city? Both live and the local telecast.,https://www.reddit.com/r/nba/comments/4u3tcc/whats_goodnot_good_about_watching_a_game_in_your/,self.nba,https://www.reddit.com/r/nba/comments/4u3tcc/whats_goodnot_good_about_watching_a_game_in_your/?ref=search_posts,nba,19,35,0,1469236065.0,Bulls,ryanmint,True,False
4u4449,Do you expect anybody to beat the warriors in a series this season?,https://www.reddit.com/r/nba/comments/4u4449/do_you_expect_anybody_to_beat_the_warriors_in_a/,self.nba,https://www.reddit.com/r/nba/comments/4u4449/do_you_expect_anybody_to_beat_the_warriors_in_a/?ref=search_posts,nba,2,94,0,1469239654.0,,sportsfan161,True,False
4u2imx,Can you build a team around LeBron James that would not make the postseason?,https://www.reddit.com/r/nba/comments/4u2imx/can_you_build_a_team_around_lebron_james_that/,self.nba,https://www.reddit.com/r/nba/comments/4u2imx/can_you_build_a_team_around_lebron_james_that/?ref=search_posts,nba,0,66,0,1469219455.0,Pelicans,ConsumedAM,True,False
4u3vat,2016-17 Top 50 players by Projected Win Shares,https://www.reddit.com/r/nba/comments/4u3vat/201617_top_50_players_by_projected_win_shares/,self.nba,https://www.reddit.com/r/nba/comments/4u3vat/201617_top_50_players_by_projected_win_shares/?ref=search_posts,nba,22,48,0,1469236736.0,Jazz,RGiss,True,False
4u3dtc,"You can make a starting 5 with any current players, but the chemistry of the team has to be perfect. Who do you choose?",https://www.reddit.com/r/nba/comments/4u3dtc/you_can_make_a_starting_5_with_any_current/,self.nba,https://www.reddit.com/r/nba/comments/4u3dtc/you_can_make_a_starting_5_with_any_current/?ref=search_posts,nba,4,52,0,1469231031.0,,pm_me_noobs,True,False
4u2qsa,Chris Bosh Full Highlights 2008.11.21 vs Nets - 42 Pts,https://www.youtube.com/watch?v=7XyUD5Fa0M4,youtube.com,https://www.reddit.com/r/nba/comments/4u2qsa/chris_bosh_full_highlights_20081121_vs_nets_42_pts/?ref=search_posts,nba,105,31,0,1469222852.0,Thunder,nomad700,False,False
4u3a3z,NC Congressman Robert Pittenger on All Star Game being moved,https://twitter.com/robertpittenger/status/756311261630042113,twitter.com,https://www.reddit.com/r/nba/comments/4u3a3z/nc_congressman_robert_pittenger_on_all_star_game/?ref=search_posts,nba,65,77,0,1469229796.0,Magic,SergeantButthole,False,False
4u3mmc,Which East playoff teams could the Celtics beat in a playoff series?,https://www.reddit.com/r/nba/comments/4u3mmc/which_east_playoff_teams_could_the_celtics_beat/,self.nba,https://www.reddit.com/r/nba/comments/4u3mmc/which_east_playoff_teams_could_the_celtics_beat/?ref=search_posts,nba,0,70,0,1469233910.0,,jakaloaf,True,False
4u3976,Top 10 Ugliest Shot Forms in NBA History,https://www.youtube.com/watch?v=v3IUNJ9vDlo,youtube.com,https://www.reddit.com/r/nba/comments/4u3976/top_10_ugliest_shot_forms_in_nba_history/?ref=search_posts,nba,49,49,0,1469229486.0,,KalEl1232,False,False
4u3xpb,J-Will and Bibby together on TV.,http://twitter.com/thetournament/status/756490742684643328,twitter.com,https://www.reddit.com/r/nba/comments/4u3xpb/jwill_and_bibby_together_on_tv/?ref=search_posts,nba,34,23,0,1469237552.0,Kings,airon0828,False,False
4u26hk,"If you could put your team's current roster in any year (past, present, or future), which year would you choose?",https://www.reddit.com/r/nba/comments/4u26hk/if_you_could_put_your_teams_current_roster_in_any/,self.nba,https://www.reddit.com/r/nba/comments/4u26hk/if_you_could_put_your_teams_current_roster_in_any/?ref=search_posts,nba,2,13,0,1469213162.0,Magic,Friendly_Erection,True,False
4u361l,Carmelo Anthony & Coach K Mic'd Up - Training Camp,https://www.youtube.com/watch?v=YWDpyfHc2Dc,youtube.com,https://www.reddit.com/r/nba/comments/4u361l/carmelo_anthony_coach_k_micd_up_training_camp/?ref=search_posts,nba,20,3,0,1469228420.0,,KalEl1232,False,False
4u392x,Why isn't Kyrie Irving playing with the Boomers in the Olympics?,https://www.reddit.com/r/nba/comments/4u392x/why_isnt_kyrie_irving_playing_with_the_boomers_in/,self.nba,https://www.reddit.com/r/nba/comments/4u392x/why_isnt_kyrie_irving_playing_with_the_boomers_in/?ref=search_posts,nba,0,20,0,1469229449.0,Warriors,highlyironic,True,False
4u35fw,Jeff Goodman Verified account @GoodmanESPN The word I got from several people who have been around Olympic team workouts is that Jimmy Butler has been as impressive as anyone.,https://twitter.com/GoodmanESPN/status/756234824986361858,twitter.com,https://www.reddit.com/r/nba/comments/4u35fw/jeff_goodman_verified_account_goodmanespn_the/?ref=search_posts,nba,9,22,0,1469228199.0,,rowseyna,False,False
4u3w8o,"Since they are teammates in the NBA, will Coach K be playing Lowry and DeRozan at the same time? Or is one higher on the pecking order for his position than the other?",https://www.reddit.com/r/nba/comments/4u3w8o/since_they_are_teammates_in_the_nba_will_coach_k/,self.nba,https://www.reddit.com/r/nba/comments/4u3w8o/since_they_are_teammates_in_the_nba_will_coach_k/?ref=search_posts,nba,0,24,0,1469237065.0,Raptors,TrillTaskforce,True,False
4u3x5r,Top reasons for bad free throw shooting,https://www.reddit.com/r/nba/comments/4u3x5r/top_reasons_for_bad_free_throw_shooting/,self.nba,https://www.reddit.com/r/nba/comments/4u3x5r/top_reasons_for_bad_free_throw_shooting/?ref=search_posts,nba,0,13,0,1469237369.0,,CarlRemy,True,False
4u3htu,Coolest/best websites for NBA?,https://www.reddit.com/r/nba/comments/4u3htu/coolestbest_websites_for_nba/,self.nba,https://www.reddit.com/r/nba/comments/4u3htu/coolestbest_websites_for_nba/?ref=search_posts,nba,0,8,0,1469232307.0,,jvrm1993,True,False
4u2a1v,"[K.C. Johnson, Chicago Tribune] Bulls open to hosting 2017, future All-Star Games after NBA nixes Charlotte",http://www.chicagotribune.com/sports/basketball/bulls/ct-united-center-nba-all-star-game-spt-0722-20160721-story.html,chicagotribune.com,https://www.reddit.com/r/nba/comments/4u2a1v/kc_johnson_chicago_tribune_bulls_open_to_hosting/?ref=search_posts,nba,15,7,0,1469215170.0,Bulls,wjbc,False,False
4u3hut,"Per a crappy Ringer NBA Podcast I was listening to a few weeks ago, Steph to the Hornets?",https://www.reddit.com/r/nba/comments/4u3hut/per_a_crappy_ringer_nba_podcast_i_was_listening/,self.nba,https://www.reddit.com/r/nba/comments/4u3hut/per_a_crappy_ringer_nba_podcast_i_was_listening/?ref=search_posts,nba,0,28,0,1469232314.0,Celtics,JerebkosBiggestFan,True,False
4u3v0z,All Triple Overtimes Should be Decided by 1 v 1,https://www.reddit.com/r/nba/comments/4u3v0z/all_triple_overtimes_should_be_decided_by_1_v_1/,self.nba,https://www.reddit.com/r/nba/comments/4u3v0z/all_triple_overtimes_should_be_decided_by_1_v_1/?ref=search_posts,nba,0,34,0,1469236641.0,Knicks,drum35,True,False
4u1zpm,Tim Duncan's Top 21 Dunks,https://youtu.be/j5_E1IQWq10,youtu.be,https://www.reddit.com/r/nba/comments/4u1zpm/tim_duncans_top_21_dunks/?ref=search_posts,nba,14,6,0,1469209079.0,[SAS] Tim Duncan,karlchilders1,False,False
4u4hxy,Full Team USA Select Final Practice at UNLV (1:03:23),https://www.youtube.com/watch?v=GJZqVqo9xAs,youtube.com,https://www.reddit.com/r/nba/comments/4u4hxy/full_team_usa_select_final_practice_at_unlv_10323/?ref=search_posts,nba,10,2,0,1469244236.0,Lakers,ChappellShow96,False,False
4u4o5u,Which of these starting fives would you take?,https://www.reddit.com/r/nba/comments/4u4o5u/which_of_these_starting_fives_would_you_take/,self.nba,https://www.reddit.com/r/nba/comments/4u4o5u/which_of_these_starting_fives_would_you_take/?ref=search_posts,nba,4,26,0,1469246345.0,,GusHasATruck,True,False
4u4ap2,Rockets are looking for a new Clutch the Bear,http://rockets.clutchfans.net/9944/houston-rockets-seeking-new-clutch-the-bear/,rockets.clutchfans.net,https://www.reddit.com/r/nba/comments/4u4ap2/rockets_are_looking_for_a_new_clutch_the_bear/?ref=search_posts,nba,19,8,0,1469241849.0,Rockets,r_phill,False,False
4u36sl,Playoffs clinching per team,https://drive.google.com/file/d/0B80mBRciBOhBczNCQndRYml6WjA/view?usp=sharing,drive.google.com,https://www.reddit.com/r/nba/comments/4u36sl/playoffs_clinching_per_team/?ref=search_posts,nba,8,11,0,1469228683.0,Raptors,bbnexus,False,False
4u38x8,What are the best old school games and where can I watch them,https://www.reddit.com/r/nba/comments/4u38x8/what_are_the_best_old_school_games_and_where_can/,self.nba,https://www.reddit.com/r/nba/comments/4u38x8/what_are_the_best_old_school_games_and_where_can/?ref=search_posts,nba,13,11,0,1469229397.0,Thunder Bandwagon,DangerFrancis,True,False
4u4h49,Taller men and FT's: My (most likely incorrect) hypothesis.,https://www.reddit.com/r/nba/comments/4u4h49/taller_men_and_fts_my_most_likely_incorrect/,self.nba,https://www.reddit.com/r/nba/comments/4u4h49/taller_men_and_fts_my_most_likely_incorrect/?ref=search_posts,nba,1,18,0,1469243944.0,Rockets,MrChexmix,True,False
4u4jmv,Jimmy Butler only cares about the glory ahead of him,http://www.sbnation.com/2016/7/22/12253438/jimmy-butler-team-usa-basketball-chicago-bulls-rise,sbnation.com,https://www.reddit.com/r/nba/comments/4u4jmv/jimmy_butler_only_cares_about_the_glory_ahead_of/?ref=search_posts,nba,9,4,0,1469244797.0,,rowseyna,False,False
4u4ar1,Howard Beck Interview,https://www.reddit.com/r/nba/comments/4u4ar1/howard_beck_interview/,self.nba,https://www.reddit.com/r/nba/comments/4u4ar1/howard_beck_interview/?ref=search_posts,nba,1,8,0,1469241866.0,,LeonDaPoweFessional,True,False
4u3eji,"(Request) Deals, trades NBA teams can still make with their cap space",https://www.reddit.com/r/nba/comments/4u3eji/request_deals_trades_nba_teams_can_still_make/,self.nba,https://www.reddit.com/r/nba/comments/4u3eji/request_deals_trades_nba_teams_can_still_make/?ref=search_posts,nba,0,2,0,1469231272.0,,spoofrice11,True,False
4u4lry,Check out Kevin Durant Warriors Mix,https://www.youtube.com/watch?v=bXykxyAvKbI,youtube.com,https://www.reddit.com/r/nba/comments/4u4lry/check_out_kevin_durant_warriors_mix/?ref=search_posts,nba,0,6,0,1469245527.0,,DTNPLAYS,False,False
4u354f,Thibs and LaVine talking trade rumors awkwardly close to Jimmy Buckets,https://i.reddituploads.com/6bf3193a310e42b4a3f1987d7ec5be2f?fit=max&h=1536&w=1536&s=129a0e6b5404be77889bdda315cbcdc8,i.reddituploads.com,https://www.reddit.com/r/nba/comments/4u354f/thibs_and_lavine_talking_trade_rumors_awkwardly/?ref=search_posts,nba,0,4,0,1469228090.0,Timberwolves,dbru22,False,False
4u3ce3,"Isaiah Stokes, Jarnell Stokes's Younger Brother, Breaks Backboard at an AAU Game",http://espn.go.com/mens-college-basketball/story/_/id/17121529/recruit-isaiah-stokes-breaks-backboard-dunk-aau-game,espn.go.com,https://www.reddit.com/r/nba/comments/4u3ce3/isaiah_stokes_jarnell_stokess_younger_brother/?ref=search_posts,nba,0,2,0,1469230558.0,[LAL] Dick Schnittker,310BrownGuy,False,False
