id,title,url,domain,permalink,subreddit,score,num_comments,gilded,created,author_flair_text,author,is_self,over_18
5215cp,"Shaq: ""I'd like to thank Kobe Bryant, a guy that pushed me to three titles -- and then pushed me off the team and got me traded to Miami""",http://www.si.com/nba/2016/09/09/shaquille-oneal-kobe-bryant-hall-fame-speech-video,si.com,https://www.reddit.com/r/nba/comments/5215cp/shaq_id_like_to_thank_kobe_bryant_a_guy_that/?ref=search_posts,nba,5396,615,0,1473503956.0,Pistons,m3s1,False,False
51zovw,Peyton Manning teaching Yao how to throw a football.,https://www.instagram.com/p/BKE5P3TDzl9/?taken-by=houseofhighlights,instagram.com,https://www.reddit.com/r/nba/comments/51zovw/peyton_manning_teaching_yao_how_to_throw_a/?ref=search_posts,nba,370,56,0,1473484072.0,Lakers,2Garbanzos1Bean,False,False
51zwn2,Lance Stephenson has agreed to sign with the New Orleans Pelicans,https://twitter.com/ShamsCharania/status/774364148448788482,twitter.com,https://www.reddit.com/r/nba/comments/51zwn2/lance_stephenson_has_agreed_to_sign_with_the_new/?ref=search_posts,nba,945,199,0,1473486666.0,,RCHIII,False,False
521b4c,Iverson Hall of Fame Speech. All Time Great.,https://www.youtube.com/watch?time_continue=205&v=QHb5ygIiF-I,youtube.com,https://www.reddit.com/r/nba/comments/521b4c/iverson_hall_of_fame_speech_all_time_great/?ref=search_posts,nba,325,71,0,1473506554.0,76ers,gman2345,False,False
5210kb,Allen Iverson used to keep trash bags filled with money in his home and once couldn't find where he parked his car at an airport so he abandoned it and just bought a new one.,https://www.reddit.com/r/nba/comments/5210kb/allen_iverson_used_to_keep_trash_bags_filled_with/,self.nba,https://www.reddit.com/r/nba/comments/5210kb/allen_iverson_used_to_keep_trash_bags_filled_with/?ref=search_posts,nba,491,82,0,1473501952.0,Raptors,TrillTaskforce,True,False
5219rl,"Shaq on when he discovered Yao spoke English. ""He hit me with an Hakeem Olajuwon move. I said, ""Nice move."" He said, 'Thanks my brother.""",https://twitter.com/Jonathan_Feigen/status/774431674465652736,twitter.com,https://www.reddit.com/r/nba/comments/5219rl/shaq_on_when_he_discovered_yao_spoke_english_he/?ref=search_posts,nba,1802,98,0,1473505929.0,Celtics,jcarmona24,False,False
52022g,"How Paul Pierce got his nickname: After dropping 42 on Shaq and the Lakers in 2001, Shaq stated postgame: ""Take this down, Paul Pierce is the motherf***ing Truth""",https://www.youtube.com/watch?v=DukFu8Xm2CU,youtube.com,https://www.reddit.com/r/nba/comments/52022g/how_paul_pierce_got_his_nickname_after_dropping/?ref=search_posts,nba,1163,163,0,1473488584.0,Raptors,aday12,False,False
520qpg,"Yao Ming teases Allen Iverson about ""practice"" during HOF speech",https://streamable.com/hxy0,streamable.com,https://www.reddit.com/r/nba/comments/520qpg/yao_ming_teases_allen_iverson_about_practice/?ref=search_posts,nba,1384,211,0,1473497907.0,,teriyakisushi,False,False
5202qk,"This is what each team's roster would look like if every team had to keep their last 15 first-round picks. (No trades, shitty excel, and all-stars highlighted)",http://imgur.com/a/mdd9y,imgur.com,https://www.reddit.com/r/nba/comments/5202qk/this_is_what_each_teams_roster_would_look_like_if/?ref=search_posts,nba,239,135,0,1473488803.0,Trail Blazers,sleeptrouble,False,False
51zx9b,Good to see A.I. FINALLY updating his suit game at today's HOF photo shoot.,https://i.reddituploads.com/5f1c43b438c54c00965bd9abd94d51f0?fit=max&h=1536&w=1536&s=bd2b935613d8cf925cc15a82f7ee3a12,i.reddituploads.com,https://www.reddit.com/r/nba/comments/51zx9b/good_to_see_ai_finally_updating_his_suit_game_at/?ref=search_posts,nba,953,70,0,1473486880.0,Bullets,HalfManHalfBlazing,False,False
521psn,Allen Iverson’s Basketball Hall of Fame Enshrinement Speech,https://www.youtube.com/watch?v=x67RQKknl-g,youtube.com,https://www.reddit.com/r/nba/comments/521psn/allen_iversons_basketball_hall_of_fame/?ref=search_posts,nba,43,4,0,1473513646.0,Magic,klassik891,False,False
52155x,Shaq's Hall of Fame enshrinement speech,https://youtu.be/Fm4hy1-lDP0,youtu.be,https://www.reddit.com/r/nba/comments/52155x/shaqs_hall_of_fame_enshrinement_speech/?ref=search_posts,nba,114,27,0,1473503878.0,[CHI] Scottie Pippen,jeric13xd,False,False
521ayo,How good is George Hill?,https://www.reddit.com/r/nba/comments/521ayo/how_good_is_george_hill/,self.nba,https://www.reddit.com/r/nba/comments/521ayo/how_good_is_george_hill/?ref=search_posts,nba,29,34,0,1473506494.0,,lakeshow22,True,False
5208g3,Why isn't Moses Malone better known?,https://www.reddit.com/r/nba/comments/5208g3/why_isnt_moses_malone_better_known/,self.nba,https://www.reddit.com/r/nba/comments/5208g3/why_isnt_moses_malone_better_known/?ref=search_posts,nba,58,66,0,1473490824.0,San Diego Clippers,untaken-username,True,False
5203qy,Game Thread: Hall of Fame Induction Ceremony,https://www.reddit.com/r/nba/comments/5203qy/game_thread_hall_of_fame_induction_ceremony/,self.nba,https://www.reddit.com/r/nba/comments/5203qy/game_thread_hall_of_fame_induction_ceremony/?ref=search_posts,nba,27,44,0,1473489160.0,Bulls,wjbc,True,False
51zsax,Who is your favorite player in the NBA to watch and why?,https://www.reddit.com/r/nba/comments/51zsax/who_is_your_favorite_player_in_the_nba_to_watch/,self.nba,https://www.reddit.com/r/nba/comments/51zsax/who_is_your_favorite_player_in_the_nba_to_watch/?ref=search_posts,nba,12,56,0,1473485227.0,,peterhumm18,True,False
520moz,"How heavily do you think the ""social media"" era influences our perceptions of great players?",https://www.reddit.com/r/nba/comments/520moz/how_heavily_do_you_think_the_social_media_era/,self.nba,https://www.reddit.com/r/nba/comments/520moz/how_heavily_do_you_think_the_social_media_era/?ref=search_posts,nba,8,27,0,1473496289.0,Spurs,micahclay,True,False
51zps2,"Miami guard Josh Richardson has sustained a partially torn MCL in right knee, league sources tell The Vertical. Return time based on rehab.",https://twitter.com/ShamsCharania/status/774354701123026944,twitter.com,https://www.reddit.com/r/nba/comments/51zps2/miami_guard_josh_richardson_has_sustained_a/?ref=search_posts,nba,175,53,0,1473484348.0,[TOR] Jorge Garbajosa,inlifetroll,False,False
520s2y,JaKarr Sampson 76ers 2015 Season Highlights. Poor man's Ben Simmons,https://youtu.be/6pi_Pc7Xtno,youtu.be,https://www.reddit.com/r/nba/comments/520s2y/jakarr_sampson_76ers_2015_season_highlights_poor/?ref=search_posts,nba,10,24,0,1473498445.0,Nuggets,eg14000,False,False
51zlm1,[Simmons] Shaq and A.I.: Where They Stack Up in the Basketball Pantheon,https://theringer.com/shaquille-oneal-allen-iverson-book-of-basketball-af5f76450f78#.u9642hwhq,theringer.com,https://www.reddit.com/r/nba/comments/51zlm1/simmons_shaq_and_ai_where_they_stack_up_in_the/?ref=search_posts,nba,36,18,0,1473482985.0,76ers,TheTurribleTurtle,False,False
520zw1,What is Shaq saying that's being censored?,https://www.reddit.com/r/nba/comments/520zw1/what_is_shaq_saying_thats_being_censored/,self.nba,https://www.reddit.com/r/nba/comments/520zw1/what_is_shaq_saying_thats_being_censored/?ref=search_posts,nba,79,16,0,1473501670.0,Magic,RabbitFeet25,True,False
51zxey,The Allen Iverson I Saw | By Aaron McKie,http://www.theplayerstribune.com/aaron-mckie-allen-iverson-sixers-hall-of-fame-2016/,theplayerstribune.com,https://www.reddit.com/r/nba/comments/51zxey/the_allen_iverson_i_saw_by_aaron_mckie/?ref=search_posts,nba,46,9,0,1473486932.0,,Somali_Pir8,False,False
520cpq,Kevin Durant says he and Russell Westbrook are 'still cool' at UT event,http://newsok.com/article/5517457?utm_source=NewsOK.com&utm_medium=Social&utm_campaign=ShareBar-Twitter,newsok.com,https://www.reddit.com/r/nba/comments/520cpq/kevin_durant_says_he_and_russell_westbrook_are/?ref=search_posts,nba,32,17,0,1473492455.0,Thunder,rangersrule1997,False,False
520l21,"""My Hall of Fame Speech"" - Yao Ming",http://www.theplayerstribune.com/yao-ming-basketball-hall-of-fame-speech-full-text/,theplayerstribune.com,https://www.reddit.com/r/nba/comments/520l21/my_hall_of_fame_speech_yao_ming/?ref=search_posts,nba,216,18,0,1473495637.0,Clippers,jdesign808,False,False
521obr,Allen Iverson's debut game in NBA. Guy scored 30 points in his first proffesional game. CRAZY.,https://www.youtube.com/watch?v=C06iW1giQsY,youtube.com,https://www.reddit.com/r/nba/comments/521obr/allen_iversons_debut_game_in_nba_guy_scored_30/?ref=search_posts,nba,24,15,0,1473512860.0,NBA,cenki95,False,False
51zqqc,Jeff Van Gundy thinks Rockets will be an offensive juggernaut,http://rockets.clutchfans.net/9984/jeff-van-gundy-thinks-houston-rockets-offensive-juggernaut/,rockets.clutchfans.net,https://www.reddit.com/r/nba/comments/51zqqc/jeff_van_gundy_thinks_rockets_will_be_an/?ref=search_posts,nba,36,28,0,1473484689.0,[HOU] James Harden,GettingLostInDaSauce,False,False
520v2i,Is Kemba Walker underrated?,https://www.reddit.com/r/nba/comments/520v2i/is_kemba_walker_underrated/,self.nba,https://www.reddit.com/r/nba/comments/520v2i/is_kemba_walker_underrated/?ref=search_posts,nba,8,91,0,1473499661.0,Bulls,wjbc,True,False
521hva,Specifics on Kobe/Shaq feud?,https://www.reddit.com/r/nba/comments/521hva/specifics_on_kobeshaq_feud/,self.nba,https://www.reddit.com/r/nba/comments/521hva/specifics_on_kobeshaq_feud/?ref=search_posts,nba,25,48,0,1473509682.0,,DonaldFlump,True,False
520odn,Top 6 Point Gaurds,https://www.reddit.com/r/nba/comments/520odn/top_6_point_gaurds/,self.nba,https://www.reddit.com/r/nba/comments/520odn/top_6_point_gaurds/?ref=search_posts,nba,0,69,0,1473496946.0,,_myuniqueusername_,True,False
51zwk6,"The Pelicans are closing in on a deal to sign Lance Stephenson, according to league sources",https://twitter.com/ESPNSteinLine/status/774364292032270336,twitter.com,https://www.reddit.com/r/nba/comments/51zwk6/the_pelicans_are_closing_in_on_a_deal_to_sign/?ref=search_posts,nba,31,14,0,1473486643.0,Nuggets,PotRoastBoobs,False,False
520uxs,Is it better for nba players to not submit to breathalyzers?,https://www.reddit.com/r/nba/comments/520uxs/is_it_better_for_nba_players_to_not_submit_to/,self.nba,https://www.reddit.com/r/nba/comments/520uxs/is_it_better_for_nba_players_to_not_submit_to/?ref=search_posts,nba,13,25,0,1473499612.0,76ers,kevdude222,True,False
51zhjo,Rajon Rondo dunks over Dwight Howard back in 2009 playoffs,https://youtu.be/RHPHfzus6AA,youtu.be,https://www.reddit.com/r/nba/comments/51zhjo/rajon_rondo_dunks_over_dwight_howard_back_in_2009/?ref=search_posts,nba,2,5,0,1473481623.0,Celtics,Timi093,False,False
521l7w,Allen Iverson 1994 Kenner League (DC) highlights (summer before entering Georgetown),http://youtu.be/G1Lizyp1YOI,youtu.be,https://www.reddit.com/r/nba/comments/521l7w/allen_iverson_1994_kenner_league_dc_highlights/?ref=search_posts,nba,8,0,0,1473511276.0,,Hell_Camino,False,False
51zhj0,Allen Iverson's Ultimate Career Mixtape,https://youtu.be/3W14pRfhO4k,youtu.be,https://www.reddit.com/r/nba/comments/51zhj0/allen_iversons_ultimate_career_mixtape/?ref=search_posts,nba,28,0,0,1473481616.0,[CHI] Jimmy Butler,MrMittenz,False,False
520lcw,"Kings bench player uses ""cold reading"" to run on the floor and celebrate the shot before it went in (link in comments)",https://www.youtube.com/watch?v=IjPsnfysrp8,youtube.com,https://www.reddit.com/r/nba/comments/520lcw/kings_bench_player_uses_cold_reading_to_run_on/?ref=search_posts,nba,0,7,0,1473495754.0,[IND] Dale Davis,Roekaiben,False,False
521b3z,Tom Izzo - Hall of Fame Speech,http://www.nba.com/video/channels/hall_of_fame/2016/09/10/20160909-hof-speech-tom-izzo.nba/,nba.com,https://www.reddit.com/r/nba/comments/521b3z/tom_izzo_hall_of_fame_speech/?ref=search_posts,nba,9,3,0,1473506550.0,Pistons,MegaTater,False,False
5213zh,Sports Illustrated: A skills trainer explains the world of NBA player development,http://www.si.com/nba/2016/09/08/jimmy-butler-jaylen-brown-chris-johnson-bulls-celtics-nba-offseason,si.com,https://www.reddit.com/r/nba/comments/5213zh/sports_illustrated_a_skills_trainer_explains_the/?ref=search_posts,nba,22,2,0,1473503411.0,Suns,sems_can_gcig,False,False
5214ur,Remember that you can watch today and precedent speeches at the official channel of the BBall HoF,https://www.youtube.com/user/OfficialHoophall/videos,youtube.com,https://www.reddit.com/r/nba/comments/5214ur/remember_that_you_can_watch_today_and_precedent/?ref=search_posts,nba,12,0,0,1473503750.0,Heat,Ferrari_322,False,False
5209ef,Which class of Basketball Hall of Fame has the most icons in your opinion?,https://www.reddit.com/r/nba/comments/5209ef/which_class_of_basketball_hall_of_fame_has_the/,self.nba,https://www.reddit.com/r/nba/comments/5209ef/which_class_of_basketball_hall_of_fame_has_the/?ref=search_posts,nba,3,22,0,1473491178.0,Celtics,IanCaesars,True,False
5217d8,Yao Ming Hall of Fame Speech : NBA.com,http://www.nba.com/video/channels/hall_of_fame/2016/09/09/20160909-hof-speech-yao-ming.nba/,nba.com,https://www.reddit.com/r/nba/comments/5217d8/yao_ming_hall_of_fame_speech_nbacom/?ref=search_posts,nba,24,2,0,1473504874.0,Jazz,chrimewave,False,False
520jqr,Impossible is 0 - Gilbert Arenas,https://www.youtube.com/watch?v=447k9RAAoc8,youtube.com,https://www.reddit.com/r/nba/comments/520jqr/impossible_is_0_gilbert_arenas/?ref=search_posts,nba,10,0,0,1473495142.0,[MIN] Latrell Sprewell,Jesus_Shuttlesworth,False,False
51zyme,[OC] Quality Defensive Game Leaders @ Each Position (Since 1983),https://imgur.com/gallery/qdz2h,imgur.com,https://www.reddit.com/r/nba/comments/51zyme/oc_quality_defensive_game_leaders_each_position/?ref=search_posts,nba,3,12,0,1473487346.0,[SAS] Kyle Anderson,ManuGinosebleed,False,False
51zkod,Skip Bayless and Shannon Sharpe Debate LeBron's Legacy:Part 1 (Part 2 in Autoplay Link),https://www.youtube.com/watch?v=PWwGbrxJMEc,youtube.com,https://www.reddit.com/r/nba/comments/51zkod/skip_bayless_and_shannon_sharpe_debate_lebrons/?ref=search_posts,nba,0,23,0,1473482660.0,Pistons,PapaPapadopoulos2,False,False
521wxu,Shaq baptizes David Robinson at '96 All star Game in San Antonio,https://www.youtube.com/watch?v=ztvmf228wvQ,youtube.com,https://www.reddit.com/r/nba/comments/521wxu/shaq_baptizes_david_robinson_at_96_all_star_game/?ref=search_posts,nba,21,9,0,1473517657.0,Nets,MTing1315,False,False
52082k,Which network would win in a basketball game -- ESPN or Turner Sports?,https://www.reddit.com/r/nba/comments/52082k/which_network_would_win_in_a_basketball_game_espn/,self.nba,https://www.reddit.com/r/nba/comments/52082k/which_network_would_win_in_a_basketball_game_espn/?ref=search_posts,nba,6,11,0,1473490685.0,Hornets,YizWasHere,True,False
5200ry,"DeAndre Jordan Misses Open Dunk, Crowd Laughs",https://streamable.com/1vw1,streamable.com,https://www.reddit.com/r/nba/comments/5200ry/deandre_jordan_misses_open_dunk_crowd_laughs/?ref=search_posts,nba,10,3,0,1473488135.0,[TOR] Jonas Valanciunas,maybaccc,False,False
520e57,Huertas comes up with the sneakiest steal I've ever seen on Dragic,https://www.youtube.com/watch?v=1vkqHZhjuhM,youtube.com,https://www.reddit.com/r/nba/comments/520e57/huertas_comes_up_with_the_sneakiest_steal_ive/?ref=search_posts,nba,23,4,0,1473492983.0,[LAL] Magic Johnson,DesiMango,False,False
520e0s,"LeBron executive producer of medical drama on NBC, with consultant Dr. James Andrews: Story follows a doctor who specializes in treating the world’s top athletes. But when he is plagued by a health crisis of his own, he must consult with a sports psychologist to change his approach to medicine.",http://www.thewrap.com/lebron-james-sells-scripted-medical-drama-to-nbc/,thewrap.com,https://www.reddit.com/r/nba/comments/520e0s/lebron_executive_producer_of_medical_drama_on_nbc/?ref=search_posts,nba,4,12,0,1473492933.0,Cavaliers,Chuggawumba123,False,False
521m9w,"If iverson had somehow led the sixers over the 01 lakers in the finals, where would You rank him all time?",https://www.reddit.com/r/nba/comments/521m9w/if_iverson_had_somehow_led_the_sixers_over_the_01/,self.nba,https://www.reddit.com/r/nba/comments/521m9w/if_iverson_had_somehow_led_the_sixers_over_the_01/?ref=search_posts,nba,5,21,0,1473511789.0,,Incognitohero11,True,False
5203qj,USA Basketball Match Halftime funny guy 13 years apart!,https://m.youtube.com/watch?v=StvaFE41TeI,m.youtube.com,https://www.reddit.com/r/nba/comments/5203qj/usa_basketball_match_halftime_funny_guy_13_years/?ref=search_posts,nba,21,5,0,1473489157.0,[NOP] Anthony Davis,FreshhMarcus,False,False
521hfs,Lebron Posterizes Delonte West in '06,https://youtu.be/t-YMn3UFy8w?t=488,youtu.be,https://www.reddit.com/r/nba/comments/521hfs/lebron_posterizes_delonte_west_in_06/?ref=search_posts,nba,15,7,0,1473509472.0,,cv145,False,False
