id,title,url,domain,permalink,subreddit,score,num_comments,gilded,created,author_flair_text,author,is_self,over_18
4rmd8a,The Lakers ended up being the model organization after all of this,https://www.reddit.com/r/nba/comments/4rmd8a/the_lakers_ended_up_being_the_model_organization/,self.nba,https://www.reddit.com/r/nba/comments/4rmd8a/the_lakers_ended_up_being_the_model_organization/?ref=search_posts,nba,2219,1228,1,1467889244.0,,PZinger6,True,False
4rm0jl,"[Mays] The Bulls' new backcourt shot a combined .524 percent from 3 last year. Like, if you add their indivual rates together",https://twitter.com/robertmays/status/750867167176855552,twitter.com,https://www.reddit.com/r/nba/comments/4rm0jl/mays_the_bulls_new_backcourt_shot_a_combined_524/?ref=search_posts,nba,3120,440,0,1467884515.0,Celtics,Brad-Stevens,False,False
4rlxpl,"[Wojnarowski] Dwyane Wade has informed the Bulls he plans to sign a deal with them, sources tell @TheVertical. Bulls sending out contracts now.",https://twitter.com/WojVerticalNBA/status/750863038505418752,twitter.com,https://www.reddit.com/r/nba/comments/4rlxpl/wojnarowski_dwyane_wade_has_informed_the_bulls_he/?ref=search_posts,nba,5281,4365,0,1467883478.0,Warriors,Anon10W1z,False,False
4rm5y2,"[Wojnarowski] Chicago has traded guard Jose Calderon to the Los Angeles Lakers, league sources tell @TheVertical.",https://twitter.com/WojVerticalNBA/status/750875762991964160,twitter.com,https://www.reddit.com/r/nba/comments/4rm5y2/wojnarowski_chicago_has_traded_guard_jose/?ref=search_posts,nba,1551,640,0,1467886511.0,Warriors,Anon10W1z,False,False
4rn15z,Thank you from DJ Khaled,http://imgur.com/ZVouEWZ,imgur.com,https://www.reddit.com/r/nba/comments/4rn15z/thank_you_from_dj_khaled/?ref=search_posts,nba,956,172,0,1467899469.0,[MIA] Justise Winslow,Tito_Our_Saviour,False,False
4rmgto,"Micky Arison on Twitter: ""Thank you @DwyaneWade for a great 13 yrs! You've had a tremendous impact on our community and our organization. We wish you all the best.""",https://twitter.com/MickyArison/status/750891909934112768,twitter.com,https://www.reddit.com/r/nba/comments/4rmgto/micky_arison_on_twitter_thank_you_dwyanewade_for/?ref=search_posts,nba,337,63,0,1467890687.0,[DAL] Michael Finley,monetclaude,False,False
4rlunv,Looks Like Snoop Dogg Just Gave Kobe the Dopest Laker Car For Retirement!,https://twitter.com/kobebryant/status/750857765866778625,twitter.com,https://www.reddit.com/r/nba/comments/4rlunv/looks_like_snoop_dogg_just_gave_kobe_the_dopest/?ref=search_posts,nba,1206,211,0,1467882328.0,Lakers,KingsCrossings,False,False
4rkkxh,Brandon Jennings decides his Jersey Number.,https://twitter.com/brandonjennings/status/750786643003604992,twitter.com,https://www.reddit.com/r/nba/comments/4rkkxh/brandon_jennings_decides_his_jersey_number/?ref=search_posts,nba,545,64,0,1467865681.0,,oache88,False,False
4rlcci,"[Wojnarowski] Sources: In last few hours, Bulls calling teams to unload contracts, trying to create space to sign Dwyane Wade. Wade is serious about them.",https://twitter.com/WojVerticalNBA/status/750829311838519296,twitter.com,https://www.reddit.com/r/nba/comments/4rlcci/wojnarowski_sources_in_last_few_hours_bulls/?ref=search_posts,nba,1241,466,0,1467875446.0,Warriors,Anon10W1z,False,False
4rm07p,"Zach Lowe on Twitter: ""Bulls loading up on non-shooters for Fred Hoiberg's pace-and-space system.""",https://twitter.com/ZachLowe_NBA/status/750863489422528512,twitter.com,https://www.reddit.com/r/nba/comments/4rm07p/zach_lowe_on_twitter_bulls_loading_up_on/?ref=search_posts,nba,1028,360,0,1467884390.0,[NYK] Steve Novak,alexyxray,False,False
4rm4t3,"K.C. Johnson on Twitter: ""Mike Dunleavy has been informed he has been traded to the Cavaliers.""",https://twitter.com/KCJHoop/status/750873887185985536,twitter.com,https://www.reddit.com/r/nba/comments/4rm4t3/kc_johnson_on_twitter_mike_dunleavy_has_been/?ref=search_posts,nba,270,80,0,1467886070.0,[DAL] Michael Finley,monetclaude,False,False
4rmocn,Ezeli Allegedly Wants $70M For His Services,https://twitter.com/LegionHoops/status/750860481573904384,twitter.com,https://www.reddit.com/r/nba/comments/4rmocn/ezeli_allegedly_wants_70m_for_his_services/?ref=search_posts,nba,307,179,0,1467893698.0,Heat,JJWhatWhat,False,False
4rmjfp,"[Wojnarowski] Free agent Leandro Barbosa has agreed to a two-year, $8M deal with the Suns, league source tells @TheVertical.",https://twitter.com/WojVerticalNBA/status/750897580687622144,twitter.com,https://www.reddit.com/r/nba/comments/4rmjfp/wojnarowski_free_agent_leandro_barbosa_has_agreed/?ref=search_posts,nba,1457,458,0,1467891713.0,Warriors,Anon10W1z,False,False
4rmizn,Kevin Durant's Friendship With Draymond Green Bothered Thunder Teammates,http://thebiglead.com/2016/07/06/kevin-durant-draymond-green-oklahoma-city-golden-state-warriors/?v=0.01428210bd5e1b0dc6a,thebiglead.com,https://www.reddit.com/r/nba/comments/4rmizn/kevin_durants_friendship_with_draymond_green/?ref=search_posts,nba,359,103,0,1467891541.0,Thunder,okiewxchaser,False,False
4rkwl9,"[Winters] Luke Walton praised Brandon Ingram for his basketball IQ, skill set, handles, post ups & defense: “I’m very excited about what he can do.""",https://twitter.com/SerenaWinters/status/750802032802443264,twitter.com,https://www.reddit.com/r/nba/comments/4rkwl9/winters_luke_walton_praised_brandon_ingram_for/?ref=search_posts,nba,246,91,0,1467869708.0,Lakers,ChrisKamanMyEye,False,False
4rl5up,I put together another huge photo gallery - this time 150 high res photos from the 1950s to the 2010s.,http://imgur.com/a/isp75,imgur.com,https://www.reddit.com/r/nba/comments/4rl5up/i_put_together_another_huge_photo_gallery_this/?ref=search_posts,nba,578,82,0,1467873058.0,Nuggets,macgarnickle,False,False
4rltrg,[Kurtenbach] Wade was pushing Miami to give him more by threatening to take a minimum contract in Cleveland or going to Denver. Chicago made it real.,https://twitter.com/dkurtenbach/status/750855397561413632,twitter.com,https://www.reddit.com/r/nba/comments/4rltrg/kurtenbach_wade_was_pushing_miami_to_give_him/?ref=search_posts,nba,510,77,0,1467881989.0,Heat,JimJamJones,False,False
4rm0ep,"Nick Friedell on Twitter: ""Two weeks ago Gar Forman told media that Bulls needed to get ""younger"" and more ""athletic."" Now they're about to land Wade+Rondo. Wow.""",https://twitter.com/NickFriedell/status/750866911630614529,twitter.com,https://www.reddit.com/r/nba/comments/4rm0ep/nick_friedell_on_twitter_two_weeks_ago_gar_forman/?ref=search_posts,nba,785,172,0,1467884463.0,[DAL] Michael Finley,monetclaude,False,False
4rlx4i,"Adrian Wojnarowski on Twitter: ""Pending Chicago's belief they have deal to clear cap space, Dwyane Wade is nearing commitment to sign with Bulls, sources tell @TheVertical""",https://twitter.com/WojVerticalNBA/status/750862014772371456,twitter.com,https://www.reddit.com/r/nba/comments/4rlx4i/adrian_wojnarowski_on_twitter_pending_chicagos/?ref=search_posts,nba,511,260,0,1467883242.0,NBA,JaySpike,False,False
4rkhi5,"Ayesha Curry apologizes for her tweets: “I was just a fan in that moment so I didn’t think about the ramifications,I regret the way that I voiced how hurt I was. I felt hurt for [Steph],and I didn’t mean to offend anybody. Obviously, what I wrote is not what I think about what he does for a living.”",https://site.people.com/food/ayesha-stephen-curry-twitter-response/,site.people.com,https://www.reddit.com/r/nba/comments/4rkhi5/ayesha_curry_apologizes_for_her_tweets_i_was_just/?ref=search_posts,nba,350,342,0,1467864550.0,West,urfaselol,False,False
4rkwhw,[Sefko] Word filtering around is that David Lee may be in line to end up back in Golden State with the team he helped win the title in 2015,https://twitter.com/ESefko/status/750801857056894976,twitter.com,https://www.reddit.com/r/nba/comments/4rkwhw/sefko_word_filtering_around_is_that_david_lee_may/?ref=search_posts,nba,357,161,0,1467869678.0,Mavericks,gigantism,False,False
4rkvp5,Who has some good stories of meeting anyone in the NBA?,https://www.reddit.com/r/nba/comments/4rkvp5/who_has_some_good_stories_of_meeting_anyone_in/,self.nba,https://www.reddit.com/r/nba/comments/4rkvp5/who_has_some_good_stories_of_meeting_anyone_in/?ref=search_posts,nba,169,220,0,1467869386.0,,sticksandstoneslove,True,False
4rm0q6,Bosh retiring would be the ultimate nail in the coffin for Miami this summer.,https://www.reddit.com/r/nba/comments/4rm0q6/bosh_retiring_would_be_the_ultimate_nail_in_the/,self.nba,https://www.reddit.com/r/nba/comments/4rm0q6/bosh_retiring_would_be_the_ultimate_nail_in_the/?ref=search_posts,nba,1544,582,0,1467884583.0,[CLE] LeBron James,thisiseku,True,False
4rm0av,"[WOjnarowski] The contract for Dwyane Wade is two years, $47 million",http://sports.yahoo.com/news/sources--dwyane-wade-to-join-220539051.html,sports.yahoo.com,https://www.reddit.com/r/nba/comments/4rm0av/wojnarowski_the_contract_for_dwyane_wade_is_two/?ref=search_posts,nba,1169,528,0,1467884419.0,Knicks,noahsbun,False,False
4rm8im,"Update: Dwyane Wade confirms he is leaving the Miami Heat after 13 seasons, will go to Chicago Bulls; 'This was not an easy decision, but I feel I have made the right choice,' Wade says",http://abcnews.go.com/Sports/wireStory/ap-source-dwyane-wade-leaving-heat-bulls-40394019,abcnews.go.com,https://www.reddit.com/r/nba/comments/4rm8im/update_dwyane_wade_confirms_he_is_leaving_the/?ref=search_posts,nba,857,194,0,1467887463.0,,X_Jok3rzWiLd_X,False,False
4rmjyl,DeAndre Jordan was a Mavs locker room topic until Christmas when Carlisle said the next guy to bring it up would never play for him again. That was the last time anyone talked about it.,https://www.reddit.com/r/nba/comments/4rmjyl/deandre_jordan_was_a_mavs_locker_room_topic_until/,self.nba,https://www.reddit.com/r/nba/comments/4rmjyl/deandre_jordan_was_a_mavs_locker_room_topic_until/?ref=search_posts,nba,1381,363,0,1467891922.0,Mavericks,gigantism,True,False
4rlu91,What are the bulls doing exactly?,https://www.reddit.com/r/nba/comments/4rlu91/what_are_the_bulls_doing_exactly/,self.nba,https://www.reddit.com/r/nba/comments/4rlu91/what_are_the_bulls_doing_exactly/?ref=search_posts,nba,564,254,0,1467882179.0,,PirateKata,True,False
4rm39e,"Wade has updated his Twitter profile. He has changed ""it's bigger than basketball"" to ""from Robbins, IL.""",https://mobile.twitter.com/dwyanewade?lang=en,mobile.twitter.com,https://www.reddit.com/r/nba/comments/4rm39e/wade_has_updated_his_twitter_profile_he_has/?ref=search_posts,nba,518,49,0,1467885522.0,Heat,phatwithaphd,False,False
4rmnsu,"Mark Cuban on Twitter: ""Welcome to Dallas @hbarnes https://t.co/ZIEOnqYCV1""",https://twitter.com/mcuban/status/750904871717597184,twitter.com,https://www.reddit.com/r/nba/comments/4rmnsu/mark_cuban_on_twitter_welcome_to_dallas_hbarnes/?ref=search_posts,nba,581,121,0,1467893481.0,[DAL] Michael Finley,monetclaude,False,False
4rm6tf,"Marc Stein on Twitter: ""Lakers swoop in and convince Chicago to trade them Jose Calderon ahead of Brooklyn on a wild night, according to league sources""",https://twitter.com/ESPNSteinLine/status/750877095442599936,twitter.com,https://www.reddit.com/r/nba/comments/4rm6tf/marc_stein_on_twitter_lakers_swoop_in_and/?ref=search_posts,nba,209,121,0,1467886833.0,[DAL] Michael Finley,monetclaude,False,False
4rmhw1,"[Steve Kyler] The 76ers offered Jamal Crawford a 1 year deal, worth $25 million. He rejected it, reports @stevekylerNBA",https://twitter.com/LegionHoops/status/750888128081195008?s=09,twitter.com,https://www.reddit.com/r/nba/comments/4rmhw1/steve_kyler_the_76ers_offered_jamal_crawford_a_1/?ref=search_posts,nba,267,118,0,1467891095.0,Bulls,BlueTeamTV,False,False
4rmh9b,"[Skolnick] The frustration with always feeling like Wade was second to someone else, created by overconfidence that he would always come back. The perception that it was Pat Riley, not him, who had created the Big Three Ultimately the conclusion he came to was that Riley didn’t value him.",http://www.miamiherald.com/sports/spt-columns-blogs/ethan-j-skolnick/article88119252.html,miamiherald.com,https://www.reddit.com/r/nba/comments/4rmh9b/skolnick_the_frustration_with_always_feeling_like/?ref=search_posts,nba,513,213,0,1467890848.0,West,urfaselol,False,False
4rm4gs,"[Wojnarowski] Chicago is finalzing a deal to send Mike Dunleavy to the Cleveland Cavaliers, league sources tells @TheVertical.",https://twitter.com/WojVerticalNBA/status/750873443147579392,twitter.com,https://www.reddit.com/r/nba/comments/4rm4gs/wojnarowski_chicago_is_finalzing_a_deal_to_send/?ref=search_posts,nba,822,286,0,1467885958.0,Warriors,Anon10W1z,False,False
4rn5ks,Dan LeBatard's Piece on Dwayne Wade's Breakup with the Miami Heat -- Wade's Epic Miami Story Ends in Messy Breakup.,http://www.miamiherald.com/sports/spt-columns-blogs/dan-le-batard/article88135197.html,miamiherald.com,https://www.reddit.com/r/nba/comments/4rn5ks/dan_lebatards_piece_on_dwayne_wades_breakup_with/?ref=search_posts,nba,57,29,0,1467901742.0,NBA,SuhMachineGun,False,False
4rlrvy,NBA Player's Snapchat Names,https://www.reddit.com/r/nba/comments/4rlrvy/nba_players_snapchat_names/,self.nba,https://www.reddit.com/r/nba/comments/4rlrvy/nba_players_snapchat_names/?ref=search_posts,nba,17,27,0,1467881288.0,Timberwolves,rchung68,True,False
4rlixz,"[K.C. Johnson] ""As of now, Bulls reluctant to part with young players/picks in attempts to clear more cap space for Wade.""",https://twitter.com/KCJHoop/status/750839106293207040,twitter.com,https://www.reddit.com/r/nba/comments/4rlixz/kc_johnson_as_of_now_bulls_reluctant_to_part_with/?ref=search_posts,nba,39,53,0,1467877849.0,[CLE] LeBron James,vibhyk,False,False
4rksvo,"If KD puts up a stat line similar to 30/7/5 as the best player on a finals winning team, would your opinion of him change?",https://www.reddit.com/r/nba/comments/4rksvo/if_kd_puts_up_a_stat_line_similar_to_3075_as_the/,self.nba,https://www.reddit.com/r/nba/comments/4rksvo/if_kd_puts_up_a_stat_line_similar_to_3075_as_the/?ref=search_posts,nba,0,119,0,1467868386.0,Mavericks,badoosh123,True,False
4rkw2s,Early MVP favorite?,https://www.reddit.com/r/nba/comments/4rkw2s/early_mvp_favorite/,self.nba,https://www.reddit.com/r/nba/comments/4rkw2s/early_mvp_favorite/?ref=search_posts,nba,0,87,0,1467869526.0,Magic,bmalbert81,True,False
4rm53e,"Bobby Marks on Twitter: ""Cleveland will use part of the Anderson Varejao $9.6m trade exception to take in Dunleavy's $4.8m contract. https://t.co/Cna25fFwap""",https://twitter.com/BobbyMarks42/status/750874254451863552,twitter.com,https://www.reddit.com/r/nba/comments/4rm53e/bobby_marks_on_twitter_cleveland_will_use_part_of/?ref=search_posts,nba,38,28,0,1467886180.0,[DAL] Michael Finley,monetclaude,False,False
4rl4vx,Are the Durant-Warriors REALLY a lock to win the championship in 2017?,https://www.reddit.com/r/nba/comments/4rl4vx/are_the_durantwarriors_really_a_lock_to_win_the/,self.nba,https://www.reddit.com/r/nba/comments/4rl4vx/are_the_durantwarriors_really_a_lock_to_win_the/?ref=search_posts,nba,0,80,0,1467872725.0,Spurs,othersideofthetracks,True,False
4rmm19,"PinPoint Sports on Twitter: ""People are already burning Dwyane Wade's jersey https://t.co/SKjVQY6hOK""",https://twitter.com/SportsPinPoint/status/750900621411176452,twitter.com,https://www.reddit.com/r/nba/comments/4rmm19/pinpoint_sports_on_twitter_people_are_already/?ref=search_posts,nba,33,54,0,1467892762.0,[DAL] Michael Finley,monetclaude,False,False
4rlxle,"Brian Windhorst on Twitter: ""Dwyane Wade is on the verge of a deal with the Bulls, who are nearing trades to clear needed cap space, sources told ESPN""",https://twitter.com/WindhorstESPN/status/750862514540253184,twitter.com,https://www.reddit.com/r/nba/comments/4rlxle/brian_windhorst_on_twitter_dwyane_wade_is_on_the/?ref=search_posts,nba,112,54,0,1467883433.0,Lakers,pthrowaway91321,False,False
4rm7g6,"Ben Golliver on Twitter: ""Bulls' new backcourt of Rajon Rondo + Dwyane Wade = 69 combined threes in 2015-16 Stephen Curry = 71 threes in first 14 games of 2015-16""",https://twitter.com/BenGolliver/status/750876322415538176,twitter.com,https://www.reddit.com/r/nba/comments/4rm7g6/ben_golliver_on_twitter_bulls_new_backcourt_of/?ref=search_posts,nba,41,33,0,1467887071.0,[PHI] Julius Erving,barmpot,False,False
4rlvb6,"[Skolnick] ""Can confirm other reports on Bulls. They think if they get close financially to Miami's original 2 for 40, they have a good shot.""",https://twitter.com/EthanJSkolnick/status/750858973520154624,twitter.com,https://www.reddit.com/r/nba/comments/4rlvb6/skolnick_can_confirm_other_reports_on_bulls_they/?ref=search_posts,nba,20,29,0,1467882576.0,[CLE] LeBron James,vibhyk,False,False
4rm9yw,"[Wojnarowski] The Dwyane Wade two-year, $47.5M deal with Chicago includes a player option, league sources tell @TheVertical.",https://twitter.com/WojVerticalNBA/status/750882028065816576,twitter.com,https://www.reddit.com/r/nba/comments/4rm9yw/wojnarowski_the_dwyane_wade_twoyear_475m_deal/?ref=search_posts,nba,139,38,0,1467888006.0,Warriors,Anon10W1z,False,False
4rlk5u,"Zach Lowe on Twitter: ""Ok, Bulls!""",https://twitter.com/ZachLowe_NBA/status/750836117134516224,twitter.com,https://www.reddit.com/r/nba/comments/4rlk5u/zach_lowe_on_twitter_ok_bulls/?ref=search_posts,nba,7,42,0,1467878315.0,[MIA] Alonzo Mourning,fsuizzy,False,False
4rmp0r,This Year was a Historic Year for Basketball. Let's Appreciate It.,https://www.reddit.com/r/nba/comments/4rmp0r/this_year_was_a_historic_year_for_basketball_lets/,self.nba,https://www.reddit.com/r/nba/comments/4rmp0r/this_year_was_a_historic_year_for_basketball_lets/?ref=search_posts,nba,20,17,0,1467893984.0,[LAL] Vlade Divac,weeyummy1,True,False
4rm0pr,"Marc J. Spears on Twitter: """"If we land Wade it's going to be a zoo around here. He'd be coming back home. It's the Bulls. Not too many offers better,"" - Rajon Rondo",https://twitter.com/MarcJSpearsESPN/status/750867514050031617,twitter.com,https://www.reddit.com/r/nba/comments/4rm0pr/marc_j_spears_on_twitter_if_we_land_wade_its/?ref=search_posts,nba,131,62,0,1467884578.0,[DAL] Michael Finley,monetclaude,False,False
4rmaum,So who do you think will win the Southeast Division this year?,https://www.reddit.com/r/nba/comments/4rmaum/so_who_do_you_think_will_win_the_southeast/,self.nba,https://www.reddit.com/r/nba/comments/4rmaum/so_who_do_you_think_will_win_the_southeast/?ref=search_posts,nba,6,27,0,1467888335.0,Hornets,Poopertroop,True,False
4rmbcp,Do you guys think LeBron's title win for his hometown was any motivation for Wade to choose Chicago?,https://www.reddit.com/r/nba/comments/4rmbcp/do_you_guys_think_lebrons_title_win_for_his/,self.nba,https://www.reddit.com/r/nba/comments/4rmbcp/do_you_guys_think_lebrons_title_win_for_his/?ref=search_posts,nba,8,27,0,1467888536.0,,socdude,True,False
4rm4l1,"Marc Stein on Twitter: ""Milwaukee wants Mike Dunleavy but DWade's buddy LeBron and his Cavs are working to acquire a player King James has long sought as a teammate""",https://twitter.com/ESPNSteinLine/status/750873566439018496,twitter.com,https://www.reddit.com/r/nba/comments/4rm4l1/marc_stein_on_twitter_milwaukee_wants_mike/?ref=search_posts,nba,22,25,0,1467885998.0,[DAL] Michael Finley,monetclaude,False,False
4rmcf7,[Adande] 1st time Wade & Durant played in same All-Star game was 2010. Now only 2 players in that game have stayed w/same team since: Dirk & Duncan,https://twitter.com/jadande/status/750885396091850756,twitter.com,https://www.reddit.com/r/nba/comments/4rmcf7/adande_1st_time_wade_durant_played_in_same/?ref=search_posts,nba,40,16,0,1467888928.0,Warriors,lf2012,False,False
4rmvhv,With all the roster moves I was thinking we could get a thread of potential starting lineups and key bench guys for every team next season.,https://www.reddit.com/r/nba/comments/4rmvhv/with_all_the_roster_moves_i_was_thinking_we_could/,self.nba,https://www.reddit.com/r/nba/comments/4rmvhv/with_all_the_roster_moves_i_was_thinking_we_could/?ref=search_posts,nba,29,69,0,1467896772.0,[SAS] Boban Marjanovic,korny12345,True,False
4rn0ny,Fastest Players in the League?,https://www.reddit.com/r/nba/comments/4rn0ny/fastest_players_in_the_league/,self.nba,https://www.reddit.com/r/nba/comments/4rn0ny/fastest_players_in_the_league/?ref=search_posts,nba,2,61,0,1467899202.0,,SquanchyParty,True,False
4rm6fa,Canada Basketball's new ad,https://www.youtube.com/watch?v=iNVVPyN1pBo,youtube.com,https://www.reddit.com/r/nba/comments/4rm6fa/canada_basketballs_new_ad/?ref=search_posts,nba,38,11,0,1467886689.0,Raptors,M-G-K,False,False
4rmk7l,Another dagger for us Heat Fans; D-Wade's Gatorade commercial will stop airing for sure.,https://www.reddit.com/r/nba/comments/4rmk7l/another_dagger_for_us_heat_fans_dwades_gatorade/,self.nba,https://www.reddit.com/r/nba/comments/4rmk7l/another_dagger_for_us_heat_fans_dwades_gatorade/?ref=search_posts,nba,58,20,0,1467892017.0,,fuknob,True,False
4rl2vg,Is it theoretically possible for r/NBA to raise enough money to buy an expansion team (if the NBA ever expands again) and act as shareholders of said team?,https://www.reddit.com/r/nba/comments/4rl2vg/is_it_theoretically_possible_for_rnba_to_raise/,self.nba,https://www.reddit.com/r/nba/comments/4rl2vg/is_it_theoretically_possible_for_rnba_to_raise/?ref=search_posts,nba,6,64,0,1467871985.0,Hornets,awkwardsealion,True,False
4rkhlm,Teams Shooting guards hated playing against,https://www.reddit.com/r/nba/comments/4rkhlm/teams_shooting_guards_hated_playing_against/,self.nba,https://www.reddit.com/r/nba/comments/4rkhlm/teams_shooting_guards_hated_playing_against/?ref=search_posts,nba,23,24,0,1467864584.0,,shanmustafa,True,False
4rmp7p,"Eric Pincus on Twitter: ""Not sure if this was reported but the Minnesota Timberwolves signed Kris Dunn to his rookie contract on Tuesday $17.9 mil @BBallInsiders""",https://twitter.com/EricPincus/status/750907437922684928,twitter.com,https://www.reddit.com/r/nba/comments/4rmp7p/eric_pincus_on_twitter_not_sure_if_this_was/?ref=search_posts,nba,114,47,0,1467894069.0,[DAL] Michael Finley,monetclaude,False,False
4rmo8n,State Of The Bulls,https://www.reddit.com/r/nba/comments/4rmo8n/state_of_the_bulls/,self.nba,https://www.reddit.com/r/nba/comments/4rmo8n/state_of_the_bulls/?ref=search_posts,nba,4,82,0,1467893654.0,Bulls,jkalltheway,True,False
4rm8ak,[Skolnick] The meeting between Dwyane Wade and Micky Arison was an attempted relationship patch. This was too far gone this time.,https://twitter.com/EthanJSkolnick/status/750879085497184256,twitter.com,https://www.reddit.com/r/nba/comments/4rm8ak/skolnick_the_meeting_between_dwyane_wade_and/?ref=search_posts,nba,47,14,0,1467887382.0,Nuggets,PotRoastBoobs,False,False
4rkw1q,Why do people think the Mavericks will be good next year?,https://www.reddit.com/r/nba/comments/4rkw1q/why_do_people_think_the_mavericks_will_be_good/,self.nba,https://www.reddit.com/r/nba/comments/4rkw1q/why_do_people_think_the_mavericks_will_be_good/?ref=search_posts,nba,0,62,0,1467869516.0,[LAL] D'Angelo Russell,HolyRomanPrince,True,False
4rm7mt,"The only player from the 2003 draft, widely considered as one of the greatest ever, to stay on the same team that drafted them is Nick Collison.",https://www.reddit.com/r/nba/comments/4rm7mt/the_only_player_from_the_2003_draft_widely/,self.nba,https://www.reddit.com/r/nba/comments/4rm7mt/the_only_player_from_the_2003_draft_widely/?ref=search_posts,nba,85,46,0,1467887136.0,Heat,LamborghiniAngels,True,False
4rlbhw,Does Sacramento make the playoffs next season?,https://www.reddit.com/r/nba/comments/4rlbhw/does_sacramento_make_the_playoffs_next_season/,self.nba,https://www.reddit.com/r/nba/comments/4rlbhw/does_sacramento_make_the_playoffs_next_season/?ref=search_posts,nba,2,31,0,1467875100.0,Wizards,AnalSlutFrog,True,False
4rl3g9,Galloway says goodbye,https://instagram.com/p/BHiT3rajmXD/,instagram.com,https://www.reddit.com/r/nba/comments/4rl3g9/galloway_says_goodbye/?ref=search_posts,nba,39,19,0,1467872202.0,,4for5,False,False
4rl945,"[Winderman] ""Heat meeting with Wade did not necessarily lead to overwhelming optimism or pessimism. Very much up in air, Sun Sentinel told.""",https://twitter.com/IraHeatBeat/status/750823787319300096,twitter.com,https://www.reddit.com/r/nba/comments/4rl945/winderman_heat_meeting_with_wade_did_not/?ref=search_posts,nba,28,16,0,1467874208.0,[CLE] LeBron James,vibhyk,False,False
4rlyzd,Why can the Bulls trade Calderon?,https://www.reddit.com/r/nba/comments/4rlyzd/why_can_the_bulls_trade_calderon/,self.nba,https://www.reddit.com/r/nba/comments/4rlyzd/why_can_the_bulls_trade_calderon/?ref=search_posts,nba,3,31,0,1467883942.0,[DEN] Danilo Gallinari,kobeanbryant,True,False
4rmn45,Chris Paul on Instagram,https://www.instagram.com/p/BHi7n6LhaA6/,instagram.com,https://www.reddit.com/r/nba/comments/4rmn45/chris_paul_on_instagram/?ref=search_posts,nba,40,36,0,1467893204.0,[IND] Paul George,btirumala,False,False
4rmd2r,Is this the craziest off season in a while?,https://www.reddit.com/r/nba/comments/4rmd2r/is_this_the_craziest_off_season_in_a_while/,self.nba,https://www.reddit.com/r/nba/comments/4rmd2r/is_this_the_craziest_off_season_in_a_while/?ref=search_posts,nba,10,17,0,1467889188.0,,theclownermb,True,False
4rmmmz,Timeline of the Heat/Wade Breakup,https://www.reddit.com/r/nba/comments/4rmmmz/timeline_of_the_heatwade_breakup/,self.nba,https://www.reddit.com/r/nba/comments/4rmmmz/timeline_of_the_heatwade_breakup/?ref=search_posts,nba,35,17,0,1467893008.0,,willblieve,True,False
4rmnqd,[Associated Press] Dwyane Wade writes letter to Miami after choosing to leave Heat,http://espn.go.com/nba/story/_/id/16843473/dwyane-wade-writes-letter-miami-leaving-heat-chicago-bulls,espn.go.com,https://www.reddit.com/r/nba/comments/4rmnqd/associated_press_dwyane_wade_writes_letter_to/?ref=search_posts,nba,57,14,0,1467893450.0,Suns,iamstarbucks,False,False
