id,title,url,domain,permalink,subreddit,score,num_comments,gilded,created,author_flair_text,author,is_self,over_18
4mzqm4,"Jeremy Lin declines player option, officially becomes Free Agent",http://www.atthehive.com/2016/6/7/11876002/jeremy-lin-declines-player-option-becomes-free-agent,atthehive.com,https://www.reddit.com/r/nba/comments/4mzqm4/jeremy_lin_declines_player_option_officially/?ref=search_posts,nba,3750,1487,0,1465344024.0,,Kinprime,False,False
4mz521,Lue Vs. Blatt,https://www.reddit.com/r/nba/comments/4mz521/lue_vs_blatt/,self.nba,https://www.reddit.com/r/nba/comments/4mz521/lue_vs_blatt/?ref=search_posts,nba,173,266,0,1465336482.0,,ryfyrdio,True,False
4mz3qb,"If the Warriors win the Finals 4-0, what effect do you think it will have on LeBron, the Cavs, and the rest of the league?",https://www.reddit.com/r/nba/comments/4mz3qb/if_the_warriors_win_the_finals_40_what_effect_do/,self.nba,https://www.reddit.com/r/nba/comments/4mz3qb/if_the_warriors_win_the_finals_40_what_effect_do/?ref=search_posts,nba,215,339,0,1465335966.0,Pacers,AmadeusCrumb,True,False
4mzrqk,Has there ever been better back to back to back picks by one team than Seattle/OKC from 2007-2009?,https://www.reddit.com/r/nba/comments/4mzrqk/has_there_ever_been_better_back_to_back_to_back/,self.nba,https://www.reddit.com/r/nba/comments/4mzrqk/has_there_ever_been_better_back_to_back_to_back/?ref=search_posts,nba,263,253,0,1465344387.0,Raptors,Snowy_Thighs,True,False
4mztgv,"[The Ringers | Jonathan Tjarks] Can Kevin Love Be Saved? (He can, but it won't be as a Cavalier)",https://theringer.com/kevin-love-cleveland-cavaliers-trade-247956d0fcde#.bm4iyhsjk,theringer.com,https://www.reddit.com/r/nba/comments/4mztgv/the_ringers_jonathan_tjarks_can_kevin_love_be/?ref=search_posts,nba,264,223,0,1465344976.0,West,urfaselol,False,False
4myc31,"Shaq: ""15 years ago today, for only the second time in NBA Finals history, two opposing players scored 40 or more points in the same NBA Finals game!""",http://imgur.com/Qm4MUhG,imgur.com,https://www.reddit.com/r/nba/comments/4myc31/shaq_15_years_ago_today_for_only_the_second_time/?ref=search_posts,nba,2128,512,0,1465323174.0,[GSW] Stephen Curry,banya30,False,False
4n03rj,"[Jeff Zillgitt] USA Basketball announces select team that will practice, train with U.S. Olympic team this summer: (includes KCP, Devin Booker, Willie Caulie Stein, Brandon Ingram, CJ McCollum, Jabari Parker, Justice Winslow and more.)",https://twitter.com/JeffZillgitt/status/740228907564204032,twitter.com,https://www.reddit.com/r/nba/comments/4n03rj/jeff_zillgitt_usa_basketball_announces_select/?ref=search_posts,nba,215,130,0,1465348425.0,West,urfaselol,False,False
4mzynx,"[Haberstroh] Kobe tells ESPN that NBA needs to reduce 82 gms. ""But do they want to put in the effort to turn the Titanic around?""",https://twitter.com/tomhaberstroh/status/740222674278830080,twitter.com,https://www.reddit.com/r/nba/comments/4mzynx/haberstroh_kobe_tells_espn_that_nba_needs_to/?ref=search_posts,nba,560,346,0,1465346665.0,Nuggets,PotRoastBoobs,False,False
4mzzr1,"Haberstroh: ""New study: Players have lost 61 games due to injury this postseason, hitting a 20-yr high & 3x the rate in late 90s.""",https://twitter.com/tomhaberstroh/status/740224272208039941,twitter.com,https://www.reddit.com/r/nba/comments/4mzzr1/haberstroh_new_study_players_have_lost_61_games/?ref=search_posts,nba,284,92,0,1465347053.0,Rockets,Jux_,False,False
4mzs6r,"[SiriusXM NBA Radio] ""I've tried to work on his jumpshot with him but it's just not good."" -Paul Silas on LeBron James (LeBron's first NBA head coach)",https://twitter.com/SiriusXMNBA/status/740213545221132288,twitter.com,https://www.reddit.com/r/nba/comments/4mzs6r/siriusxm_nba_radio_ive_tried_to_work_on_his/?ref=search_posts,nba,388,421,0,1465344542.0,West,urfaselol,False,False
4mzcsx,"[Magic Johnson] I disagree with Mychal Thompson and his son Klay, my ""Showtime"" Lakers would beat the Warriors.",https://twitter.com/magicjohnson/status/740189894253809664,twitter.com,https://www.reddit.com/r/nba/comments/4mzcsx/magic_johnson_i_disagree_with_mychal_thompson_and/?ref=search_posts,nba,1144,995,0,1465339325.0,[NYK] Jeremy Lin,Q-TipResistance,False,False
4n01h7,[Shams Charania] Vertical Sources: Ben Simmons -- projected top pick in 2016 NBA draft -- is nearing agreement on a significant multiyear deal with Nike.,https://twitter.com/ShamsCharania/status/740225317638311937,twitter.com,https://www.reddit.com/r/nba/comments/4n01h7/shams_charania_vertical_sources_ben_simmons/?ref=search_posts,nba,202,132,0,1465347651.0,West,urfaselol,False,False
4mzk0t,KD was hanging out with James Harden,https://www.instagram.com/p/BGSoBHmgYii/,instagram.com,https://www.reddit.com/r/nba/comments/4mzk0t/kd_was_hanging_out_with_james_harden/?ref=search_posts,nba,310,236,0,1465341781.0,,PZinger6,False,False
4n0d5f,Michael Grange: ''Andrew Bogut on risk of getting dunked on while blocking a shot: 'hazard of the job.' He also says young players worried about getting dunked on are part of the 'vine generation; snapchat generation' - won't risk embarrassment.'',https://twitter.com/michaelgrange/status/740240655000211457,twitter.com,https://www.reddit.com/r/nba/comments/4n0d5f/michael_grange_andrew_bogut_on_risk_of_getting/?ref=search_posts,nba,1822,311,0,1465351336.0,Raptors,Go_Habs_Go31,False,False
4myx84,[Lowe] There's nothing that fuels Klay Thompson more than losing and people underestimating his skills,http://espn.go.com/nba/story/_/id/16007209/there-fuels-klay-thompson-more-losing-people-underestimating-skills,espn.go.com,https://www.reddit.com/r/nba/comments/4myx84/lowe_theres_nothing_that_fuels_klay_thompson_more/?ref=search_posts,nba,742,377,0,1465333421.0,Warriors,nwow,False,False
4mzhg3,Would you Blame LeBron if he left Cleveland if the cavs lose this series?,https://www.reddit.com/r/nba/comments/4mzhg3/would_you_blame_lebron_if_he_left_cleveland_if/,self.nba,https://www.reddit.com/r/nba/comments/4mzhg3/would_you_blame_lebron_if_he_left_cleveland_if/?ref=search_posts,nba,1012,1674,0,1465340867.0,[CLE] Kyrie Irving,Pizzaplan3tman,True,False
4n0ebr,"Giannis Antetokounmpo ""Duncan and Kobe my role models""",http://www.eurohoops.net/featured/258212/one-day-were-going-to-win-the-championship,eurohoops.net,https://www.reddit.com/r/nba/comments/4n0ebr/giannis_antetokounmpo_duncan_and_kobe_my_role/?ref=search_posts,nba,321,72,0,1465351678.0,Bucks,LivingHitokiri,False,False
4n07u8,"[Skolnick] Another narrative: Total payroll of 2010-11 Heat that were ""unfair to NBA"": $67M Total payroll of 2015-16 Cavs that ""need more help"": $108M",https://twitter.com/ethanjskolnick/status/740170700908990466,twitter.com,https://www.reddit.com/r/nba/comments/4n07u8/skolnick_another_narrative_total_payroll_of/?ref=search_posts,nba,428,480,0,1465349687.0,Heat,Treasy,False,False
4mz7w5,"Budgeting tool reveals average NBA player spends $42,500/month",http://www.sfchronicle.com/business/networth/article/Tool-helps-show-how-NBA-players-spend-their-cash-7966688.php,sfchronicle.com,https://www.reddit.com/r/nba/comments/4mz7w5/budgeting_tool_reveals_average_nba_player_spends/?ref=search_posts,nba,58,32,0,1465337547.0,,delsolryda,False,False
4mz2sh,Andre Drummond playing cricket at Lords,http://www.skysports.com/cricket/news/12123/10306453/nba-star-andre-drummond-meets-eoin-morgan-and-brendon-mccullum-at-lords,skysports.com,https://www.reddit.com/r/nba/comments/4mz2sh/andre_drummond_playing_cricket_at_lords/?ref=search_posts,nba,121,55,0,1465335603.0,,IAmRobbb,False,False
4n0q26,Thoughts on a couple Toronto Raptors trades,https://www.reddit.com/r/nba/comments/4n0q26/thoughts_on_a_couple_toronto_raptors_trades/,self.nba,https://www.reddit.com/r/nba/comments/4n0q26/thoughts_on_a_couple_toronto_raptors_trades/?ref=search_posts,nba,0,39,0,1465355308.0,Raptors,waswereual,True,False
4n0hf6,"[Lowe Post] Zach talks to ESPN's Brian Windhorst about Cleveland adjustments, traffic, and everything else from the NBA Finals.",http://espn.go.com/espnradio/play?id=16021375,espn.go.com,https://www.reddit.com/r/nba/comments/4n0hf6/lowe_post_zach_talks_to_espns_brian_windhorst/?ref=search_posts,nba,48,28,0,1465352576.0,West,urfaselol,False,False
4n09j5,"[Eddie Sefko] Dirk Nowitzki on opt out: ""Since I felt great, played decent, I might opt out and sign a 2- or 3-year deal. That's prolly the plan for now""",https://twitter.com/ESefko/status/740237342602985473,twitter.com,https://www.reddit.com/r/nba/comments/4n09j5/eddie_sefko_dirk_nowitzki_on_opt_out_since_i_felt/?ref=search_posts,nba,127,64,0,1465350222.0,West,urfaselol,False,False
4n0gon,"If Kevin Love misses game 3 and the Cavs win, how will Cleveland (players and coaches) react?",https://www.reddit.com/r/nba/comments/4n0gon/if_kevin_love_misses_game_3_and_the_cavs_win_how/,self.nba,https://www.reddit.com/r/nba/comments/4n0gon/if_kevin_love_misses_game_3_and_the_cavs_win_how/?ref=search_posts,nba,16,20,0,1465352370.0,Trail Blazers,OldManWillow,True,False
4mzyxd,Six-year workload for LeBron James unlike anything in league history,http://espn.go.com/nba/story/_/id/15877630/six-year-workload-lebron-james-unlike-anything-league-history,espn.go.com,https://www.reddit.com/r/nba/comments/4mzyxd/sixyear_workload_for_lebron_james_unlike_anything/?ref=search_posts,nba,76,35,0,1465346759.0,,hermionedidthework,False,False
4mzmtn,"[Ken Berger | Article] In multi-billion-dollar business of NBA, sleep is the biggest debt - The smart teams, and players, are playing catch-up.",http://www.cbssports.com/nba/news/in-multi-billion-dollar-business-of-nba-sleep-is-the-biggest-debt/,cbssports.com,https://www.reddit.com/r/nba/comments/4mzmtn/ken_berger_article_in_multibilliondollar_business/?ref=search_posts,nba,44,9,0,1465342738.0,West,urfaselol,False,False
4mzj0a,How would the Cavs had matched up with the Thunder?,https://www.reddit.com/r/nba/comments/4mzj0a/how_would_the_cavs_had_matched_up_with_the_thunder/,self.nba,https://www.reddit.com/r/nba/comments/4mzj0a/how_would_the_cavs_had_matched_up_with_the_thunder/?ref=search_posts,nba,8,45,0,1465341463.0,Knicks,NJ_Yankees_Fan,True,False
4n0afn,"[Golliver] Stephen Curry on Zika virus: ""That didn't have a bearing on my decision [to skip Olympics]."" Not enough time to ""get body ready"" for 2016-17",https://twitter.com/BenGolliver/status/740238348556587008,twitter.com,https://www.reddit.com/r/nba/comments/4n0afn/golliver_stephen_curry_on_zika_virus_that_didnt/?ref=search_posts,nba,99,40,0,1465350500.0,[NJN] Vince Carter,VinceBarter,False,False
4mznzn,"[SI, Mahoney] How Stephen Curry, Klay Thompson became the best decoys in basketball",http://www.si.com/nba/2016/06/06/warriors-stephen-curry-klay-thompson-steve-kerr-cavaliers-nba-finals-lebron-james,si.com,https://www.reddit.com/r/nba/comments/4mznzn/si_mahoney_how_stephen_curry_klay_thompson_became/?ref=search_posts,nba,59,20,0,1465343138.0,[MIN] Kevin Garnett,harrisonsmitheyes,False,False
4mz8xg,Who will WIN? In Game 3: GSW vs CAVS (6/8) - 8pm CST,https://www.reddit.com/r/nba/comments/4mz8xg/who_will_win_in_game_3_gsw_vs_cavs_68_8pm_cst/,self.nba,https://www.reddit.com/r/nba/comments/4mz8xg/who_will_win_in_game_3_gsw_vs_cavs_68_8pm_cst/?ref=search_posts,nba,3,30,0,1465337925.0,,MatchThreadStream,True,False
4n0n7k,"Brian Witt: ""Tyronn Lue on Kyrie: ""He has the best handle in the NBA, so he's able to play iso basketball.""""",https://twitter.com/Wittnessed/status/740247365592944640,twitter.com,https://www.reddit.com/r/nba/comments/4n0n7k/brian_witt_tyronn_lue_on_kyrie_he_has_the_best/?ref=search_posts,nba,30,32,0,1465354388.0,[BOS] Paul Pierce,Chancelor_West,False,False
4mzeu6,Will the GS Warriors sweep the Cavs?,https://www.reddit.com/r/nba/comments/4mzeu6/will_the_gs_warriors_sweep_the_cavs/,self.nba,https://www.reddit.com/r/nba/comments/4mzeu6/will_the_gs_warriors_sweep_the_cavs/?ref=search_posts,nba,0,41,0,1465339979.0,Celtics,WhatUp13,True,False
4mz278,Where would you rank Klay Thompson's deep shooting playoffs?,https://www.reddit.com/r/nba/comments/4mz278/where_would_you_rank_klay_thompsons_deep_shooting/,self.nba,https://www.reddit.com/r/nba/comments/4mz278/where_would_you_rank_klay_thompsons_deep_shooting/?ref=search_posts,nba,20,26,0,1465335390.0,[CHI] Horace Grant,theKabides,True,False
4mzy95,"[Tom Haberstroh & Baxter Holmes] With Steph out of Olympics and injuries piling to record-highs, the NBA faces a health crisis. Too many games: The NBA's injury problem is a scheduling one",http://espn.go.com/nba/story/_/id/16009898/nba-injury-problem-scheduling-one,espn.go.com,https://www.reddit.com/r/nba/comments/4mzy95/tom_haberstroh_baxter_holmes_with_steph_out_of/?ref=search_posts,nba,72,29,0,1465346534.0,West,urfaselol,False,False
4n0o46,"If the Cavs lose, Why Would Kevin Durant leave OKC?",https://www.reddit.com/r/nba/comments/4n0o46/if_the_cavs_lose_why_would_kevin_durant_leave_okc/,self.nba,https://www.reddit.com/r/nba/comments/4n0o46/if_the_cavs_lose_why_would_kevin_durant_leave_okc/?ref=search_posts,nba,22,78,0,1465354675.0,,Snickamanx,True,False
4n0lez,NBA Refs Call For an End to L2M Reporting in Written Statement,https://twitter.com/OfficialNBARefs/status/740250612768591872,twitter.com,https://www.reddit.com/r/nba/comments/4n0lez/nba_refs_call_for_an_end_to_l2m_reporting_in/?ref=search_posts,nba,147,84,0,1465353803.0,[POR] Damian Lillard,trazzz123,False,False
4n0sne,"[ESPN] LeBron James: 11 TO last 2 games. Over last 30 years, only player w/ more TO through 2 games of the #NBAFinals is James himself (12 in 2007)",https://twitter.com/ESPNStatsInfo/status/740261233618784256,twitter.com,https://www.reddit.com/r/nba/comments/4n0sne/espn_lebron_james_11_to_last_2_games_over_last_30/?ref=search_posts,nba,168,64,0,1465356133.0,Knicks,mikecuh,False,False
4mzrxh,All-NBA teams based on various stats,https://www.reddit.com/r/nba/comments/4mzrxh/allnba_teams_based_on_various_stats/,self.nba,https://www.reddit.com/r/nba/comments/4mzrxh/allnba_teams_based_on_various_stats/?ref=search_posts,nba,36,35,0,1465344451.0,Raptors,waswereual,True,False
4n0lm7,"[Dave McMenamin] ""Wonder if all these Olympic drop outs will open the door once again for a final Kobe Bryant basketball sendoff in Rio.""",https://twitter.com/mcten/status/740242339139072001,twitter.com,https://www.reddit.com/r/nba/comments/4n0lm7/dave_mcmenamin_wonder_if_all_these_olympic_drop/?ref=search_posts,nba,114,59,0,1465353869.0,Lakers,vulgarswami_,False,False
4n05fh,Who is your all time favorite player and why?,https://www.reddit.com/r/nba/comments/4n05fh/who_is_your_all_time_favorite_player_and_why/,self.nba,https://www.reddit.com/r/nba/comments/4n05fh/who_is_your_all_time_favorite_player_and_why/?ref=search_posts,nba,14,63,0,1465348956.0,[MIN] Kevin Garnett,Neur007,True,False
4n0rug,[Fedor] I fully expect #Cavs to start Richard Jefferson in place of Kevin Love if he's not cleared to return for Game 3 of #NBAFinals,https://twitter.com/ChrisFedor/status/740215878462099458,twitter.com,https://www.reddit.com/r/nba/comments/4n0rug/fedor_i_fully_expect_cavs_to_start_richard/?ref=search_posts,nba,94,57,0,1465355872.0,[GSW] Calbert Cheaney,swollencornholio,False,False
4myhtc,"[Spoiler Alert] NBA Recap: 6/7/16 - The Cavaliers are: getting clobbered, unraveling, spinning their wheels, dead men walking, Iverson steps on Tyronn Lue, Shaq shows up nude, Steph Curry's alleged 'side chick', Highlights, Recaps, Podcasts, and more",https://www.reddit.com/r/nba/comments/4myhtc/spoiler_alert_nba_recap_6716_the_cavaliers_are/,self.nba,https://www.reddit.com/r/nba/comments/4myhtc/spoiler_alert_nba_recap_6716_the_cavaliers_are/?ref=search_posts,nba,116,80,0,1465326271.0,,msaleem,True,False
4n0tpe,[BleacherReport] How the Golden State Warriors Created the Blueprint of a Champion,https://youtu.be/WUuvUqG0kDE,youtu.be,https://www.reddit.com/r/nba/comments/4n0tpe/bleacherreport_how_the_golden_state_warriors/?ref=search_posts,nba,64,41,0,1465356499.0,[MIA] Voshon Lenard,conenubi701,False,False
4n06qa,Who is your least favorite player of all time from your favorite team?,https://www.reddit.com/r/nba/comments/4n06qa/who_is_your_least_favorite_player_of_all_time/,self.nba,https://www.reddit.com/r/nba/comments/4n06qa/who_is_your_least_favorite_player_of_all_time/?ref=search_posts,nba,30,182,0,1465349356.0,Kings,CeJeH,True,False
4n06fh,Was Kobe Bryant the greatest 1 on 1 player of all time?,https://www.reddit.com/r/nba/comments/4n06fh/was_kobe_bryant_the_greatest_1_on_1_player_of_all/,self.nba,https://www.reddit.com/r/nba/comments/4n06fh/was_kobe_bryant_the_greatest_1_on_1_player_of_all/?ref=search_posts,nba,0,117,0,1465349258.0,,heymrsafi,True,False
4mynf3,What makes the Warriors so dominant?,https://www.reddit.com/r/nba/comments/4mynf3/what_makes_the_warriors_so_dominant/,self.nba,https://www.reddit.com/r/nba/comments/4mynf3/what_makes_the_warriors_so_dominant/?ref=search_posts,nba,0,47,0,1465329063.0,Jazz,NudyGobert,True,False
4mzkwb,"""For Kristaps Porzingis' Sake, NY Knicks Shouldn't Trade Carmelo Anthony""",http://bleacherreport.com/articles/2644672-for-kristaps-porzingis-sake-ny-knicks-shouldnt-trade-carmelo-anthony,bleacherreport.com,https://www.reddit.com/r/nba/comments/4mzkwb/for_kristaps_porzingis_sake_ny_knicks_shouldnt/?ref=search_posts,nba,30,21,0,1465342054.0,,tetsuoandkaneda,False,False
4n0334,"Evan Turner: ""In terms of being myself, if you don’t like it you can kiss my ass""",http://nypost.com/2016/06/07/kiss-my-ass-evan-turner-is-nbas-most-interesting-free-agent/,nypost.com,https://www.reddit.com/r/nba/comments/4n0334/evan_turner_in_terms_of_being_myself_if_you_dont/?ref=search_posts,nba,46,21,0,1465348197.0,,delsolryda,False,False
4n0gnq,[Begley] Phil Jackson believes the Knicks are just a couple tweaks in the spacing in its triangle offense to adapt to the modern NBA being a postseason contender.,http://espn.go.com/nba/story/_/id/16018812/phil-jackson-thinks-new-york-knicks-reach-playoffs-weak-eastern-conference,espn.go.com,https://www.reddit.com/r/nba/comments/4n0gnq/begley_phil_jackson_believes_the_knicks_are_just/?ref=search_posts,nba,2,16,0,1465352362.0,West,urfaselol,False,False
4myz01,Anybody know where I can find the NBA documentary about Allen Iverson that aired yesterday ?,https://www.reddit.com/r/nba/comments/4myz01/anybody_know_where_i_can_find_the_nba_documentary/,self.nba,https://www.reddit.com/r/nba/comments/4myz01/anybody_know_where_i_can_find_the_nba_documentary/?ref=search_posts,nba,5,8,0,1465334144.0,[HOU] Clint Capela,Tjthedj122,True,False
4mzr22,Are KD and Russ good friends off the court?,https://www.reddit.com/r/nba/comments/4mzr22/are_kd_and_russ_good_friends_off_the_court/,self.nba,https://www.reddit.com/r/nba/comments/4mzr22/are_kd_and_russ_good_friends_off_the_court/?ref=search_posts,nba,0,29,0,1465344163.0,Bucks,vindura,True,False
4n0p4j,"What is ""winning one for the land"" really accomplishing?",https://www.reddit.com/r/nba/comments/4n0p4j/what_is_winning_one_for_the_land_really/,self.nba,https://www.reddit.com/r/nba/comments/4n0p4j/what_is_winning_one_for_the_land_really/?ref=search_posts,nba,0,51,0,1465354994.0,Knicks,ironickirk,True,False
4n0deg,2015-16 Clutch Highlights,https://youtu.be/CX6xieFUVM8,youtu.be,https://www.reddit.com/r/nba/comments/4n0deg/201516_clutch_highlights/?ref=search_posts,nba,0,10,0,1465351412.0,[HOU] James Harden,GettingLostInDaSauce,False,False
4mzdvu,"Where can I watch ""The Answer""?",https://www.reddit.com/r/nba/comments/4mzdvu/where_can_i_watch_the_answer/,self.nba,https://www.reddit.com/r/nba/comments/4mzdvu/where_can_i_watch_the_answer/?ref=search_posts,nba,10,8,0,1465339679.0,,clouie99,True,False
4n0tov,What' the history of foreign players/playstyle in the NBA?,https://www.reddit.com/r/nba/comments/4n0tov/what_the_history_of_foreign_playersplaystyle_in/,self.nba,https://www.reddit.com/r/nba/comments/4n0tov/what_the_history_of_foreign_playersplaystyle_in/?ref=search_posts,nba,3,15,0,1465356493.0,Bucks,Joetommy33,True,False
4mymc2,Who would you put on Team USA if you could force any player to go?,https://www.reddit.com/r/nba/comments/4mymc2/who_would_you_put_on_team_usa_if_you_could_force/,self.nba,https://www.reddit.com/r/nba/comments/4mymc2/who_would_you_put_on_team_usa_if_you_could_force/?ref=search_posts,nba,2,27,0,1465328530.0,Warriors,manisier,True,False
4mza2o,Could the warriors bench make the playoffs in the east?,https://www.reddit.com/r/nba/comments/4mza2o/could_the_warriors_bench_make_the_playoffs_in_the/,self.nba,https://www.reddit.com/r/nba/comments/4mza2o/could_the_warriors_bench_make_the_playoffs_in_the/?ref=search_posts,nba,0,34,0,1465338357.0,,jdl34,True,False
4mzysi,2016 NBA Finals Game 2 Heard Around The World,https://youtu.be/cnj0nxujrj4,youtu.be,https://www.reddit.com/r/nba/comments/4mzysi/2016_nba_finals_game_2_heard_around_the_world/?ref=search_posts,nba,5,0,0,1465346713.0,,blazinflames666,False,False
4myxt9,"If GSW sweeps the Cavs in dominant fashion, do you think this may help and expedite consideration by the league to restructure playoff seeding?",https://www.reddit.com/r/nba/comments/4myxt9/if_gsw_sweeps_the_cavs_in_dominant_fashion_do_you/,self.nba,https://www.reddit.com/r/nba/comments/4myxt9/if_gsw_sweeps_the_cavs_in_dominant_fashion_do_you/?ref=search_posts,nba,0,29,0,1465333660.0,[LAL] Kobe Bryant,SkoivanSchiem,True,False
4n0boj,[SERIOUS] How can CLE start winning some games in this Finals series? Let's hear some legit strategies.,https://www.reddit.com/r/nba/comments/4n0boj/serious_how_can_cle_start_winning_some_games_in/,self.nba,https://www.reddit.com/r/nba/comments/4n0boj/serious_how_can_cle_start_winning_some_games_in/?ref=search_posts,nba,0,27,0,1465350891.0,Raptors,PistolPeteWouldLose,True,False
4n0es4,Should Mozgov get more minutes vs Golden State?,https://www.reddit.com/r/nba/comments/4n0es4/should_mozgov_get_more_minutes_vs_golden_state/,self.nba,https://www.reddit.com/r/nba/comments/4n0es4/should_mozgov_get_more_minutes_vs_golden_state/?ref=search_posts,nba,4,8,0,1465351816.0,[BOS] Marcus Smart,Fozzy24,True,False
4myp77,Stupid question because I don't know where to post this: can you remove the Kia logo on the asg jerseys?,https://www.reddit.com/r/nba/comments/4myp77/stupid_question_because_i_dont_know_where_to_post/,self.nba,https://www.reddit.com/r/nba/comments/4myp77/stupid_question_because_i_dont_know_where_to_post/?ref=search_posts,nba,1,5,0,1465329905.0,[WAS] John Wall,ninenyan9,True,False
4n0lw7,Is LeBron done winning championships?,https://www.reddit.com/r/nba/comments/4n0lw7/is_lebron_done_winning_championships/,self.nba,https://www.reddit.com/r/nba/comments/4n0lw7/is_lebron_done_winning_championships/?ref=search_posts,nba,0,59,0,1465353959.0,Lakers,bhargavat,True,False
4mzy07,"Given the way the modern NBA has started to quantify and value defense, will we see players make the Hall of Fame purely based on their defensive ability rather than their offense?",https://www.reddit.com/r/nba/comments/4mzy07/given_the_way_the_modern_nba_has_started_to/,self.nba,https://www.reddit.com/r/nba/comments/4mzy07/given_the_way_the_modern_nba_has_started_to/?ref=search_posts,nba,1,10,0,1465346450.0,Rockets,pdking5000,True,False
4mzya7,How do the Cavaliers recover from two epic stinkers?,http://theundefeated.com/features/the-only-thing-to-fear-is-playing-like-that-again/,theundefeated.com,https://www.reddit.com/r/nba/comments/4mzya7/how_do_the_cavaliers_recover_from_two_epic/?ref=search_posts,nba,2,13,0,1465346544.0,,KalEl1232,False,False
4mzdoi,"Dwane Casey, Raptors confirm new deal - CBC Sports - Basketball",http://www.cbc.ca/sports/basketball/nba/dwane-casey-raptors-1.3619820,cbc.ca,https://www.reddit.com/r/nba/comments/4mzdoi/dwane_casey_raptors_confirm_new_deal_cbc_sports/?ref=search_posts,nba,11,4,0,1465339609.0,Trust The Process,tde12,False,False
4n0xmu,"[SI, Jenkins] The birth of the Warriors' death lineup - examines start of mainstream analytics/Mark Cuban's stats professor",http://www.si.com/nba/2016/06/07/golden-state-warriors-death-lineup-nba-finals-cleveland-cavaliers,si.com,https://www.reddit.com/r/nba/comments/4n0xmu/si_jenkins_the_birth_of_the_warriors_death_lineup/?ref=search_posts,nba,0,3,0,1465357736.0,Lakers,dietcokewLime,False,False
4mzzk8,How Ayesha Curry is proving she's more than just Steph Curry's wife,http://espn.go.com/espnw/culture/feature/article/16002785/ayesha-curry-exclusive-interview-having-fun-proving-people-wrong,espn.go.com,https://www.reddit.com/r/nba/comments/4mzzk8/how_ayesha_curry_is_proving_shes_more_than_just/?ref=search_posts,nba,0,45,0,1465346989.0,,msaleem,False,False
4n00fz,Inside the Warriors' Blueprint: The Historic Construction of an NBA Champion,http://bleacherreport.com/articles/2644802-inside-the-warriors-blueprint-the-historic-construction-of-an-nba-champion,bleacherreport.com,https://www.reddit.com/r/nba/comments/4n00fz/inside_the_warriors_blueprint_the_historic/?ref=search_posts,nba,2,0,0,1465347283.0,,msaleem,False,False
4mzhn2,ESPN First Take - Mychal Thompson on The Warriors,https://www.youtube.com/watch?v=AuOBKIxMuUo,youtube.com,https://www.reddit.com/r/nba/comments/4mzhn2/espn_first_take_mychal_thompson_on_the_warriors/?ref=search_posts,nba,0,5,0,1465340943.0,Warriors,inmyrhyme,False,False
4mziik,ESPN First Take - Magic Johnson on Splash Brothers Vs Showtime Lakers Team,https://www.youtube.com/watch?v=TzImtkBif2E,youtube.com,https://www.reddit.com/r/nba/comments/4mziik/espn_first_take_magic_johnson_on_splash_brothers/?ref=search_posts,nba,0,4,0,1465341272.0,Warriors,inmyrhyme,False,False
4n0g42,When NBA began to have play-by-play reports and plus/minus stats?,https://www.reddit.com/r/nba/comments/4n0g42/when_nba_began_to_have_playbyplay_reports_and/,self.nba,https://www.reddit.com/r/nba/comments/4n0g42/when_nba_began_to_have_playbyplay_reports_and/?ref=search_posts,nba,3,0,0,1465352205.0,[LAL] James Worthy,defensive_hexagon,True,False
