id,title,url,domain,permalink,subreddit,score,num_comments,gilded,created,author_flair_text,author,is_self,over_18
4n2h91,If it wasn't for Ximo I would'nt be able to keep in touch with the NBA games & interviews. It actually saddens me seeing his 5th youtube account being taken down by NBA when he is providing us with far more content than NBA official is.,https://www.reddit.com/r/nba/comments/4n2h91/if_it_wasnt_for_ximo_i_wouldnt_be_able_to_keep_in/,self.nba,https://www.reddit.com/r/nba/comments/4n2h91/if_it_wasnt_for_ximo_i_wouldnt_be_able_to_keep_in/?ref=search_posts,nba,3128,251,0,1465377024.0,Warriors,CmenDmen123,True,False
4n30zm,"[Shaq]2001 Lakers would have beaten this Warriors. ""If you're using those rules, we'd win. Now we use these rules these days, we'd still win, because you wouldn't be allowed to touch me, you wouldn't be allowed to touch Kobe.""",http://hosted.ap.org/dynamic/stories/B/BKN_NBA_FINALS_SHAQ_SPEAKS?SITE=AP&SECTION=HOME&TEMPLATE=DEFAULT&CTIME=2016-06-07-03-02-11,hosted.ap.org,https://www.reddit.com/r/nba/comments/4n30zm/shaq2001_lakers_would_have_beaten_this_warriors/?ref=search_posts,nba,1809,1858,0,1465384825.0,Pistons,Shelocksme,False,False
4n2njk,Phil Jackson: LeBron needs to take over like Jordan,http://www.foxsports.com/nba/story/lebron-james-phil-jackson-michael-jordan-0-2-nba-finals-cleveland-cavaliers-chicago-bulls-060716,foxsports.com,https://www.reddit.com/r/nba/comments/4n2njk/phil_jackson_lebron_needs_to_take_over_like_jordan/?ref=search_posts,nba,348,885,0,1465379473.0,,PZinger6,False,False
4n18f5,"[MacMahon] Mark Cuban on contract talks with Dirk Nowitzki: ""Dirk gets to do whatever he wants to do. Period.""",https://twitter.com/espn_macmahon/status/740283104393187329,twitter.com,https://www.reddit.com/r/nba/comments/4n18f5/macmahon_mark_cuban_on_contract_talks_with_dirk/?ref=search_posts,nba,1164,222,0,1465361151.0,Mavericks,gigantism,False,False
4n1qpd,"[Kennedy] The Brooklyn Nets and New York Knicks are each aggressively trying to acquire at least one pick in the 2016 NBA Draft, per sources.",https://twitter.com/alexkennedynba/status/740298307193450496,twitter.com,https://www.reddit.com/r/nba/comments/4n1qpd/kennedy_the_brooklyn_nets_and_new_york_knicks_are/?ref=search_posts,nba,201,166,0,1465367196.0,Raptors,TrillTaskforce,False,False
4n1ka1,[Reuters] BREAKING: Oklahoma City police say inquiry finds no evidence pointing to a suicide by oilman and Oklahoma City Thunder Owner Aubrey McClendon,https://twitter.com/ReutersBiz/status/740299275490500608,twitter.com,https://www.reddit.com/r/nba/comments/4n1ka1/reuters_breaking_oklahoma_city_police_say_inquiry/?ref=search_posts,nba,311,99,0,1465364999.0,West,urfaselol,False,False
4n1ase,"[Windhorst] This post season, the Cavs have had four games in which they ran 20 or more isolation plays. These games are the four games they've lost this post season.",https://www.reddit.com/r/nba/comments/4n1ase/windhorst_this_post_season_the_cavs_have_had_four/,self.nba,https://www.reddit.com/r/nba/comments/4n1ase/windhorst_this_post_season_the_cavs_have_had_four/?ref=search_posts,nba,327,74,0,1465361883.0,Cavaliers,I_cut_my_own_jib,True,False
4n221k,"It saddens to report Sixers assistant coach & ex-NBA center Sean Rooks, 46, passed away in Philadelphia today, sources told @TheUndefeated.",https://twitter.com/MarcJSpearsESPN/status/740325212525367296,twitter.com,https://www.reddit.com/r/nba/comments/4n221k/it_saddens_to_report_sixers_assistant_coach_exnba/?ref=search_posts,nba,1160,127,0,1465371318.0,Celtics,jcarmona24,False,False
4n1eq0,"Mark Cuban: ""We won't trade a future pick unless there is a deal good enough that they would fire the other general manager for making.""",https://twitter.com/espn_macmahon/status/740291389968113664,twitter.com,https://www.reddit.com/r/nba/comments/4n1eq0/mark_cuban_we_wont_trade_a_future_pick_unless/?ref=search_posts,nba,660,78,0,1465363192.0,Knicks,HaruSoul,False,False
4n2r8q,"Lowest price at Quicken Loans Arena, $199; at Oracle, $519",https://instagram.com/p/BGYD7CwjBtQ/,instagram.com,https://www.reddit.com/r/nba/comments/4n2r8q/lowest_price_at_quicken_loans_arena_199_at_oracle/?ref=search_posts,nba,427,363,0,1465380905.0,,4for5,False,False
4n382p,The fan who was ejected from the ECF game was shot and killed today.,http://www.theprovince.com/touch/news/crime/former+metro+vancouver+gangster+shot+death+toronto/11971168/story.html?rel=838332,theprovince.com,https://www.reddit.com/r/nba/comments/4n382p/the_fan_who_was_ejected_from_the_ecf_game_was/?ref=search_posts,nba,803,500,0,1465387867.0,Raptors,Gage101,False,False
4n2ppk,"In a first for professional sports, the NBA unveiled Tuesday a line of T-shirts with the logo of all 30 NBA teams colored in rainbow for Pride Month.",https://www.washingtonpost.com/news/early-lead/wp/2016/06/07/nba-team-logos-get-rainbow-treatment-with-new-line-of-lgbt-pride-month-shirts/,washingtonpost.com,https://www.reddit.com/r/nba/comments/4n2ppk/in_a_first_for_professional_sports_the_nba/?ref=search_posts,nba,319,174,0,1465380287.0,,4for5,False,False
4n2lcu,Somber Stat: Eric Piatkowski played for the Clippers from 1994-2003. Six of his Clipper teammates have already passed away at a young age,https://www.reddit.com/r/nba/comments/4n2lcu/somber_stat_eric_piatkowski_played_for_the/,self.nba,https://www.reddit.com/r/nba/comments/4n2lcu/somber_stat_eric_piatkowski_played_for_the/?ref=search_posts,nba,303,69,0,1465378626.0,[NYK] Qyntel Woods,Blacramento,True,False
4n2ynl,How is LeBron seen in Miami?,https://www.reddit.com/r/nba/comments/4n2ynl/how_is_lebron_seen_in_miami/,self.nba,https://www.reddit.com/r/nba/comments/4n2ynl/how_is_lebron_seen_in_miami/?ref=search_posts,nba,15,51,0,1465383845.0,Warriors,49_Giants,True,False
4n2o29,Ranking the TOP 10 NBA POINT GUARDS Entering Next Season.,https://www.reddit.com/r/nba/comments/4n2o29/ranking_the_top_10_nba_point_guards_entering_next/,self.nba,https://www.reddit.com/r/nba/comments/4n2o29/ranking_the_top_10_nba_point_guards_entering_next/?ref=search_posts,nba,12,136,0,1465379662.0,[SAC] DeMarcus Cousins,KayJayA7X,True,False
4n1yny,Who are the top five players on your current team? (in order),https://www.reddit.com/r/nba/comments/4n1yny/who_are_the_top_five_players_on_your_current_team/,self.nba,https://www.reddit.com/r/nba/comments/4n1yny/who_are_the_top_five_players_on_your_current_team/?ref=search_posts,nba,10,70,0,1465370108.0,Pacers,AmadeusCrumb,True,False
4n35jo,"Leandro Barbosa (GSW), Luke Walton (GSW), and James Jones (CLE) were drafted on the same year as Lebron",https://www.reddit.com/r/nba/comments/4n35jo/leandro_barbosa_gsw_luke_walton_gsw_and_james/,self.nba,https://www.reddit.com/r/nba/comments/4n35jo/leandro_barbosa_gsw_luke_walton_gsw_and_james/?ref=search_posts,nba,196,62,0,1465386765.0,Suns,petshop87,True,False
4n2zs2,Where do you think the '11 draft will end up all time?,https://www.reddit.com/r/nba/comments/4n2zs2/where_do_you_think_the_11_draft_will_end_up_all/,self.nba,https://www.reddit.com/r/nba/comments/4n2zs2/where_do_you_think_the_11_draft_will_end_up_all/?ref=search_posts,nba,2,78,0,1465384333.0,Spurs,kcheng686,True,False
4n2ppa,2015-16 Warriors vs 2012-13 Miami Heat,https://www.reddit.com/r/nba/comments/4n2ppa/201516_warriors_vs_201213_miami_heat/,self.nba,https://www.reddit.com/r/nba/comments/4n2ppa/201516_warriors_vs_201213_miami_heat/?ref=search_posts,nba,16,34,0,1465380282.0,,raptorsin7,True,False
4n398u,"Sign of the times -- Guys Who've Made More 3-Pointers than Larry Bird -- Marcus Thorton, DJ Augustin, Charlie Villanueva, Kirk Hinrich, Gerald Green, Ray Felton, Martell Webster, Rasual Butler and Randy Foye",https://www.reddit.com/r/nba/comments/4n398u/sign_of_the_times_guys_whove_made_more_3pointers/,self.nba,https://www.reddit.com/r/nba/comments/4n398u/sign_of_the_times_guys_whove_made_more_3pointers/?ref=search_posts,nba,239,62,0,1465388358.0,NBA,SuhMachineGun,True,False
4n2dpn,Which player are you surprised to find out hasn't made an All-Star team before?,https://www.reddit.com/r/nba/comments/4n2dpn/which_player_are_you_surprised_to_find_out_hasnt/,self.nba,https://www.reddit.com/r/nba/comments/4n2dpn/which_player_are_you_surprised_to_find_out_hasnt/?ref=search_posts,nba,12,32,0,1465375651.0,Knicks,Alexei_Kovalev_GOAT,True,False
4n29ym,"UNINTERRUPTED on Twitter: ""UNINTERRUPTED Exclusive: @BenSimmons25 announces he will be part of the @Nike family.""",https://twitter.com/uninterrupted/status/740299537177157634,twitter.com,https://www.reddit.com/r/nba/comments/4n29ym/uninterrupted_on_twitter_uninterrupted_exclusive/?ref=search_posts,nba,23,21,0,1465374213.0,Warriors Bandwagon,DAngeloHustle,False,False
4n3ok0,Report: Carmelo Anthony says Knicks’ situation “not that bad”,http://nba.nbcsports.com/2016/06/08/report-carmelo-anthony-says-knicks-situation-not-that-bad/?utm_source=dlvr.it&utm_medium=twitter,nba.nbcsports.com,https://www.reddit.com/r/nba/comments/4n3ok0/report_carmelo_anthony_says_knicks_situation_not/?ref=search_posts,nba,57,64,0,1465396042.0,Knicks,jondavidbrooks,False,False
4n1ad3,[Dave McMenamin] Source close to Kobe Bryant shot down the idea of a last Olympics hurrah in Rio for KB. So much for that. The 60 exit will stand.,https://twitter.com/mcten/status/740273343161454592,twitter.com,https://www.reddit.com/r/nba/comments/4n1ad3/dave_mcmenamin_source_close_to_kobe_bryant_shot/?ref=search_posts,nba,50,12,0,1465361763.0,West,urfaselol,False,False
4n2r9e,What are your favorite highlights of your favorite player?,https://www.reddit.com/r/nba/comments/4n2r9e/what_are_your_favorite_highlights_of_your/,self.nba,https://www.reddit.com/r/nba/comments/4n2r9e/what_are_your_favorite_highlights_of_your/?ref=search_posts,nba,40,51,0,1465380911.0,Wizards,AnalSlutFrog,True,False
4n2ij6,"Hours after Knicks interview, Sean Rooks passes away",https://twitter.com/wojverticalnba/status/740352126249881600,twitter.com,https://www.reddit.com/r/nba/comments/4n2ij6/hours_after_knicks_interview_sean_rooks_passes/?ref=search_posts,nba,58,9,0,1465377526.0,,BrontoPronto,False,False
4n1cju,The Unicorn - Kristaps Porzingis and the small ball revolution [OC] - wall of text/streamable warning,https://www.reddit.com/r/nba/comments/4n1cju/the_unicorn_kristaps_porzingis_and_the_small_ball/,self.nba,https://www.reddit.com/r/nba/comments/4n1cju/the_unicorn_kristaps_porzingis_and_the_small_ball/?ref=search_posts,nba,215,33,0,1465362470.0,Knicks,cyph3x,True,False
4n3f73,What are some of the best instances of college teammates reuniting in the NBA?,https://www.reddit.com/r/nba/comments/4n3f73/what_are_some_of_the_best_instances_of_college/,self.nba,https://www.reddit.com/r/nba/comments/4n3f73/what_are_some_of_the_best_instances_of_college/?ref=search_posts,nba,20,41,0,1465391148.0,[HOU] Yao Ming,_rajivvv,True,False
4n28lw,[Ryan Hollins] Will play for food #basketball,https://twitter.com/theryanhollins/status/740312909436178432,twitter.com,https://www.reddit.com/r/nba/comments/4n28lw/ryan_hollins_will_play_for_food_basketball/?ref=search_posts,nba,85,17,0,1465373696.0,Kings,4everpurple,False,False
4n2awz,Parsons practicing with D-Rose,https://www.instagram.com/p/BGXdxMIHseb/?taken-by=chandlerparsons,instagram.com,https://www.reddit.com/r/nba/comments/4n2awz/parsons_practicing_with_drose/?ref=search_posts,nba,20,16,0,1465374570.0,Pistons,dodd1331,False,False
4n3ckd,"Keith Pompey :A league scout on Richardson's workout: ""Phenomenal. It looked like last year's Porzingis workout. I'm hearing he's going in the Top 10.""",https://twitter.com/PompeyOnSixers/status/740268928245465089,twitter.com,https://www.reddit.com/r/nba/comments/4n3ckd/keith_pompey_a_league_scout_on_richardsons/?ref=search_posts,nba,14,30,0,1465389892.0,,teritore,False,False
4n26zi,Why do people blame scheduling for the escalating rate of NBA injuries when the schedule hasn't changed for almost 50 years?,https://www.reddit.com/r/nba/comments/4n26zi/why_do_people_blame_scheduling_for_the_escalating/,self.nba,https://www.reddit.com/r/nba/comments/4n26zi/why_do_people_blame_scheduling_for_the_escalating/?ref=search_posts,nba,82,39,0,1465373119.0,Suns,finchdad,True,False
4n3790,Not everyone is a sports fan,http://www.sfchronicle.com/entertainment/article/Not-everyone-is-a-sports-fan-7964806.php?t=67a72908921210a92f&cmpid=fb-premium,sfchronicle.com,https://www.reddit.com/r/nba/comments/4n3790/not_everyone_is_a_sports_fan/?ref=search_posts,nba,25,12,0,1465387497.0,,cinemaf1le,False,False
4n30uh,Amar’e Stoudemire Is Igniting a Fast Break for Emerging Art in the NBA,https://www.artsy.net/artsyeditorial1580,artsy.net,https://www.reddit.com/r/nba/comments/4n30uh/amare_stoudemire_is_igniting_a_fast_break_for/?ref=search_posts,nba,30,7,0,1465384772.0,Lakers,lope5,False,False
4n1ywi,"Why don't the Cavs and Dan Gilbert get criticized for using up a 1st round pick for cap relief, during LeBron's prime?",https://www.reddit.com/r/nba/comments/4n1ywi/why_dont_the_cavs_and_dan_gilbert_get_criticized/,self.nba,https://www.reddit.com/r/nba/comments/4n1ywi/why_dont_the_cavs_and_dan_gilbert_get_criticized/?ref=search_posts,nba,0,66,0,1465370197.0,[LAL] Luke Walton,rjvir,True,False
4n2acx,[Wojnarowski | Article] Embarrassed Cavs looking more and more like NBA's Buffalo Bills,http://sports.yahoo.com/news/embarrassed-cavs-looking-more-and-more-like-nba-s-buffalo-bills-074727428.html,sports.yahoo.com,https://www.reddit.com/r/nba/comments/4n2acx/wojnarowski_article_embarrassed_cavs_looking_more/?ref=search_posts,nba,158,88,0,1465374369.0,West,urfaselol,False,False
4n293f,"Kevin Durant VS The truth in his prime, Who's on your team",https://www.reddit.com/r/nba/comments/4n293f/kevin_durant_vs_the_truth_in_his_prime_whos_on/,self.nba,https://www.reddit.com/r/nba/comments/4n293f/kevin_durant_vs_the_truth_in_his_prime_whos_on/?ref=search_posts,nba,0,71,0,1465373874.0,Celtics,falseprophet9,True,False
4n3wqx,This is the first time since 2008 LeBron James has been down 0-2 in a playoff series. He went 10-6 the previous four times he fell behind 0-2.,https://www.reddit.com/r/nba/comments/4n3wqx/this_is_the_first_time_since_2008_lebron_james/,self.nba,https://www.reddit.com/r/nba/comments/4n3wqx/this_is_the_first_time_since_2008_lebron_james/?ref=search_posts,nba,18,24,0,1465400827.0,,BearsNecessity,True,False
4n21bj,"Who was the most overpaid player in the league this past season, not accounting for injuries?",https://www.reddit.com/r/nba/comments/4n21bj/who_was_the_most_overpaid_player_in_the_league/,self.nba,https://www.reddit.com/r/nba/comments/4n21bj/who_was_the_most_overpaid_player_in_the_league/?ref=search_posts,nba,40,108,0,1465371060.0,Spurs,danielbauer1375,True,False
4n226m,What happened to LeBron's secret motivation?,https://www.reddit.com/r/nba/comments/4n226m/what_happened_to_lebrons_secret_motivation/,self.nba,https://www.reddit.com/r/nba/comments/4n226m/what_happened_to_lebrons_secret_motivation/?ref=search_posts,nba,30,36,0,1465371364.0,[WAS] Otto Porter,Ehjookayted,True,False
4n2sry,How to pronounce Tyronn Lue?,https://www.reddit.com/r/nba/comments/4n2sry/how_to_pronounce_tyronn_lue/,self.nba,https://www.reddit.com/r/nba/comments/4n2sry/how_to_pronounce_tyronn_lue/?ref=search_posts,nba,5,38,0,1465381515.0,Heat,tft7178,True,False
4n3ku9,What type of money do you think Roy Hibbert will demand in FA?,https://www.reddit.com/r/nba/comments/4n3ku9/what_type_of_money_do_you_think_roy_hibbert_will/,self.nba,https://www.reddit.com/r/nba/comments/4n3ku9/what_type_of_money_do_you_think_roy_hibbert_will/?ref=search_posts,nba,11,32,0,1465394016.0,[LAL] Luke Walton,Wateriswet1212,True,False
4n38iv,What are some predictions you were dead wrong about,https://www.reddit.com/r/nba/comments/4n38iv/what_are_some_predictions_you_were_dead_wrong/,self.nba,https://www.reddit.com/r/nba/comments/4n38iv/what_are_some_predictions_you_were_dead_wrong/?ref=search_posts,nba,49,169,0,1465388045.0,Pistons,agentAI,True,False
4n2iro,Boston Big Three Reunion @tic_pix,https://www.instagram.com/p/BGX6eyJlbHA/?taken-by=tic_pix,instagram.com,https://www.reddit.com/r/nba/comments/4n2iro/boston_big_three_reunion_tic_pix/?ref=search_posts,nba,89,29,0,1465377615.0,[TOR] Kyle Lowry,borsalino12,False,False
4n1jc1,(The Ringer) What's the Worst Team USA Roster Than Could Still Win Gold?,https://theringer.com/alternate-starting-fives-for-team-usa-olympic-basketball-1820a4216b64#.oa54ipv4v,theringer.com,https://www.reddit.com/r/nba/comments/4n1jc1/the_ringer_whats_the_worst_team_usa_roster_than/?ref=search_posts,nba,65,47,0,1465364705.0,,JAYG567,False,False
4n2mwh,The Key For The Cavaliers: Get Steph Curry On LeBron James,https://www.youtube.com/watch?v=F8fV9DFkJ_A,youtube.com,https://www.reddit.com/r/nba/comments/4n2mwh/the_key_for_the_cavaliers_get_steph_curry_on/?ref=search_posts,nba,12,20,0,1465379224.0,[GSW] Draymond Green,inspyral,False,False
4n1jy8,Source: Love optimistic he'll return for Game 3,http://espn.go.com/nba/story/_/id/16021025/kevin-love-cleveland-cavaliers-optimistic-play-game-3-nba-finals,espn.go.com,https://www.reddit.com/r/nba/comments/4n1jy8/source_love_optimistic_hell_return_for_game_3/?ref=search_posts,nba,22,18,0,1465364895.0,Trail Blazers,burninator3343,False,False
4n2ufa,Stephen Curry Is Chewing His Mouthguard Even More,http://www.wsj.com/articles/stephen-curry-is-chewing-his-mouthguard-even-more-1465333957,wsj.com,https://www.reddit.com/r/nba/comments/4n2ufa/stephen_curry_is_chewing_his_mouthguard_even_more/?ref=search_posts,nba,0,36,0,1465382170.0,,Imnottheassman,False,False
4n2yla,Jabari Parker or Andrew Wiggins,https://www.reddit.com/r/nba/comments/4n2yla/jabari_parker_or_andrew_wiggins/,self.nba,https://www.reddit.com/r/nba/comments/4n2yla/jabari_parker_or_andrew_wiggins/?ref=search_posts,nba,0,28,0,1465383816.0,[LAL] Luke Walton,rjvir,True,False
4n2rh2,USA men's basketball managing director Jerry Colangelo wants Mike Krzyzewski to succeed him,http://espn.go.com/olympics/story/_/id/16025537/usa-men-basketball-managing-director-jerry-colangelo-wants-mike-krzyzewski-succeed-him,espn.go.com,https://www.reddit.com/r/nba/comments/4n2rh2/usa_mens_basketball_managing_director_jerry/?ref=search_posts,nba,14,9,0,1465380991.0,Cavaliers,mpholt,False,False
4n30u6,How can an overseas visitor buy NBA Tickets through Flash Seats?,https://www.reddit.com/r/nba/comments/4n30u6/how_can_an_overseas_visitor_buy_nba_tickets/,self.nba,https://www.reddit.com/r/nba/comments/4n30u6/how_can_an_overseas_visitor_buy_nba_tickets/?ref=search_posts,nba,6,3,0,1465384770.0,,thebitisharecoming,True,False
4n33i9,Cap Space and the likelihood of landing Harrison Barnes,https://www.reddit.com/r/nba/comments/4n33i9/cap_space_and_the_likelihood_of_landing_harrison/,self.nba,https://www.reddit.com/r/nba/comments/4n33i9/cap_space_and_the_likelihood_of_landing_harrison/?ref=search_posts,nba,1,23,0,1465385883.0,[GSW] Klay Thompson,stephcurrysmom,True,False
4n1nkc,Something that's understated about Curry's ability to get quick shots off and dribble past defenders is his excellent posture,https://www.reddit.com/r/nba/comments/4n1nkc/something_thats_understated_about_currys_ability/,self.nba,https://www.reddit.com/r/nba/comments/4n1nkc/something_thats_understated_about_currys_ability/?ref=search_posts,nba,23,8,0,1465366107.0,76ers,DariosDentist,True,False
4n3tf8,Why doesn't LeBron take a min contract like Brady?,https://www.reddit.com/r/nba/comments/4n3tf8/why_doesnt_lebron_take_a_min_contract_like_brady/,self.nba,https://www.reddit.com/r/nba/comments/4n3tf8/why_doesnt_lebron_take_a_min_contract_like_brady/?ref=search_posts,nba,0,40,0,1465398843.0,Bulls,Give_me_an_M3,True,False
4n1602,What's the most number of games that we can in the regular season can have so that every game matters?,https://www.reddit.com/r/nba/comments/4n1602/whats_the_most_number_of_games_that_we_can_in_the/,self.nba,https://www.reddit.com/r/nba/comments/4n1602/whats_the_most_number_of_games_that_we_can_in_the/?ref=search_posts,nba,2,14,0,1465360356.0,,bluedingoblood,True,False
4n2k8k,[OC] 2016 NBA Mock Draft round-up (June 7th edition),https://docs.google.com/spreadsheets/d/1ihgb74y7wnGblVEV6oxQ4Y2qG6V5qUk-4cdYB9jTTrI/edit?usp=sharing,docs.google.com,https://www.reddit.com/r/nba/comments/4n2k8k/oc_2016_nba_mock_draft_roundup_june_7th_edition/?ref=search_posts,nba,19,10,0,1465378205.0,[DET] Reggie Jackson,El-Random,False,False
4n2bpi,Random question: T.Thompson and Noel v 2014 Duncan and Splitter,https://www.reddit.com/r/nba/comments/4n2bpi/random_question_tthompson_and_noel_v_2014_duncan/,self.nba,https://www.reddit.com/r/nba/comments/4n2bpi/random_question_tthompson_and_noel_v_2014_duncan/?ref=search_posts,nba,0,10,0,1465374880.0,,mwmiller93,True,False
4n36cd,Best option to watch the game the next morning?,https://www.reddit.com/r/nba/comments/4n36cd/best_option_to_watch_the_game_the_next_morning/,self.nba,https://www.reddit.com/r/nba/comments/4n36cd/best_option_to_watch_the_game_the_next_morning/?ref=search_posts,nba,14,7,0,1465387106.0,NBA,Jimmy_Pesto_,True,False
4n16yr,The cutting edge: Injury prediction and prevention,http://espn.go.com/nba/story/_/id/16009403/cutting-edge-injury-prediction-prevention,espn.go.com,https://www.reddit.com/r/nba/comments/4n16yr/the_cutting_edge_injury_prediction_and_prevention/?ref=search_posts,nba,6,0,0,1465360688.0,,msaleem,False,False
4n2dck,Shaq lip sync battle,http://youtu.be/jHheBBA7zWc,youtu.be,https://www.reddit.com/r/nba/comments/4n2dck/shaq_lip_sync_battle/?ref=search_posts,nba,3,2,0,1465375501.0,Lakers,SupaZT,False,False
4n21ke,"Jerry West defends LeBron James - ""It's hard for me to believe that someone doesn't recognize his greatness""",http://espn.go.com/nba/playoffs/2016/story/_/id/15956952/jerry-west-defends-nba-finals-record-lebron-james,espn.go.com,https://www.reddit.com/r/nba/comments/4n21ke/jerry_west_defends_lebron_james_its_hard_for_me/?ref=search_posts,nba,21,11,0,1465371146.0,Cavaliers,Terduckenn,False,False
4n3w0m,"With all of these old greats coming out and comparing their teams favorably against the Warriors, I find it interesting that I have not seen anything from the 96 bulls on the subject besides that great circle dance us/we quote from Kerr.",https://www.reddit.com/r/nba/comments/4n3w0m/with_all_of_these_old_greats_coming_out_and/,self.nba,https://www.reddit.com/r/nba/comments/4n3w0m/with_all_of_these_old_greats_coming_out_and/?ref=search_posts,nba,0,21,0,1465400361.0,Warriors,Rakulon,True,False
4n20jl,Why is the Finals dragged out for over 2 weeks?,https://www.reddit.com/r/nba/comments/4n20jl/why_is_the_finals_dragged_out_for_over_2_weeks/,self.nba,https://www.reddit.com/r/nba/comments/4n20jl/why_is_the_finals_dragged_out_for_over_2_weeks/?ref=search_posts,nba,0,29,0,1465370794.0,Spurs,ztejas,True,False
4n1nx9,If Ingram shines on the us select team,https://www.reddit.com/r/nba/comments/4n1nx9/if_ingram_shines_on_the_us_select_team/,self.nba,https://www.reddit.com/r/nba/comments/4n1nx9/if_ingram_shines_on_the_us_select_team/?ref=search_posts,nba,0,19,0,1465366218.0,[PHI] Allen Iverson,McKie4Three,True,False
4n2iwx,Will/should D'antoni make Harden the point guard of the Rockets?,https://www.reddit.com/r/nba/comments/4n2iwx/willshould_dantoni_make_harden_the_point_guard_of/,self.nba,https://www.reddit.com/r/nba/comments/4n2iwx/willshould_dantoni_make_harden_the_point_guard_of/?ref=search_posts,nba,4,18,0,1465377676.0,,MomChomsky,True,False
4n3exo,Daily Sidebar Image Selection Thread (2016.06.08),https://www.reddit.com/r/nba/comments/4n3exo/daily_sidebar_image_selection_thread_20160608/,self.nba,https://www.reddit.com/r/nba/comments/4n3exo/daily_sidebar_image_selection_thread_20160608/?ref=search_posts,nba,9,3,0,1465391016.0,,AutoModerator,True,False
4n1rvg,Can we put an end to this bullshit narrative?,https://www.reddit.com/r/nba/comments/4n1rvg/can_we_put_an_end_to_this_bullshit_narrative/,self.nba,https://www.reddit.com/r/nba/comments/4n1rvg/can_we_put_an_end_to_this_bullshit_narrative/?ref=search_posts,nba,0,74,0,1465367626.0,[CLE] LeBron James,thuursty,True,False
4n3erk,Which would be a better 30 for 30?,https://www.reddit.com/r/nba/comments/4n3erk/which_would_be_a_better_30_for_30/,self.nba,https://www.reddit.com/r/nba/comments/4n3erk/which_would_be_a_better_30_for_30/?ref=search_posts,nba,0,32,0,1465390936.0,[CHI] Michael Jordan,sumpuertoricanguy,True,False
4n2jul,Has anyone from the NBA ever explained the 3 day gap between games?,https://www.reddit.com/r/nba/comments/4n2jul/has_anyone_from_the_nba_ever_explained_the_3_day/,self.nba,https://www.reddit.com/r/nba/comments/4n2jul/has_anyone_from_the_nba_ever_explained_the_3_day/?ref=search_posts,nba,0,14,0,1465378061.0,,EasyGibson,True,False
4n2lk3,The impact on Cavs with the 3 day gap and the amount of negative press and social media,https://www.reddit.com/r/nba/comments/4n2lk3/the_impact_on_cavs_with_the_3_day_gap_and_the/,self.nba,https://www.reddit.com/r/nba/comments/4n2lk3/the_impact_on_cavs_with_the_3_day_gap_and_the/?ref=search_posts,nba,5,6,0,1465378693.0,Warriors Bandwagon,diggfuge,True,False
4n2jzi,"The upcoming draft is going to be exciting, right?",https://www.reddit.com/r/nba/comments/4n2jzi/the_upcoming_draft_is_going_to_be_exciting_right/,self.nba,https://www.reddit.com/r/nba/comments/4n2jzi/the_upcoming_draft_is_going_to_be_exciting_right/?ref=search_posts,nba,0,20,0,1465378115.0,,-OleOleOle-,True,False
4n13f8,[Discussion] Should the Cavaliers trade Kevin Love to the Timberwolves for the 5th pick in order to make cap room for Durant?,https://www.reddit.com/r/nba/comments/4n13f8/discussion_should_the_cavaliers_trade_kevin_love/,self.nba,https://www.reddit.com/r/nba/comments/4n13f8/discussion_should_the_cavaliers_trade_kevin_love/?ref=search_posts,nba,0,70,0,1465359552.0,Heat,fifaman1662,True,False
