id,title,url,domain,permalink,subreddit,score,num_comments,gilded,created,author_flair_text,author,is_self,over_18
4qjr5v,[Bontemps] Sources: Joakim Noah is expected to reunite with Derrick Rose & return to NYC on a deal starting around $18 million.,https://twitter.com/TimBontemps/status/748364203262607360,twitter.com,https://www.reddit.com/r/nba/comments/4qjr5v/bontemps_sources_joakim_noah_is_expected_to/?ref=search_posts,nba,2964,970,0,1467287815.0,[NJN] Rondae Hollis-Jefferson,MisterBellic,False,False
4qhvpm,"[Highkin] Jimmy Butler on finding out Derrick Rose was traded on The Jump: ""I wasn't surprised. I knew it had to be one of us",https://twitter.com/highkin/status/748258748058243072,twitter.com,https://www.reddit.com/r/nba/comments/4qhvpm/highkin_jimmy_butler_on_finding_out_derrick_rose/?ref=search_posts,nba,806,349,0,1467262593.0,Raptors,dealin92,False,False
4qhtws,[Windhorst] Two of the teams Wade's camp contacted to let know that he was fielding offers were the Spurs and Mavericks,https://www.reddit.com/r/nba/comments/4qhtws/windhorst_two_of_the_teams_wades_camp_contacted/,self.nba,https://www.reddit.com/r/nba/comments/4qhtws/windhorst_two_of_the_teams_wades_camp_contacted/?ref=search_posts,nba,302,153,0,1467262013.0,Heat,Number333,True,False
4qikfa,"With Kobe retiring in ""the most Kobe way possible"", what is ""the most Player X way possible"" that Player X could retire?",https://www.reddit.com/r/nba/comments/4qikfa/with_kobe_retiring_in_the_most_kobe_way_possible/,self.nba,https://www.reddit.com/r/nba/comments/4qikfa/with_kobe_retiring_in_the_most_kobe_way_possible/?ref=search_posts,nba,158,337,0,1467271039.0,Timberwolves,Limehulio,True,False
4qj27r,"Jared Zwerling on Twitter: ""2,000 people have been in line for @matthewdelly's store appearance today for his PEAK shoe, with many kids arriving 7 hours early at 2 a.m.""",https://twitter.com/JaredZwerling/status/748311404785074176,twitter.com,https://www.reddit.com/r/nba/comments/4qj27r/jared_zwerling_on_twitter_2000_people_have_been/?ref=search_posts,nba,402,103,0,1467277796.0,Suns,p0tatoman,False,False
4qjh78,"Clippers’ reported primary pitch to Kevin Durant involves him taking pay cut to play with Chris Paul, DeAndre, Blake",http://nba.nbcsports.com/2016/06/29/clippers-reported-primary-pitch-to-kevin-durant-involves-him-taking-pay-cut-to-play-with-chris-paul-deandre-jordan-and-blake-griffin/?utm_source=dlvr.it&utm_medium=twitter,nba.nbcsports.com,https://www.reddit.com/r/nba/comments/4qjh78/clippers_reported_primary_pitch_to_kevin_durant/?ref=search_posts,nba,478,391,0,1467283731.0,[PHI] Allen Iverson,ericmalloy15,False,False
4qitam,"Wade, LeBron, CP3 Snapchat filter fun [mrdwyanewade snapchat]",https://streamable.com/uou2,streamable.com,https://www.reddit.com/r/nba/comments/4qitam/wade_lebron_cp3_snapchat_filter_fun_mrdwyanewade/?ref=search_posts,nba,658,134,0,1467274410.0,Cavaliers,Chuggawumba123,False,False
4qiqun,"[McMahon]: Mavericks will get first meeting with Whiteside, ""will take all of one second"" to offer him a max deal",http://heatnation.com/rumors/miami-heat-rumors-dallas-mavericks-absolutely-offer-whiteside-max-deal/?utm_content=buffer4f210&utm_medium=social&utm_source=twitter.com&utm_campaign=buffer,heatnation.com,https://www.reddit.com/r/nba/comments/4qiqun/mcmahon_mavericks_will_get_first_meeting_with/?ref=search_posts,nba,855,358,0,1467273510.0,[DAL] Steve Nash,aceofspadez138,False,False
4qhmdw,"Before every individual NBA game, every member of the media get a roughly 30-page printout of every possible stat you can think of for every single player in the game. Would anyone be interested in seeing them?",https://www.reddit.com/r/nba/comments/4qhmdw/before_every_individual_nba_game_every_member_of/,self.nba,https://www.reddit.com/r/nba/comments/4qhmdw/before_every_individual_nba_game_every_member_of/?ref=search_posts,nba,1327,189,0,1467259629.0,NBA,JaySpike,True,False
4qjr5m,[Washington Post] Joakim Noah expected to sign with New York Knicks for $18 milllion a year,https://www.washingtonpost.com/news/sports/wp/2016/06/29/joakim-noah-expected-to-sign-with-new-york-knicks-for-18-milllion-a-year/,washingtonpost.com,https://www.reddit.com/r/nba/comments/4qjr5m/washington_post_joakim_noah_expected_to_sign_with/?ref=search_posts,nba,347,209,0,1467287812.0,Nets,aydee123,False,False
4qjafx,[Lowe] Raptors have approached the Sixers about Nerlens Noel.,http://espn.go.com/nba/story/_/id/16621548/when-clock-strikes-midnight-friday-nba-contracts-flying-shelves,espn.go.com,https://www.reddit.com/r/nba/comments/4qjafx/lowe_raptors_have_approached_the_sixers_about/?ref=search_posts,nba,528,318,0,1467281074.0,,joe4942,False,False
4qhxml,Wojnarowski: Warriors' Players Have Been Recruiting Kevin Durant All Season,https://twitter.com/TheVertical/status/748180504214528000,twitter.com,https://www.reddit.com/r/nba/comments/4qhxml/wojnarowski_warriors_players_have_been_recruiting/?ref=search_posts,nba,195,222,0,1467263207.0,Clippers,jcw4455,False,False
4qiqvn,You ever get blocked on Twitter by an NBA Player or Media Member? What did you say?,https://www.reddit.com/r/nba/comments/4qiqvn/you_ever_get_blocked_on_twitter_by_an_nba_player/,self.nba,https://www.reddit.com/r/nba/comments/4qiqvn/you_ever_get_blocked_on_twitter_by_an_nba_player/?ref=search_posts,nba,337,508,0,1467273522.0,NBA,SuhMachineGun,True,False
4qi8h3,"[Grange] ""Raptors balked at sending Cory Joseph, Norman Powell, Patrick Patterson and their No. 9 pick to Oklahoma City for Ibaka.""",http://www.sportsnet.ca/basketball/nba/raptors-negotiation-demar-derozan-quick-one/,sportsnet.ca,https://www.reddit.com/r/nba/comments/4qi8h3/grange_raptors_balked_at_sending_cory_joseph/?ref=search_posts,nba,510,231,0,1467266742.0,[TOR] Amir Johnson,ModernPoultry,False,False
4qj4yf,Dwight Howard scenarios for next season.,https://www.reddit.com/r/nba/comments/4qj4yf/dwight_howard_scenarios_for_next_season/,self.nba,https://www.reddit.com/r/nba/comments/4qj4yf/dwight_howard_scenarios_for_next_season/?ref=search_posts,nba,12,31,0,1467278886.0,,DoomDunkGod,True,False
4qhl3f,"[Stein] Tim Duncan's cap number next season will be $6.4 million (up from $5.6 million) thanks to a $750,000 bonus from San Antonio scoring 62+ wins",https://twitter.com/ESPNSteinLine/status/748244364963393536,twitter.com,https://www.reddit.com/r/nba/comments/4qhl3f/stein_tim_duncans_cap_number_next_season_will_be/?ref=search_posts,nba,152,13,0,1467259249.0,Nets,hubwub,False,False
4qie36,Players who could theoretically play in different positions but don't,https://www.reddit.com/r/nba/comments/4qie36/players_who_could_theoretically_play_in_different/,self.nba,https://www.reddit.com/r/nba/comments/4qie36/players_who_could_theoretically_play_in_different/?ref=search_posts,nba,19,51,0,1467268728.0,,killerkebab1499,True,False
4qhunn,"[Brad Turner] Center Cole Aldrich not only will have interest from Clippers to return, but Orlando and Phoenix have expressed interested, source.",https://twitter.com/BA_Turner/status/748257381059035137,twitter.com,https://www.reddit.com/r/nba/comments/4qhunn/brad_turner_center_cole_aldrich_not_only_will/?ref=search_posts,nba,16,38,0,1467262276.0,West,urfaselol,False,False
4qj949,"FK of House Kaminsky on Twitter: ""Surgery was #Lit and I'm alive and stuff so that's pretty cool. Thank you to everyone for wishing me well.""",https://twitter.com/FSKPart3/status/748238806701117441,twitter.com,https://www.reddit.com/r/nba/comments/4qj949/fk_of_house_kaminsky_on_twitter_surgery_was_lit/?ref=search_posts,nba,38,9,0,1467280557.0,Hornets,Daheixiong,False,False
4qi4fz,What states/cities need a team?,https://www.reddit.com/r/nba/comments/4qi4fz/what_statescities_need_a_team/,self.nba,https://www.reddit.com/r/nba/comments/4qi4fz/what_statescities_need_a_team/?ref=search_posts,nba,5,91,0,1467265404.0,[GSW] Draymond Green,GlacierPineapple,True,False
4qil7v,Strangest Regular Season Player Game Performances Of The Last Decade,https://www.reddit.com/r/nba/comments/4qil7v/strangest_regular_season_player_game_performances/,self.nba,https://www.reddit.com/r/nba/comments/4qil7v/strangest_regular_season_player_game_performances/?ref=search_posts,nba,23,12,0,1467271361.0,[ORL] Vince Carter,ChaosEmperorBalloon,True,False
4qk3ez,Is there anyone in the NBA that is under 25 that can play the SF/PF positions on both ends as well as Harrison Barnes?,https://www.reddit.com/r/nba/comments/4qk3ez/is_there_anyone_in_the_nba_that_is_under_25_that/,self.nba,https://www.reddit.com/r/nba/comments/4qk3ez/is_there_anyone_in_the_nba_that_is_under_25_that/?ref=search_posts,nba,0,96,0,1467293693.0,,CarlRemy,True,False
4qikbs,Who's the fastest guy in the NBA?,https://www.reddit.com/r/nba/comments/4qikbs/whos_the_fastest_guy_in_the_nba/,self.nba,https://www.reddit.com/r/nba/comments/4qikbs/whos_the_fastest_guy_in_the_nba/?ref=search_posts,nba,15,54,0,1467271000.0,,operatorred,True,False
4qhv2v,Is Kobe top 5 all time? Whos above him?,https://www.reddit.com/r/nba/comments/4qhv2v/is_kobe_top_5_all_time_whos_above_him/,self.nba,https://www.reddit.com/r/nba/comments/4qhv2v/is_kobe_top_5_all_time_whos_above_him/?ref=search_posts,nba,0,72,0,1467262403.0,,Redditor200,True,False
4qjt88,[Charania] Joakim Noah has set meeting with Knicks president Phil Jackson after midnight July 1. Significant traction on both sides.,https://twitter.com/ShamsCharania/status/748368400871743488,twitter.com,https://www.reddit.com/r/nba/comments/4qjt88/charania_joakim_noah_has_set_meeting_with_knicks/?ref=search_posts,nba,90,51,0,1467288773.0,Nets,hubwub,False,False
4qiaop,[Haynes] Warriors will not extend qualifying offer to retain F James Michael McAdoo. Unrestricted free agent,https://twitter.com/ChrisBHaynes/status/748278750261870593,twitter.com,https://www.reddit.com/r/nba/comments/4qiaop/haynes_warriors_will_not_extend_qualifying_offer/?ref=search_posts,nba,51,30,0,1467267519.0,Warriors,lf2012,False,False
4qiwy4,New fan deciding a team to follow?,https://www.reddit.com/r/nba/comments/4qiwy4/new_fan_deciding_a_team_to_follow/,self.nba,https://www.reddit.com/r/nba/comments/4qiwy4/new_fan_deciding_a_team_to_follow/?ref=search_posts,nba,0,114,0,1467275734.0,,IUsedToBeANewAccount,True,False
4qhq3e,[Serious] Why do people already treat Sam Hinkie like a success?,https://www.reddit.com/r/nba/comments/4qhq3e/serious_why_do_people_already_treat_sam_hinkie/,self.nba,https://www.reddit.com/r/nba/comments/4qhq3e/serious_why_do_people_already_treat_sam_hinkie/?ref=search_posts,nba,12,135,0,1467260833.0,Celtics,Ifuckinglovebball,True,False
4qk1ym,"What is Miami's pitch to Kevin Durant? They could be without Wade, Bosh and Whiteside next season.",https://www.reddit.com/r/nba/comments/4qk1ym/what_is_miamis_pitch_to_kevin_durant_they_could/,self.nba,https://www.reddit.com/r/nba/comments/4qk1ym/what_is_miamis_pitch_to_kevin_durant_they_could/?ref=search_posts,nba,69,118,0,1467292932.0,Raptors,TrillTaskforce,True,False
4qk4qz,Where does Carmelo Anthony rank in the all time list of NBA players?,https://www.reddit.com/r/nba/comments/4qk4qz/where_does_carmelo_anthony_rank_in_the_all_time/,self.nba,https://www.reddit.com/r/nba/comments/4qk4qz/where_does_carmelo_anthony_rank_in_the_all_time/?ref=search_posts,nba,3,47,0,1467294364.0,[LAC] Chris Paul,Wheylab3,True,False
4qj6rb,What are the best signature moves in the NBA?,https://www.reddit.com/r/nba/comments/4qj6rb/what_are_the_best_signature_moves_in_the_nba/,self.nba,https://www.reddit.com/r/nba/comments/4qj6rb/what_are_the_best_signature_moves_in_the_nba/?ref=search_posts,nba,20,59,0,1467279625.0,Timberwolves,KATgonnaGetThatYarn,True,False
4qjtlp,"[Broussard] Houston, New Orleans, Brooklyn and Los Angeles Lakers also interested in Conley, sources say",https://twitter.com/Chris_Broussard/status/748369123344850949,twitter.com,https://www.reddit.com/r/nba/comments/4qjtlp/broussard_houston_new_orleans_brooklyn_and_los/?ref=search_posts,nba,17,53,0,1467288969.0,Nuggets,PotRoastBoobs,False,False
4qj0vy,Top 5 All-Time by Position - Rank the Teams,https://www.reddit.com/r/nba/comments/4qj0vy/top_5_alltime_by_position_rank_the_teams/,self.nba,https://www.reddit.com/r/nba/comments/4qj0vy/top_5_alltime_by_position_rank_the_teams/?ref=search_posts,nba,0,46,0,1467277278.0,[CLE] LeBron James,thenimblybimbly,True,False
4qjwko,Are the Knicks rebuilding to contend for a long time or just doing what Dallas is doing and trying to put old stars around their big name to be somewhat competitive in the short term?,https://www.reddit.com/r/nba/comments/4qjwko/are_the_knicks_rebuilding_to_contend_for_a_long/,self.nba,https://www.reddit.com/r/nba/comments/4qjwko/are_the_knicks_rebuilding_to_contend_for_a_long/?ref=search_posts,nba,5,47,0,1467290313.0,Raptors,TrillTaskforce,True,False
4qjs7y,"[Broussard] Mike Conley will meet with the Dallas Mavericks on July 1, according to league sources.",https://twitter.com/Chris_Broussard/status/748366528240824320,twitter.com,https://www.reddit.com/r/nba/comments/4qjs7y/broussard_mike_conley_will_meet_with_the_dallas/?ref=search_posts,nba,87,31,0,1467288299.0,Nuggets,PotRoastBoobs,False,False
4qjavc,Interesting difference between Kobe and LeBron,https://www.reddit.com/r/nba/comments/4qjavc/interesting_difference_between_kobe_and_lebron/,self.nba,https://www.reddit.com/r/nba/comments/4qjavc/interesting_difference_between_kobe_and_lebron/?ref=search_posts,nba,47,35,0,1467281251.0,Suns,iamstarbucks,True,False
4qjr7h,Welsh: Hearing Durant will meet with Celtics on July 4th in The Hamptons,http://www.csnne.com/boston-celtics/Tim-Welsh-Hearing-Kevin-Durant-will-meet-with-Boston-Celtics-on-July-4th-in-The-Hamptons,csnne.com,https://www.reddit.com/r/nba/comments/4qjr7h/welsh_hearing_durant_will_meet_with_celtics_on/?ref=search_posts,nba,45,40,0,1467287837.0,[BOS] Antoine Walker,DRobCity,False,False
4qidul,"Worst current mascot, best current mascot?",https://www.reddit.com/r/nba/comments/4qidul/worst_current_mascot_best_current_mascot/,self.nba,https://www.reddit.com/r/nba/comments/4qidul/worst_current_mascot_best_current_mascot/?ref=search_posts,nba,0,46,0,1467268637.0,[GSW] Draymond Green,GlacierPineapple,True,False
4qjr9w,"The Vertical on Twitter: "".@TheVertical to host live NBA free agency show on Thursday. Tips off at 11:30 p.m. ET.",https://twitter.com/TheVertical/status/747952746297331713,twitter.com,https://www.reddit.com/r/nba/comments/4qjr9w/the_vertical_on_twitter_thevertical_to_host_live/?ref=search_posts,nba,24,13,0,1467287869.0,Raptors,BismackMyBiyombo,False,False
4qiqe5,"Dirk: ""I think if we would have signed DeAndre last year [signing Durant] might have been a bigger chance now.""",http://www.star-telegram.com/sports/nba/dallas-mavericks/article86477942.html,star-telegram.com,https://www.reddit.com/r/nba/comments/4qiqe5/dirk_i_think_if_we_would_have_signed_deandre_last/?ref=search_posts,nba,47,9,0,1467273333.0,[DAL] Steve Nash,aceofspadez138,False,False
4qijwj,Shaq swears on live TV,https://www.youtube.com/watch?v=ujl9rx-RURo,youtube.com,https://www.reddit.com/r/nba/comments/4qijwj/shaq_swears_on_live_tv/?ref=search_posts,nba,34,8,0,1467270841.0,Suns,iamstarbucks,False,False
4qki1m,How much worse are the Warriors this past year if you replace Barnes with Robert Covington?,https://www.reddit.com/r/nba/comments/4qki1m/how_much_worse_are_the_warriors_this_past_year_if/,self.nba,https://www.reddit.com/r/nba/comments/4qki1m/how_much_worse_are_the_warriors_this_past_year_if/?ref=search_posts,nba,13,50,0,1467301513.0,,JKirbs14,True,False
4qhn25,"[Chris Broussard] Despite their hopes, Lakers will not get a meeting with KD, sources say.",https://twitter.com/chris_broussard/status/748177951934582786,twitter.com,https://www.reddit.com/r/nba/comments/4qhn25/chris_broussard_despite_their_hopes_lakers_will/?ref=search_posts,nba,137,74,0,1467259841.0,Lakers,vulgarswami_,False,False
4qk382,What's the joke about Brian Scalabrine?,https://www.reddit.com/r/nba/comments/4qk382/whats_the_joke_about_brian_scalabrine/,self.nba,https://www.reddit.com/r/nba/comments/4qk382/whats_the_joke_about_brian_scalabrine/?ref=search_posts,nba,14,33,0,1467293584.0,[CLE] LeBron James,ThePickledSponge,True,False
4qixtz,Which division has the best combined team?,https://www.reddit.com/r/nba/comments/4qixtz/which_division_has_the_best_combined_team/,self.nba,https://www.reddit.com/r/nba/comments/4qixtz/which_division_has_the_best_combined_team/?ref=search_posts,nba,14,46,0,1467276056.0,Cavaliers Bandwagon,xivlivsx,True,False
4qje4p,Steph Curry is charging kids over $2000 for a 4 day basketball camp,http://www.nba.com/warriors/currycamp/2016/,nba.com,https://www.reddit.com/r/nba/comments/4qje4p/steph_curry_is_charging_kids_over_2000_for_a_4/?ref=search_posts,nba,0,116,0,1467282547.0,Cavaliers,FUCK_CURRY,False,False
4qjgxc,Raptors/Sixers trade idea,https://www.reddit.com/r/nba/comments/4qjgxc/raptorssixers_trade_idea/,self.nba,https://www.reddit.com/r/nba/comments/4qjgxc/raptorssixers_trade_idea/?ref=search_posts,nba,0,43,0,1467283626.0,Hawks,ImABundleOfSticks,True,False
4qiyb5,Russell Westbrook Top 10 Plays of Career,https://www.youtube.com/watch?v=nbLfmqnDDT4,youtube.com,https://www.reddit.com/r/nba/comments/4qiyb5/russell_westbrook_top_10_plays_of_career/?ref=search_posts,nba,24,16,0,1467276231.0,Thunder,nomad700,False,False
4qic11,"[Brad Turner] Free agent small forward Nicolas Batum mulling over options, including talking with Lakers, source. He's flying from Paris to US tomorrow.",https://twitter.com/BA_Turner/status/748281335106703360,twitter.com,https://www.reddit.com/r/nba/comments/4qic11/brad_turner_free_agent_small_forward_nicolas/?ref=search_posts,nba,201,75,0,1467268021.0,West,urfaselol,False,False
4qib2k,"Warriors frustrated with Bogut's unreliability; team ""prefers"" Ezeli",http://bleacherreport.com/articles/2649222-andrew-bogut-trade-rumors-latest-news-buzz-and-speculation-on-warriors-center,bleacherreport.com,https://www.reddit.com/r/nba/comments/4qib2k/warriors_frustrated_with_boguts_unreliability/?ref=search_posts,nba,32,86,0,1467267665.0,Lakers,vulgarswami_,False,False
4qk65h,Knicks reportedly waived Tony Wroten for disciplinary reasons.,http://www.hoopsrumors.com/2016/06/eastern-notes-saric-wroten-budenholzer.html,hoopsrumors.com,https://www.reddit.com/r/nba/comments/4qk65h/knicks_reportedly_waived_tony_wroten_for/?ref=search_posts,nba,33,11,0,1467295129.0,,teritore,False,False
4qhro6,"Przybilla to Boozer: ""Meet me after. Meet me after. I'll fuck you up""",https://www.youtube.com/watch?v=4XGOVAqh8HU,youtube.com,https://www.reddit.com/r/nba/comments/4qhro6/przybilla_to_boozer_meet_me_after_meet_me_after/?ref=search_posts,nba,116,36,0,1467261307.0,[POR] Arvydas Sabonis,yeeeeeehaaaw,False,False
4qikki,"[Lowe] Nets will tender Markel Brown a qualifying offer, making him a restricted free agent, sources say.",https://twitter.com/ZachLowe_NBA/status/748290694758940673,twitter.com,https://www.reddit.com/r/nba/comments/4qikki/lowe_nets_will_tender_markel_brown_a_qualifying/?ref=search_posts,nba,32,9,0,1467271103.0,[NJN] Rondae Hollis-Jefferson,MisterBellic,False,False
4qj758,What's the most impressive rookie season you've seen?,https://www.reddit.com/r/nba/comments/4qj758/whats_the_most_impressive_rookie_season_youve_seen/,self.nba,https://www.reddit.com/r/nba/comments/4qj758/whats_the_most_impressive_rookie_season_youve_seen/?ref=search_posts,nba,34,88,0,1467279764.0,Nuggets,Punainenapina,True,False
4qhtyz,[SLAM] Perry Ellis signs Perry Ellis,http://www.slamonline.com/news-rumors/other-news/perry-ellis-signs-endorsement-deal-perry-ellis/#OYTjbE9ICix6musI.97http://www.slamonline.com/news-rumors/other-news/perry-ellis-signs-endorsement-deal-perry-ellis/#OYTjbE9ICix6musI.97,slamonline.com,https://www.reddit.com/r/nba/comments/4qhtyz/slam_perry_ellis_signs_perry_ellis/?ref=search_posts,nba,38,8,0,1467262037.0,Rockets,forzadepor13,False,False
4qiiul,Cousins for Porzingis,https://www.reddit.com/r/nba/comments/4qiiul/cousins_for_porzingis/,self.nba,https://www.reddit.com/r/nba/comments/4qiiul/cousins_for_porzingis/?ref=search_posts,nba,0,95,0,1467270456.0,,miriczivojin,True,False
4qi2ov,Which position has the greatest collection of talent?,https://www.reddit.com/r/nba/comments/4qi2ov/which_position_has_the_greatest_collection_of/,self.nba,https://www.reddit.com/r/nba/comments/4qi2ov/which_position_has_the_greatest_collection_of/?ref=search_posts,nba,9,46,0,1467264817.0,[PHO] Leandro Barbosa,BasketballBricksquad,True,False
4qhnqg,[OC] A look back on the Utah Jazz and onward to 2016-17 (Not a Thon Maker post in disguise),https://www.reddit.com/r/nba/comments/4qhnqg/oc_a_look_back_on_the_utah_jazz_and_onward_to/,self.nba,https://www.reddit.com/r/nba/comments/4qhnqg/oc_a_look_back_on_the_utah_jazz_and_onward_to/?ref=search_posts,nba,58,12,0,1467260045.0,[POR] Sean Marks,poik12,True,False
4qjcq1,"[Scotto] Source: Alonzo Gee has declined his $1,375,000 player option with the New Orleans Pelicans and he will become an unrestricted free agent as a result.",https://twitter.com/MikeAScotto/status/748339295660965888,twitter.com,https://www.reddit.com/r/nba/comments/4qjcq1/scotto_source_alonzo_gee_has_declined_his_1375000/?ref=search_posts,nba,55,30,0,1467281997.0,Celtics,Brad-Stevens,False,False
4qin3a,"[Simmons] The Warriors extending qualifying offers to Harrison Barnes and Festus Ezeli, making the four-year players restricted free agents.",https://twitter.com/Rusty_SFChron/status/748298318854316032?s=09,twitter.com,https://www.reddit.com/r/nba/comments/4qin3a/simmons_the_warriors_extending_qualifying_offers/?ref=search_posts,nba,47,21,0,1467272048.0,Kings,ThisIsMyFavoriteSub,False,False
4qi9u4,"NBA's version of fuck, marry or kill: ""Trade, max, amnesty",https://www.reddit.com/r/nba/comments/4qi9u4/nbas_version_of_fuck_marry_or_kill_trade_max/,self.nba,https://www.reddit.com/r/nba/comments/4qi9u4/nbas_version_of_fuck_marry_or_kill_trade_max/?ref=search_posts,nba,66,145,0,1467267214.0,[ATL] Pete Maravich,lipstickpizza,True,False
4qkjjs,"The most money the Thunder have ever spent to bring a free agent over from another team? Nenad Krstic’s 3-year, $15.6M deal.",https://twitter.com/FredKatz/status/748402771099955200,twitter.com,https://www.reddit.com/r/nba/comments/4qkjjs/the_most_money_the_thunder_have_ever_spent_to/?ref=search_posts,nba,209,106,0,1467302356.0,Knicks,rdogg1026,False,False
4qijxe,"Am I crazy, or does Jimmy Butler for Okafor and picks make perfect sense?",https://www.reddit.com/r/nba/comments/4qijxe/am_i_crazy_or_does_jimmy_butler_for_okafor_and/,self.nba,https://www.reddit.com/r/nba/comments/4qijxe/am_i_crazy_or_does_jimmy_butler_for_okafor_and/?ref=search_posts,nba,9,42,0,1467270854.0,Bulls,ajswdf,True,False
4qjaxq,[Haynes] 76ers guard Isaiah Canaan to become FA after team elects not to extend qualifying offer,https://twitter.com/ChrisBHaynes/status/748336876839403520,twitter.com,https://www.reddit.com/r/nba/comments/4qjaxq/haynes_76ers_guard_isaiah_canaan_to_become_fa/?ref=search_posts,nba,48,30,0,1467281277.0,Nets,hubwub,False,False
4qis4z,[OC] Which NBA stars throw up the most halfcourt heaves? Which protect their 3-point %?,https://www.reddit.com/r/nba/comments/4qis4z/oc_which_nba_stars_throw_up_the_most_halfcourt/,self.nba,https://www.reddit.com/r/nba/comments/4qis4z/oc_which_nba_stars_throw_up_the_most_halfcourt/?ref=search_posts,nba,40,37,0,1467273994.0,Heat,Number333,True,False
4qig3q,"Donatas Motiejunas on Twitter: ""It was a pleasure to have dinner and to talk with new Rockets coach Mike D'Antoni! Best wishes! :) #Rockets""",https://twitter.com/DonatasMot/status/748259234253520896,twitter.com,https://www.reddit.com/r/nba/comments/4qig3q/donatas_motiejunas_on_twitter_it_was_a_pleasure/?ref=search_posts,nba,59,23,0,1467269469.0,Cavaliers Bandwagon,napoleon_the_corgi,False,False
4qjqjd,Shelburne: Durant needs to give Lakers meeting out of respect,http://espn.go.com/video/clip?id=espn:16623825,espn.go.com,https://www.reddit.com/r/nba/comments/4qjqjd/shelburne_durant_needs_to_give_lakers_meeting_out/?ref=search_posts,nba,0,78,0,1467287528.0,Lakers,claydavisismyhero,False,False
4qjdcg,Personality swap.,https://www.reddit.com/r/nba/comments/4qjdcg/personality_swap/,self.nba,https://www.reddit.com/r/nba/comments/4qjdcg/personality_swap/?ref=search_posts,nba,12,21,0,1467282252.0,Spurs,kcheng686,True,False
4qht3r,Underrated NBA Free Agents,https://www.reddit.com/r/nba/comments/4qht3r/underrated_nba_free_agents/,self.nba,https://www.reddit.com/r/nba/comments/4qht3r/underrated_nba_free_agents/?ref=search_posts,nba,6,40,0,1467261756.0,,TDrizzle301,True,False
4qi941,[CSN] Sources: Warriors frustration with Bogut could lead to trade,http://www.csnbayarea.com/warriors/sources-warriors-frustration-bogut-could-lead-trade,csnbayarea.com,https://www.reddit.com/r/nba/comments/4qi941/csn_sources_warriors_frustration_with_bogut_could/?ref=search_posts,nba,121,76,0,1467266962.0,Warriors,lf2012,False,False
4qi5t6,Wall couldn't jump off his left leg due to bone spur last season,https://www.washingtonpost.com/news/dc-sports-bog/wp/2016/06/29/wizards-owe-it-to-john-wall-to-make-this-the-biggest-summer/,washingtonpost.com,https://www.reddit.com/r/nba/comments/4qi5t6/wall_couldnt_jump_off_his_left_leg_due_to_bone/?ref=search_posts,nba,41,24,0,1467265867.0,Wizards,AnalSlutFrog,False,False
4qjwyr,What's the best NBA drama on and off the court have you experienced or watched?,https://www.reddit.com/r/nba/comments/4qjwyr/whats_the_best_nba_drama_on_and_off_the_court/,self.nba,https://www.reddit.com/r/nba/comments/4qjwyr/whats_the_best_nba_drama_on_and_off_the_court/?ref=search_posts,nba,15,45,0,1467290501.0,Lakers,byronray14,True,False
