id,title,url,domain,permalink,subreddit,score,num_comments,gilded,created,author_flair_text,author,is_self,over_18
4n2czs,Was Ty Lue emboldened to play small lineup against Warriors because the success OKC had against them in WCF?,https://www.reddit.com/r/nba/comments/4n2czs/was_ty_lue_emboldened_to_play_small_lineup/,self.nba,https://www.reddit.com/r/nba/comments/4n2czs/was_ty_lue_emboldened_to_play_small_lineup/?ref=search_posts,nba,0,12,0,1465375361.0,Bucks,vindura,True,False
4n1343,Jeremy Lamb's potential,https://www.reddit.com/r/nba/comments/4n1343/jeremy_lambs_potential/,self.nba,https://www.reddit.com/r/nba/comments/4n1343/jeremy_lambs_potential/?ref=search_posts,nba,4,26,0,1465359459.0,Bucks,vindura,True,False
4n2jcf,NBA top posts from 2016-05-08 to 2016-06-06 23:01 PDT,https://www.reddit.com/r/nba/comments/4n2jcf/nba_top_posts_from_20160508_to_20160606_2301_pdt/,self.nba,https://www.reddit.com/r/nba/comments/4n2jcf/nba_top_posts_from_20160508_to_20160606_2301_pdt/?ref=search_posts,nba,8,6,0,1465377853.0,Spurs,GuacamoleFanatic,True,False
4n217k,"Quick question: Are there any videos of referees reacting to a huge, game-winning play?",https://www.reddit.com/r/nba/comments/4n217k/quick_question_are_there_any_videos_of_referees/,self.nba,https://www.reddit.com/r/nba/comments/4n217k/quick_question_are_there_any_videos_of_referees/?ref=search_posts,nba,10,5,0,1465371020.0,[CHA] Jeremy Lin,MikothWayt,True,False
4n3gok,"With the increasing cap, does the value of rookie contracts increase because quality rookies can be had for on roster for a relatively tiny amount of payroll since they are on the rookie pay scale?",https://www.reddit.com/r/nba/comments/4n3gok/with_the_increasing_cap_does_the_value_of_rookie/,self.nba,https://www.reddit.com/r/nba/comments/4n3gok/with_the_increasing_cap_does_the_value_of_rookie/?ref=search_posts,nba,1,8,0,1465391896.0,Raptors,TrillTaskforce,True,False
4n3fc4,Stephen A. Smith loses his shit over J. R. Smith having a reality TV Show,https://web.facebook.com/ESPNAusNZ/videos/1124296977637584/,web.facebook.com,https://www.reddit.com/r/nba/comments/4n3fc4/stephen_a_smith_loses_his_shit_over_j_r_smith/?ref=search_posts,nba,0,19,0,1465391222.0,Cavaliers Bandwagon,SonnyBillProperty,False,False
4n2035,[question] is there a way to figure out how many rings the players on each team have?,https://www.reddit.com/r/nba/comments/4n2035/question_is_there_a_way_to_figure_out_how_many/,self.nba,https://www.reddit.com/r/nba/comments/4n2035/question_is_there_a_way_to_figure_out_how_many/?ref=search_posts,nba,0,5,0,1465370642.0,,comicbooksven,True,False
4n286i,I think everyone is looking at the wrong part of Lebron losing,https://www.reddit.com/r/nba/comments/4n286i/i_think_everyone_is_looking_at_the_wrong_part_of/,self.nba,https://www.reddit.com/r/nba/comments/4n286i/i_think_everyone_is_looking_at_the_wrong_part_of/?ref=search_posts,nba,0,13,0,1465373545.0,Grizzlies,sciencevolforlife,True,False
4n3hj4,Steven Adams shows he's not a bad shot off the court as well,https://www.facebook.com/DUKETVNZ/videos/1134358553289592/,facebook.com,https://www.reddit.com/r/nba/comments/4n3hj4/steven_adams_shows_hes_not_a_bad_shot_off_the/?ref=search_posts,nba,0,2,0,1465392331.0,[OKC] Steven Adams,legendariusss,False,False
