id,title,url,domain,permalink,subreddit,score,num_comments,gilded,created,author_flair_text,author,is_self,over_18
4pmu56,"[Dominguez] LeBron James to DeJounte Murray after the Spurs selected him at 29: ''You might not feel like you landed where you wanted, but you're with the best organization in the NBA.''",http://sports.yahoo.com/news/spurs-washington-guard-dejounte-murray-no-29-030158906--nba.html,sports.yahoo.com,https://www.reddit.com/r/nba/comments/4pmu56/dominguez_lebron_james_to_dejounte_murray_after/?ref=search_posts,nba,3800,941,0,1466803358.0,Spurs,sagednovice,False,False
4pnq20,Phil Jackson believes Derrick Rose will reinvigorate Carmelo Anthony,http://www.cbssports.com/nba/news/phil-jackson-believes-derrick-rose-will-reinvigorate-carmelo-anthony,cbssports.com,https://www.reddit.com/r/nba/comments/4pnq20/phil_jackson_believes_derrick_rose_will/?ref=search_posts,nba,309,129,0,1466813999.0,Bulls,douloskerux,False,False
4po92k,"[Sporting News] Wizards lead four-team race for Joakim Noah, sources say",http://www.sportingnews.com/nba/news/nba-free-agency-washington-wizards-joakim-noah-chicago-bulls-knicks-derrick-rose-bucks-timberwolves/1g5h2xcr8ello1ct5ne29gn4m5,sportingnews.com,https://www.reddit.com/r/nba/comments/4po92k/sporting_news_wizards_lead_fourteam_race_for/?ref=search_posts,nba,277,183,0,1466819899.0,Warriors,lf2012,False,False
4pn7jl,Magic Fans Take on Oladipo,https://www.reddit.com/r/nba/comments/4pn7jl/magic_fans_take_on_oladipo/,self.nba,https://www.reddit.com/r/nba/comments/4pn7jl/magic_fans_take_on_oladipo/?ref=search_posts,nba,168,191,0,1466808065.0,[ORL] Mario Hezonja,MagicKnightt,True,False
4pnjfi,"[Spears]: ""Kings All-Star DeMarcus Cousins told The Undefeated his draft night tweet had nothing to do with the draft. So what was it about? ""A hot sculpting class,"" Cousins said jokingly.""",https://twitter.com/MarcJSpearsESPN/status/746367691888308224,twitter.com,https://www.reddit.com/r/nba/comments/4pnjfi/spears_kings_allstar_demarcus_cousins_told_the/?ref=search_posts,nba,631,175,0,1466811954.0,Knicks,johnhenryirons,False,False
4pmtpt,PSA: With the season now over don't forget to cancel your league pass if you don't plan to use it again until next season.,https://www.reddit.com/r/nba/comments/4pmtpt/psa_with_the_season_now_over_dont_forget_to/,self.nba,https://www.reddit.com/r/nba/comments/4pmtpt/psa_with_the_season_now_over_dont_forget_to/?ref=search_posts,nba,1210,167,0,1466803193.0,Heat,plzdontshadowbanme,True,False
4pnqmy,Serge Ibaka to the fans of Oklahoma City after the trade to Orlando,https://www.instagram.com/p/BHCydszhz5S/,instagram.com,https://www.reddit.com/r/nba/comments/4pnqmy/serge_ibaka_to_the_fans_of_oklahoma_city_after/?ref=search_posts,nba,865,127,0,1466814180.0,West,urfaselol,False,False
4pobvh,"[Wojnarowski] After the draft, Detroit will continue to shop guard Jodie Meeks to find him a new team, league sources tell @TheVertical.",https://twitter.com/WojVerticalNBA/status/746405523004792832,twitter.com,https://www.reddit.com/r/nba/comments/4pobvh/wojnarowski_after_the_draft_detroit_will_continue/?ref=search_posts,nba,190,129,0,1466820723.0,Warriors,Anon10W1z,False,False
4pnfjb,LeBron James celebration: Akron designates downtown street as King James Way,http://www.ohio.com/news/local/lebron-james-celebration-akron-designates-downtown-street-as-king-james-way-1.692548#.V21QpZs_loY.reddit,ohio.com,https://www.reddit.com/r/nba/comments/4pnfjb/lebron_james_celebration_akron_designates/?ref=search_posts,nba,1312,224,0,1466810692.0,,bootywizard42O,False,False
4pmve4,Georgios Papagiannis's Dad has been hating on Dragan Bender on Twitter for the past 6 Months,https://twitter.com/lukewinn/status/746091178135805953,twitter.com,https://www.reddit.com/r/nba/comments/4pmve4/georgios_papagianniss_dad_has_been_hating_on/?ref=search_posts,nba,1148,203,0,1466803845.0,Suns,p0tatoman,False,False
4pokn3,[Lowe] Beware of the early verdict in the Ibaka-Oladipo trade,http://espn.go.com/nba/story/_/id/16480955/breaking-other-side-ibaka-oladipo-trade,espn.go.com,https://www.reddit.com/r/nba/comments/4pokn3/lowe_beware_of_the_early_verdict_in_the/?ref=search_posts,nba,359,323,0,1466823471.0,Warriors,DubsSinceRunTMC,False,False
4pob8h,Villanova's Arcidiacono to sign with Spurs,http://supertwosports.com/nba/villanovas-arcidiacono-to-sign-with-spurs.html,supertwosports.com,https://www.reddit.com/r/nba/comments/4pob8h/villanovas_arcidiacono_to_sign_with_spurs/?ref=search_posts,nba,355,102,0,1466820531.0,Spurs,RLLRRR,False,False
4pod5c,"[Alan Hahn] ""Just had @MarcJSpearsESPN on the show. He said Kevin Durant will hold free agency meetings not just in LA but also the Hamptons. #NBA""",https://twitter.com/alanhahn/status/746406200489742336,twitter.com,https://www.reddit.com/r/nba/comments/4pod5c/alan_hahn_just_had_marcjspearsespn_on_the_show_he/?ref=search_posts,nba,255,131,0,1466821121.0,Nets,ChalupaTacoBatman,False,False
4pnrjm,"Who was the last white player in the NBA to be labeled a ""great athlete""?",https://www.reddit.com/r/nba/comments/4pnrjm/who_was_the_last_white_player_in_the_nba_to_be/,self.nba,https://www.reddit.com/r/nba/comments/4pnrjm/who_was_the_last_white_player_in_the_nba_to_be/?ref=search_posts,nba,151,298,0,1466814467.0,Pistons,Guitarjack87,True,False
4pnoxm,"[Ira Winderman] Hassan Whiteside, on his Snapchat, when asked if he was a basketball player said he responded, ""'I'm a businessman that plays basketball.""",https://twitter.com/IraHeatBeat/status/746371283160424448,twitter.com,https://www.reddit.com/r/nba/comments/4pnoxm/ira_winderman_hassan_whiteside_on_his_snapchat/?ref=search_posts,nba,606,213,0,1466813649.0,West,urfaselol,False,False
4pofp6,Who is gonna be the Cavs biggest enemy in the East next year?,https://www.reddit.com/r/nba/comments/4pofp6/who_is_gonna_be_the_cavs_biggest_enemy_in_the/,self.nba,https://www.reddit.com/r/nba/comments/4pofp6/who_is_gonna_be_the_cavs_biggest_enemy_in_the/?ref=search_posts,nba,176,341,0,1466821897.0,Raptors,DemonRDT6,True,False
4pn7pi,"In the last 4 months, ORL has essentially traded Tobias Harris + Oladipo + 11th pick for a 2-month rental of Jennings and a 1-year rental of Serge Ibaka",https://www.reddit.com/r/nba/comments/4pn7pi/in_the_last_4_months_orl_has_essentially_traded/,self.nba,https://www.reddit.com/r/nba/comments/4pn7pi/in_the_last_4_months_orl_has_essentially_traded/?ref=search_posts,nba,1735,422,0,1466808121.0,,v1n5anity,True,False
4pon5l,Classic Lebron response when Ben Simmons said he couldn't wait to face him,http://www.businessinsider.com/lebron-james-trash-talking-ben-simmons-2016-6,businessinsider.com,https://www.reddit.com/r/nba/comments/4pon5l/classic_lebron_response_when_ben_simmons_said_he/?ref=search_posts,nba,741,225,0,1466824240.0,Knicks,konag0603,False,False
4porix,"Blake Murphy on Twitter: ""Poeltl pointed out to Raptors that he scored 27 on Valanciunas last summer. I'm dying.""",https://twitter.com/BlakeMurphyODC/status/746426050096181249,twitter.com,https://www.reddit.com/r/nba/comments/4porix/blake_murphy_on_twitter_poeltl_pointed_out_to/?ref=search_posts,nba,427,118,0,1466825644.0,Raptors,BismackMyBiyombo,False,False
4pnmke,[Next Day Thread] What are your reactions to the draft choices/trades from last night?,https://www.reddit.com/r/nba/comments/4pnmke/next_day_thread_what_are_your_reactions_to_the/,self.nba,https://www.reddit.com/r/nba/comments/4pnmke/next_day_thread_what_are_your_reactions_to_the/?ref=search_posts,nba,804,1137,0,1466812946.0,[NYK] Chris Copeland,bootum,True,False
4pnt3f,"[Johnson] Reported last night but bears repeating: When Dunn dropped past 3, TWolves offered Rubio and No. 5 pick for Butler. Bulls said no.",https://twitter.com/KCJHoop/status/746359309450289152,twitter.com,https://www.reddit.com/r/nba/comments/4pnt3f/johnson_reported_last_night_but_bears_repeating/?ref=search_posts,nba,495,349,0,1466814936.0,Bulls,Riderz_of_Brohan,False,False
4pnifw,Free Talk Friday: something something edition,https://www.reddit.com/r/nba/comments/4pnifw/free_talk_friday_something_something_edition/,self.nba,https://www.reddit.com/r/nba/comments/4pnifw/free_talk_friday_something_something_edition/?ref=search_posts,nba,150,609,0,1466811632.0,[CHA] Gerald Wallace,hercules-rockefeller,True,False
4pmd7b,Cavs vs GSW or Heat vs Spurs: Which finals rivalry did you prefer?,https://www.reddit.com/r/nba/comments/4pmd7b/cavs_vs_gsw_or_heat_vs_spurs_which_finals_rivalry/,self.nba,https://www.reddit.com/r/nba/comments/4pmd7b/cavs_vs_gsw_or_heat_vs_spurs_which_finals_rivalry/?ref=search_posts,nba,32,37,0,1466795937.0,,aprilmayjune2,True,False
4pn0iu,Can we talk about Boston?,https://www.reddit.com/r/nba/comments/4pn0iu/can_we_talk_about_boston/,self.nba,https://www.reddit.com/r/nba/comments/4pn0iu/can_we_talk_about_boston/?ref=search_posts,nba,7,105,0,1466805752.0,,Lebyas,True,False
4poawt,LeBron James 2015-16 chasedown block compilation,https://youtu.be/FRrh_WkyXko,youtu.be,https://www.reddit.com/r/nba/comments/4poawt/lebron_james_201516_chasedown_block_compilation/?ref=search_posts,nba,136,20,0,1466820438.0,[MIA] Lamar Odom,MarylandWerewolf,False,False
4pnqhd,"[Givony] Isaia Cordinier had a promise to be picked by a team drafting in the late 30s/early 40s, but team reneged at the last minute. Ugly story. Even told other teams not to pick him because he was guaranteed to be brought to NBA right away. Had to scramble last minute to get picked",https://www.reddit.com/r/nba/comments/4pnqhd/givony_isaia_cordinier_had_a_promise_to_be_picked/,self.nba,https://www.reddit.com/r/nba/comments/4pnqhd/givony_isaia_cordinier_had_a_promise_to_be_picked/?ref=search_posts,nba,217,60,0,1466814134.0,,tsn123456789,True,False
4pn2a8,Rose to Knicks: What does it mean to Adidas?,https://www.reddit.com/r/nba/comments/4pn2a8/rose_to_knicks_what_does_it_mean_to_adidas/,self.nba,https://www.reddit.com/r/nba/comments/4pn2a8/rose_to_knicks_what_does_it_mean_to_adidas/?ref=search_posts,nba,31,41,0,1466806376.0,NBA,sinisterbathala,True,False
4po34c,"[Ding] Brandon Ingram Holds Lakers' Spotlight, but D'Angelo Russell Holds the Future",http://bleacherreport.com/articles/2648296-brandon-ingram-holds-lakers-spotlight-but-dangelo-russell-holds-the-future,bleacherreport.com,https://www.reddit.com/r/nba/comments/4po34c/ding_brandon_ingram_holds_lakers_spotlight_but/?ref=search_posts,nba,18,32,0,1466818052.0,Lakers,zon3d0ut,False,False
4pnim8,"Which young core is better? Suns, Nuggets, or Lakers?",https://www.reddit.com/r/nba/comments/4pnim8/which_young_core_is_better_suns_nuggets_or_lakers/,self.nba,https://www.reddit.com/r/nba/comments/4pnim8/which_young_core_is_better_suns_nuggets_or_lakers/?ref=search_posts,nba,19,65,0,1466811695.0,Lakers,Goonsquad18,True,False
4pos04,Predict next year's playoff teams,https://www.reddit.com/r/nba/comments/4pos04/predict_next_years_playoff_teams/,self.nba,https://www.reddit.com/r/nba/comments/4pos04/predict_next_years_playoff_teams/?ref=search_posts,nba,0,91,0,1466825800.0,Lakers,WordsAreSomething,True,False
4po7u9,Can a Team sign a random guy?,https://www.reddit.com/r/nba/comments/4po7u9/can_a_team_sign_a_random_guy/,self.nba,https://www.reddit.com/r/nba/comments/4po7u9/can_a_team_sign_a_random_guy/?ref=search_posts,nba,90,59,0,1466819493.0,Raptors,DemonRDT6,True,False
4por4y,[Bradley Beal] I have declined the opportunity to participate with Team USA this summer in Rio.,http://tmi.me/1feCb9,tmi.me,https://www.reddit.com/r/nba/comments/4por4y/bradley_beal_i_have_declined_the_opportunity_to/?ref=search_posts,nba,126,39,0,1466825522.0,[POR] Allen Crabbe,BlazeBloom,False,False
4popc6,Five Celtics picks lined up at introductory press conference (Demetrius Jackson absent),http://i.imgur.com/Ng2ciHw.jpg,i.imgur.com,https://www.reddit.com/r/nba/comments/4popc6/five_celtics_picks_lined_up_at_introductory_press/?ref=search_posts,nba,46,53,0,1466824944.0,[BOS] Larry Bird,I_Enjoy_Taffy,False,False
4pnodw,T-wolves PGs,https://www.reddit.com/r/nba/comments/4pnodw/twolves_pgs/,self.nba,https://www.reddit.com/r/nba/comments/4pnodw/twolves_pgs/?ref=search_posts,nba,12,29,0,1466813497.0,[MIN] Karl-Anthony Towns,PM_ME_YOUR_CUTE_IDOL,True,False
4pnt3r,What one rule could you remove/alter that would have a dramatic impact on the NBA?,https://www.reddit.com/r/nba/comments/4pnt3r/what_one_rule_could_you_removealter_that_would/,self.nba,https://www.reddit.com/r/nba/comments/4pnt3r/what_one_rule_could_you_removealter_that_would/?ref=search_posts,nba,5,58,0,1466814939.0,Jazz,CowTank,True,False
4povb1,"[Nate Duncan] ""Permutations of max contracts based on most recent league memo",https://twitter.com/NateDuncanNBA/status/746421534168801280,twitter.com,https://www.reddit.com/r/nba/comments/4povb1/nate_duncan_permutations_of_max_contracts_based/?ref=search_posts,nba,14,22,0,1466826885.0,Nets,ChalupaTacoBatman,False,False
4pnd8d,Which players are you looking forward to seeing play in Summer League now that they're on their respective teams?,https://www.reddit.com/r/nba/comments/4pnd8d/which_players_are_you_looking_forward_to_seeing/,self.nba,https://www.reddit.com/r/nba/comments/4pnd8d/which_players_are_you_looking_forward_to_seeing/?ref=search_posts,nba,5,31,0,1466809936.0,[BOS] Larry Bird,I_Enjoy_Taffy,True,False
4pnm2i,Should the Kings trade Demarcus Cousins?,https://www.reddit.com/r/nba/comments/4pnm2i/should_the_kings_trade_demarcus_cousins/,self.nba,https://www.reddit.com/r/nba/comments/4pnm2i/should_the_kings_trade_demarcus_cousins/?ref=search_posts,nba,0,78,0,1466812802.0,Suns,dirtydesert,True,False
4pndbb,Is there going to be no off season action between now and the lifting of the moratorium on July 1st?,https://www.reddit.com/r/nba/comments/4pndbb/is_there_going_to_be_no_off_season_action_between/,self.nba,https://www.reddit.com/r/nba/comments/4pndbb/is_there_going_to_be_no_off_season_action_between/?ref=search_posts,nba,20,14,0,1466809961.0,Raptors,TrillTaskforce,True,False
4pn1we,Boston Celtics Owner Wyc Grousbeck says it was a easy day to not make any trade.,https://youtu.be/MxBxoBLxnFg,youtu.be,https://www.reddit.com/r/nba/comments/4pn1we/boston_celtics_owner_wyc_grousbeck_says_it_was_a/?ref=search_posts,nba,9,34,0,1466806237.0,Lakers,ginormousego,False,False
4po1iv,Who was the best NBA draft prospect since LeBron?,https://www.reddit.com/r/nba/comments/4po1iv/who_was_the_best_nba_draft_prospect_since_lebron/,self.nba,https://www.reddit.com/r/nba/comments/4po1iv/who_was_the_best_nba_draft_prospect_since_lebron/?ref=search_posts,nba,40,137,0,1466817541.0,76ers,patarack,True,False
4pou7u,.@drose has arrived in NYC! #Knicks,https://twitter.com/nyknicks/status/746428444334919680/photo/1,twitter.com,https://www.reddit.com/r/nba/comments/4pou7u/drose_has_arrived_in_nyc_knicks/?ref=search_posts,nba,185,78,0,1466826506.0,Lakers,nochill95,False,False
4pmzlv,Can someone explain to me how the thunder won the trade?,https://www.reddit.com/r/nba/comments/4pmzlv/can_someone_explain_to_me_how_the_thunder_won_the/,self.nba,https://www.reddit.com/r/nba/comments/4pmzlv/can_someone_explain_to_me_how_the_thunder_won_the/?ref=search_posts,nba,0,90,0,1466805417.0,Heat,Libertines24,True,False
4poe7l,What now for the 76ers?,https://www.reddit.com/r/nba/comments/4poe7l/what_now_for_the_76ers/,self.nba,https://www.reddit.com/r/nba/comments/4poe7l/what_now_for_the_76ers/?ref=search_posts,nba,22,54,0,1466821428.0,Celtics,KevinMcCallister,True,False
4pomdo,"The Mavericks have identified RFA Evan Fournier and UFAs Kent Bazemore, Evan Turner and Marvin Williams as possible replacements for Parsons",http://espn.go.com/nba/story/_/id/16481753/chandler-parsons-looking-forward-free-agency-dallas-mavericks,espn.go.com,https://www.reddit.com/r/nba/comments/4pomdo/the_mavericks_have_identified_rfa_evan_fournier/?ref=search_posts,nba,35,55,0,1466823999.0,[DAL] Steve Nash,aceofspadez138,False,False
4poo4t,[Fisher] Source tells me Tyson Chandler would be interested in return but #Mavs only consider if #Suns buyout,https://twitter.com/fishsports/status/746401181891592192,twitter.com,https://www.reddit.com/r/nba/comments/4poo4t/fisher_source_tells_me_tyson_chandler_would_be/?ref=search_posts,nba,53,51,0,1466824560.0,[DAL] Steve Nash,aceofspadez138,False,False
4pokgi,"As an NBA novice, I have a couple of questions about free agency, if that's okay.",https://www.reddit.com/r/nba/comments/4pokgi/as_an_nba_novice_i_have_a_couple_of_questions/,self.nba,https://www.reddit.com/r/nba/comments/4pokgi/as_an_nba_novice_i_have_a_couple_of_questions/?ref=search_posts,nba,49,31,0,1466823408.0,Thunder,totti10poke,True,False
4poouc,"What are examples of players taken ""too high"" in the draft but ended up being worth it?",https://www.reddit.com/r/nba/comments/4poouc/what_are_examples_of_players_taken_too_high_in/,self.nba,https://www.reddit.com/r/nba/comments/4poouc/what_are_examples_of_players_taken_too_high_in/?ref=search_posts,nba,19,43,0,1466824782.0,Warriors,theblackhole25,True,False
4po8z1,"Warriors eyeing Horford, Whiteside, and Batum if they can't get Durant",https://twitter.com/nbcsports/status/746390974545309696,twitter.com,https://www.reddit.com/r/nba/comments/4po8z1/warriors_eyeing_horford_whiteside_and_batum_if/?ref=search_posts,nba,74,80,0,1466819868.0,Hawks,DankVoid,False,False
4pol0l,"CSN Wizards on Twitter: ""Report: Wizards prepping max offer for Joakim Noah""",https://twitter.com/CSNWizards/status/746412590675464192,twitter.com,https://www.reddit.com/r/nba/comments/4pol0l/csn_wizards_on_twitter_report_wizards_prepping/?ref=search_posts,nba,13,55,0,1466823591.0,Wizards,micgou14,False,False
4pof5n,[Solari]: Michigan State's undrafted Matt Costello to sign with Atlanta Hawks,http://www.freep.com/story/sports/college/michigan-state/spartans/2016/06/24/matt-costello-undrafted-atlanta-hawks/86339066/,freep.com,https://www.reddit.com/r/nba/comments/4pof5n/solari_michigan_states_undrafted_matt_costello_to/?ref=search_posts,nba,38,3,0,1466821728.0,[DET] Ben Wallace,johnazoidberg-,False,False
4pocro,"Gary Harris’ job is starting shooting guard, says Nuggets GM Tim Connelly",http://www.denverpost.com/2016/06/24/gary-harris-denver-nuggets-starting-shooting-guard/,denverpost.com,https://www.reddit.com/r/nba/comments/4pocro/gary_harris_job_is_starting_shooting_guard_says/?ref=search_posts,nba,36,49,0,1466821017.0,Nuggets,kidbom,False,False
4porb6,Devin Booker looks like Dwyane Wade,https://streamable.com/cxe1,streamable.com,https://www.reddit.com/r/nba/comments/4porb6/devin_booker_looks_like_dwyane_wade/?ref=search_posts,nba,202,50,0,1466825580.0,Lakers,sheeeeeez,False,False
4pniz1,A Cavs Fan in Utah Threw a Small Championship Parade Yesterday in Provo,http://www.clevescene.com/scene-and-heard/archives/2016/06/24/a-cavs-fan-in-utah-threw-a-small-championship-parade-yesterday-in-provo,clevescene.com,https://www.reddit.com/r/nba/comments/4pniz1/a_cavs_fan_in_utah_threw_a_small_championship/?ref=search_posts,nba,107,22,0,1466811813.0,Bucks,pierdonia,False,False
4pnm0e,"[David Pick] New Orleans Pelicans, I'm told, invite Nick Minnerath to Summer League. He lit up the D-League, shot 50/40/90.",https://twitter.com/IAmDPick/status/746370844063047680,twitter.com,https://www.reddit.com/r/nba/comments/4pnm0e/david_pick_new_orleans_pelicans_im_told_invite/?ref=search_posts,nba,45,4,0,1466812778.0,[NOP] Anthony Davis,blinkme123,False,False
4pojbe,Was Thibs getting back at the Bulls with the rumors last night?,https://www.reddit.com/r/nba/comments/4pojbe/was_thibs_getting_back_at_the_bulls_with_the/,self.nba,https://www.reddit.com/r/nba/comments/4pojbe/was_thibs_getting_back_at_the_bulls_with_the/?ref=search_posts,nba,14,25,0,1466823021.0,76ers,tenyor,True,False
4pm5ae,"2016 Draft Player Statistics (age, weight, height, origin)",http://i.imgur.com/GCX8qt6.jpg,i.imgur.com,https://www.reddit.com/r/nba/comments/4pm5ae/2016_draft_player_statistics_age_weight_height/?ref=search_posts,nba,41,7,0,1466791870.0,Wizards,ZaphBeeblebrox,False,False
4pnoih,Where will KD end up?,https://www.reddit.com/r/nba/comments/4pnoih/where_will_kd_end_up/,self.nba,https://www.reddit.com/r/nba/comments/4pnoih/where_will_kd_end_up/?ref=search_posts,nba,0,78,0,1466813535.0,Knicks,joetragedy,True,False
4poha7,What the Rose Trade Means for Knicks O and Who Should They Sign,https://www.reddit.com/r/nba/comments/4poha7/what_the_rose_trade_means_for_knicks_o_and_who/,self.nba,https://www.reddit.com/r/nba/comments/4poha7/what_the_rose_trade_means_for_knicks_o_and_who/?ref=search_posts,nba,204,32,0,1466822382.0,,beldarconehead,True,False
4pnnns,Whos your starting lineup from anyone that has played for your team past or present?,https://www.reddit.com/r/nba/comments/4pnnns/whos_your_starting_lineup_from_anyone_that_has/,self.nba,https://www.reddit.com/r/nba/comments/4pnnns/whos_your_starting_lineup_from_anyone_that_has/?ref=search_posts,nba,6,64,0,1466813277.0,Warriors,livinglegend415,True,False
4pnnum,Do we understand why Davis fell to the second round when he was expected to be a mid lottery pick?,https://www.reddit.com/r/nba/comments/4pnnum/do_we_understand_why_davis_fell_to_the_second/,self.nba,https://www.reddit.com/r/nba/comments/4pnnum/do_we_understand_why_davis_fell_to_the_second/?ref=search_posts,nba,1,29,0,1466813332.0,Raptors,TrillTaskforce,True,False
4pmkkj,How will the Thunder pay everyone?,https://www.reddit.com/r/nba/comments/4pmkkj/how_will_the_thunder_pay_everyone/,self.nba,https://www.reddit.com/r/nba/comments/4pmkkj/how_will_the_thunder_pay_everyone/?ref=search_posts,nba,29,48,0,1466799416.0,Magic,ItoldonAnneFrank,True,False
4pom3u,"[Begley] The Thunder, Nets & Mavericks are among teams expected to have interest in Knicks FA Lance Thomas",https://twitter.com/IanBegley/status/746336313893339136,twitter.com,https://www.reddit.com/r/nba/comments/4pom3u/begley_the_thunder_nets_mavericks_are_among_teams/?ref=search_posts,nba,18,31,0,1466823914.0,[DAL] Steve Nash,aceofspadez138,False,False
4pn0cq,Thoughts on the Ibaka/Oladipo trade from a Magic fan.,https://www.reddit.com/r/nba/comments/4pn0cq/thoughts_on_the_ibakaoladipo_trade_from_a_magic/,self.nba,https://www.reddit.com/r/nba/comments/4pn0cq/thoughts_on_the_ibakaoladipo_trade_from_a_magic/?ref=search_posts,nba,5,55,0,1466805692.0,Magic,jw44,True,False
4po112,"Where do you see the Lakers, Timberwolves in 3-4 years?",https://www.reddit.com/r/nba/comments/4po112/where_do_you_see_the_lakers_timberwolves_in_34/,self.nba,https://www.reddit.com/r/nba/comments/4po112/where_do_you_see_the_lakers_timberwolves_in_34/?ref=search_posts,nba,57,156,0,1466817386.0,Heat,JJWhatWhat,True,False
4pnh4x,This year the draft was kinda backwards with relation to the Spurs,https://www.reddit.com/r/nba/comments/4pnh4x/this_year_the_draft_was_kinda_backwards_with/,self.nba,https://www.reddit.com/r/nba/comments/4pnh4x/this_year_the_draft_was_kinda_backwards_with/?ref=search_posts,nba,16,21,0,1466811203.0,Spurs,honsuo73,True,False
4pohop,Bill Simmons Podcast on the NBA Draft,https://soundcloud.com/the-bill-simmons-podcast/ep-107-friday-rollin-nba-draft-wrap-up-with-joe-house-and-kevin-clark-on-orlando,soundcloud.com,https://www.reddit.com/r/nba/comments/4pohop/bill_simmons_podcast_on_the_nba_draft/?ref=search_posts,nba,102,129,0,1466822506.0,Bulls,redditnaked,False,False
4po0ih,"Herd w/Colin Cowherd on Twitter: """"Oklahoma City will be next season's NBA Champion.""",https://twitter.com/TheHerd/status/746388819906166784,twitter.com,https://www.reddit.com/r/nba/comments/4po0ih/herd_wcolin_cowherd_on_twitter_oklahoma_city_will/?ref=search_posts,nba,0,74,0,1466817227.0,[MEM] Tony Allen,reliabletinman,False,False
4poa8l,"[Marc Stein] ""USA Basketball has extended an Olympic invitation to the Wizards' Bradley Beal, sources say, but Beal has much to weigh in a contract summer""",https://twitter.com/ESPNSteinLine/status/746402239309189121,twitter.com,https://www.reddit.com/r/nba/comments/4poa8l/marc_stein_usa_basketball_has_extended_an_olympic/?ref=search_posts,nba,88,24,0,1466820238.0,Nets,ChalupaTacoBatman,False,False
4poqfy,Thunder smallball net rating vs. Warriors with Ibaka at center: +18.7. Adams at center: -41.2,https://twitter.com/samesfandiari/status/746415119492481024,twitter.com,https://www.reddit.com/r/nba/comments/4poqfy/thunder_smallball_net_rating_vs_warriors_with/?ref=search_posts,nba,67,35,0,1466825303.0,,BearsNecessity,False,False
4pni0b,What do you want to see in the newest Space Jam movie?,https://www.reddit.com/r/nba/comments/4pni0b/what_do_you_want_to_see_in_the_newest_space_jam/,self.nba,https://www.reddit.com/r/nba/comments/4pni0b/what_do_you_want_to_see_in_the_newest_space_jam/?ref=search_posts,nba,39,48,0,1466811491.0,Nuggets,Jew_Juan_Howard,True,False
4pnq2b,"Without Ibaka, don't the Thunder have an obvious hole at power forward now? Kanter and Adams are both centers.",https://www.reddit.com/r/nba/comments/4pnq2b/without_ibaka_dont_the_thunder_have_an_obvious/,self.nba,https://www.reddit.com/r/nba/comments/4pnq2b/without_ibaka_dont_the_thunder_have_an_obvious/?ref=search_posts,nba,60,149,0,1466814001.0,Raptors,TrillTaskforce,True,False
4pmm6v,Your personal unpopular opinions and predictions from this years draft,https://www.reddit.com/r/nba/comments/4pmm6v/your_personal_unpopular_opinions_and_predictions/,self.nba,https://www.reddit.com/r/nba/comments/4pmm6v/your_personal_unpopular_opinions_and_predictions/?ref=search_posts,nba,30,213,0,1466800145.0,,killerkebab1499,True,False
4pobza,What's your opinion on Ben Simmons?,https://www.reddit.com/r/nba/comments/4pobza/whats_your_opinion_on_ben_simmons/,self.nba,https://www.reddit.com/r/nba/comments/4pobza/whats_your_opinion_on_ben_simmons/?ref=search_posts,nba,6,58,0,1466820755.0,Cavaliers,ThirdTermObama,True,False
