id,title,url,domain,permalink,subreddit,score,num_comments,gilded,created,author_flair_text,author,is_self,over_18
4qju1k,"[Broussard] Houston, Memphis, New York, New Orleans interested in free agent guard Eric Gordon, sources say",https://twitter.com/Chris_Broussard/status/748370247145644032,twitter.com,https://www.reddit.com/r/nba/comments/4qju1k/broussard_houston_memphis_new_york_new_orleans/?ref=search_posts,nba,19,32,0,1467289181.0,Nuggets,PotRoastBoobs,False,False
4qjljv,Delly 1's unveiling and shoe signing in Melbourne [matthewdelly snapchat],https://streamable.com/8g09,streamable.com,https://www.reddit.com/r/nba/comments/4qjljv/delly_1s_unveiling_and_shoe_signing_in_melbourne/?ref=search_posts,nba,68,48,0,1467285506.0,Cavaliers,Chuggawumba123,False,False
4qhy9m,"[Watkins] Donatas Motiejunas, a restricted free agent, told ESPN he's willing to return to the Rockets. Houston is the first team he plans to meet with on July 1.",http://espn.go.com/espn/now?nowId=21-0539914308272790856-4,espn.go.com,https://www.reddit.com/r/nba/comments/4qhy9m/watkins_donatas_motiejunas_a_restricted_free/?ref=search_posts,nba,29,22,0,1467263405.0,West,urfaselol,False,False
4qk46y,Compilation of Wade's snapchats from yacht with LeBron and CP3,https://streamable.com/vrqj,streamable.com,https://www.reddit.com/r/nba/comments/4qk46y/compilation_of_wades_snapchats_from_yacht_with/?ref=search_posts,nba,99,62,0,1467294074.0,Cavaliers,King_Of_The_Land,False,False
4qjou7,"Marc Stein on Twitter: ""Have heard the same lament from multiple interested teams tonight: They see New York as a big favorite to land Joakim Noah in free agency.""",https://twitter.com/ESPNSteinLine/status/748360476912812033,twitter.com,https://www.reddit.com/r/nba/comments/4qjou7/marc_stein_on_twitter_have_heard_the_same_lament/?ref=search_posts,nba,63,64,0,1467286851.0,,joe4942,False,False
4qjcka,[Serious] Why are so many people so sure of Embiid being a star player?,https://www.reddit.com/r/nba/comments/4qjcka/serious_why_are_so_many_people_so_sure_of_embiid/,self.nba,https://www.reddit.com/r/nba/comments/4qjcka/serious_why_are_so_many_people_so_sure_of_embiid/?ref=search_posts,nba,45,48,0,1467281933.0,[MIN] Andrew Wiggins,impossiber,True,False
4qj8k6,"[Lowe] In wake of Jodie Meeks deal, Pistons working to secure a weekend meeting with Al Horford",https://twitter.com/ZachLowe_NBA/status/748332869169389568,twitter.com,https://www.reddit.com/r/nba/comments/4qj8k6/lowe_in_wake_of_jodie_meeks_deal_pistons_working/?ref=search_posts,nba,33,44,0,1467280334.0,Celtics,Brad-Stevens,False,False
4qhw4c,[Stein] Dario Saric told reporters in Europe he's headed to the Sixers; they are working to make it happen this month,https://twitter.com/ESPNSteinLine/status/748256018023407617,twitter.com,https://www.reddit.com/r/nba/comments/4qhw4c/stein_dario_saric_told_reporters_in_europe_hes/?ref=search_posts,nba,64,44,0,1467262721.0,,Felipe19_,False,False
4qi1el,Is there a reason why 7 of the 8 best long two shooters were bigs and not guards last season?,https://twitter.com/bball_ref/status/747496008305770496,twitter.com,https://www.reddit.com/r/nba/comments/4qi1el/is_there_a_reason_why_7_of_the_8_best_long_two/?ref=search_posts,nba,16,23,0,1467264419.0,Raptors,TrillTaskforce,False,False
4qjmnv,Any Given Wednesday with Bill Simmons: Bill's Free Agency advice for the New York Knicks,https://www.youtube.com/watch?v=Yha7vG7cGUE,youtube.com,https://www.reddit.com/r/nba/comments/4qjmnv/any_given_wednesday_with_bill_simmons_bills_free/?ref=search_posts,nba,31,63,0,1467285955.0,[LAL] Jordan Clarkson,ReallyGoodUsername,False,False
4qkfmg,Last years rookies,https://www.reddit.com/r/nba/comments/4qkfmg/last_years_rookies/,self.nba,https://www.reddit.com/r/nba/comments/4qkfmg/last_years_rookies/?ref=search_posts,nba,3,37,0,1467300197.0,[OKC] Russell Westbrook,limark,True,False
4qi9ds,Can Kings turn it around?,https://www.reddit.com/r/nba/comments/4qi9ds/can_kings_turn_it_around/,self.nba,https://www.reddit.com/r/nba/comments/4qi9ds/can_kings_turn_it_around/?ref=search_posts,nba,12,31,0,1467267048.0,,miriczivojin,True,False
4qjgkm,Would you date the ugliest player on your team for one season if it meant you'd win a title for the next 6?,https://www.reddit.com/r/nba/comments/4qjgkm/would_you_date_the_ugliest_player_on_your_team/,self.nba,https://www.reddit.com/r/nba/comments/4qjgkm/would_you_date_the_ugliest_player_on_your_team/?ref=search_posts,nba,33,197,0,1467283492.0,Wizards,AnalSlutFrog,True,False
4qjvsu,Sources: New York Knicks emerge as strong favorites to sign Joakim Noah in free agency,http://espn.go.com/nba/story/_/id/16630471/new-york-knicks-emerge-strong-favorites-sign-joakim-noah-free-agency,espn.go.com,https://www.reddit.com/r/nba/comments/4qjvsu/sources_new_york_knicks_emerge_as_strong/?ref=search_posts,nba,34,47,0,1467289949.0,[NYK] Kristaps Porzingis,ViewsFromThe516,False,False
4qji81,"If you could have 5 years of prime LeBron or 5 years of prime Shaq on your team, which do you chose?",https://www.reddit.com/r/nba/comments/4qji81/if_you_could_have_5_years_of_prime_lebron_or_5/,self.nba,https://www.reddit.com/r/nba/comments/4qji81/if_you_could_have_5_years_of_prime_lebron_or_5/?ref=search_posts,nba,37,137,0,1467284179.0,Pacers,Obi2,True,False
4qhsl1,Propose A Trade Thread,https://www.reddit.com/r/nba/comments/4qhsl1/propose_a_trade_thread/,self.nba,https://www.reddit.com/r/nba/comments/4qhsl1/propose_a_trade_thread/?ref=search_posts,nba,4,71,0,1467261602.0,Timberwolves,kapitan_buko,True,False
4qhxlk,Kings extend qualifying offer to Seth Curry,https://twitter.com/mr_jasonjones/status/748200571945910272,twitter.com,https://www.reddit.com/r/nba/comments/4qhxlk/kings_extend_qualifying_offer_to_seth_curry/?ref=search_posts,nba,44,21,0,1467263199.0,[SAC] Willie Cauley-Stein,zeriloa,False,False
4qjwf8,"[Stein] More meetings for Kevin Durant: Clippers on Friday, Boston on Saturday and Miami on Sunday -- all in the Hamptons -- league sources say.",https://twitter.com/ESPNSteinLine/status/748374717132857344,twitter.com,https://www.reddit.com/r/nba/comments/4qjwf8/stein_more_meetings_for_kevin_durant_clippers_on/?ref=search_posts,nba,15,41,0,1467290236.0,Nuggets,PotRoastBoobs,False,False
4qjhpc,[Lowe] The Hawks are reluctant to offer Horford the fifth year,https://www.reddit.com/r/nba/comments/4qjhpc/lowe_the_hawks_are_reluctant_to_offer_horford_the/,self.nba,https://www.reddit.com/r/nba/comments/4qjhpc/lowe_the_hawks_are_reluctant_to_offer_horford_the/?ref=search_posts,nba,52,45,0,1467283961.0,Hawks,Decatur_Psalm,True,False
4qk8jt,The Life of Bron shirt?,https://www.reddit.com/r/nba/comments/4qk8jt/the_life_of_bron_shirt/,self.nba,https://www.reddit.com/r/nba/comments/4qk8jt/the_life_of_bron_shirt/?ref=search_posts,nba,1,8,0,1467296381.0,NBA,sinisterbathala,True,False
4qhpab,Can the current Spanish National team win an NBA title?,https://www.reddit.com/r/nba/comments/4qhpab/can_the_current_spanish_national_team_win_an_nba/,self.nba,https://www.reddit.com/r/nba/comments/4qhpab/can_the_current_spanish_national_team_win_an_nba/?ref=search_posts,nba,0,16,0,1467260568.0,Bulls,black_asian,True,False
4qje16,"Reggie, Randy and Randle spending their vacations with Wade,LBJ and CP3",https://www.instagram.com/p/BHQmpLMhFLp/,instagram.com,https://www.reddit.com/r/nba/comments/4qje16/reggie_randy_and_randle_spending_their_vacations/?ref=search_posts,nba,14,12,0,1467282513.0,Heat,Imzarth,False,False
4qj9zr,Rant - Bill Simmons is alienating his international fanbase,https://www.reddit.com/r/nba/comments/4qj9zr/rant_bill_simmons_is_alienating_his_international/,self.nba,https://www.reddit.com/r/nba/comments/4qj9zr/rant_bill_simmons_is_alienating_his_international/?ref=search_posts,nba,0,38,0,1467280889.0,NBA,nxxkx,True,False
4qinfj,Will the Raptors retire Jose Calderon's number?,https://www.reddit.com/r/nba/comments/4qinfj/will_the_raptors_retire_jose_calderons_number/,self.nba,https://www.reddit.com/r/nba/comments/4qinfj/will_the_raptors_retire_jose_calderons_number/?ref=search_posts,nba,0,25,0,1467272172.0,Knicks,capin18,True,False
4qjexy,Is there an example of long-term tanking actually working?,https://www.reddit.com/r/nba/comments/4qjexy/is_there_an_example_of_longterm_tanking_actually/,self.nba,https://www.reddit.com/r/nba/comments/4qjexy/is_there_an_example_of_longterm_tanking_actually/?ref=search_posts,nba,0,30,0,1467282889.0,Thunder,Your_Personal_Jesus,True,False
4qj6uw,33-Year-Old Canadian Steve Sir joins the Milwaukee Bucks summer league team.,http://edmontonjournal.com/sports/basketball/nba/local-basketball-veteran-called-to-milwaukee-bucks-nba-summer-league-team,edmontonjournal.com,https://www.reddit.com/r/nba/comments/4qj6uw/33yearold_canadian_steve_sir_joins_the_milwaukee/?ref=search_posts,nba,23,11,0,1467279663.0,Raptors,theantarctica,False,False
4qjz4m,NBA Podcasts,https://www.reddit.com/r/nba/comments/4qjz4m/nba_podcasts/,self.nba,https://www.reddit.com/r/nba/comments/4qjz4m/nba_podcasts/?ref=search_posts,nba,0,12,0,1467291530.0,,mouthyy,True,False
4qi0gz,Kings Fan turn Warriors Fan,https://www.reddit.com/r/nba/comments/4qi0gz/kings_fan_turn_warriors_fan/,self.nba,https://www.reddit.com/r/nba/comments/4qi0gz/kings_fan_turn_warriors_fan/?ref=search_posts,nba,0,43,0,1467264126.0,,bridge_view,True,False
