id,title,url,domain,permalink,subreddit,score,num_comments,gilded,created,author_flair_text,author,is_self,over_18
551nr4,"[OC] So close, yet so far: Dirk's unluckiness in regards to attaining various records/statistics throughout his career",https://www.reddit.com/r/nba/comments/551nr4/oc_so_close_yet_so_far_dirks_unluckiness_in/,self.nba,https://www.reddit.com/r/nba/comments/551nr4/oc_so_close_yet_so_far_dirks_unluckiness_in/?ref=search_posts,nba,606,161,0,1475176453.0,Cavaliers Bandwagon,Joonypoo,True,False
5535yh,Cameron Payne Suffers Foot Fracture In Blue-White Scrimmage,http://www.newson6.com/story/33280331/cameron-payne-suffers-foot-fracture-in-blue-white-scrimmage,newson6.com,https://www.reddit.com/r/nba/comments/5535yh/cameron_payne_suffers_foot_fracture_in_bluewhite/?ref=search_posts,nba,291,152,0,1475197046.0,OKC Hornets,mccoolio,False,False
553img,The NBA PhD Program - Year 3,https://www.reddit.com/r/nba/comments/553img/the_nba_phd_program_year_3/,self.nba,https://www.reddit.com/r/nba/comments/553img/the_nba_phd_program_year_3/?ref=search_posts,nba,523,150,0,1475201105.0,Nuggets,icarus_adam,True,False
553jhe,Derrick Rose says the Knicks' triangle offense is 'complicated',https://mobile.twitter.com/CBSSportsNBA/status/781554565598490624,mobile.twitter.com,https://www.reddit.com/r/nba/comments/553jhe/derrick_rose_says_the_knicks_triangle_offense_is/?ref=search_posts,nba,363,279,0,1475201359.0,,teritore,False,False
552scw,"[McDonald] In the span of 365 days, LaMarcus Aldridge has become the Spurs' longest tenured big man",http://www.expressnews.com/sports/spurs/article/For-Spurs-big-man-rotation-some-assembly-9392932.php?t=8d21e14bdf927fc3fb&cmpid=twitter-premium,expressnews.com,https://www.reddit.com/r/nba/comments/552scw/mcdonald_in_the_span_of_365_days_lamarcus/?ref=search_posts,nba,1983,146,0,1475192657.0,Bulls,wjbc,False,False
551r01,Which 3 players are you excited to see play this year?,https://www.reddit.com/r/nba/comments/551r01/which_3_players_are_you_excited_to_see_play_this/,self.nba,https://www.reddit.com/r/nba/comments/551r01/which_3_players_are_you_excited_to_see_play_this/?ref=search_posts,nba,95,256,0,1475178151.0,Celtics,RoundRajon34,True,False
553q8w,Gregg Popovich used to drop carrot cake off at Tim Duncan's hotel room door on road trips,https://twitter.com/steven_lebron/status/780887896807071746?ref_src=twsrc%5Etfw,twitter.com,https://www.reddit.com/r/nba/comments/553q8w/gregg_popovich_used_to_drop_carrot_cake_off_at/?ref=search_posts,nba,757,78,0,1475203517.0,[BOS] Larry Bird,I_Enjoy_Taffy,False,False
551hk0,Two MVPs in one team,https://www.reddit.com/r/nba/comments/551hk0/two_mvps_in_one_team/,self.nba,https://www.reddit.com/r/nba/comments/551hk0/two_mvps_in_one_team/?ref=search_posts,nba,258,102,0,1475172826.0,NBA,sinisterbathala,True,False
552p80,I was looking at some stats last night and noticed how close Paul Pierce is to making a huge jump up on the all-time scoring list in his final NBA season. [OC],http://imgur.com/8HsapbH,imgur.com,https://www.reddit.com/r/nba/comments/552p80/i_was_looking_at_some_stats_last_night_and/?ref=search_posts,nba,248,98,0,1475191595.0,,qwertymm8383,False,False
553olz,"[McMenamin] Tyronn Lue says he has invited Kevin Garnett, a good friend of his, to join the Cavs coaching staff. KG will be a guest of his at ring night.",http://www.espn.com/espn/now?nowId=21-0573211525376907674-4,espn.com,https://www.reddit.com/r/nba/comments/553olz/mcmenamin_tyronn_lue_says_he_has_invited_kevin/?ref=search_posts,nba,882,159,0,1475203003.0,,Xlow48,False,False
5540ol,"KAT: ""There are so many talented players in the league. But only a few of them are remembered as being great--because they were willing to say they don't know. And I'm willing to say that I don't know everything. I do not know how it is to be a great player, to be a Hall of Famer. I want to learn.""",https://twitter.com/Kyle_Ratke/status/781577769616494592,twitter.com,https://www.reddit.com/r/nba/comments/5540ol/kat_there_are_so_many_talented_players_in_the/?ref=search_posts,nba,993,162,0,1475206848.0,Timberwolves,WhirledWorld,False,False
55412p,KG practiced with the Clippers today,https://twitter.com/LAClippers/status/781576725914202113,twitter.com,https://www.reddit.com/r/nba/comments/55412p/kg_practiced_with_the_clippers_today/?ref=search_posts,nba,387,72,0,1475206971.0,Clippers,SlyHoooper,False,False
552u76,Summer 2004: Shaq and T-Mac wanted to team up with Dirk in Dallas,http://usatoday30.usatoday.com/sports/basketball/nba/2004-06-20-shaq-tmac_x.htm,usatoday30.usatoday.com,https://www.reddit.com/r/nba/comments/552u76/summer_2004_shaq_and_tmac_wanted_to_team_up_with/?ref=search_posts,nba,273,90,0,1475193267.0,Mavericks,decadentrebel,False,False
553ifv,Roy Hibbert will be on the Eric Andre show tomorrow night,https://twitter.com/ericandre/status/781521016250073089,twitter.com,https://www.reddit.com/r/nba/comments/553ifv/roy_hibbert_will_be_on_the_eric_andre_show/?ref=search_posts,nba,1029,210,0,1475201047.0,Raptors,SullyAndLowrysFatAss,False,False
552eta,"Earl Watson on the Suns' new offense: “Point-five mentality. Pass it. Drive it. Shoot it. Don’t hold it. Cut to the rim. Sacrifice cuts and play with pace.""",http://www.azcentral.com/story/sports/nba/suns/2016/09/28/phoenix-suns-install-new-offense-more-efficient/91250768/,azcentral.com,https://www.reddit.com/r/nba/comments/552eta/earl_watson_on_the_suns_new_offense_pointfive/?ref=search_posts,nba,436,119,0,1475187957.0,Suns,scooper1030,False,False
553xcl,"The 5'9"" Point Guard That Torched Powerhouse Programs is Now Pro (Vice sports - Kay Felder)",https://www.youtube.com/watch?v=TolgyTqpK0o,youtube.com,https://www.reddit.com/r/nba/comments/553xcl/the_59_point_guard_that_torched_powerhouse/?ref=search_posts,nba,84,21,0,1475205744.0,[CLE] Brian Scalabrine,Ziberg,False,False
553tme,[Candace Buckner] Bradley Beal diagnosed with mild concussion,https://twitter.com/candacedbuckner/status/781547776308043776,twitter.com,https://www.reddit.com/r/nba/comments/553tme/candace_buckner_bradley_beal_diagnosed_with_mild/?ref=search_posts,nba,97,46,0,1475204579.0,Thunder,dandeman4,False,False
5528qp,"[Tjarks] Is a Change in Scenery All Harrison Barnes Needed?: With a new role on a new team, the Warriors’ afterthought gets his second chance at becoming the star we all thought he would be",https://theringer.com/harrison-barnes-dallas-mavericks-second-chance-5ee9f7c46440#.d6jsl2my5,theringer.com,https://www.reddit.com/r/nba/comments/5528qp/tjarks_is_a_change_in_scenery_all_harrison_barnes/?ref=search_posts,nba,106,127,0,1475185667.0,Knicks,Melanismdotcom,False,False
552rj8,Is there something I'm missing about KG?,https://www.reddit.com/r/nba/comments/552rj8/is_there_something_im_missing_about_kg/,self.nba,https://www.reddit.com/r/nba/comments/552rj8/is_there_something_im_missing_about_kg/?ref=search_posts,nba,0,73,0,1475192360.0,Hawks,OutrageousSerenity,True,False
5531wu,[Curry's trainer] We’ll see some better decision making. I think his improvement this year is going to be some defensive.,http://www.sbnation.com/2016/9/28/13093904/stephen-curry-move-dribble-warriors-brandon-payne,sbnation.com,https://www.reddit.com/r/nba/comments/5531wu/currys_trainer_well_see_some_better_decision/?ref=search_posts,nba,19,24,0,1475195743.0,Warriors,MagicWade,False,False
551dpc,"Before this terrifying season begins, can we have a pre-Warriors Kevin Durant remembrance and mourning thread?",https://www.reddit.com/r/nba/comments/551dpc/before_this_terrifying_season_begins_can_we_have/,self.nba,https://www.reddit.com/r/nba/comments/551dpc/before_this_terrifying_season_begins_can_we_have/?ref=search_posts,nba,123,98,0,1475170454.0,Trail Blazers,shickard,True,False
5528vc,Do you think we will see a woman play in the NBA?,https://www.reddit.com/r/nba/comments/5528vc/do_you_think_we_will_see_a_woman_play_in_the_nba/,self.nba,https://www.reddit.com/r/nba/comments/5528vc/do_you_think_we_will_see_a_woman_play_in_the_nba/?ref=search_posts,nba,0,155,0,1475185724.0,Suns,FootballCTE,True,False
552wcn,Paul Pierce comparison,https://www.reddit.com/r/nba/comments/552wcn/paul_pierce_comparison/,self.nba,https://www.reddit.com/r/nba/comments/552wcn/paul_pierce_comparison/?ref=search_posts,nba,11,38,0,1475193966.0,,angered_shovel,True,False
553fgq,GREGG POPPOVICH - Funniest Moments,https://www.youtube.com/watch?v=WioDKkjugqw,youtube.com,https://www.reddit.com/r/nba/comments/553fgq/gregg_poppovich_funniest_moments/?ref=search_posts,nba,43,1,0,1475200067.0,Spurs,PhillipJFry32,False,False
5523fl,Funny Past NBAonTNT commercials #TBT,https://www.youtube.com/watch?v=RCQZocVq2gI,youtube.com,https://www.reddit.com/r/nba/comments/5523fl/funny_past_nbaontnt_commercials_tbt/?ref=search_posts,nba,37,4,0,1475183567.0,Bobcats,mcmikechan123,False,False
553o7r,[Wojnarowski] Sources: Free agent PJ Hairston is joining the Houston Rockets on a training camp deal. Houston will have his D-League rights.,https://twitter.com/WojVerticalNBA/status/781556378380840961,twitter.com,https://www.reddit.com/r/nba/comments/553o7r/wojnarowski_sources_free_agent_pj_hairston_is/?ref=search_posts,nba,122,24,0,1475202893.0,,tsn123456789,False,False
5539ww,"After losing Dwyane Wade and Chris Bosh this offseason, should Miami regret not drafting Devin Booker in the 2015 draft?",https://www.reddit.com/r/nba/comments/5539ww/after_losing_dwyane_wade_and_chris_bosh_this/,self.nba,https://www.reddit.com/r/nba/comments/5539ww/after_losing_dwyane_wade_and_chris_bosh_this/?ref=search_posts,nba,0,109,0,1475198310.0,[MIA] Shane Battier,PrinceLifer,True,False
553ykt,Ray Allen hits the game-winner against Charlotte Bobcats,https://youtu.be/frIXQ-yNm_E,youtu.be,https://www.reddit.com/r/nba/comments/553ykt/ray_allen_hits_the_gamewinner_against_charlotte/?ref=search_posts,nba,37,7,0,1475206138.0,Celtics,Timi093,False,False
552o6g,"[McDonald] That didn't take long: The Spurs announce they have waived camp invitee Ryan Richards, their former second-round pick",https://twitter.com/JMcDonald_SAEN/status/781483564973957120,twitter.com,https://www.reddit.com/r/nba/comments/552o6g/mcdonald_that_didnt_take_long_the_spurs_announce/?ref=search_posts,nba,129,20,0,1475191252.0,NBA,-RAMBI-,False,False
553cvs,Once In A Generation - A Tribute To Tim Duncan,https://www.youtube.com/watch?v=K4n-Gb0x3jU,youtube.com,https://www.reddit.com/r/nba/comments/553cvs/once_in_a_generation_a_tribute_to_tim_duncan/?ref=search_posts,nba,57,6,0,1475199263.0,,BearsNecessity,False,False
553gd1,"Ben Wallace is currently ranked in the top 5 for Career DRtg and DB+/- in both Regular Season and Playoffs, the only player so far.",https://www.reddit.com/r/nba/comments/553gd1/ben_wallace_is_currently_ranked_in_the_top_5_for/,self.nba,https://www.reddit.com/r/nba/comments/553gd1/ben_wallace_is_currently_ranked_in_the_top_5_for/?ref=search_posts,nba,149,81,0,1475200352.0,Timberwolves,Wasteland2612,True,False
5533to,Most talented NBA teams in history,https://www.reddit.com/r/nba/comments/5533to/most_talented_nba_teams_in_history/,self.nba,https://www.reddit.com/r/nba/comments/5533to/most_talented_nba_teams_in_history/?ref=search_posts,nba,11,51,0,1475196359.0,,pclark90210,True,False
553xws,NBA Overweight Edition,https://www.reddit.com/r/nba/comments/553xws/nba_overweight_edition/,self.nba,https://www.reddit.com/r/nba/comments/553xws/nba_overweight_edition/?ref=search_posts,nba,7,31,0,1475205928.0,[MIN] Robbie Hummel,wkbaum,True,False
5530h2,Which players do you think have the best chance of breaking out this year?,https://www.reddit.com/r/nba/comments/5530h2/which_players_do_you_think_have_the_best_chance/,self.nba,https://www.reddit.com/r/nba/comments/5530h2/which_players_do_you_think_have_the_best_chance/?ref=search_posts,nba,32,53,0,1475195302.0,Nets,olmanwes,True,False
55382d,What category does Michael Jordan lead the NBA in?,https://www.reddit.com/r/nba/comments/55382d/what_category_does_michael_jordan_lead_the_nba_in/,self.nba,https://www.reddit.com/r/nba/comments/55382d/what_category_does_michael_jordan_lead_the_nba_in/?ref=search_posts,nba,27,83,0,1475197700.0,Cavaliers,jedimasterchief,True,False
553bqx,Demar sinks the Magic with the most Derozan-esque shot,https://www.youtube.com/watch?v=FLgYmZH14K4,youtube.com,https://www.reddit.com/r/nba/comments/553bqx/demar_sinks_the_magic_with_the_most_derozanesque/?ref=search_posts,nba,171,60,0,1475198897.0,Raptors,RaceCarace,False,False
551a5n,"With parts missing, Kyle Anderson and Jonathan Simmons could become crucial to the Spurs' success this year",http://www.expressnews.com/sports/spurs/article/With-parts-missing-Anderson-Simmons-become-9392928.php,expressnews.com,https://www.reddit.com/r/nba/comments/551a5n/with_parts_missing_kyle_anderson_and_jonathan/?ref=search_posts,nba,30,29,0,1475168179.0,San Diego Clippers,Chad3000,False,False
553of9,KAT starring in new Gatorade commercial,https://m.youtube.com/watch?v=4gQ53cjW0Mw,m.youtube.com,https://www.reddit.com/r/nba/comments/553of9/kat_starring_in_new_gatorade_commercial/?ref=search_posts,nba,117,28,0,1475202948.0,[MIN] Karl-Anthony Towns,42Vert,False,False
553pjf,Dwight havin fun,https://twitter.com/DennisMike93/status/781560707313704960?lang=de,twitter.com,https://www.reddit.com/r/nba/comments/553pjf/dwight_havin_fun/?ref=search_posts,nba,7,15,0,1475203309.0,Warriors,Presidentlbo,False,False
551g6s,Suns Veterans Surprise Rookies with Kids Backpacks | Phoenix Suns,http://www.nba.com/suns/blog/suns-veterans-surprise-rookies-kids-backpacks,nba.com,https://www.reddit.com/r/nba/comments/551g6s/suns_veterans_surprise_rookies_with_kids/?ref=search_posts,nba,10,0,0,1475172030.0,[PHO] Vince Carter,SunsFan97,False,False
553xf0,[CBS Sports on Twitter] Kevin Durant turns 28 today!,https://twitter.com/CBSSports/status/781567806051528704/photo/1,twitter.com,https://www.reddit.com/r/nba/comments/553xf0/cbs_sports_on_twitter_kevin_durant_turns_28_today/?ref=search_posts,nba,0,13,0,1475205766.0,Bulls,wjbc,False,False
553ykm,All Star Weekend Event Idea - Coach's Scrimmage,https://www.reddit.com/r/nba/comments/553ykm/all_star_weekend_event_idea_coachs_scrimmage/,self.nba,https://www.reddit.com/r/nba/comments/553ykm/all_star_weekend_event_idea_coachs_scrimmage/?ref=search_posts,nba,17,9,0,1475206135.0,,dougburr,True,False
551epn,Sacramento Kings explain no cupholders in upper level of new arena.,http://www.sactownroyalty.com/2016/9/27/13086618/kings-explain-no-cupholders-in-upper-level-of-new-arena,sactownroyalty.com,https://www.reddit.com/r/nba/comments/551epn/sacramento_kings_explain_no_cupholders_in_upper/?ref=search_posts,nba,16,13,0,1475171083.0,Kings,SacRoyals2312,False,False
552sgg,2004 Espy Awards - A Song for Kevin Garnett,https://www.youtube.com/watch?v=YiVcnxQGfLI,youtube.com,https://www.reddit.com/r/nba/comments/552sgg/2004_espy_awards_a_song_for_kevin_garnett/?ref=search_posts,nba,26,0,0,1475192689.0,[BOS] Dick Dickey,TomBradyGOAT,False,False
551zxp,Kenyon Martin -> The Vertical,https://www.reddit.com/r/nba/comments/551zxp/kenyon_martin_the_vertical/,self.nba,https://www.reddit.com/r/nba/comments/551zxp/kenyon_martin_the_vertical/?ref=search_posts,nba,17,5,0,1475182166.0,,_NeVaRa_,True,False
551v33,A question about buying tickets,https://www.reddit.com/r/nba/comments/551v33/a_question_about_buying_tickets/,self.nba,https://www.reddit.com/r/nba/comments/551v33/a_question_about_buying_tickets/?ref=search_posts,nba,8,14,0,1475180105.0,,Fatasaurus84,True,False
5539dp,Shaq's top 5 fights,https://www.youtube.com/watch?v=BtHJcYMAw10,youtube.com,https://www.reddit.com/r/nba/comments/5539dp/shaqs_top_5_fights/?ref=search_posts,nba,0,1,0,1475198138.0,,KalEl1232,False,False
5531kg,First Take - Paul Pierce Calls Clippers A Super Team At Media Day,https://youtu.be/vLF2I87dleg,youtu.be,https://www.reddit.com/r/nba/comments/5531kg/first_take_paul_pierce_calls_clippers_a_super/?ref=search_posts,nba,0,5,0,1475195638.0,NBA,cenki95,False,False
